surah_ayah	position	string	meaning	ayah_link
39:21	24	yajʿaluhu	He makes them	 ثُمَّ يَهِيجُ فَتَرَاهُ مُصْفَرًّا ثُمَّ يَجْعَلُهُ حُطَامًا
41:9	9	watajʿalūna	and you set up	 قُلْ أَئِنَّكُمْ لَتَكْفُرُونَ بِالَّذِي خَلَقَ الْأَرْضَ فِي يَوْمَيْنِ وَتَجْعَلُونَ لَهُ أَنْدَادًا
41:29	11	najʿalhumā	(so) we may put them	 أَرِنَا اللَّذَيْنِ أَضَلَّانَا مِنَ الْجِنِّ وَالْإِنْسِ نَجْعَلْهُمَا تَحْتَ أَقْدَامِنَا
42:50	5	wayajʿalu	and He makes	 أَوْ يُزَوِّجُهُمْ ذُكْرَانًا وَإِنَاثًا وَيَجْعَلُ مَنْ يَشَاءُ عَقِيمًا
45:21	7	najʿalahum	We will make them	 أَمْ حَسِبَ الَّذِينَ اجْتَرَحُوا السَّيِّئَاتِ أَنْ نَجْعَلَهُمْ كَالَّذِينَ آمَنُوا
51:42	8	jaʿalathu	it made it	 مَا تَذَرُ مِنْ شَيْءٍ أَتَتْ عَلَيْهِ إِلَّا جَعَلَتْهُ كَالرَّمِيمِ
51:51	2	tajʿalū	make	 وَلَا تَجْعَلُوا مَعَ اللَّهِ إِلَٰهًا آخَرَ إِنِّي لَكُمْ مِنْهُ نَذِيرٌ مُبِينٌ
56:82	1	watajʿalūna	And you make	 وَتَجْعَلُونَ رِزْقَكُمْ أَنَّكُمْ تُكَذِّبُونَ
57:28	12	wayajʿal	and He will make	 وَيَجْعَلْ لَكُمْ نُورًا تَمْشُونَ بِهِ وَيَغْفِرْ لَكُمْ
59:10	14	tajʿal	put	 وَلَا تَجْعَلْ فِي قُلُوبِنَا غِلًّا لِلَّذِينَ آمَنُوا
60:5	3	tajʿalnā	make us	 رَبَّنَا لَا تَجْعَلْنَا فِتْنَةً لِلَّذِينَ كَفَرُوا وَاغْفِرْ لَنَا رَبَّنَا
60:7	4	yajʿala	will put	 عَسَى اللَّهُ أَنْ يَجْعَلَ بَيْنَكُمْ وَبَيْنَ الَّذِينَ عَادَيْتُمْ مِنْهُمْ مَوَدَّةً
65:2	28	yajʿal	He will make	 وَمَنْ يَتَّقِ اللَّهَ يَجْعَلْ لَهُ مَخْرَجًا
65:4	24	yajʿal	He will make	 وَمَنْ يَتَّقِ اللَّهَ يَجْعَلْ لَهُ مِنْ أَمْرِهِ يُسْرًا
65:7	21	sayajʿalu	Will bring about	 سَيَجْعَلُ اللَّهُ بَعْدَ عُسْرٍ يُسْرًا
68:35	1	afanajʿalu	Then will We treat	 أَفَنَجْعَلُ الْمُسْلِمِينَ كَالْمُجْرِمِينَ
69:12	1	linajʿalahā	That We might make it	 لِنَجْعَلَهَا لَكُمْ تَذْكِرَةً وَتَعِيَهَا أُذُنٌ وَاعِيَةٌ
71:12	4	wayajʿal	and make	 وَيُمْدِدْكُمْ بِأَمْوَالٍ وَبَنِينَ وَيَجْعَلْ لَكُمْ جَنَّاتٍ
71:12	7	wayajʿal	and make	 وَيَجْعَلْ لَكُمْ أَنْهَارًا
72:25	8	yajʿalu	will appoint	 قُلْ إِنْ أَدْرِي أَقَرِيبٌ مَا تُوعَدُونَ أَمْ يَجْعَلُ لَهُ رَبِّي أَمَدًا
73:17	6	yajʿalu	(that) will make	 فَكَيْفَ تَتَّقُونَ إِنْ كَفَرْتُمْ يَوْمًا يَجْعَلُ الْوِلْدَانَ شِيبًا
77:25	2	najʿali	We made	 أَلَمْ نَجْعَلِ الْأَرْضَ كِفَاتًا
78:6	2	najʿali	We made	 أَلَمْ نَجْعَلِ الْأَرْضَ مِهَادًا
90:8	2	najʿal	We made	 أَلَمْ نَجْعَلْ لَهُ عَيْنَيْنِ
105:2	2	yajʿal	He make	 أَلَمْ يَجْعَلْ كَيْدَهُمْ فِي تَضْلِيلٍ
