surah_ayah	position	string	meaning	ayah_link
2:164	25	bihi	thereby	 وَمَا أَنْزَلَ اللَّهُ مِنَ السَّمَاءِ مِنْ مَاءٍ فَأَحْيَا بِهِ الْأَرْضَ بَعْدَ مَوْتِهَا
2:206	3	lahu	to him	 وَإِذَا قِيلَ لَهُ اتَّقِ اللَّهَ أَخَذَتْهُ الْعِزَّةُ بِالْإِثْمِ
2:247	14	lahu	for him	 قَالُوا أَنَّىٰ يَكُونُ لَهُ الْمُلْكُ عَلَيْنَا وَنَحْنُ أَحَقُّ بِالْمُلْكِ مِنْهُ
2:284	16	bihi	for it	 وَإِنْ تُبْدُوا مَا فِي أَنْفُسِكُمْ أَوْ تُخْفُوهُ يُحَاسِبْكُمْ بِهِ اللَّهُ
4:115	8	lahu	to him	 وَمَنْ يُشَاقِقِ الرَّسُولَ مِنْ بَعْدِ مَا تَبَيَّنَ لَهُ الْهُدَىٰ وَيَتَّبِعْ غَيْرَ سَبِيلِ الْمُؤْمِنِينَ نُوَلِّهِ مَا تَوَلَّىٰ
5:16	2	bihi	with it	 يَهْدِي بِهِ اللَّهُ مَنِ اتَّبَعَ رِضْوَانَهُ سُبُلَ السَّلَامِ
6:46	16	bihi	with it	 وَخَتَمَ عَلَىٰ قُلُوبِكُمْ مَنْ إِلَٰهٌ غَيْرُ اللَّهِ يَأْتِيكُمْ بِهِ
6:51	2	bihi	with it	 وَأَنْذِرْ بِهِ الَّذِينَ يَخَافُونَ أَنْ يُحْشَرُوا إِلَىٰ رَبِّهِمْ
6:62	8	lahu	for Him	 ثُمَّ رُدُّوا إِلَى اللَّهِ مَوْلَاهُمُ الْحَقِّ أَلَا لَهُ الْحُكْمُ
6:73	13	walahu	And for Him	 قَوْلُهُ الْحَقُّ وَلَهُ الْمُلْكُ يَوْمَ يُنْفَخُ فِي الصُّورِ
7:29	12	lahu	to Him	 وَأَقِيمُوا وُجُوهَكُمْ عِنْدَ كُلِّ مَسْجِدٍ وَادْعُوهُ مُخْلِصِينَ لَهُ الدِّينَ
7:54	26	lahu	for Him	 أَلَا لَهُ الْخَلْقُ وَالْأَمْرُ تَبَارَكَ اللَّهُ رَبُّ الْعَالَمِينَ
7:57	18	bihi	from it	 حَتَّىٰ إِذَا أَقَلَّتْ سَحَابًا ثِقَالًا سُقْنَاهُ لِبَلَدٍ مَيِّتٍ فَأَنْزَلْنَا بِهِ الْمَاءَ
8:11	21	bihi	with it	 وَلِيَرْبِطَ عَلَىٰ قُلُوبِكُمْ وَيُثَبِّتَ بِهِ الْأَقْدَامَ
9:37	7	bihi	by it	 إِنَّمَا النَّسِيءُ زِيَادَةٌ فِي الْكُفْرِ يُضَلُّ بِهِ الَّذِينَ كَفَرُوا
10:22	33	lahu	to Him	 وَظَنُّوا أَنَّهُمْ أُحِيطَ بِهِمْ دَعَوُا اللَّهَ مُخْلِصِينَ لَهُ الدِّينَ
10:81	7	bihi	[it]	 قَالَ مُوسَىٰ مَا جِئْتُمْ بِهِ السِّحْرُ إِنَّ اللَّهَ سَيُبْطِلُهُ
11:33	4	bihi	will bring it (on) you	 قَالَ إِنَّمَا يَأْتِيكُمْ بِهِ اللَّهُ إِنْ شَاءَ وَمَا أَنْتُمْ بِمُعْجِزِينَ
11:103	12	lahu	on it	 ذَٰلِكَ يَوْمٌ مَجْمُوعٌ لَهُ النَّاسُ وَذَٰلِكَ يَوْمٌ مَشْهُودٌ
13:31	5	bihi	by it	 وَلَوْ أَنَّ قُرْآنًا سُيِّرَتْ بِهِ الْجِبَالُ أَوْ قُطِّعَتْ بِهِ الْأَرْضُ
13:31	9	bihi	by it	 وَلَوْ أَنَّ قُرْآنًا سُيِّرَتْ بِهِ الْجِبَالُ أَوْ قُطِّعَتْ بِهِ الْأَرْضُ
13:31	13	bihi	by it	 وَلَوْ أَنَّ قُرْآنًا سُيِّرَتْ بِهِ الْجِبَالُ أَوْ قُطِّعَتْ بِهِ الْأَرْضُ أَوْ كُلِّمَ بِهِ الْمَوْتَىٰ
14:18	8	bihi	on it	 أَعْمَالُهُمْ كَرَمَادٍ اشْتَدَّتْ بِهِ الرِّيحُ فِي يَوْمٍ عَاصِفٍ
16:11	3	bihi	with it	 يُنْبِتُ لَكُمْ بِهِ الزَّرْعَ وَالزَّيْتُونَ وَالنَّخِيلَ وَالْأَعْنَابَ
16:52	6	walahu	and to Him	 وَلَهُ مَا فِي السَّمَاوَاتِ وَالْأَرْضِ وَلَهُ الدِّينُ وَاصِبًا
16:65	7	bihi	by it	 وَاللَّهُ أَنْزَلَ مِنَ السَّمَاءِ مَاءً فَأَحْيَا بِهِ الْأَرْضَ بَعْدَ مَوْتِهَا
17:44	2	lahu	[to] Him	 تُسَبِّحُ لَهُ السَّمَاوَاتُ السَّبْعُ وَالْأَرْضُ وَمَنْ فِيهِنَّ
17:110	10	falahu	to Him (belongs)	 أَيًّا مَا تَدْعُوا فَلَهُ الْأَسْمَاءُ الْحُسْنَىٰ
18:56	12	bihi	thereby	 وَيُجَادِلُ الَّذِينَ كَفَرُوا بِالْبَاطِلِ لِيُدْحِضُوا بِهِ الْحَقَّ
19:75	7	lahu	for him	 قُلْ مَنْ كَانَ فِي الضَّلَالَةِ فَلْيَمْدُدْ لَهُ الرَّحْمَٰنُ مَدًّا
19:97	5	bihi	with it	 فَإِنَّمَا يَسَّرْنَاهُ بِلِسَانِكَ لِتُبَشِّرَ بِهِ الْمُتَّقِينَ وَتُنْذِرَ بِهِ قَوْمًا لُدًّا
20:8	6	lahu	To Him (belong)	 اللَّهُ لَا إِلَٰهَ إِلَّا هُوَ لَهُ الْأَسْمَاءُ الْحُسْنَىٰ
20:109	8	lahu	[to him]	 إِلَّا مَنْ أَذِنَ لَهُ الرَّحْمَٰنُ وَرَضِيَ لَهُ قَوْلًا
22:31	17	bihi	him	 فَتَخْطَفُهُ الطَّيْرُ أَوْ تَهْوِي بِهِ الرِّيحُ فِي مَكَانٍ سَحِيقٍ
23:80	5	walahu	and for Him	 وَهُوَ الَّذِي يُحْيِي وَيُمِيتُ وَلَهُ اخْتِلَافُ اللَّيْلِ وَالنَّهَارِ
25:39	3	lahu	for him	 وَكُلًّا ضَرَبْنَا لَهُ الْأَمْثَالَ وَكُلًّا تَبَّرْنَا تَتْبِيرًا
25:69	2	lahu	for him	 يُضَاعَفْ لَهُ الْعَذَابُ يَوْمَ الْقِيَامَةِ وَيَخْلُدْ فِيهِ مُهَانًا
26:193	2	bihi	Has brought it down	 نَزَلَ بِهِ الرُّوحُ الْأَمِينُ
26:210	3	bihi	have brought it down	 وَمَا تَنَزَّلَتْ بِهِ الشَّيَاطِينُ
28:70	7	lahu	To Him	 وَهُوَ اللَّهُ لَا إِلَٰهَ إِلَّا هُوَ لَهُ الْحَمْدُ فِي الْأُولَىٰ وَالْآخِرَةِ
28:70	12	walahu	And for Him	 لَهُ الْحَمْدُ فِي الْأُولَىٰ وَالْآخِرَةِ وَلَهُ الْحُكْمُ وَإِلَيْهِ تُرْجَعُونَ
28:88	16	lahu	To Him	 كُلُّ شَيْءٍ هَالِكٌ إِلَّا وَجْهَهُ لَهُ الْحُكْمُ وَإِلَيْهِ تُرْجَعُونَ
29:40	16	bihi	him	 وَمِنْهُمْ مَنْ خَسَفْنَا بِهِ الْأَرْضَ وَمِنْهُمْ مَنْ أَغْرَقْنَا
29:63	9	bihi	thereby	 وَلَئِنْ سَأَلْتَهُمْ مَنْ نَزَّلَ مِنَ السَّمَاءِ مَاءً فَأَحْيَا بِهِ الْأَرْضَ مِنْ بَعْدِ مَوْتِهَا لَيَقُولُنَّ اللَّهُ
29:65	8	lahu	to Him	 فَإِذَا رَكِبُوا فِي الْفُلْكِ دَعَوُا اللَّهَ مُخْلِصِينَ لَهُ الدِّينَ
30:18	1	walahu	And for Him	 وَلَهُ الْحَمْدُ فِي السَّمَاوَاتِ وَالْأَرْضِ وَعَشِيًّا وَحِينَ تُظْهِرُونَ
30:24	12	bihi	therewith	 وَيُنَزِّلُ مِنَ السَّمَاءِ مَاءً فَيُحْيِي بِهِ الْأَرْضَ بَعْدَ مَوْتِهَا
30:27	10	walahu	And for Him	 وَلَهُ الْمَثَلُ الْأَعْلَىٰ فِي السَّمَاوَاتِ وَالْأَرْضِ وَهُوَ الْعَزِيزُ الْحَكِيمُ
31:32	8	lahu	to Him	 وَإِذَا غَشِيَهُمْ مَوْجٌ كَالظُّلَلِ دَعَوُا اللَّهَ مُخْلِصِينَ لَهُ الدِّينَ
34:1	11	walahu	and for Him	 وَلَهُ الْحَمْدُ فِي الْآخِرَةِ وَهُوَ الْحَكِيمُ الْخَبِيرُ
34:10	11	lahu	for him	 وَأَلَنَّا لَهُ الْحَدِيدَ
35:9	12	bihi	therewith	 فَسُقْنَاهُ إِلَىٰ بَلَدٍ مَيِّتٍ فَأَحْيَيْنَا بِهِ الْأَرْضَ بَعْدَ مَوْتِهَا
35:13	19	lahu	for Him	 ذَٰلِكُمُ اللَّهُ رَبُّكُمْ لَهُ الْمُلْكُ
38:36	2	lahu	to him	 فَسَخَّرْنَا لَهُ الرِّيحَ تَجْرِي بِأَمْرِهِ رُخَاءً حَيْثُ أَصَابَ
39:2	9	lahu	to Him	 إِنَّا أَنْزَلْنَا إِلَيْكَ الْكِتَابَ بِالْحَقِّ فَاعْبُدِ اللَّهَ مُخْلِصًا لَهُ الدِّينَ
39:6	29	lahu	for Him	 ذَٰلِكُمُ اللَّهُ رَبُّكُمْ لَهُ الْمُلْكُ لَا إِلَٰهَ إِلَّا هُوَ فَأَنَّىٰ تُصْرَفُونَ
39:11	8	lahu	to Him	 قُلْ إِنِّي أُمِرْتُ أَنْ أَعْبُدَ اللَّهَ مُخْلِصًا لَهُ الدِّينَ
40:5	16	bihi	thereby	 وَجَادَلُوا بِالْبَاطِلِ لِيُدْحِضُوا بِهِ الْحَقَّ فَأَخَذْتُهُمْ
40:14	4	lahu	to Him	 فَادْعُوا اللَّهَ مُخْلِصِينَ لَهُ الدِّينَ وَلَوْ كَرِهَ الْكَافِرُونَ
40:65	9	lahu	to Him	 هُوَ الْحَيُّ لَا إِلَٰهَ إِلَّا هُوَ فَادْعُوهُ مُخْلِصِينَ لَهُ الدِّينَ
42:21	11	bihi	Allah has given permission of it	 أَمْ لَهُمْ شُرَكَاءُ شَرَعُوا لَهُمْ مِنَ الدِّينِ مَا لَمْ يَأْذَنْ بِهِ اللَّهُ
45:5	12	bihi	thereby	 وَمَا أَنْزَلَ اللَّهُ مِنَ السَّمَاءِ مِنْ رِزْقٍ فَأَحْيَا بِهِ الْأَرْضَ بَعْدَ مَوْتِهَا
45:37	1	walahu	And for Him	 وَلَهُ الْكِبْرِيَاءُ فِي السَّمَاوَاتِ وَالْأَرْضِ وَهُوَ الْعَزِيزُ الْحَكِيمُ
52:39	2	lahu	for Him	 أَمْ لَهُ الْبَنَاتُ وَلَكُمُ الْبَنُونَ
53:21	3	walahu	and for Him	 أَلَكُمُ الذَّكَرُ وَلَهُ الْأُنْثَىٰ
55:24	1	walahu	And for Him	 وَلَهُ الْجَوَارِ الْمُنْشَآتُ فِي الْبَحْرِ كَالْأَعْلَامِ
58:8	24	bihi	therewith	 وَإِذَا جَاءُوكَ حَيَّوْكَ بِمَا لَمْ يُحَيِّكَ بِهِ اللَّهُ
59:24	6	lahu	For Him	 هُوَ اللَّهُ الْخَالِقُ الْبَارِئُ الْمُصَوِّرُ لَهُ الْأَسْمَاءُ الْحُسْنَىٰ
64:1	9	lahu	For Him	 يُسَبِّحُ لِلَّهِ مَا فِي السَّمَاوَاتِ وَمَا فِي الْأَرْضِ لَهُ الْمُلْكُ وَلَهُ الْحَمْدُ
64:1	11	walahu	and for Him	 يُسَبِّحُ لِلَّهِ مَا فِي السَّمَاوَاتِ وَمَا فِي الْأَرْضِ لَهُ الْمُلْكُ وَلَهُ الْحَمْدُ
69:35	2	lahu	for him	 فَلَيْسَ لَهُ الْيَوْمَ هَاهُنَا حَمِيمٌ
78:38	11	lahu	[for] him	 لَا يَتَكَلَّمُونَ إِلَّا مَنْ أَذِنَ لَهُ الرَّحْمَٰنُ وَقَالَ صَوَابًا
89:23	8	lahu	(will be) for him	 يَوْمَئِذٍ يَتَذَكَّرُ الْإِنْسَانُ وَأَنَّىٰ لَهُ الذِّكْرَىٰ
98:5	7	lahu	to Him	 وَمَا أُمِرُوا إِلَّا لِيَعْبُدُوا اللَّهَ مُخْلِصِينَ لَهُ الدِّينَ حُنَفَاءَ
