surah:ayah	position	word	meaning	ayah_link
2:3	2	yu'minūna	believe	 الَّذِينَ يُؤْمِنُونَ بِالْغَيْبِ وَيُقِيمُونَ الصَّلَاةَ
2:4	2	yu'minūna	believe	 وَالَّذِينَ يُؤْمِنُونَ بِمَا أُنْزِلَ إِلَيْكَ وَمَا أُنْزِلَ مِنْ قَبْلِكَ
2:6	11	yu'minūna	they believe	 سَوَاءٌ عَلَيْهِمْ أَأَنْذَرْتَهُمْ أَمْ لَمْ تُنْذِرْهُمْ لَا يُؤْمِنُونَ
2:8	5	āmannā	We believed	 وَمِنَ النَّاسِ مَنْ يَقُولُ آمَنَّا بِاللَّهِ وَبِالْيَوْمِ الْآخِرِ
2:9	4	āmanū	believe[d]	 يُخَادِعُونَ اللَّهَ وَالَّذِينَ آمَنُوا وَمَا يَخْدَعُونَ إِلَّا أَنْفُسَهُمْ
2:13	4	āminū	Believe	 وَإِذَا قِيلَ لَهُمْ آمِنُوا كَمَا آمَنَ النَّاسُ قَالُوا أَنُؤْمِنُ كَمَا آمَنَ السُّفَهَاءُ
2:13	6	āmana	believed	 وَإِذَا قِيلَ لَهُمْ آمِنُوا كَمَا آمَنَ النَّاسُ قَالُوا
2:13	9	anu'minu	Should we believe	 قَالُوا أَنُؤْمِنُ كَمَا آمَنَ السُّفَهَاءُ
2:13	11	āmana	believed	 أَنُؤْمِنُ كَمَا آمَنَ السُّفَهَاءُ أَلَا إِنَّهُمْ هُمُ السُّفَهَاءُ
2:14	4	āmanū	believe[d]	 وَإِذَا لَقُوا الَّذِينَ آمَنُوا قَالُوا آمَنَّا
2:14	6	āmannā	We believe[d]	 وَإِذَا لَقُوا الَّذِينَ آمَنُوا قَالُوا آمَنَّا
2:25	3	āmanū	believe	 وَبَشِّرِ الَّذِينَ آمَنُوا وَعَمِلُوا الصَّالِحَاتِ أَنَّ لَهُمْ جَنَّاتٍ
2:26	14	āmanū	believed	 فَأَمَّا الَّذِينَ آمَنُوا فَيَعْلَمُونَ أَنَّهُ الْحَقُّ مِنْ رَبِّهِمْ
2:41	1	waāminū	And believe	 وَآمِنُوا بِمَا أَنْزَلْتُ مُصَدِّقًا لِمَا مَعَكُمْ
2:55	5	nu'mina	(will) we believe	 وَإِذْ قُلْتُمْ يَا مُوسَىٰ لَنْ نُؤْمِنَ لَكَ حَتَّىٰ نَرَى اللَّهَ جَهْرَةً
2:62	3	āmanū	believed	 إِنَّ الَّذِينَ آمَنُوا وَالَّذِينَ هَادُوا وَالنَّصَارَىٰ وَالصَّابِئِينَ
2:62	9	āmana	believed	 مَنْ آمَنَ بِاللَّهِ وَالْيَوْمِ الْآخِرِ وَعَمِلَ صَالِحًا فَلَهُمْ أَجْرُهُمْ
2:75	3	yu'minū	they will believe	 أَفَتَطْمَعُونَ أَنْ يُؤْمِنُوا لَكُمْ
2:76	4	āmanū	believe[d]	 وَإِذَا لَقُوا الَّذِينَ آمَنُوا قَالُوا آمَنَّا
2:76	6	āmannā	We have believed	 وَإِذَا لَقُوا الَّذِينَ آمَنُوا قَالُوا آمَنَّا
2:82	2	āmanū	believed	 وَالَّذِينَ آمَنُوا وَعَمِلُوا الصَّالِحَاتِ أُولَٰئِكَ أَصْحَابُ الْجَنَّةِ
2:85	23	afatu'minūna	So do you believe	 أَفَتُؤْمِنُونَ بِبَعْضِ الْكِتَابِ وَتَكْفُرُونَ بِبَعْضٍ
2:88	10	yu'minūna	they believe	 لَعَنَهُمُ اللَّهُ بِكُفْرِهِمْ فَقَلِيلًا مَا يُؤْمِنُونَ
2:91	4	āminū	Believe	 وَإِذَا قِيلَ لَهُمْ آمِنُوا بِمَا أَنْزَلَ اللَّهُ قَالُوا نُؤْمِنُ بِمَا أُنْزِلَ عَلَيْنَا
2:91	9	nu'minu	We believe	 قَالُوا نُؤْمِنُ بِمَا أُنْزِلَ عَلَيْنَا وَيَكْفُرُونَ بِمَا وَرَاءَهُ وَهُوَ الْحَقُّ
2:100	10	yu'minūna	believe	 نَبَذَهُ فَرِيقٌ مِنْهُمْ بَلْ أَكْثَرُهُمْ لَا يُؤْمِنُونَ
2:103	3	āmanū	(had) believed	 وَلَوْ أَنَّهُمْ آمَنُوا وَاتَّقَوْا لَمَثُوبَةٌ مِنْ عِنْدِ اللَّهِ خَيْرٌ
2:104	3	āmanū	believe[d]	 يَا أَيُّهَا الَّذِينَ آمَنُوا لَا تَقُولُوا رَاعِنَا وَقُولُوا انْظُرْنَا
2:121	8	yu'minūna	believe	 الَّذِينَ آتَيْنَاهُمُ الْكِتَابَ يَتْلُونَهُ حَقَّ تِلَاوَتِهِ أُولَٰئِكَ يُؤْمِنُونَ بِهِ
2:126	14	āmana	believed	 وَارْزُقْ أَهْلَهُ مِنَ الثَّمَرَاتِ مَنْ آمَنَ مِنْهُمْ بِاللَّهِ
2:136	2	āmannā	We have believed	 قُولُوا آمَنَّا بِاللَّهِ وَمَا أُنْزِلَ إِلَيْنَا وَمَا أُنْزِلَ إِلَىٰ إِبْرَاهِيمَ
2:137	2	āmanū	they believe[d]	 فَإِنْ آمَنُوا بِمِثْلِ مَا آمَنْتُمْ بِهِ فَقَدِ اهْتَدَوْا
2:137	5	āmantum	you have believed	 فَإِنْ آمَنُوا بِمِثْلِ مَا آمَنْتُمْ بِهِ فَقَدِ اهْتَدَوْا
2:153	3	āmanū	believe[d]	 يَا أَيُّهَا الَّذِينَ آمَنُوا اسْتَعِينُوا بِالصَّبْرِ وَالصَّلَاةِ
2:165	13	āmanū	believe[d]	 يُحِبُّونَهُمْ كَحُبِّ اللَّهِ وَالَّذِينَ آمَنُوا أَشَدُّ حُبًّا لِلَّهِ
2:172	3	āmanū	believe[d]	 يَا أَيُّهَا الَّذِينَ آمَنُوا كُلُوا مِنْ طَيِّبَاتِ مَا رَزَقْنَاكُمْ
2:177	12	āmana	believes	 وَلَٰكِنَّ الْبِرَّ مَنْ آمَنَ بِاللَّهِ وَالْيَوْمِ الْآخِرِ وَالْمَلَائِكَةِ
2:178	3	āmanū	believe[d]	 يَا أَيُّهَا الَّذِينَ آمَنُوا كُتِبَ عَلَيْكُمُ الْقِصَاصُ فِي الْقَتْلَى
2:183	3	āmanū	believe[d]	 يَا أَيُّهَا الَّذِينَ آمَنُوا كُتِبَ عَلَيْكُمُ الصِّيَامُ
2:186	14	walyu'minū	and let them believe	 فَلْيَسْتَجِيبُوا لِي وَلْيُؤْمِنُوا بِي لَعَلَّهُمْ يَرْشُدُونَ
2:208	3	āmanū	believe[d]	 يَا أَيُّهَا الَّذِينَ آمَنُوا ادْخُلُوا فِي السِّلْمِ كَافَّةً
2:212	9	āmanū	believe[d]	 زُيِّنَ لِلَّذِينَ كَفَرُوا الْحَيَاةُ الدُّنْيَا وَيَسْخَرُونَ مِنَ الَّذِينَ آمَنُوا
2:213	36	āmanū	believe[d]	 فَهَدَى اللَّهُ الَّذِينَ آمَنُوا لِمَا اخْتَلَفُوا فِيهِ مِنَ الْحَقِّ
2:214	21	āmanū	believed	 حَتَّىٰ يَقُولَ الرَّسُولُ وَالَّذِينَ آمَنُوا مَعَهُ مَتَىٰ نَصْرُ اللَّهِ
2:218	3	āmanū	believed	 إِنَّ الَّذِينَ آمَنُوا وَالَّذِينَ هَاجَرُوا
2:221	5	yu'minna	they believe	 وَلَا تَنْكِحُوا الْمُشْرِكَاتِ حَتَّىٰ يُؤْمِنَّ
2:221	17	yu'minū	they believe	 وَلَا تُنْكِحُوا الْمُشْرِكِينَ حَتَّىٰ يُؤْمِنُوا
2:228	18	yu'minna	believe	 إِنْ كُنَّ يُؤْمِنَّ بِاللَّهِ وَالْيَوْمِ الْآخِرِ
2:232	21	yu'minu	believes	 ذَٰلِكَ يُوعَظُ بِهِ مَنْ كَانَ مِنْكُمْ يُؤْمِنُ بِاللَّهِ وَالْيَوْمِ الْآخِرِ
2:249	34	āmanū	believed	 فَلَمَّا جَاوَزَهُ هُوَ وَالَّذِينَ آمَنُوا مَعَهُ قَالُوا لَا طَاقَةَ لَنَا
2:253	39	āmana	believed	 وَلَٰكِنِ اخْتَلَفُوا فَمِنْهُمْ مَنْ آمَنَ وَمِنْهُمْ مَنْ كَفَرَ
2:254	3	āmanū	believe[d]	 يَا أَيُّهَا الَّذِينَ آمَنُوا أَنْفِقُوا مِمَّا رَزَقْنَاكُمْ
2:256	13	wayu'min	and believes	 فَمَنْ يَكْفُرْ بِالطَّاغُوتِ وَيُؤْمِنْ بِاللَّهِ فَقَدِ اسْتَمْسَكَ بِالْعُرْوَةِ
2:257	4	āmanū	believe[d]	 اللَّهُ وَلِيُّ الَّذِينَ آمَنُوا يُخْرِجُهُمْ مِنَ الظُّلُمَاتِ إِلَى النُّورِ
2:260	11	tu'min	you believed	 قَالَ أَوَلَمْ تُؤْمِنْ قَالَ بَلَىٰ وَلَٰكِنْ لِيَطْمَئِنَّ قَلْبِي
2:264	3	āmanū	believe[d]	 يَا أَيُّهَا الَّذِينَ آمَنُوا لَا تُبْطِلُوا صَدَقَاتِكُمْ بِالْمَنِّ وَالْأَذَىٰ
2:264	15	yu'minu	believe	 كَالَّذِي يُنْفِقُ مَالَهُ رِئَاءَ النَّاسِ وَلَا يُؤْمِنُ بِاللَّهِ وَالْيَوْمِ الْآخِرِ
2:267	3	āmanū	believe[d]	 يَا أَيُّهَا الَّذِينَ آمَنُوا أَنْفِقُوا مِنْ طَيِّبَاتِ مَا كَسَبْتُمْ
2:277	3	āmanū	believe[d]	 إِنَّ الَّذِينَ آمَنُوا وَعَمِلُوا الصَّالِحَاتِ وَأَقَامُوا الصَّلَاةَ
2:278	3	āmanū	believe[d]	 يَا أَيُّهَا الَّذِينَ آمَنُوا اتَّقُوا اللَّهَ وَذَرُوا مَا بَقِيَ مِنَ الرِّبَا
2:282	3	āmanū	believe[d]	 يَا أَيُّهَا الَّذِينَ آمَنُوا إِذَا تَدَايَنْتُمْ بِدَيْنٍ إِلَىٰ أَجَلٍ مُسَمًّى فَاكْتُبُوهُ
2:285	1	āmana	Believed	 آمَنَ الرَّسُولُ بِمَا أُنْزِلَ إِلَيْهِ مِنْ رَبِّهِ وَالْمُؤْمِنُونَ
2:285	10	āmana	believed	 كُلٌّ آمَنَ بِاللَّهِ وَمَلَائِكَتِهِ وَكُتُبِهِ وَرُسُلِهِ
3:7	36	āmannā	We believe	 وَالرَّاسِخُونَ فِي الْعِلْمِ يَقُولُونَ آمَنَّا بِهِ كُلٌّ مِنْ عِنْدِ رَبِّنَا
3:16	5	āmannā	(have) believed	 الَّذِينَ يَقُولُونَ رَبَّنَا إِنَّنَا آمَنَّا فَاغْفِرْ لَنَا ذُنُوبَنَا
3:52	16	āmannā	we believe[d]	 قَالَ الْحَوَارِيُّونَ نَحْنُ أَنْصَارُ اللَّهِ آمَنَّا بِاللَّهِ
3:53	2	āmannā	we believe[d]	 رَبَّنَا آمَنَّا بِمَا أَنْزَلْتَ وَاتَّبَعْنَا الرَّسُولَ
3:57	3	āmanū	believe[d]	 وَأَمَّا الَّذِينَ آمَنُوا وَعَمِلُوا الصَّالِحَاتِ فَيُوَفِّيهِمْ أُجُورَهُمْ
3:68	10	āmanū	believe[d]	 لَلَّذِينَ اتَّبَعُوهُ وَهَٰذَا النَّبِيُّ وَالَّذِينَ آمَنُوا
3:72	6	āminū	Believe	 آمِنُوا بِالَّذِي أُنْزِلَ عَلَى الَّذِينَ آمَنُوا وَجْهَ النَّهَارِ
3:72	11	āmanū	believe[d]	 آمِنُوا بِالَّذِي أُنْزِلَ عَلَى الَّذِينَ آمَنُوا وَجْهَ النَّهَارِ
3:73	2	tu'minū	believe	 وَلَا تُؤْمِنُوا إِلَّا لِمَنْ تَبِعَ دِينَكُمْ
3:81	17	latu'minunna	you must believe	 ثُمَّ جَاءَكُمْ رَسُولٌ مُصَدِّقٌ لِمَا مَعَكُمْ لَتُؤْمِنُنَّ بِهِ وَلَتَنْصُرُنَّهُ
3:84	2	āmannā	We believed	 قُلْ آمَنَّا بِاللَّهِ وَمَا أُنْزِلَ عَلَيْنَا وَمَا أُنْزِلَ عَلَىٰ إِبْرَاهِيمَ
3:99	10	āmana	believe[d]	 قُلْ يَا أَهْلَ الْكِتَابِ لِمَ تَصُدُّونَ عَنْ سَبِيلِ اللَّهِ مَنْ آمَنَ
3:100	3	āmanū	believe[d]	 يَا أَيُّهَا الَّذِينَ آمَنُوا إِنْ تُطِيعُوا فَرِيقًا مِنَ الَّذِينَ أُوتُوا الْكِتَابَ يَرُدُّوكُمْ بَعْدَ إِيمَانِكُمْ كَافِرِينَ
3:102	3	āmanū	believe[d]	 يَا أَيُّهَا الَّذِينَ آمَنُوا اتَّقُوا اللَّهَ حَقَّ تُقَاتِهِ
3:110	11	watu'minūna	and believing	 تَأْمُرُونَ بِالْمَعْرُوفِ وَتَنْهَوْنَ عَنِ الْمُنْكَرِ وَتُؤْمِنُونَ بِاللَّهِ
3:110	14	āmana	believed	 وَلَوْ آمَنَ أَهْلُ الْكِتَابِ لَكَانَ خَيْرًا لَهُمْ
3:114	1	yu'minūna	They believe	 يُؤْمِنُونَ بِاللَّهِ وَالْيَوْمِ الْآخِرِ وَيَأْمُرُونَ بِالْمَعْرُوفِ
3:118	3	āmanū	believe[d]	 يَا أَيُّهَا الَّذِينَ آمَنُوا لَا تَتَّخِذُوا بِطَانَةً مِنْ دُونِكُمْ
3:119	6	watu'minūna	and you believe	 هَا أَنْتُمْ أُولَاءِ تُحِبُّونَهُمْ وَلَا يُحِبُّونَكُمْ وَتُؤْمِنُونَ بِالْكِتَابِ كُلِّهِ
3:119	12	āmannā	We believe	 وَإِذَا لَقُوكُمْ قَالُوا آمَنَّا وَإِذَا خَلَوْا عَضُّوا عَلَيْكُمُ الْأَنَامِلَ
3:130	3	āmanū	believe	 يَا أَيُّهَا الَّذِينَ آمَنُوا لَا تَأْكُلُوا الرِّبَا أَضْعَافًا مُضَاعَفَةً
3:140	17	āmanū	believe[d]	 وَلِيَعْلَمَ اللَّهُ الَّذِينَ آمَنُوا وَيَتَّخِذَ مِنْكُمْ شُهَدَاءَ
3:141	4	āmanū	believe	 وَلِيُمَحِّصَ اللَّهُ الَّذِينَ آمَنُوا وَيَمْحَقَ الْكَافِرِينَ
3:149	3	āmanū	believe	 يَا أَيُّهَا الَّذِينَ آمَنُوا إِنْ تُطِيعُوا الَّذِينَ كَفَرُوا يَرُدُّوكُمْ
3:156	3	āmanū	believe[d]	 يَا أَيُّهَا الَّذِينَ آمَنُوا لَا تَكُونُوا كَالَّذِينَ كَفَرُوا
3:179	28	faāminū	so believe	 فَآمِنُوا بِاللَّهِ وَرُسُلِهِ وَإِنْ تُؤْمِنُوا وَتَتَّقُوا فَلَكُمْ أَجْرٌ
3:179	32	tu'minū	you believe	 وَإِنْ تُؤْمِنُوا وَتَتَّقُوا فَلَكُمْ أَجْرٌ عَظِيمٌ
3:183	8	nu'mina	we (should) believe	 إِنَّ اللَّهَ عَهِدَ إِلَيْنَا أَلَّا نُؤْمِنَ لِرَسُولٍ حَتَّىٰ يَأْتِيَنَا بِقُرْبَانٍ
3:193	8	āminū	Believe	 رَبَّنَا إِنَّنَا سَمِعْنَا مُنَادِيًا يُنَادِي لِلْإِيمَانِ أَنْ آمِنُوا بِرَبِّكُمْ
3:193	10	faāmannā	so we have believed	 رَبَّنَا إِنَّنَا سَمِعْنَا مُنَادِيًا يُنَادِي لِلْإِيمَانِ أَنْ آمِنُوا بِرَبِّكُمْ فَآمَنَّا
3:199	6	yu'minu	believe	 وَإِنَّ مِنْ أَهْلِ الْكِتَابِ لَمَنْ يُؤْمِنُ بِاللَّهِ وَمَا أُنْزِلَ إِلَيْكُمْ
3:200	3	āmanū	believe[d]	 يَا أَيُّهَا الَّذِينَ آمَنُوا اصْبِرُوا وَصَابِرُوا وَرَابِطُوا
4:19	3	āmanū	believe[d]	 يَا أَيُّهَا الَّذِينَ آمَنُوا لَا يَحِلُّ لَكُمْ أَنْ تَرِثُوا النِّسَاءَ كَرْهًا
4:29	3	āmanū	believe[d]	 يَا أَيُّهَا الَّذِينَ آمَنُوا لَا تَأْكُلُوا أَمْوَالَكُمْ بَيْنَكُمْ بِالْبَاطِلِ
4:38	7	yu'minūna	they believe	 وَالَّذِينَ يُنْفِقُونَ أَمْوَالَهُمْ رِئَاءَ النَّاسِ وَلَا يُؤْمِنُونَ بِاللَّهِ
4:39	4	āmanū	they believed	 وَمَاذَا عَلَيْهِمْ لَوْ آمَنُوا بِاللَّهِ وَالْيَوْمِ الْآخِرِ
4:43	3	āmanū	believe[d]	 يَا أَيُّهَا الَّذِينَ آمَنُوا لَا تَقْرَبُوا الصَّلَاةَ وَأَنْتُمْ سُكَارَىٰ
4:46	36	yu'minūna	they believe	 وَلَٰكِنْ لَعَنَهُمُ اللَّهُ بِكُفْرِهِمْ فَلَا يُؤْمِنُونَ إِلَّا قَلِيلًا
4:47	5	āminū	believe	 يَا أَيُّهَا الَّذِينَ أُوتُوا الْكِتَابَ آمِنُوا بِمَا نَزَّلْنَا
4:51	9	yu'minūna	They believe	 أَلَمْ تَرَ إِلَى الَّذِينَ أُوتُوا نَصِيبًا مِنَ الْكِتَابِ يُؤْمِنُونَ بِالْجِبْتِ
4:51	19	āmanū	believe[d]	 هَٰؤُلَاءِ أَهْدَىٰ مِنَ الَّذِينَ آمَنُوا سَبِيلًا
4:55	3	āmana	believed	 فَمِنْهُمْ مَنْ آمَنَ بِهِ وَمِنْهُمْ مَنْ صَدَّ عَنْهُ وَكَفَىٰ بِجَهَنَّمَ سَعِيرًا
4:57	2	āmanū	believe[d]	 وَالَّذِينَ آمَنُوا وَعَمِلُوا الصَّالِحَاتِ سَنُدْخِلُهُمْ جَنَّاتٍ
4:59	3	āmanū	believe[d]	 يَا أَيُّهَا الَّذِينَ آمَنُوا أَطِيعُوا اللَّهَ وَأَطِيعُوا الرَّسُولَ
4:59	21	tu'minūna	believe	 فَرُدُّوهُ إِلَى اللَّهِ وَالرَّسُولِ إِنْ كُنْتُمْ تُؤْمِنُونَ بِاللَّهِ وَالْيَوْمِ الْآخِرِ
4:60	7	āmanū	believe	 أَلَمْ تَرَ إِلَى الَّذِينَ يَزْعُمُونَ أَنَّهُمْ آمَنُوا بِمَا أُنْزِلَ إِلَيْكَ
4:65	4	yu'minūna	will they believe	 فَلَا وَرَبِّكَ لَا يُؤْمِنُونَ حَتَّىٰ يُحَكِّمُوكَ فِيمَا شَجَرَ بَيْنَهُمْ
4:71	3	āmanū	believe[d]	 يَا أَيُّهَا الَّذِينَ آمَنُوا خُذُوا حِذْرَكُمْ فَانْفِرُوا ثُبَاتٍ
4:76	2	āmanū	believe	 الَّذِينَ آمَنُوا يُقَاتِلُونَ فِي سَبِيلِ اللَّهِ
4:94	3	āmanū	believe[d]	 يَا أَيُّهَا الَّذِينَ آمَنُوا إِذَا ضَرَبْتُمْ فِي سَبِيلِ اللَّهِ فَتَبَيَّنُوا
4:122	2	āmanū	believe[d]	 وَالَّذِينَ آمَنُوا وَعَمِلُوا الصَّالِحَاتِ سَنُدْخِلُهُمْ جَنَّاتٍ
4:135	3	āmanū	believe[d]	 يَا أَيُّهَا الَّذِينَ آمَنُوا كُونُوا قَوَّامِينَ بِالْقِسْطِ شُهَدَاءَ لِلَّهِ
4:136	3	āmanū	believe[d]	 يَا أَيُّهَا الَّذِينَ آمَنُوا آمِنُوا بِاللَّهِ وَرَسُولِهِ
4:136	4	āminū	Believe	 يَا أَيُّهَا الَّذِينَ آمَنُوا آمِنُوا بِاللَّهِ وَرَسُولِهِ
4:137	3	āmanū	believed	 إِنَّ الَّذِينَ آمَنُوا ثُمَّ كَفَرُوا
4:137	7	āmanū	(again) believed	 ثُمَّ آمَنُوا ثُمَّ كَفَرُوا ثُمَّ ازْدَادُوا كُفْرًا لَمْ يَكُنِ اللَّهُ لِيَغْفِرَ لَهُمْ
4:144	3	āmanū	believe[d]	 يَا أَيُّهَا الَّذِينَ آمَنُوا لَا تَتَّخِذُوا الْكَافِرِينَ أَوْلِيَاءَ
4:147	7	waāmantum	and you believe	 مَا يَفْعَلُ اللَّهُ بِعَذَابِكُمْ إِنْ شَكَرْتُمْ وَآمَنْتُمْ
4:150	13	nu'minu	We believe	 وَيَقُولُونَ نُؤْمِنُ بِبَعْضٍ وَنَكْفُرُ بِبَعْضٍ
4:152	2	āmanū	believe	 وَالَّذِينَ آمَنُوا بِاللَّهِ وَرُسُلِهِ وَلَمْ يُفَرِّقُوا بَيْنَ أَحَدٍ مِنْهُمْ
4:155	20	yu'minūna	they believe	 بَلْ طَبَعَ اللَّهُ عَلَيْهَا بِكُفْرِهِمْ فَلَا يُؤْمِنُونَ إِلَّا قَلِيلًا
4:159	6	layu'minanna	surely he believes	 وَإِنْ مِنْ أَهْلِ الْكِتَابِ إِلَّا لَيُؤْمِنَنَّ بِهِ قَبْلَ مَوْتِهِ
4:162	7	yu'minūna	believe	 لَٰكِنِ الرَّاسِخُونَ فِي الْعِلْمِ مِنْهُمْ وَالْمُؤْمِنُونَ يُؤْمِنُونَ بِمَا أُنْزِلَ
4:170	9	faāminū	so believe	 قَدْ جَاءَكُمُ الرَّسُولُ بِالْحَقِّ مِنْ رَبِّكُمْ فَآمِنُوا خَيْرًا لَكُمْ
4:171	26	faāminū	So believe	 فَآمِنُوا بِاللَّهِ وَرُسُلِهِ وَلَا تَقُولُوا ثَلَاثَةٌ
4:173	3	āmanū	believed	 فَأَمَّا الَّذِينَ آمَنُوا وَعَمِلُوا الصَّالِحَاتِ فَيُوَفِّيهِمْ أُجُورَهُمْ
4:175	3	āmanū	believed	 فَأَمَّا الَّذِينَ آمَنُوا بِاللَّهِ وَاعْتَصَمُوا بِهِ فَسَيُدْخِلُهُمْ فِي رَحْمَةٍ مِنْهُ
5:1	3	āmanū	believe	 يَا أَيُّهَا الَّذِينَ آمَنُوا أَوْفُوا بِالْعُقُودِ
5:2	3	āmanū	believe	 يَا أَيُّهَا الَّذِينَ آمَنُوا لَا تُحِلُّوا شَعَائِرَ اللَّهِ
5:6	3	āmanū	believe	 يَا أَيُّهَا الَّذِينَ آمَنُوا إِذَا قُمْتُمْ إِلَى الصَّلَاةِ فَاغْسِلُوا وُجُوهَكُمْ
5:8	3	āmanū	believe	 يَا أَيُّهَا الَّذِينَ آمَنُوا كُونُوا قَوَّامِينَ لِلَّهِ شُهَدَاءَ بِالْقِسْطِ
5:9	4	āmanū	believe	 وَعَدَ اللَّهُ الَّذِينَ آمَنُوا وَعَمِلُوا الصَّالِحَاتِ لَهُمْ مَغْفِرَةٌ
5:11	3	āmanū	believe	 يَا أَيُّهَا الَّذِينَ آمَنُوا اذْكُرُوا نِعْمَتَ اللَّهِ عَلَيْكُمْ
5:12	21	waāmantum	and you believe	 لَئِنْ أَقَمْتُمُ الصَّلَاةَ وَآتَيْتُمُ الزَّكَاةَ وَآمَنْتُمْ بِرُسُلِي
5:35	3	āmanū	believe	 يَا أَيُّهَا الَّذِينَ آمَنُوا اتَّقُوا اللَّهَ وَابْتَغُوا إِلَيْهِ الْوَسِيلَةَ
5:41	12	āmannā	We believe	 الَّذِينَ يُسَارِعُونَ فِي الْكُفْرِ مِنَ الَّذِينَ قَالُوا آمَنَّا بِأَفْوَاهِهِمْ
5:41	15	tu'min	believe	 مِنَ الَّذِينَ قَالُوا آمَنَّا بِأَفْوَاهِهِمْ وَلَمْ تُؤْمِنْ قُلُوبُهُمْ
5:51	3	āmanū	believe	 يَا أَيُّهَا الَّذِينَ آمَنُوا لَا تَتَّخِذُوا الْيَهُودَ وَالنَّصَارَىٰ أَوْلِيَاءَ
5:53	3	āmanū	believe	 وَيَقُولُ الَّذِينَ آمَنُوا أَهَٰؤُلَاءِ الَّذِينَ أَقْسَمُوا بِاللَّهِ
5:54	3	āmanū	believe	 يَا أَيُّهَا الَّذِينَ آمَنُوا مَنْ يَرْتَدَّ مِنْكُمْ عَنْ دِينِهِ فَسَوْفَ يَأْتِي اللَّهُ بِقَوْمٍ يُحِبُّهُمْ
5:55	6	āmanū	believe	 إِنَّمَا وَلِيُّكُمُ اللَّهُ وَرَسُولُهُ وَالَّذِينَ آمَنُوا
5:56	6	āmanū	believe	 وَمَنْ يَتَوَلَّ اللَّهَ وَرَسُولَهُ وَالَّذِينَ آمَنُوا فَإِنَّ حِزْبَ اللَّهِ هُمُ الْغَالِبُونَ
5:57	3	āmanū	believe	 يَا أَيُّهَا الَّذِينَ آمَنُوا لَا تَتَّخِذُوا الَّذِينَ اتَّخَذُوا دِينَكُمْ هُزُوًا
5:59	9	āmannā	we believe	 هَلْ تَنْقِمُونَ مِنَّا إِلَّا أَنْ آمَنَّا بِاللَّهِ وَمَا أُنْزِلَ إِلَيْنَا
5:61	4	āmannā	We believe	 وَإِذَا جَاءُوكُمْ قَالُوا آمَنَّا وَقَدْ دَخَلُوا بِالْكُفْرِ
5:65	5	āmanū	(had) believed	 وَلَوْ أَنَّ أَهْلَ الْكِتَابِ آمَنُوا وَاتَّقَوْا لَكَفَّرْنَا عَنْهُمْ سَيِّئَاتِهِمْ
5:69	3	āmanū	believed	 إِنَّ الَّذِينَ آمَنُوا وَالَّذِينَ هَادُوا وَالصَّابِئُونَ
5:69	9	āmana	believed	 مَنْ آمَنَ بِاللَّهِ وَالْيَوْمِ الْآخِرِ وَعَمِلَ صَالِحًا فَلَا خَوْفٌ عَلَيْهِمْ
5:81	3	yu'minūna	believed	 وَلَوْ كَانُوا يُؤْمِنُونَ بِاللَّهِ وَالنَّبِيِّ وَمَا أُنْزِلَ إِلَيْهِ مَا اتَّخَذُوهُمْ أَوْلِيَاءَ
5:82	6	āmanū	believe	 لَتَجِدَنَّ أَشَدَّ النَّاسِ عَدَاوَةً لِلَّذِينَ آمَنُوا الْيَهُودَ وَالَّذِينَ أَشْرَكُوا
5:82	14	āmanū	believe	 وَلَتَجِدَنَّ أَقْرَبَهُمْ مَوَدَّةً لِلَّذِينَ آمَنُوا الَّذِينَ قَالُوا إِنَّا نَصَارَىٰ
