surah:ayah	position	word	meaning	ayah_link
52:21	2	āmanū	believed	 وَالَّذِينَ آمَنُوا وَاتَّبَعَتْهُمْ ذُرِّيَّتُهُمْ بِإِيمَانٍ
52:33	6	yu'minūna	they believe	 أَمْ يَقُولُونَ تَقَوَّلَهُ بَلْ لَا يُؤْمِنُونَ
53:27	4	yu'minūna	believe	 الَّذِينَ لَا يُؤْمِنُونَ بِالْآخِرَةِ لَيُسَمُّونَ الْمَلَائِكَةَ تَسْمِيَةَ الْأُنْثَىٰ
57:7	1	āminū	Believe	 آمِنُوا بِاللَّهِ وَرَسُولِهِ وَأَنْفِقُوا مِمَّا جَعَلَكُمْ مُسْتَخْلَفِينَ فِيهِ
57:7	10	āmanū	who believe	 فَالَّذِينَ آمَنُوا مِنْكُمْ وَأَنْفَقُوا لَهُمْ أَجْرٌ كَبِيرٌ
57:8	4	tu'minūna	you believe	 وَمَا لَكُمْ لَا تُؤْمِنُونَ بِاللَّهِ وَالرَّسُولُ يَدْعُوكُمْ لِتُؤْمِنُوا بِرَبِّكُمْ
57:8	8	litu'minū	that you believe	 وَالرَّسُولُ يَدْعُوكُمْ لِتُؤْمِنُوا بِرَبِّكُمْ وَقَدْ أَخَذَ مِيثَاقَكُمْ
57:13	6	āmanū	believed	 يَوْمَ يَقُولُ الْمُنَافِقُونَ وَالْمُنَافِقَاتُ لِلَّذِينَ آمَنُوا انْظُرُونَا
57:16	4	āmanū	believed	 أَلَمْ يَأْنِ لِلَّذِينَ آمَنُوا أَنْ تَخْشَعَ قُلُوبُهُمْ لِذِكْرِ اللَّهِ
57:19	2	āmanū	believe	 وَالَّذِينَ آمَنُوا بِاللَّهِ وَرُسُلِهِ أُولَٰئِكَ هُمُ الصِّدِّيقُونَ
57:21	13	āmanū	believe	 عَرْضُهَا كَعَرْضِ السَّمَاءِ وَالْأَرْضِ أُعِدَّتْ لِلَّذِينَ آمَنُوا بِاللَّهِ
57:27	34	āmanū	believed	 فَآتَيْنَا الَّذِينَ آمَنُوا مِنْهُمْ أَجْرَهُمْ وَكَثِيرٌ مِنْهُمْ فَاسِقُونَ
57:28	3	āmanū	O you who believe	 يَا أَيُّهَا الَّذِينَ آمَنُوا اتَّقُوا اللَّهَ وَآمِنُوا بِرَسُولِهِ
57:28	6	waāminū	and believe	 اتَّقُوا اللَّهَ وَآمِنُوا بِرَسُولِهِ يُؤْتِكُمْ كِفْلَيْنِ مِنْ رَحْمَتِهِ
58:4	18	litu'minū	so that you may believe	 ذَٰلِكَ لِتُؤْمِنُوا بِاللَّهِ وَرَسُولِهِ وَتِلْكَ حُدُودُ اللَّهِ
58:9	3	āmanū	O you who believe	 يَا أَيُّهَا الَّذِينَ آمَنُوا إِذَا تَنَاجَيْتُمْ فَلَا تَتَنَاجَوْا بِالْإِثْمِ
58:10	7	āmanū	believe	 إِنَّمَا النَّجْوَىٰ مِنَ الشَّيْطَانِ لِيَحْزُنَ الَّذِينَ آمَنُوا
58:11	3	āmanū	O you who believe	 يَا أَيُّهَا الَّذِينَ آمَنُوا إِذَا قِيلَ لَكُمْ تَفَسَّحُوا فِي الْمَجَالِسِ فَافْسَحُوا
58:11	21	āmanū	believe	 يَرْفَعِ اللَّهُ الَّذِينَ آمَنُوا مِنْكُمْ وَالَّذِينَ أُوتُوا الْعِلْمَ دَرَجَاتٍ
58:12	3	āmanū	O you who believe	 يَا أَيُّهَا الَّذِينَ آمَنُوا إِذَا نَاجَيْتُمُ الرَّسُولَ فَقَدِّمُوا
58:22	4	yu'minūna	who believe	 لَا تَجِدُ قَوْمًا يُؤْمِنُونَ بِاللَّهِ وَالْيَوْمِ الْآخِرِ يُوَادُّونَ مَنْ حَادَّ اللَّهَ
59:10	19	āmanū	believed	 وَلَا تَجْعَلْ فِي قُلُوبِنَا غِلًّا لِلَّذِينَ آمَنُوا
59:18	3	āmanū	believe	 يَا أَيُّهَا الَّذِينَ آمَنُوا اتَّقُوا اللَّهَ وَلْتَنْظُرْ نَفْسٌ مَا قَدَّمَتْ لِغَدٍ
60:1	3	āmanū	believe	 يَا أَيُّهَا الَّذِينَ آمَنُوا لَا تَتَّخِذُوا عَدُوِّي وَعَدُوَّكُمْ أَوْلِيَاءَ
60:1	22	tu'minū	you believe	 يُخْرِجُونَ الرَّسُولَ وَإِيَّاكُمْ أَنْ تُؤْمِنُوا بِاللَّهِ رَبِّكُمْ
60:4	30	tu'minū	you believe	 بَيْنَنَا وَبَيْنَكُمُ الْعَدَاوَةُ وَالْبَغْضَاءُ أَبَدًا حَتَّىٰ تُؤْمِنُوا بِاللَّهِ
60:10	3	āmanū	believe	 يَا أَيُّهَا الَّذِينَ آمَنُوا إِذَا جَاءَكُمُ الْمُؤْمِنَاتُ مُهَاجِرَاتٍ فَامْتَحِنُوهُنَّ
60:13	3	āmanū	believe	 يَا أَيُّهَا الَّذِينَ آمَنُوا لَا تَتَوَلَّوْا قَوْمًا غَضِبَ اللَّهُ عَلَيْهِمْ
61:2	3	āmanū	believe	 يَا أَيُّهَا الَّذِينَ آمَنُوا لِمَ تَقُولُونَ مَا لَا تَفْعَلُونَ
61:10	3	āmanū	believe	 يَا أَيُّهَا الَّذِينَ آمَنُوا هَلْ أَدُلُّكُمْ عَلَىٰ تِجَارَةٍ تُنْجِيكُمْ مِنْ عَذَابٍ أَلِيمٍ
61:11	1	tu'minūna	Believe	 تُؤْمِنُونَ بِاللَّهِ وَرَسُولِهِ وَتُجَاهِدُونَ فِي سَبِيلِ اللَّهِ
61:14	3	āmanū	believe	 يَا أَيُّهَا الَّذِينَ آمَنُوا كُونُوا أَنْصَارَ اللَّهِ كَمَا قَالَ عِيسَى ابْنُ مَرْيَمَ
61:14	22	faāmanat	Then believed	 فَآمَنَتْ طَائِفَةٌ مِنْ بَنِي إِسْرَائِيلَ وَكَفَرَتْ طَائِفَةٌ
61:14	31	āmanū	believed	 فَأَيَّدْنَا الَّذِينَ آمَنُوا عَلَىٰ عَدُوِّهِمْ فَأَصْبَحُوا ظَاهِرِينَ
62:9	3	āmanū	believe	 يَا أَيُّهَا الَّذِينَ آمَنُوا إِذَا نُودِيَ لِلصَّلَاةِ مِنْ يَوْمِ الْجُمُعَةِ فَاسْعَوْا
63:3	3	āmanū	they believed	 ذَٰلِكَ بِأَنَّهُمْ آمَنُوا ثُمَّ كَفَرُوا فَطُبِعَ عَلَىٰ قُلُوبِهِمْ فَهُمْ لَا يَفْقَهُونَ
63:9	3	āmanū	believe	 يَا أَيُّهَا الَّذِينَ آمَنُوا لَا تُلْهِكُمْ أَمْوَالُكُمْ وَلَا أَوْلَادُكُمْ عَنْ ذِكْرِ اللَّهِ
64:8	1	faāminū	So believe	 فَآمِنُوا بِاللَّهِ وَرَسُولِهِ وَالنُّورِ الَّذِي أَنْزَلْنَا
64:9	9	yu'min	believes	 وَمَنْ يُؤْمِنْ بِاللَّهِ وَيَعْمَلْ صَالِحًا يُكَفِّرْ عَنْهُ سَيِّئَاتِهِ
64:11	9	yu'min	believes	 وَمَنْ يُؤْمِنْ بِاللَّهِ يَهْدِ قَلْبَهُ وَاللَّهُ بِكُلِّ شَيْءٍ عَلِيمٌ
64:14	3	āmanū	believe	 يَا أَيُّهَا الَّذِينَ آمَنُوا إِنَّ مِنْ أَزْوَاجِكُمْ وَأَوْلَادِكُمْ عَدُوًّا لَكُمْ
65:2	21	yu'minu	believes	 ذَٰلِكُمْ يُوعَظُ بِهِ مَنْ كَانَ يُؤْمِنُ بِاللَّهِ وَالْيَوْمِ الْآخِرِ
65:10	11	āmanū	have believed	 فَاتَّقُوا اللَّهَ يَا أُولِي الْأَلْبَابِ الَّذِينَ آمَنُوا
65:11	9	āmanū	believe	 لِيُخْرِجَ الَّذِينَ آمَنُوا وَعَمِلُوا الصَّالِحَاتِ مِنَ الظُّلُمَاتِ إِلَى النُّورِ
65:11	17	yu'min	believes	 وَمَنْ يُؤْمِنْ بِاللَّهِ وَيَعْمَلْ صَالِحًا يُدْخِلْهُ جَنَّاتٍ
66:6	3	āmanū	believe	 يَا أَيُّهَا الَّذِينَ آمَنُوا قُوا أَنْفُسَكُمْ وَأَهْلِيكُمْ نَارًا وَقُودُهَا النَّاسُ
66:8	3	āmanū	believe	 يَا أَيُّهَا الَّذِينَ آمَنُوا تُوبُوا إِلَى اللَّهِ تَوْبَةً نَصُوحًا
66:8	27	āmanū	believed	 يَوْمَ لَا يُخْزِي اللَّهُ النَّبِيَّ وَالَّذِينَ آمَنُوا مَعَهُ
66:11	5	āmanū	believed 	 وَضَرَبَ اللَّهُ مَثَلًا لِلَّذِينَ آمَنُوا امْرَأَتَ فِرْعَوْنَ
67:29	4	āmannā	we believe	 قُلْ هُوَ الرَّحْمَٰنُ آمَنَّا بِهِ وَعَلَيْهِ تَوَكَّلْنَا
69:33	4	yu'minu	believing	 إِنَّهُ كَانَ لَا يُؤْمِنُ بِاللَّهِ الْعَظِيمِ
69:41	7	tu'minūna	you believe	 وَمَا هُوَ بِقَوْلِ شَاعِرٍ قَلِيلًا مَا تُؤْمِنُونَ
72:2	4	faāmannā	so we believe	 يَهْدِي إِلَى الرُّشْدِ فَآمَنَّا بِهِ وَلَنْ نُشْرِكَ بِرَبِّنَا أَحَدًا
72:13	5	āmannā	we believed	 وَأَنَّا لَمَّا سَمِعْنَا الْهُدَىٰ آمَنَّا بِهِ
72:13	8	yu'min	believes	 فَمَنْ يُؤْمِنْ بِرَبِّهِ فَلَا يَخَافُ بَخْسًا وَلَا رَهَقًا
74:31	20	āmanū	believe	 لِيَسْتَيْقِنَ الَّذِينَ أُوتُوا الْكِتَابَ وَيَزْدَادَ الَّذِينَ آمَنُوا إِيمَانًا
77:50	4	yu'minūna	will they believe	 فَبِأَيِّ حَدِيثٍ بَعْدَهُ يُؤْمِنُونَ
83:29	7	āmanū	believed	 إِنَّ الَّذِينَ أَجْرَمُوا كَانُوا مِنَ الَّذِينَ آمَنُوا يَضْحَكُونَ
83:34	3	āmanū	believed 	 فَالْيَوْمَ الَّذِينَ آمَنُوا مِنَ الْكُفَّارِ يَضْحَكُونَ
84:20	4	yu'minūna	they believe	 فَمَا لَهُمْ لَا يُؤْمِنُونَ
84:25	3	āmanū	believe	 إِلَّا الَّذِينَ آمَنُوا وَعَمِلُوا الصَّالِحَاتِ لَهُمْ أَجْرٌ غَيْرُ مَمْنُونٍ
85:8	6	yu'minū	they believed	 وَمَا نَقَمُوا مِنْهُمْ إِلَّا أَنْ يُؤْمِنُوا بِاللَّهِ الْعَزِيزِ الْحَمِيدِ
85:11	3	āmanū	believe	 إِنَّ الَّذِينَ آمَنُوا وَعَمِلُوا الصَّالِحَاتِ لَهُمْ جَنَّاتٌ
90:17	5	āmanū	believe	 ثُمَّ كَانَ مِنَ الَّذِينَ آمَنُوا وَتَوَاصَوْا بِالصَّبْرِ وَتَوَاصَوْا بِالْمَرْحَمَةِ
95:6	3	āmanū	believe	 إِلَّا الَّذِينَ آمَنُوا وَعَمِلُوا الصَّالِحَاتِ فَلَهُمْ أَجْرٌ غَيْرُ مَمْنُونٍ
98:7	3	āmanū	believe	 إِنَّ الَّذِينَ آمَنُوا وَعَمِلُوا الصَّالِحَاتِ أُولَٰئِكَ هُمْ خَيْرُ الْبَرِيَّةِ
103:3	3	āmanū	believe	 إِلَّا الَّذِينَ آمَنُوا وَعَمِلُوا الصَّالِحَاتِ وَتَوَاصَوْا بِالْحَقِّ
106:4	5	waāmanahum	and gives them security	 الَّذِي أَطْعَمَهُمْ مِنْ جُوعٍ وَآمَنَهُمْ مِنْ خَوْفٍ
