surah:ayah	position	word	meaning	form	p-o-s	ayah_link
2:196	35	amintum	you are secure	I	Verb	 فَإِذَا أَمِنْتُمْ فَمَنْ تَمَتَّعَ بِالْعُمْرَةِ إِلَى الْحَجِّ فَمَا اسْتَيْسَرَ مِنَ الْهَدْيِ
2:239	7	amintum	you are secure	I	Verb	 فَإِذَا أَمِنْتُمْ فَاذْكُرُوا اللَّهَ كَمَا عَلَّمَكُمْ مَا لَمْ تَكُونُوا تَعْلَمُونَ
2:283	11	amina	entrusts	I	Verb	 فَإِنْ أَمِنَ بَعْضُكُمْ بَعْضًا فَلْيُؤَدِّ الَّذِي اؤْتُمِنَ أَمَانَتَهُ
3:75	6	tamanhu	you entrust him	I	Verb	 وَمِنْ أَهْلِ الْكِتَابِ مَنْ إِنْ تَأْمَنْهُ بِقِنْطَارٍ يُؤَدِّهِ إِلَيْكَ
3:75	13	tamanhu	you entrust him	I	Verb	 وَمِنْهُمْ مَنْ إِنْ تَأْمَنْهُ بِدِينَارٍ لَا يُؤَدِّهِ إِلَيْكَ
4:91	5	yamanūkum	they be secure from you	I	Verb	 سَتَجِدُونَ آخَرِينَ يُرِيدُونَ أَنْ يَأْمَنُوكُمْ
4:91	6	wayamanū	and they be secure from	I	Verb	 وَيَأْمَنُوا قَوْمَهُمْ كُلَّ مَا رُدُّوا إِلَى الْفِتْنَةِ أُرْكِسُوا
7:97	1	afa-amina	Then did feel secure	I	Verb	 أَفَأَمِنَ أَهْلُ الْقُرَىٰ أَنْ يَأْتِيَهُمْ بَأْسُنَا بَيَاتًا وَهُمْ نَائِمُونَ
7:98	1	awa-amina	Or felt secure	I	Verb	 أَوَأَمِنَ أَهْلُ الْقُرَىٰ أَنْ يَأْتِيَهُمْ بَأْسُنَا ضُحًى وَهُمْ يَلْعَبُونَ
7:99	1	afa-aminū	Then did they feel secure	I	Verb	 أَفَأَمِنُوا مَكْرَ اللَّهِ فَلَا يَأْمَنُ مَكْرَ اللَّهِ إِلَّا الْقَوْمُ الْخَاسِرُونَ
7:99	5	yamanu	feel secure	I	Verb	 أَفَأَمِنُوا مَكْرَ اللَّهِ فَلَا يَأْمَنُ مَكْرَ اللَّهِ إِلَّا الْقَوْمُ الْخَاسِرُونَ
12:11	6	tamannā	trust us	I	Verb	 قَالُوا يَا أَبَانَا مَا لَكَ لَا تَأْمَنَّا عَلَىٰ يُوسُفَ وَإِنَّا لَهُ لَنَاصِحُونَ
12:64	3	āmanukum	I entrust you	I	Verb	 قَالَ هَلْ آمَنُكُمْ عَلَيْهِ إِلَّا كَمَا أَمِنْتُكُمْ عَلَىٰ أَخِيهِ مِنْ قَبْلُ
12:64	7	amintukum	I entrusted you	I	Verb	 قَالَ هَلْ آمَنُكُمْ عَلَيْهِ إِلَّا كَمَا أَمِنْتُكُمْ عَلَىٰ أَخِيهِ مِنْ قَبْلُ
12:107	1	afa-aminū	Do they then feel secure	I	Verb	 أَفَأَمِنُوا أَنْ تَأْتِيَهُمْ غَاشِيَةٌ مِنْ عَذَابِ اللَّهِ
16:45	1	afa-amina	Do then feel secure	I	Verb	 أَفَأَمِنَ الَّذِينَ مَكَرُوا السَّيِّئَاتِ أَنْ يَخْسِفَ اللَّهُ بِهِمُ الْأَرْضَ
17:68	1	afa-amintum	Do you then feel secure	I	Verb	 أَفَأَمِنْتُمْ أَنْ يَخْسِفَ بِكُمْ جَانِبَ الْبَرِّ أَوْ يُرْسِلَ عَلَيْكُمْ حَاصِبًا
17:69	2	amintum	do you feel secure	I	Verb	 أَمْ أَمِنْتُمْ أَنْ يُعِيدَكُمْ فِيهِ تَارَةً أُخْرَىٰ فَيُرْسِلَ عَلَيْكُمْ قَاصِفًا
67:16	1	a-amintum	Do you feel secure	I	Verb	 أَأَمِنْتُمْ مَنْ فِي السَّمَاءِ أَنْ يَخْسِفَ بِكُمُ الْأَرْضَ فَإِذَا هِيَ تَمُورُ
67:17	2	amintum	do you feel secure	I	Verb	 أَمْ أَمِنْتُمْ مَنْ فِي السَّمَاءِ أَنْ يُرْسِلَ عَلَيْكُمْ حَاصِبًا
2:3	2	yu'minūna	believe	IV	Verb	 الَّذِينَ يُؤْمِنُونَ بِالْغَيْبِ وَيُقِيمُونَ الصَّلَاةَ
2:4	2	yu'minūna	believe	IV	Verb	 وَالَّذِينَ يُؤْمِنُونَ بِمَا أُنْزِلَ إِلَيْكَ وَمَا أُنْزِلَ مِنْ قَبْلِكَ
2:6	11	yu'minūna	they believe	IV	Verb	 سَوَاءٌ عَلَيْهِمْ أَأَنْذَرْتَهُمْ أَمْ لَمْ تُنْذِرْهُمْ لَا يُؤْمِنُونَ
2:8	5	āmannā	We believed	IV	Verb	 وَمِنَ النَّاسِ مَنْ يَقُولُ آمَنَّا بِاللَّهِ وَبِالْيَوْمِ الْآخِرِ
2:9	4	āmanū	believe[d]	IV	Verb	 يُخَادِعُونَ اللَّهَ وَالَّذِينَ آمَنُوا وَمَا يَخْدَعُونَ إِلَّا أَنْفُسَهُمْ
2:13	4	āminū	Believe	IV	Verb	 وَإِذَا قِيلَ لَهُمْ آمِنُوا كَمَا آمَنَ النَّاسُ قَالُوا أَنُؤْمِنُ كَمَا آمَنَ السُّفَهَاءُ
2:13	6	āmana	believed	IV	Verb	 وَإِذَا قِيلَ لَهُمْ آمِنُوا كَمَا آمَنَ النَّاسُ قَالُوا
2:13	9	anu'minu	Should we believe	IV	Verb	 قَالُوا أَنُؤْمِنُ كَمَا آمَنَ السُّفَهَاءُ
2:13	11	āmana	believed	IV	Verb	 أَنُؤْمِنُ كَمَا آمَنَ السُّفَهَاءُ أَلَا إِنَّهُمْ هُمُ السُّفَهَاءُ
2:14	4	āmanū	believe[d]	IV	Verb	 وَإِذَا لَقُوا الَّذِينَ آمَنُوا قَالُوا آمَنَّا
2:14	6	āmannā	We believe[d]	IV	Verb	 وَإِذَا لَقُوا الَّذِينَ آمَنُوا قَالُوا آمَنَّا
2:25	3	āmanū	believe	IV	Verb	 وَبَشِّرِ الَّذِينَ آمَنُوا وَعَمِلُوا الصَّالِحَاتِ أَنَّ لَهُمْ جَنَّاتٍ
2:26	14	āmanū	believed	IV	Verb	 فَأَمَّا الَّذِينَ آمَنُوا فَيَعْلَمُونَ أَنَّهُ الْحَقُّ مِنْ رَبِّهِمْ
2:41	1	waāminū	And believe	IV	Verb	 وَآمِنُوا بِمَا أَنْزَلْتُ مُصَدِّقًا لِمَا مَعَكُمْ
2:55	5	nu'mina	(will) we believe	IV	Verb	 وَإِذْ قُلْتُمْ يَا مُوسَىٰ لَنْ نُؤْمِنَ لَكَ حَتَّىٰ نَرَى اللَّهَ جَهْرَةً
2:62	3	āmanū	believed	IV	Verb	 إِنَّ الَّذِينَ آمَنُوا وَالَّذِينَ هَادُوا وَالنَّصَارَىٰ وَالصَّابِئِينَ
2:62	9	āmana	believed	IV	Verb	 مَنْ آمَنَ بِاللَّهِ وَالْيَوْمِ الْآخِرِ وَعَمِلَ صَالِحًا فَلَهُمْ أَجْرُهُمْ
2:75	3	yu'minū	they will believe	IV	Verb	 أَفَتَطْمَعُونَ أَنْ يُؤْمِنُوا لَكُمْ
2:76	4	āmanū	believe[d]	IV	Verb	 وَإِذَا لَقُوا الَّذِينَ آمَنُوا قَالُوا آمَنَّا
2:76	6	āmannā	We have believed	IV	Verb	 وَإِذَا لَقُوا الَّذِينَ آمَنُوا قَالُوا آمَنَّا
2:82	2	āmanū	believed	IV	Verb	 وَالَّذِينَ آمَنُوا وَعَمِلُوا الصَّالِحَاتِ أُولَٰئِكَ أَصْحَابُ الْجَنَّةِ
2:85	23	afatu'minūna	So do you believe	IV	Verb	 أَفَتُؤْمِنُونَ بِبَعْضِ الْكِتَابِ وَتَكْفُرُونَ بِبَعْضٍ
2:88	10	yu'minūna	they believe	IV	Verb	 لَعَنَهُمُ اللَّهُ بِكُفْرِهِمْ فَقَلِيلًا مَا يُؤْمِنُونَ
2:91	4	āminū	Believe	IV	Verb	 وَإِذَا قِيلَ لَهُمْ آمِنُوا بِمَا أَنْزَلَ اللَّهُ قَالُوا نُؤْمِنُ بِمَا أُنْزِلَ عَلَيْنَا
2:91	9	nu'minu	We believe	IV	Verb	 قَالُوا نُؤْمِنُ بِمَا أُنْزِلَ عَلَيْنَا وَيَكْفُرُونَ بِمَا وَرَاءَهُ وَهُوَ الْحَقُّ
2:100	10	yu'minūna	believe	IV	Verb	 نَبَذَهُ فَرِيقٌ مِنْهُمْ بَلْ أَكْثَرُهُمْ لَا يُؤْمِنُونَ
2:103	3	āmanū	(had) believed	IV	Verb	 وَلَوْ أَنَّهُمْ آمَنُوا وَاتَّقَوْا لَمَثُوبَةٌ مِنْ عِنْدِ اللَّهِ خَيْرٌ
2:104	3	āmanū	believe[d]	IV	Verb	 يَا أَيُّهَا الَّذِينَ آمَنُوا لَا تَقُولُوا رَاعِنَا وَقُولُوا انْظُرْنَا
2:121	8	yu'minūna	believe	IV	Verb	 الَّذِينَ آتَيْنَاهُمُ الْكِتَابَ يَتْلُونَهُ حَقَّ تِلَاوَتِهِ أُولَٰئِكَ يُؤْمِنُونَ بِهِ
2:126	14	āmana	believed	IV	Verb	 وَارْزُقْ أَهْلَهُ مِنَ الثَّمَرَاتِ مَنْ آمَنَ مِنْهُمْ بِاللَّهِ
2:136	2	āmannā	We have believed	IV	Verb	 قُولُوا آمَنَّا بِاللَّهِ وَمَا أُنْزِلَ إِلَيْنَا وَمَا أُنْزِلَ إِلَىٰ إِبْرَاهِيمَ
2:137	2	āmanū	they believe[d]	IV	Verb	 فَإِنْ آمَنُوا بِمِثْلِ مَا آمَنْتُمْ بِهِ فَقَدِ اهْتَدَوْا
2:137	5	āmantum	you have believed	IV	Verb	 فَإِنْ آمَنُوا بِمِثْلِ مَا آمَنْتُمْ بِهِ فَقَدِ اهْتَدَوْا
2:153	3	āmanū	believe[d]	IV	Verb	 يَا أَيُّهَا الَّذِينَ آمَنُوا اسْتَعِينُوا بِالصَّبْرِ وَالصَّلَاةِ
2:165	13	āmanū	believe[d]	IV	Verb	 يُحِبُّونَهُمْ كَحُبِّ اللَّهِ وَالَّذِينَ آمَنُوا أَشَدُّ حُبًّا لِلَّهِ
2:172	3	āmanū	believe[d]	IV	Verb	 يَا أَيُّهَا الَّذِينَ آمَنُوا كُلُوا مِنْ طَيِّبَاتِ مَا رَزَقْنَاكُمْ
2:177	12	āmana	believes	IV	Verb	 وَلَٰكِنَّ الْبِرَّ مَنْ آمَنَ بِاللَّهِ وَالْيَوْمِ الْآخِرِ وَالْمَلَائِكَةِ
2:178	3	āmanū	believe[d]	IV	Verb	 يَا أَيُّهَا الَّذِينَ آمَنُوا كُتِبَ عَلَيْكُمُ الْقِصَاصُ فِي الْقَتْلَى
2:183	3	āmanū	believe[d]	IV	Verb	 يَا أَيُّهَا الَّذِينَ آمَنُوا كُتِبَ عَلَيْكُمُ الصِّيَامُ
2:186	14	walyu'minū	and let them believe	IV	Verb	 فَلْيَسْتَجِيبُوا لِي وَلْيُؤْمِنُوا بِي لَعَلَّهُمْ يَرْشُدُونَ
2:208	3	āmanū	believe[d]	IV	Verb	 يَا أَيُّهَا الَّذِينَ آمَنُوا ادْخُلُوا فِي السِّلْمِ كَافَّةً
2:212	9	āmanū	believe[d]	IV	Verb	 زُيِّنَ لِلَّذِينَ كَفَرُوا الْحَيَاةُ الدُّنْيَا وَيَسْخَرُونَ مِنَ الَّذِينَ آمَنُوا
2:213	36	āmanū	believe[d]	IV	Verb	 فَهَدَى اللَّهُ الَّذِينَ آمَنُوا لِمَا اخْتَلَفُوا فِيهِ مِنَ الْحَقِّ
2:214	21	āmanū	believed	IV	Verb	 حَتَّىٰ يَقُولَ الرَّسُولُ وَالَّذِينَ آمَنُوا مَعَهُ مَتَىٰ نَصْرُ اللَّهِ
2:218	3	āmanū	believed	IV	Verb	 إِنَّ الَّذِينَ آمَنُوا وَالَّذِينَ هَاجَرُوا
2:221	5	yu'minna	they believe	IV	Verb	 وَلَا تَنْكِحُوا الْمُشْرِكَاتِ حَتَّىٰ يُؤْمِنَّ
2:221	17	yu'minū	they believe	IV	Verb	 وَلَا تُنْكِحُوا الْمُشْرِكِينَ حَتَّىٰ يُؤْمِنُوا
2:228	18	yu'minna	believe	IV	Verb	 إِنْ كُنَّ يُؤْمِنَّ بِاللَّهِ وَالْيَوْمِ الْآخِرِ
2:232	21	yu'minu	believes	IV	Verb	 ذَٰلِكَ يُوعَظُ بِهِ مَنْ كَانَ مِنْكُمْ يُؤْمِنُ بِاللَّهِ وَالْيَوْمِ الْآخِرِ
2:249	34	āmanū	believed	IV	Verb	 فَلَمَّا جَاوَزَهُ هُوَ وَالَّذِينَ آمَنُوا مَعَهُ قَالُوا لَا طَاقَةَ لَنَا
2:253	39	āmana	believed	IV	Verb	 وَلَٰكِنِ اخْتَلَفُوا فَمِنْهُمْ مَنْ آمَنَ وَمِنْهُمْ مَنْ كَفَرَ
2:254	3	āmanū	believe[d]	IV	Verb	 يَا أَيُّهَا الَّذِينَ آمَنُوا أَنْفِقُوا مِمَّا رَزَقْنَاكُمْ
2:256	13	wayu'min	and believes	IV	Verb	 فَمَنْ يَكْفُرْ بِالطَّاغُوتِ وَيُؤْمِنْ بِاللَّهِ فَقَدِ اسْتَمْسَكَ بِالْعُرْوَةِ
2:257	4	āmanū	believe[d]	IV	Verb	 اللَّهُ وَلِيُّ الَّذِينَ آمَنُوا يُخْرِجُهُمْ مِنَ الظُّلُمَاتِ إِلَى النُّورِ
2:260	11	tu'min	you believed	IV	Verb	 قَالَ أَوَلَمْ تُؤْمِنْ قَالَ بَلَىٰ وَلَٰكِنْ لِيَطْمَئِنَّ قَلْبِي
2:264	3	āmanū	believe[d]	IV	Verb	 يَا أَيُّهَا الَّذِينَ آمَنُوا لَا تُبْطِلُوا صَدَقَاتِكُمْ بِالْمَنِّ وَالْأَذَىٰ
2:264	15	yu'minu	believe	IV	Verb	 كَالَّذِي يُنْفِقُ مَالَهُ رِئَاءَ النَّاسِ وَلَا يُؤْمِنُ بِاللَّهِ وَالْيَوْمِ الْآخِرِ
2:267	3	āmanū	believe[d]	IV	Verb	 يَا أَيُّهَا الَّذِينَ آمَنُوا أَنْفِقُوا مِنْ طَيِّبَاتِ مَا كَسَبْتُمْ
2:277	3	āmanū	believe[d]	IV	Verb	 إِنَّ الَّذِينَ آمَنُوا وَعَمِلُوا الصَّالِحَاتِ وَأَقَامُوا الصَّلَاةَ
2:278	3	āmanū	believe[d]	IV	Verb	 يَا أَيُّهَا الَّذِينَ آمَنُوا اتَّقُوا اللَّهَ وَذَرُوا مَا بَقِيَ مِنَ الرِّبَا
2:282	3	āmanū	believe[d]	IV	Verb	 يَا أَيُّهَا الَّذِينَ آمَنُوا إِذَا تَدَايَنْتُمْ بِدَيْنٍ إِلَىٰ أَجَلٍ مُسَمًّى فَاكْتُبُوهُ
2:285	1	āmana	Believed	IV	Verb	 آمَنَ الرَّسُولُ بِمَا أُنْزِلَ إِلَيْهِ مِنْ رَبِّهِ وَالْمُؤْمِنُونَ
2:285	10	āmana	believed	IV	Verb	 كُلٌّ آمَنَ بِاللَّهِ وَمَلَائِكَتِهِ وَكُتُبِهِ وَرُسُلِهِ
3:7	36	āmannā	We believe	IV	Verb	 وَالرَّاسِخُونَ فِي الْعِلْمِ يَقُولُونَ آمَنَّا بِهِ كُلٌّ مِنْ عِنْدِ رَبِّنَا
3:16	5	āmannā	(have) believed	IV	Verb	 الَّذِينَ يَقُولُونَ رَبَّنَا إِنَّنَا آمَنَّا فَاغْفِرْ لَنَا ذُنُوبَنَا
3:52	16	āmannā	we believe[d]	IV	Verb	 قَالَ الْحَوَارِيُّونَ نَحْنُ أَنْصَارُ اللَّهِ آمَنَّا بِاللَّهِ
3:53	2	āmannā	we believe[d]	IV	Verb	 رَبَّنَا آمَنَّا بِمَا أَنْزَلْتَ وَاتَّبَعْنَا الرَّسُولَ
3:57	3	āmanū	believe[d]	IV	Verb	 وَأَمَّا الَّذِينَ آمَنُوا وَعَمِلُوا الصَّالِحَاتِ فَيُوَفِّيهِمْ أُجُورَهُمْ
3:68	10	āmanū	believe[d]	IV	Verb	 لَلَّذِينَ اتَّبَعُوهُ وَهَٰذَا النَّبِيُّ وَالَّذِينَ آمَنُوا
3:72	6	āminū	Believe	IV	Verb	 آمِنُوا بِالَّذِي أُنْزِلَ عَلَى الَّذِينَ آمَنُوا وَجْهَ النَّهَارِ
3:72	11	āmanū	believe[d]	IV	Verb	 آمِنُوا بِالَّذِي أُنْزِلَ عَلَى الَّذِينَ آمَنُوا وَجْهَ النَّهَارِ
3:73	2	tu'minū	believe	IV	Verb	 وَلَا تُؤْمِنُوا إِلَّا لِمَنْ تَبِعَ دِينَكُمْ
3:81	17	latu'minunna	you must believe	IV	Verb	 ثُمَّ جَاءَكُمْ رَسُولٌ مُصَدِّقٌ لِمَا مَعَكُمْ لَتُؤْمِنُنَّ بِهِ وَلَتَنْصُرُنَّهُ
3:84	2	āmannā	We believed	IV	Verb	 قُلْ آمَنَّا بِاللَّهِ وَمَا أُنْزِلَ عَلَيْنَا وَمَا أُنْزِلَ عَلَىٰ إِبْرَاهِيمَ
3:99	10	āmana	believe[d]	IV	Verb	 قُلْ يَا أَهْلَ الْكِتَابِ لِمَ تَصُدُّونَ عَنْ سَبِيلِ اللَّهِ مَنْ آمَنَ
3:100	3	āmanū	believe[d]	IV	Verb	 يَا أَيُّهَا الَّذِينَ آمَنُوا إِنْ تُطِيعُوا فَرِيقًا مِنَ الَّذِينَ أُوتُوا الْكِتَابَ يَرُدُّوكُمْ بَعْدَ إِيمَانِكُمْ كَافِرِينَ
3:102	3	āmanū	believe[d]	IV	Verb	 يَا أَيُّهَا الَّذِينَ آمَنُوا اتَّقُوا اللَّهَ حَقَّ تُقَاتِهِ
3:110	11	watu'minūna	and believing	IV	Verb	 تَأْمُرُونَ بِالْمَعْرُوفِ وَتَنْهَوْنَ عَنِ الْمُنْكَرِ وَتُؤْمِنُونَ بِاللَّهِ
3:110	14	āmana	believed	IV	Verb	 وَلَوْ آمَنَ أَهْلُ الْكِتَابِ لَكَانَ خَيْرًا لَهُمْ
3:114	1	yu'minūna	They believe	IV	Verb	 يُؤْمِنُونَ بِاللَّهِ وَالْيَوْمِ الْآخِرِ وَيَأْمُرُونَ بِالْمَعْرُوفِ
3:118	3	āmanū	believe[d]	IV	Verb	 يَا أَيُّهَا الَّذِينَ آمَنُوا لَا تَتَّخِذُوا بِطَانَةً مِنْ دُونِكُمْ
3:119	6	watu'minūna	and you believe	IV	Verb	 هَا أَنْتُمْ أُولَاءِ تُحِبُّونَهُمْ وَلَا يُحِبُّونَكُمْ وَتُؤْمِنُونَ بِالْكِتَابِ كُلِّهِ
3:119	12	āmannā	We believe	IV	Verb	 وَإِذَا لَقُوكُمْ قَالُوا آمَنَّا وَإِذَا خَلَوْا عَضُّوا عَلَيْكُمُ الْأَنَامِلَ
3:130	3	āmanū	believe	IV	Verb	 يَا أَيُّهَا الَّذِينَ آمَنُوا لَا تَأْكُلُوا الرِّبَا أَضْعَافًا مُضَاعَفَةً
3:140	17	āmanū	believe[d]	IV	Verb	 وَلِيَعْلَمَ اللَّهُ الَّذِينَ آمَنُوا وَيَتَّخِذَ مِنْكُمْ شُهَدَاءَ
3:141	4	āmanū	believe	IV	Verb	 وَلِيُمَحِّصَ اللَّهُ الَّذِينَ آمَنُوا وَيَمْحَقَ الْكَافِرِينَ
3:149	3	āmanū	believe	IV	Verb	 يَا أَيُّهَا الَّذِينَ آمَنُوا إِنْ تُطِيعُوا الَّذِينَ كَفَرُوا يَرُدُّوكُمْ
3:156	3	āmanū	believe[d]	IV	Verb	 يَا أَيُّهَا الَّذِينَ آمَنُوا لَا تَكُونُوا كَالَّذِينَ كَفَرُوا
3:179	28	faāminū	so believe	IV	Verb	 فَآمِنُوا بِاللَّهِ وَرُسُلِهِ وَإِنْ تُؤْمِنُوا وَتَتَّقُوا فَلَكُمْ أَجْرٌ
3:179	32	tu'minū	you believe	IV	Verb	 وَإِنْ تُؤْمِنُوا وَتَتَّقُوا فَلَكُمْ أَجْرٌ عَظِيمٌ
3:183	8	nu'mina	we (should) believe	IV	Verb	 إِنَّ اللَّهَ عَهِدَ إِلَيْنَا أَلَّا نُؤْمِنَ لِرَسُولٍ حَتَّىٰ يَأْتِيَنَا بِقُرْبَانٍ
3:193	8	āminū	Believe	IV	Verb	 رَبَّنَا إِنَّنَا سَمِعْنَا مُنَادِيًا يُنَادِي لِلْإِيمَانِ أَنْ آمِنُوا بِرَبِّكُمْ
3:193	10	faāmannā	so we have believed	IV	Verb	 رَبَّنَا إِنَّنَا سَمِعْنَا مُنَادِيًا يُنَادِي لِلْإِيمَانِ أَنْ آمِنُوا بِرَبِّكُمْ فَآمَنَّا
3:199	6	yu'minu	believe	IV	Verb	 وَإِنَّ مِنْ أَهْلِ الْكِتَابِ لَمَنْ يُؤْمِنُ بِاللَّهِ وَمَا أُنْزِلَ إِلَيْكُمْ
3:200	3	āmanū	believe[d]	IV	Verb	 يَا أَيُّهَا الَّذِينَ آمَنُوا اصْبِرُوا وَصَابِرُوا وَرَابِطُوا
4:19	3	āmanū	believe[d]	IV	Verb	 يَا أَيُّهَا الَّذِينَ آمَنُوا لَا يَحِلُّ لَكُمْ أَنْ تَرِثُوا النِّسَاءَ كَرْهًا
4:29	3	āmanū	believe[d]	IV	Verb	 يَا أَيُّهَا الَّذِينَ آمَنُوا لَا تَأْكُلُوا أَمْوَالَكُمْ بَيْنَكُمْ بِالْبَاطِلِ
4:38	7	yu'minūna	they believe	IV	Verb	 وَالَّذِينَ يُنْفِقُونَ أَمْوَالَهُمْ رِئَاءَ النَّاسِ وَلَا يُؤْمِنُونَ بِاللَّهِ
4:39	4	āmanū	they believed	IV	Verb	 وَمَاذَا عَلَيْهِمْ لَوْ آمَنُوا بِاللَّهِ وَالْيَوْمِ الْآخِرِ
4:43	3	āmanū	believe[d]	IV	Verb	 يَا أَيُّهَا الَّذِينَ آمَنُوا لَا تَقْرَبُوا الصَّلَاةَ وَأَنْتُمْ سُكَارَىٰ
4:46	36	yu'minūna	they believe	IV	Verb	 وَلَٰكِنْ لَعَنَهُمُ اللَّهُ بِكُفْرِهِمْ فَلَا يُؤْمِنُونَ إِلَّا قَلِيلًا
4:47	5	āminū	believe	IV	Verb	 يَا أَيُّهَا الَّذِينَ أُوتُوا الْكِتَابَ آمِنُوا بِمَا نَزَّلْنَا
4:51	9	yu'minūna	They believe	IV	Verb	 أَلَمْ تَرَ إِلَى الَّذِينَ أُوتُوا نَصِيبًا مِنَ الْكِتَابِ يُؤْمِنُونَ بِالْجِبْتِ
4:51	19	āmanū	believe[d]	IV	Verb	 هَٰؤُلَاءِ أَهْدَىٰ مِنَ الَّذِينَ آمَنُوا سَبِيلًا
4:55	3	āmana	believed	IV	Verb	 فَمِنْهُمْ مَنْ آمَنَ بِهِ وَمِنْهُمْ مَنْ صَدَّ عَنْهُ وَكَفَىٰ بِجَهَنَّمَ سَعِيرًا
4:57	2	āmanū	believe[d]	IV	Verb	 وَالَّذِينَ آمَنُوا وَعَمِلُوا الصَّالِحَاتِ سَنُدْخِلُهُمْ جَنَّاتٍ
4:59	3	āmanū	believe[d]	IV	Verb	 يَا أَيُّهَا الَّذِينَ آمَنُوا أَطِيعُوا اللَّهَ وَأَطِيعُوا الرَّسُولَ
4:59	21	tu'minūna	believe	IV	Verb	 فَرُدُّوهُ إِلَى اللَّهِ وَالرَّسُولِ إِنْ كُنْتُمْ تُؤْمِنُونَ بِاللَّهِ وَالْيَوْمِ الْآخِرِ
4:60	7	āmanū	believe	IV	Verb	 أَلَمْ تَرَ إِلَى الَّذِينَ يَزْعُمُونَ أَنَّهُمْ آمَنُوا بِمَا أُنْزِلَ إِلَيْكَ
4:65	4	yu'minūna	will they believe	IV	Verb	 فَلَا وَرَبِّكَ لَا يُؤْمِنُونَ حَتَّىٰ يُحَكِّمُوكَ فِيمَا شَجَرَ بَيْنَهُمْ
4:71	3	āmanū	believe[d]	IV	Verb	 يَا أَيُّهَا الَّذِينَ آمَنُوا خُذُوا حِذْرَكُمْ فَانْفِرُوا ثُبَاتٍ
4:76	2	āmanū	believe	IV	Verb	 الَّذِينَ آمَنُوا يُقَاتِلُونَ فِي سَبِيلِ اللَّهِ
4:94	3	āmanū	believe[d]	IV	Verb	 يَا أَيُّهَا الَّذِينَ آمَنُوا إِذَا ضَرَبْتُمْ فِي سَبِيلِ اللَّهِ فَتَبَيَّنُوا
4:122	2	āmanū	believe[d]	IV	Verb	 وَالَّذِينَ آمَنُوا وَعَمِلُوا الصَّالِحَاتِ سَنُدْخِلُهُمْ جَنَّاتٍ
4:135	3	āmanū	believe[d]	IV	Verb	 يَا أَيُّهَا الَّذِينَ آمَنُوا كُونُوا قَوَّامِينَ بِالْقِسْطِ شُهَدَاءَ لِلَّهِ
4:136	3	āmanū	believe[d]	IV	Verb	 يَا أَيُّهَا الَّذِينَ آمَنُوا آمِنُوا بِاللَّهِ وَرَسُولِهِ
4:136	4	āminū	Believe	IV	Verb	 يَا أَيُّهَا الَّذِينَ آمَنُوا آمِنُوا بِاللَّهِ وَرَسُولِهِ
4:137	3	āmanū	believed	IV	Verb	 إِنَّ الَّذِينَ آمَنُوا ثُمَّ كَفَرُوا
4:137	7	āmanū	(again) believed	IV	Verb	 ثُمَّ آمَنُوا ثُمَّ كَفَرُوا ثُمَّ ازْدَادُوا كُفْرًا لَمْ يَكُنِ اللَّهُ لِيَغْفِرَ لَهُمْ
4:144	3	āmanū	believe[d]	IV	Verb	 يَا أَيُّهَا الَّذِينَ آمَنُوا لَا تَتَّخِذُوا الْكَافِرِينَ أَوْلِيَاءَ
4:147	7	waāmantum	and you believe	IV	Verb	 مَا يَفْعَلُ اللَّهُ بِعَذَابِكُمْ إِنْ شَكَرْتُمْ وَآمَنْتُمْ
4:150	13	nu'minu	We believe	IV	Verb	 وَيَقُولُونَ نُؤْمِنُ بِبَعْضٍ وَنَكْفُرُ بِبَعْضٍ
4:152	2	āmanū	believe	IV	Verb	 وَالَّذِينَ آمَنُوا بِاللَّهِ وَرُسُلِهِ وَلَمْ يُفَرِّقُوا بَيْنَ أَحَدٍ مِنْهُمْ
4:155	20	yu'minūna	they believe	IV	Verb	 بَلْ طَبَعَ اللَّهُ عَلَيْهَا بِكُفْرِهِمْ فَلَا يُؤْمِنُونَ إِلَّا قَلِيلًا
4:159	6	layu'minanna	surely he believes	IV	Verb	 وَإِنْ مِنْ أَهْلِ الْكِتَابِ إِلَّا لَيُؤْمِنَنَّ بِهِ قَبْلَ مَوْتِهِ
4:162	7	yu'minūna	believe	IV	Verb	 لَٰكِنِ الرَّاسِخُونَ فِي الْعِلْمِ مِنْهُمْ وَالْمُؤْمِنُونَ يُؤْمِنُونَ بِمَا أُنْزِلَ
