surah:ayah	position	word	meaning	ayah_link
5:83	18	āmannā	we have believed	 يَقُولُونَ رَبَّنَا آمَنَّا فَاكْتُبْنَا مَعَ الشَّاهِدِينَ
5:84	4	nu'minu	we believe	 وَمَا لَنَا لَا نُؤْمِنُ بِاللَّهِ وَمَا جَاءَنَا مِنَ الْحَقِّ
5:87	3	āmanū	believe	 يَا أَيُّهَا الَّذِينَ آمَنُوا لَا تُحَرِّمُوا طَيِّبَاتِ مَا أَحَلَّ اللَّهُ لَكُمْ
5:90	3	āmanū	believe	 يَا أَيُّهَا الَّذِينَ آمَنُوا إِنَّمَا الْخَمْرُ وَالْمَيْسِرُ وَالْأَنْصَابُ
5:93	4	āmanū	believe	 لَيْسَ عَلَى الَّذِينَ آمَنُوا وَعَمِلُوا الصَّالِحَاتِ جُنَاحٌ فِيمَا طَعِمُوا
5:93	13	waāmanū	and they believe	 إِذَا مَا اتَّقَوْا وَآمَنُوا وَعَمِلُوا الصَّالِحَاتِ
5:93	18	waāmanū	and believe	 ثُمَّ اتَّقَوْا وَآمَنُوا ثُمَّ اتَّقَوْا وَأَحْسَنُوا
5:94	3	āmanū	believe	 يَا أَيُّهَا الَّذِينَ آمَنُوا لَيَبْلُوَنَّكُمُ اللَّهُ بِشَيْءٍ مِنَ الصَّيْدِ
5:95	3	āmanū	believe	 يَا أَيُّهَا الَّذِينَ آمَنُوا لَا تَقْتُلُوا الصَّيْدَ وَأَنْتُمْ حُرُمٌ
5:101	3	āmanū	believe	 يَا أَيُّهَا الَّذِينَ آمَنُوا لَا تَسْأَلُوا عَنْ أَشْيَاءَ
5:105	3	āmanū	believe	 يَا أَيُّهَا الَّذِينَ آمَنُوا عَلَيْكُمْ أَنْفُسَكُمْ لَا يَضُرُّكُمْ مَنْ ضَلَّ
5:106	3	āmanū	believe	 يَا أَيُّهَا الَّذِينَ آمَنُوا شَهَادَةُ بَيْنِكُمْ إِذَا حَضَرَ أَحَدَكُمُ الْمَوْتُ
5:111	6	āminū	believe	 وَإِذْ أَوْحَيْتُ إِلَى الْحَوَارِيِّينَ أَنْ آمِنُوا بِي وَبِرَسُولِي
5:111	10	āmannā	We believe	 قَالُوا آمَنَّا وَاشْهَدْ بِأَنَّنَا مُسْلِمُونَ
6:12	25	yu'minūna	believe	 الَّذِينَ خَسِرُوا أَنْفُسَهُمْ فَهُمْ لَا يُؤْمِنُونَ
6:20	13	yu'minūna	believe	 الَّذِينَ خَسِرُوا أَنْفُسَهُمْ فَهُمْ لَا يُؤْمِنُونَ
6:25	19	yu'minū	will they believe	 يَرَوْا كُلَّ آيَةٍ لَا يُؤْمِنُوا بِهَا حَتَّىٰ إِذَا جَاءُوكَ يُجَادِلُونَكَ
6:48	8	āmana	believed	 فَمَنْ آمَنَ وَأَصْلَحَ فَلَا خَوْفٌ عَلَيْهِمْ وَلَا هُمْ يَحْزَنُونَ
6:54	4	yu'minūna	believe	 وَإِذَا جَاءَكَ الَّذِينَ يُؤْمِنُونَ بِآيَاتِنَا فَقُلْ سَلَامٌ عَلَيْكُمْ
6:82	2	āmanū	believed	 الَّذِينَ آمَنُوا وَلَمْ يَلْبِسُوا إِيمَانَهُمْ بِظُلْمٍ أُولَٰئِكَ لَهُمُ الْأَمْنُ
6:92	15	yu'minūna	believe	 وَلِتُنْذِرَ أُمَّ الْقُرَىٰ وَمَنْ حَوْلَهَا وَالَّذِينَ يُؤْمِنُونَ بِالْآخِرَةِ
6:92	17	yu'minūna	they believe	 يُؤْمِنُونَ بِهِ وَهُمْ عَلَىٰ صَلَاتِهِمْ يُحَافِظُونَ
6:99	44	yu'minūna	(who) believe	 إِنَّ فِي ذَٰلِكُمْ لَآيَاتٍ لِقَوْمٍ يُؤْمِنُونَ
6:109	8	layu'minunna	they would surely believe	 وَأَقْسَمُوا بِاللَّهِ جَهْدَ أَيْمَانِهِمْ لَئِنْ جَاءَتْهُمْ آيَةٌ لَيُؤْمِنُنَّ بِهَا
6:109	21	yu'minūna	they will believe	 وَمَا يُشْعِرُكُمْ أَنَّهَا إِذَا جَاءَتْ لَا يُؤْمِنُونَ
6:110	6	yu'minū	they believe	 وَنُقَلِّبُ أَفْئِدَتَهُمْ وَأَبْصَارَهُمْ كَمَا لَمْ يُؤْمِنُوا بِهِ أَوَّلَ مَرَّةٍ
6:111	15	liyu'minū	to believe	 مَا كَانُوا لِيُؤْمِنُوا إِلَّا أَنْ يَشَاءَ اللَّهُ
6:113	6	yu'minūna	believe	 وَلِتَصْغَىٰ إِلَيْهِ أَفْئِدَةُ الَّذِينَ لَا يُؤْمِنُونَ بِالْآخِرَةِ
6:124	6	nu'mina	we will believe	 قَالُوا لَنْ نُؤْمِنَ حَتَّىٰ نُؤْتَىٰ مِثْلَ مَا أُوتِيَ رُسُلُ اللَّهِ
6:125	28	yu'minūna	believe	 كَذَٰلِكَ يَجْعَلُ اللَّهُ الرِّجْسَ عَلَى الَّذِينَ لَا يُؤْمِنُونَ
6:150	23	yu'minūna	believe	 وَلَا تَتَّبِعْ أَهْوَاءَ الَّذِينَ كَذَّبُوا بِآيَاتِنَا وَالَّذِينَ لَا يُؤْمِنُونَ بِالْآخِرَةِ
6:154	17	yu'minūna	believe	 لَعَلَّهُمْ بِلِقَاءِ رَبِّهِمْ يُؤْمِنُونَ
6:158	26	āmanat	believed	 لَا يَنْفَعُ نَفْسًا إِيمَانُهَا لَمْ تَكُنْ آمَنَتْ مِنْ قَبْلُ
7:27	30	yu'minūna	believe	 إِنَّا جَعَلْنَا الشَّيَاطِينَ أَوْلِيَاءَ لِلَّذِينَ لَا يُؤْمِنُونَ
7:32	15	āmanū	believe	 قُلْ هِيَ لِلَّذِينَ آمَنُوا فِي الْحَيَاةِ الدُّنْيَا خَالِصَةً يَوْمَ الْقِيَامَةِ
7:42	2	āmanū	believe	 وَالَّذِينَ آمَنُوا وَعَمِلُوا الصَّالِحَاتِ لَا نُكَلِّفُ نَفْسًا إِلَّا وُسْعَهَا
7:52	10	yu'minūna	who believe	 فَصَّلْنَاهُ عَلَىٰ عِلْمٍ هُدًى وَرَحْمَةً لِقَوْمٍ يُؤْمِنُونَ
7:75	10	āmana	believed	 لِمَنْ آمَنَ مِنْهُمْ أَتَعْلَمُونَ أَنَّ صَالِحًا مُرْسَلٌ مِنْ رَبِّهِ
7:76	6	āmantum	you believe	 قَالَ الَّذِينَ اسْتَكْبَرُوا إِنَّا بِالَّذِي آمَنْتُمْ بِهِ كَافِرُونَ
7:86	11	āmana	believe	 وَتَصُدُّونَ عَنْ سَبِيلِ اللَّهِ مَنْ آمَنَ بِهِ وَتَبْغُونَهَا عِوَجًا
7:87	5	āmanū	(who has) believed	 وَإِنْ كَانَ طَائِفَةٌ مِنْكُمْ آمَنُوا بِالَّذِي أُرْسِلْتُ بِهِ
7:87	11	yu'minū	they believe	 وَطَائِفَةٌ لَمْ يُؤْمِنُوا فَاصْبِرُوا حَتَّىٰ يَحْكُمَ اللَّهُ بَيْنَنَا
7:88	10	āmanū	(have) believed	 لَنُخْرِجَنَّكَ يَا شُعَيْبُ وَالَّذِينَ آمَنُوا مَعَكَ مِنْ قَرْيَتِنَا
7:96	5	āmanū	(had) believed	 وَلَوْ أَنَّ أَهْلَ الْقُرَىٰ آمَنُوا وَاتَّقَوْا لَفَتَحْنَا عَلَيْهِمْ بَرَكَاتٍ
7:101	13	liyu'minū	to believe	 وَلَقَدْ جَاءَتْهُمْ رُسُلُهُمْ بِالْبَيِّنَاتِ فَمَا كَانُوا لِيُؤْمِنُوا بِمَا كَذَّبُوا
7:121	2	āmannā	We believe	 قَالُوا آمَنَّا بِرَبِّ الْعَالَمِينَ
7:123	3	āmantum	You believed	 قَالَ فِرْعَوْنُ آمَنْتُمْ بِهِ قَبْلَ أَنْ آذَنَ لَكُمْ
7:126	6	āmannā	we believed	 وَمَا تَنْقِمُ مِنَّا إِلَّا أَنْ آمَنَّا بِآيَاتِ رَبِّنَا لَمَّا جَاءَتْنَا
7:134	17	lanu'minanna	surely, we will believe	 لَئِنْ كَشَفْتَ عَنَّا الرِّجْزَ لَنُؤْمِنَنَّ لَكَ
7:146	15	yu'minū	(will) they believe	 وَإِنْ يَرَوْا كُلَّ آيَةٍ لَا يُؤْمِنُوا بِهَا
7:153	8	waāmanū	and believed	 ثُمَّ تَابُوا مِنْ بَعْدِهَا وَآمَنُوا إِنَّ رَبَّكَ مِنْ بَعْدِهَا لَغَفُورٌ
7:156	30	yu'minūna	they believe	 وَالَّذِينَ هُمْ بِآيَاتِنَا يُؤْمِنُونَ
7:157	32	āmanū	believe	 فَالَّذِينَ آمَنُوا بِهِ وَعَزَّرُوهُ وَنَصَرُوهُ وَاتَّبَعُوا النُّورَ
7:158	20	faāminū	So believe	 فَآمِنُوا بِاللَّهِ وَرَسُولِهِ النَّبِيِّ الْأُمِّيِّ الَّذِي يُؤْمِنُ بِاللَّهِ
7:158	26	yu'minu	believes	 فَآمِنُوا بِاللَّهِ وَرَسُولِهِ النَّبِيِّ الْأُمِّيِّ الَّذِي يُؤْمِنُ بِاللَّهِ وَكَلِمَاتِهِ
7:185	22	yu'minūna	will they believe	 فَبِأَيِّ حَدِيثٍ بَعْدَهُ يُؤْمِنُونَ
7:188	28	yu'minūna	who believe	 إِنْ أَنَا إِلَّا نَذِيرٌ وَبَشِيرٌ لِقَوْمٍ يُؤْمِنُونَ
7:203	23	yu'minūna	who believe	 هَٰذَا بَصَائِرُ مِنْ رَبِّكُمْ وَهُدًى وَرَحْمَةٌ لِقَوْمٍ يُؤْمِنُونَ
8:12	10	āmanū	believed	 إِذْ يُوحِي رَبُّكَ إِلَى الْمَلَائِكَةِ أَنِّي مَعَكُمْ فَثَبِّتُوا الَّذِينَ آمَنُوا
8:15	3	āmanū	believe	 يَا أَيُّهَا الَّذِينَ آمَنُوا إِذَا لَقِيتُمُ الَّذِينَ كَفَرُوا زَحْفًا
8:20	3	āmanū	believe	 يَا أَيُّهَا الَّذِينَ آمَنُوا أَطِيعُوا اللَّهَ وَرَسُولَهُ وَلَا تَوَلَّوْا عَنْهُ
8:24	3	āmanū	believe	 يَا أَيُّهَا الَّذِينَ آمَنُوا اسْتَجِيبُوا لِلَّهِ وَلِلرَّسُولِ إِذَا دَعَاكُمْ
8:27	3	āmanū	believe	 يَا أَيُّهَا الَّذِينَ آمَنُوا لَا تَخُونُوا اللَّهَ وَالرَّسُولَ وَتَخُونُوا أَمَانَاتِكُمْ
8:29	3	āmanū	believe	 يَا أَيُّهَا الَّذِينَ آمَنُوا إِنْ تَتَّقُوا اللَّهَ يَجْعَلْ لَكُمْ فُرْقَانًا
8:41	18	āmantum	believe	 إِنْ كُنْتُمْ آمَنْتُمْ بِاللَّهِ وَمَا أَنْزَلْنَا عَلَىٰ عَبْدِنَا يَوْمَ الْفُرْقَانِ
8:45	3	āmanū	believe	 يَا أَيُّهَا الَّذِينَ آمَنُوا إِذَا لَقِيتُمْ فِئَةً فَاثْبُتُوا
8:55	10	yu'minūna	believe	 إِنَّ شَرَّ الدَّوَابِّ عِنْدَ اللَّهِ الَّذِينَ كَفَرُوا فَهُمْ لَا يُؤْمِنُونَ
8:72	3	āmanū	believed	 إِنَّ الَّذِينَ آمَنُوا وَهَاجَرُوا وَجَاهَدُوا بِأَمْوَالِهِمْ
8:72	19	āmanū	believed	 وَالَّذِينَ آمَنُوا وَلَمْ يُهَاجِرُوا مَا لَكُمْ مِنْ وَلَايَتِهِمْ مِنْ شَيْءٍ
8:74	2	āmanū	believed	 وَالَّذِينَ آمَنُوا وَهَاجَرُوا وَجَاهَدُوا فِي سَبِيلِ اللَّهِ
8:75	2	āmanū	believed	 وَالَّذِينَ آمَنُوا مِنْ بَعْدُ وَهَاجَرُوا وَجَاهَدُوا مَعَكُمْ
9:18	6	āmana	believes	 إِنَّمَا يَعْمُرُ مَسَاجِدَ اللَّهِ مَنْ آمَنَ بِاللَّهِ وَالْيَوْمِ الْآخِرِ
9:19	8	āmana	believes	 أَجَعَلْتُمْ سِقَايَةَ الْحَاجِّ وَعِمَارَةَ الْمَسْجِدِ الْحَرَامِ كَمَنْ آمَنَ بِاللَّهِ
9:20	2	āmanū	believed	 الَّذِينَ آمَنُوا وَهَاجَرُوا وَجَاهَدُوا فِي سَبِيلِ اللَّهِ
9:23	3	āmanū	believe	 يَا أَيُّهَا الَّذِينَ آمَنُوا لَا تَتَّخِذُوا آبَاءَكُمْ وَإِخْوَانَكُمْ أَوْلِيَاءَ إِنِ اسْتَحَبُّوا الْكُفْرَ
9:28	3	āmanū	O you who believe	 يَا أَيُّهَا الَّذِينَ آمَنُوا إِنَّمَا الْمُشْرِكُونَ نَجَسٌ
9:29	4	yu'minūna	believe	 قَاتِلُوا الَّذِينَ لَا يُؤْمِنُونَ بِاللَّهِ وَلَا بِالْيَوْمِ الْآخِرِ
9:34	3	āmanū	O you who believe	 يَا أَيُّهَا الَّذِينَ آمَنُوا إِنَّ كَثِيرًا مِنَ الْأَحْبَارِ
9:38	3	āmanū	O you who believe	 يَا أَيُّهَا الَّذِينَ آمَنُوا مَا لَكُمْ إِذَا قِيلَ لَكُمُ انْفِرُوا
9:44	4	yu'minūna	believe	 لَا يَسْتَأْذِنُكَ الَّذِينَ يُؤْمِنُونَ بِاللَّهِ وَالْيَوْمِ الْآخِرِ
9:45	5	yu'minūna	believe	 إِنَّمَا يَسْتَأْذِنُكَ الَّذِينَ لَا يُؤْمِنُونَ بِاللَّهِ وَالْيَوْمِ الْآخِرِ
9:61	12	yu'minu	he believes	 قُلْ أُذُنُ خَيْرٍ لَكُمْ يُؤْمِنُ بِاللَّهِ
9:61	14	wayu'minu	and believes	 وَيُؤْمِنُ لِلْمُؤْمِنِينَ وَرَحْمَةٌ لِلَّذِينَ آمَنُوا مِنْكُمْ
9:61	18	āmanū	believe	 يُؤْمِنُ بِاللَّهِ وَيُؤْمِنُ لِلْمُؤْمِنِينَ وَرَحْمَةٌ لِلَّذِينَ آمَنُوا مِنْكُمْ
9:86	5	āminū	believe	 أُنْزِلَتْ سُورَةٌ أَنْ آمِنُوا بِاللَّهِ وَجَاهِدُوا مَعَ رَسُولِهِ
9:88	4	āmanū	believed	 لَٰكِنِ الرَّسُولُ وَالَّذِينَ آمَنُوا مَعَهُ جَاهَدُوا بِأَمْوَالِهِمْ
9:94	10	nu'mina	we will believe	 قُلْ لَا تَعْتَذِرُوا لَنْ نُؤْمِنَ لَكُمْ قَدْ نَبَّأَنَا اللَّهُ مِنْ أَخْبَارِكُمْ
9:99	4	yu'minu	believes	 وَمِنَ الْأَعْرَابِ مَنْ يُؤْمِنُ بِاللَّهِ وَالْيَوْمِ الْآخِرِ
9:113	5	āmanū	believe	 مَا كَانَ لِلنَّبِيِّ وَالَّذِينَ آمَنُوا أَنْ يَسْتَغْفِرُوا لِلْمُشْرِكِينَ
9:119	3	āmanū	O you who believe	 يَا أَيُّهَا الَّذِينَ آمَنُوا اتَّقُوا اللَّهَ وَكُونُوا مَعَ الصَّادِقِينَ
9:123	3	āmanū	O you who believe	 يَا أَيُّهَا الَّذِينَ آمَنُوا قَاتِلُوا الَّذِينَ يَلُونَكُمْ مِنَ الْكُفَّارِ
9:124	14	āmanū	believe	 فَأَمَّا الَّذِينَ آمَنُوا فَزَادَتْهُمْ إِيمَانًا وَهُمْ يَسْتَبْشِرُونَ
10:2	14	āmanū	believe	 وَبَشِّرِ الَّذِينَ آمَنُوا أَنَّ لَهُمْ قَدَمَ صِدْقٍ عِنْدَ رَبِّهِمْ
10:4	14	āmanū	believed	 لِيَجْزِيَ الَّذِينَ آمَنُوا وَعَمِلُوا الصَّالِحَاتِ بِالْقِسْطِ
10:9	3	āmanū	believed	 إِنَّ الَّذِينَ آمَنُوا وَعَمِلُوا الصَّالِحَاتِ يَهْدِيهِمْ رَبُّهُمْ
10:13	13	liyu'minū	to believe	 وَجَاءَتْهُمْ رُسُلُهُمْ بِالْبَيِّنَاتِ وَمَا كَانُوا لِيُؤْمِنُوا
10:33	10	yu'minūna	believe	 كَذَٰلِكَ حَقَّتْ كَلِمَتُ رَبِّكَ عَلَى الَّذِينَ فَسَقُوا أَنَّهُمْ لَا يُؤْمِنُونَ
10:40	3	yu'minu	believes	 وَمِنْهُمْ مَنْ يُؤْمِنُ بِهِ
10:40	8	yu'minu	believe	 وَمِنْهُمْ مَنْ لَا يُؤْمِنُ بِهِ وَرَبُّكَ أَعْلَمُ بِالْمُفْسِدِينَ
10:51	5	āmantum	you (will) believe	 أَثُمَّ إِذَا مَا وَقَعَ آمَنْتُمْ بِهِ آلْآنَ وَقَدْ كُنْتُمْ بِهِ تَسْتَعْجِلُونَ
10:63	2	āmanū	believe	 الَّذِينَ آمَنُوا وَكَانُوا يَتَّقُونَ
10:74	12	liyu'minū	to believe	 فَجَاءُوهُمْ بِالْبَيِّنَاتِ فَمَا كَانُوا لِيُؤْمِنُوا بِمَا كَذَّبُوا بِهِ مِنْ قَبْلُ
10:83	2	āmana	believed	 فَمَا آمَنَ لِمُوسَىٰ إِلَّا ذُرِّيَّةٌ مِنْ قَوْمِهِ عَلَىٰ خَوْفٍ مِنْ فِرْعَوْنَ
10:84	6	āmantum	believed	 إِنْ كُنْتُمْ آمَنْتُمْ بِاللَّهِ فَعَلَيْهِ تَوَكَّلُوا إِنْ كُنْتُمْ مُسْلِمِينَ
10:88	25	yu'minū	they believe	 وَاشْدُدْ عَلَىٰ قُلُوبِهِمْ فَلَا يُؤْمِنُوا حَتَّىٰ يَرَوُا الْعَذَابَ الْأَلِيمَ
10:90	15	āmantu	I believe	 حَتَّىٰ إِذَا أَدْرَكَهُ الْغَرَقُ قَالَ آمَنْتُ
10:90	21	āmanat	in Whom believe	 لَا إِلَٰهَ إِلَّا الَّذِي آمَنَتْ بِهِ بَنُو إِسْرَائِيلَ
10:96	8	yu'minūna	believe	 إِنَّ الَّذِينَ حَقَّتْ عَلَيْهِمْ كَلِمَتُ رَبِّكَ لَا يُؤْمِنُونَ
10:98	4	āmanat	that believed	 فَلَوْلَا كَانَتْ قَرْيَةٌ آمَنَتْ فَنَفَعَهَا إِيمَانُهَا إِلَّا قَوْمَ يُونُسَ
10:98	11	āmanū	they believed	 إِلَّا قَوْمَ يُونُسَ لَمَّا آمَنُوا كَشَفْنَا عَنْهُمْ عَذَابَ الْخِزْيِ
10:99	4	laāmana	surely, (would) have believed	 وَلَوْ شَاءَ رَبُّكَ لَآمَنَ مَنْ فِي الْأَرْضِ كُلُّهُمْ جَمِيعًا
10:100	5	tu'mina	believe	 وَمَا كَانَ لِنَفْسٍ أَنْ تُؤْمِنَ إِلَّا بِإِذْنِ اللَّهِ
10:101	14	yu'minūna	believe	 وَمَا تُغْنِي الْآيَاتُ وَالنُّذُرُ عَنْ قَوْمٍ لَا يُؤْمِنُونَ
10:103	5	āmanū	believe	 ثُمَّ نُنَجِّي رُسُلَنَا وَالَّذِينَ آمَنُوا
11:17	17	yu'minūna	believe	 أُولَٰئِكَ يُؤْمِنُونَ بِهِ وَمَنْ يَكْفُرْ بِهِ مِنَ الْأَحْزَابِ فَالنَّارُ مَوْعِدُهُ
11:17	39	yu'minūna	believe	 إِنَّهُ الْحَقُّ مِنْ رَبِّكَ وَلَٰكِنَّ أَكْثَرَ النَّاسِ لَا يُؤْمِنُونَ
11:23	3	āmanū	believe	 إِنَّ الَّذِينَ آمَنُوا وَعَمِلُوا الصَّالِحَاتِ وَأَخْبَتُوا إِلَىٰ رَبِّهِمْ
11:29	15	āmanū	believed	 وَمَا أَنَا بِطَارِدِ الَّذِينَ آمَنُوا إِنَّهُمْ مُلَاقُو رَبِّهِمْ
11:36	6	yu'mina	believe	 وَأُوحِيَ إِلَىٰ نُوحٍ أَنَّهُ لَنْ يُؤْمِنَ مِنْ قَوْمِكَ إِلَّا مَنْ قَدْ آمَنَ
11:36	12	āmana	believed	 وَأُوحِيَ إِلَىٰ نُوحٍ أَنَّهُ لَنْ يُؤْمِنَ مِنْ قَوْمِكَ إِلَّا مَنْ قَدْ آمَنَ
11:40	21	āmana	believed	 وَأَهْلَكَ إِلَّا مَنْ سَبَقَ عَلَيْهِ الْقَوْلُ وَمَنْ آمَنَ
11:40	23	āmana	believed	 وَمَا آمَنَ مَعَهُ إِلَّا قَلِيلٌ
11:58	7	āmanū	believed	 وَلَمَّا جَاءَ أَمْرُنَا نَجَّيْنَا هُودًا وَالَّذِينَ آمَنُوا مَعَهُ بِرَحْمَةٍ مِنَّا
11:66	7	āmanū	believed	 فَلَمَّا جَاءَ أَمْرُنَا نَجَّيْنَا صَالِحًا وَالَّذِينَ آمَنُوا مَعَهُ بِرَحْمَةٍ مِنَّا
11:94	7	āmanū	believed	 وَلَمَّا جَاءَ أَمْرُنَا نَجَّيْنَا شُعَيْبًا وَالَّذِينَ آمَنُوا مَعَهُ بِرَحْمَةٍ مِنَّا
11:121	4	yu'minūna	believe	 وَقُلْ لِلَّذِينَ لَا يُؤْمِنُونَ اعْمَلُوا عَلَىٰ مَكَانَتِكُمْ إِنَّا عَامِلُونَ
12:37	21	yu'minūna	they believe	 إِنِّي تَرَكْتُ مِلَّةَ قَوْمٍ لَا يُؤْمِنُونَ بِاللَّهِ وَهُمْ بِالْآخِرَةِ هُمْ كَافِرُونَ
12:57	5	āmanū	believe	 وَلَأَجْرُ الْآخِرَةِ خَيْرٌ لِلَّذِينَ آمَنُوا وَكَانُوا يَتَّقُونَ
12:106	2	yu'minu	believe	 وَمَا يُؤْمِنُ أَكْثَرُهُمْ بِاللَّهِ إِلَّا وَهُمْ مُشْرِكُونَ
12:111	23	yu'minūna	who believe	 وَتَفْصِيلَ كُلِّ شَيْءٍ وَهُدًى وَرَحْمَةً لِقَوْمٍ يُؤْمِنُونَ
13:1	15	yu'minūna	believe	 وَلَٰكِنَّ أَكْثَرَ النَّاسِ لَا يُؤْمِنُونَ
13:28	2	āmanū	believed	 الَّذِينَ آمَنُوا وَتَطْمَئِنُّ قُلُوبُهُمْ بِذِكْرِ اللَّهِ
13:29	2	āmanū	believed	 الَّذِينَ آمَنُوا وَعَمِلُوا الصَّالِحَاتِ طُوبَىٰ لَهُمْ وَحُسْنُ مَآبٍ
13:31	22	āmanū	believe	 أَفَلَمْ يَيْأَسِ الَّذِينَ آمَنُوا أَنْ لَوْ يَشَاءُ اللَّهُ لَهَدَى النَّاسَ
14:23	3	āmanū	believed	 وَأُدْخِلَ الَّذِينَ آمَنُوا وَعَمِلُوا الصَّالِحَاتِ جَنَّاتٍ تَجْرِي
14:27	4	āmanū	believe	 يُثَبِّتُ اللَّهُ الَّذِينَ آمَنُوا بِالْقَوْلِ الثَّابِتِ فِي الْحَيَاةِ الدُّنْيَا
14:31	4	āmanū	believe	 قُلْ لِعِبَادِيَ الَّذِينَ آمَنُوا يُقِيمُوا الصَّلَاةَ
15:13	2	yu'minūna	they believe	 لَا يُؤْمِنُونَ بِهِ وَقَدْ خَلَتْ سُنَّةُ الْأَوَّلِينَ
16:22	6	yu'minūna	believe	 فَالَّذِينَ لَا يُؤْمِنُونَ بِالْآخِرَةِ قُلُوبُهُمْ مُنْكِرَةٌ وَهُمْ مُسْتَكْبِرُونَ
16:60	3	yu'minūna	believe	 لِلَّذِينَ لَا يُؤْمِنُونَ بِالْآخِرَةِ مَثَلُ السَّوْءِ
16:64	14	yu'minūna	who believe	 وَهُدًى وَرَحْمَةً لِقَوْمٍ يُؤْمِنُونَ
16:72	17	yu'minūna	they believe	 أَفَبِالْبَاطِلِ يُؤْمِنُونَ وَبِنِعْمَتِ اللَّهِ هُمْ يَكْفُرُونَ
16:79	18	yu'minūna	who believe	 إِنَّ فِي ذَٰلِكَ لَآيَاتٍ لِقَوْمٍ يُؤْمِنُونَ
16:99	7	āmanū	believe	 إِنَّهُ لَيْسَ لَهُ سُلْطَانٌ عَلَى الَّذِينَ آمَنُوا
16:102	10	āmanū	believe	 لِيُثَبِّتَ الَّذِينَ آمَنُوا وَهُدًى وَبُشْرَىٰ لِلْمُسْلِمِينَ
16:104	4	yu'minūna	believe	 إِنَّ الَّذِينَ لَا يُؤْمِنُونَ بِآيَاتِ اللَّهِ لَا يَهْدِيهِمُ اللَّهُ
16:105	6	yu'minūna	believe	 إِنَّمَا يَفْتَرِي الْكَذِبَ الَّذِينَ لَا يُؤْمِنُونَ بِآيَاتِ اللَّهِ
17:10	4	yu'minūna	believe	 وَأَنَّ الَّذِينَ لَا يُؤْمِنُونَ بِالْآخِرَةِ أَعْتَدْنَا لَهُمْ عَذَابًا أَلِيمًا
17:45	9	yu'minūna	believe	 جَعَلْنَا بَيْنَكَ وَبَيْنَ الَّذِينَ لَا يُؤْمِنُونَ بِالْآخِرَةِ حِجَابًا
17:90	3	nu'mina	we will believe	 وَقَالُوا لَنْ نُؤْمِنَ لَكَ حَتَّىٰ تَفْجُرَ لَنَا مِنَ الْأَرْضِ يَنْبُوعًا
17:93	12	nu'mina	we will believe	 وَلَنْ نُؤْمِنَ لِرُقِيِّكَ حَتَّىٰ تُنَزِّلَ عَلَيْنَا كِتَابًا نَقْرَؤُهُ
17:94	5	yu'minū	they believe	 وَمَا مَنَعَ النَّاسَ أَنْ يُؤْمِنُوا إِذْ جَاءَهُمُ الْهُدَىٰ
17:107	2	āminū	Believe	 قُلْ آمِنُوا بِهِ أَوْ لَا تُؤْمِنُوا
17:107	6	tu'minū	believe	 قُلْ آمِنُوا بِهِ أَوْ لَا تُؤْمِنُوا
18:6	8	yu'minū	they believe	 فَلَعَلَّكَ بَاخِعٌ نَفْسَكَ عَلَىٰ آثَارِهِمْ إِنْ لَمْ يُؤْمِنُوا بِهَٰذَا الْحَدِيثِ أَسَفًا
18:13	8	āmanū	who believed	 إِنَّهُمْ فِتْيَةٌ آمَنُوا بِرَبِّهِمْ وَزِدْنَاهُمْ هُدًى
18:29	7	falyu'min	let him believe	 وَقُلِ الْحَقُّ مِنْ رَبِّكُمْ فَمَنْ شَاءَ فَلْيُؤْمِنْ وَمَنْ شَاءَ فَلْيَكْفُرْ
18:30	3	āmanū	believed	 إِنَّ الَّذِينَ آمَنُوا وَعَمِلُوا الصَّالِحَاتِ إِنَّا لَا نُضِيعُ أَجْرَ مَنْ أَحْسَنَ عَمَلًا
