surah:ayah	position	word	meaning	ayah_link
18:55	5	yu'minū	they believe	 وَمَا مَنَعَ النَّاسَ أَنْ يُؤْمِنُوا إِذْ جَاءَهُمُ الْهُدَىٰ
18:88	3	āmana	believes	 وَأَمَّا مَنْ آمَنَ وَعَمِلَ صَالِحًا فَلَهُ جَزَاءً الْحُسْنَىٰ
18:107	3	āmanū	believed	 إِنَّ الَّذِينَ آمَنُوا وَعَمِلُوا الصَّالِحَاتِ كَانَتْ لَهُمْ جَنَّاتُ
19:39	12	yu'minūna	believe	 إِذْ قُضِيَ الْأَمْرُ وَهُمْ فِي غَفْلَةٍ وَهُمْ لَا يُؤْمِنُونَ
19:60	4	waāmana	and believed	 إِلَّا مَنْ تَابَ وَآمَنَ وَعَمِلَ صَالِحًا فَأُولَٰئِكَ يَدْخُلُونَ الْجَنَّةَ
19:73	10	āmanū	believed	 قَالَ الَّذِينَ كَفَرُوا لِلَّذِينَ آمَنُوا أَيُّ الْفَرِيقَيْنِ خَيْرٌ مَقَامًا
19:96	3	āmanū	believed	 إِنَّ الَّذِينَ آمَنُوا وَعَمِلُوا الصَّالِحَاتِ سَيَجْعَلُ لَهُمُ الرَّحْمَٰنُ وُدًّا
20:16	6	yu'minu	believe	 فَلَا يَصُدَّنَّكَ عَنْهَا مَنْ لَا يُؤْمِنُ بِهَا وَاتَّبَعَ هَوَاهُ فَتَرْدَىٰ
20:70	5	āmannā	We believe	 فَأُلْقِيَ السَّحَرَةُ سُجَّدًا قَالُوا آمَنَّا بِرَبِّ هَارُونَ وَمُوسَىٰ
20:71	2	āmantum	You believe	 قَالَ آمَنْتُمْ لَهُ قَبْلَ أَنْ آذَنَ لَكُمْ إِنَّهُ لَكَبِيرُكُمُ
20:73	2	āmannā	we believe	 إِنَّا آمَنَّا بِرَبِّنَا لِيَغْفِرَ لَنَا خَطَايَانَا
20:82	5	waāmana	and believes	 وَإِنِّي لَغَفَّارٌ لِمَنْ تَابَ وَآمَنَ وَعَمِلَ صَالِحًا ثُمَّ اهْتَدَىٰ
20:127	6	yu'min	believes	 وَكَذَٰلِكَ نَجْزِي مَنْ أَسْرَفَ وَلَمْ يُؤْمِنْ بِآيَاتِ رَبِّهِ
21:6	2	āmanat	believed	 مَا آمَنَتْ قَبْلَهُمْ مِنْ قَرْيَةٍ أَهْلَكْنَاهَا أَفَهُمْ يُؤْمِنُونَ
21:6	8	yu'minūna	believe	 مَا آمَنَتْ قَبْلَهُمْ مِنْ قَرْيَةٍ أَهْلَكْنَاهَا أَفَهُمْ يُؤْمِنُونَ
21:30	18	yu'minūna	they believe	 وَجَعَلْنَا مِنَ الْمَاءِ كُلَّ شَيْءٍ حَيٍّ أَفَلَا يُؤْمِنُونَ
22:14	5	āmanū	believe	 إِنَّ اللَّهَ يُدْخِلُ الَّذِينَ آمَنُوا وَعَمِلُوا الصَّالِحَاتِ جَنَّاتٍ
22:17	3	āmanū	have believed	 إِنَّ الَّذِينَ آمَنُوا وَالَّذِينَ هَادُوا وَالصَّابِئِينَ وَالنَّصَارَىٰ
22:23	5	āmanū	believe	 إِنَّ اللَّهَ يُدْخِلُ الَّذِينَ آمَنُوا وَعَمِلُوا الصَّالِحَاتِ جَنَّاتٍ
22:38	6	āmanū	believe	 إِنَّ اللَّهَ يُدَافِعُ عَنِ الَّذِينَ آمَنُوا
22:50	2	āmanū	believe	 فَالَّذِينَ آمَنُوا وَعَمِلُوا الصَّالِحَاتِ لَهُمْ مَغْفِرَةٌ وَرِزْقٌ كَرِيمٌ
22:54	9	fayu'minū	and they believe	 وَلِيَعْلَمَ الَّذِينَ أُوتُوا الْعِلْمَ أَنَّهُ الْحَقُّ مِنْ رَبِّكَ فَيُؤْمِنُوا بِهِ
22:54	18	āmanū	believe	 وَإِنَّ اللَّهَ لَهَادِ الَّذِينَ آمَنُوا إِلَىٰ صِرَاطٍ مُسْتَقِيمٍ
22:56	7	āmanū	believe	 فَالَّذِينَ آمَنُوا وَعَمِلُوا الصَّالِحَاتِ فِي جَنَّاتِ النَّعِيمِ
22:77	3	āmanū	O you who believe	 يَا أَيُّهَا الَّذِينَ آمَنُوا ارْكَعُوا وَاسْجُدُوا وَاعْبُدُوا رَبَّكُمْ
23:44	19	yu'minūna	they believe	 وَجَعَلْنَاهُمْ أَحَادِيثَ فَبُعْدًا لِقَوْمٍ لَا يُؤْمِنُونَ
23:47	2	anu'minu	Shall we believe	 فَقَالُوا أَنُؤْمِنُ لِبَشَرَيْنِ مِثْلِنَا وَقَوْمُهُمَا لَنَا عَابِدُونَ
23:58	5	yu'minūna	believe	 وَالَّذِينَ هُمْ بِآيَاتِ رَبِّهِمْ يُؤْمِنُونَ
23:74	4	yu'minūna	believe	 وَإِنَّ الَّذِينَ لَا يُؤْمِنُونَ بِالْآخِرَةِ عَنِ الصِّرَاطِ لَنَاكِبُونَ
23:109	8	āmannā	We believe	 يَقُولُونَ رَبَّنَا آمَنَّا فَاغْفِرْ لَنَا وَارْحَمْنَا وَأَنْتَ خَيْرُ الرَّاحِمِينَ
24:2	18	tu'minūna	believe	 وَلَا تَأْخُذْكُمْ بِهِمَا رَأْفَةٌ فِي دِينِ اللَّهِ إِنْ كُنْتُمْ تُؤْمِنُونَ بِاللَّهِ
24:19	9	āmanū	believe	 إِنَّ الَّذِينَ يُحِبُّونَ أَنْ تَشِيعَ الْفَاحِشَةُ فِي الَّذِينَ آمَنُوا لَهُمْ عَذَابٌ أَلِيمٌ
24:21	3	āmanū	O you who believe	 يَا أَيُّهَا الَّذِينَ آمَنُوا لَا تَتَّبِعُوا خُطُوَاتِ الشَّيْطَانِ
24:27	3	āmanū	believe	 يَا أَيُّهَا الَّذِينَ آمَنُوا لَا تَدْخُلُوا بُيُوتًا غَيْرَ بُيُوتِكُمْ
24:47	2	āmannā	We believe	 وَيَقُولُونَ آمَنَّا بِاللَّهِ وَبِالرَّسُولِ وَأَطَعْنَا
24:55	4	āmanū	believe	 وَعَدَ اللَّهُ الَّذِينَ آمَنُوا مِنْكُمْ وَعَمِلُوا الصَّالِحَاتِ لَيَسْتَخْلِفَنَّهُمْ
24:58	3	āmanū	O you who believe	 يَا أَيُّهَا الَّذِينَ آمَنُوا لِيَسْتَأْذِنْكُمُ الَّذِينَ مَلَكَتْ أَيْمَانُكُمْ
24:62	4	āmanū	believe	 إِنَّمَا الْمُؤْمِنُونَ الَّذِينَ آمَنُوا بِاللَّهِ وَرَسُولِهِ
24:62	22	yu'minūna	believe	 إِنَّ الَّذِينَ يَسْتَأْذِنُونَكَ أُولَٰئِكَ الَّذِينَ يُؤْمِنُونَ بِاللَّهِ وَرَسُولِهِ
25:70	4	waāmana	and believes	 إِلَّا مَنْ تَابَ وَآمَنَ وَعَمِلَ عَمَلًا صَالِحًا
26:47	2	āmannā	We believe	 قَالُوا آمَنَّا بِرَبِّ الْعَالَمِينَ
26:49	2	āmantum	You believed	 قَالَ آمَنْتُمْ لَهُ قَبْلَ أَنْ آذَنَ لَكُمْ إِنَّهُ لَكَبِيرُكُمُ
26:111	2	anu'minu	Should we believe	 قَالُوا أَنُؤْمِنُ لَكَ وَاتَّبَعَكَ الْأَرْذَلُونَ
26:201	2	yu'minūna	they will believe	 لَا يُؤْمِنُونَ بِهِ حَتَّىٰ يَرَوُا الْعَذَابَ الْأَلِيمَ
26:227	3	āmanū	believe	 إِلَّا الَّذِينَ آمَنُوا وَعَمِلُوا الصَّالِحَاتِ وَذَكَرُوا اللَّهَ كَثِيرًا
27:4	4	yu'minūna	believe	 إِنَّ الَّذِينَ لَا يُؤْمِنُونَ بِالْآخِرَةِ زَيَّنَّا لَهُمْ أَعْمَالَهُمْ
27:53	3	āmanū	believed	 وَأَنْجَيْنَا الَّذِينَ آمَنُوا وَكَانُوا يَتَّقُونَ
27:81	11	yu'minu	believe	 إِنْ تُسْمِعُ إِلَّا مَنْ يُؤْمِنُ بِآيَاتِنَا فَهُمْ مُسْلِمُونَ
27:86	15	yu'minūna	who believe	 إِنَّ فِي ذَٰلِكَ لَآيَاتٍ لِقَوْمٍ يُؤْمِنُونَ
28:3	9	yu'minūna	who believe	 نَتْلُو عَلَيْكَ مِنْ نَبَإِ مُوسَىٰ وَفِرْعَوْنَ بِالْحَقِّ لِقَوْمٍ يُؤْمِنُونَ
28:52	8	yu'minūna	believe	 الَّذِينَ آتَيْنَاهُمُ الْكِتَابَ مِنْ قَبْلِهِ هُمْ بِهِ يُؤْمِنُونَ
28:53	5	āmannā	We believe	 وَإِذَا يُتْلَىٰ عَلَيْهِمْ قَالُوا آمَنَّا بِهِ إِنَّهُ الْحَقُّ مِنْ رَبِّنَا
28:67	4	waāmana	and believed	 فَأَمَّا مَنْ تَابَ وَآمَنَ وَعَمِلَ صَالِحًا فَعَسَىٰ أَنْ يَكُونَ مِنَ الْمُفْلِحِينَ
28:80	10	āmana	believes	 وَيْلَكُمْ ثَوَابُ اللَّهِ خَيْرٌ لِمَنْ آمَنَ وَعَمِلَ صَالِحًا
29:2	7	āmannā	We believe	 أَحَسِبَ النَّاسُ أَنْ يُتْرَكُوا أَنْ يَقُولُوا آمَنَّا وَهُمْ لَا يُفْتَنُونَ
29:7	2	āmanū	believe	 وَالَّذِينَ آمَنُوا وَعَمِلُوا الصَّالِحَاتِ لَنُكَفِّرَنَّ عَنْهُمْ سَيِّئَاتِهِمْ
29:9	2	āmanū	believe	 وَالَّذِينَ آمَنُوا وَعَمِلُوا الصَّالِحَاتِ لَنُدْخِلَنَّهُمْ فِي الصَّالِحِينَ
29:10	5	āmannā	We believe	 وَمِنَ النَّاسِ مَنْ يَقُولُ آمَنَّا بِاللَّهِ
29:11	4	āmanū	believe	 وَلَيَعْلَمَنَّ اللَّهُ الَّذِينَ آمَنُوا وَلَيَعْلَمَنَّ الْمُنَافِقِينَ
29:12	5	āmanū	believe	 وَقَالَ الَّذِينَ كَفَرُوا لِلَّذِينَ آمَنُوا اتَّبِعُوا سَبِيلَنَا
29:24	20	yu'minūna	who believe	 فَأَنْجَاهُ اللَّهُ مِنَ النَّارِ إِنَّ فِي ذَٰلِكَ لَآيَاتٍ لِقَوْمٍ يُؤْمِنُونَ
29:26	1	faāmana	And believed	 فَآمَنَ لَهُ لُوطٌ وَقَالَ إِنِّي مُهَاجِرٌ إِلَىٰ رَبِّي
29:46	14	āmannā	We believe	 وَقُولُوا آمَنَّا بِالَّذِي أُنْزِلَ إِلَيْنَا وَأُنْزِلَ إِلَيْكُمْ
29:47	8	yu'minūna	believe	 فَالَّذِينَ آتَيْنَاهُمُ الْكِتَابَ يُؤْمِنُونَ بِهِ وَمِنْ هَٰؤُلَاءِ مَنْ يُؤْمِنُ بِهِ
29:47	13	yu'minu	believe	 وَمِنْ هَٰؤُلَاءِ مَنْ يُؤْمِنُ بِهِ وَمَا يَجْحَدُ بِآيَاتِنَا إِلَّا الْكَافِرُونَ
29:51	15	yu'minūna	who believe	 إِنَّ فِي ذَٰلِكَ لَرَحْمَةً وَذِكْرَىٰ لِقَوْمٍ يُؤْمِنُونَ
29:52	13	āmanū	believe	 وَالَّذِينَ آمَنُوا بِالْبَاطِلِ وَكَفَرُوا بِاللَّهِ أُولَٰئِكَ هُمُ الْخَاسِرُونَ
29:56	3	āmanū	believe	 يَا عِبَادِيَ الَّذِينَ آمَنُوا إِنَّ أَرْضِي وَاسِعَةٌ فَإِيَّايَ فَاعْبُدُونِ
29:58	2	āmanū	believe	 وَالَّذِينَ آمَنُوا وَعَمِلُوا الصَّالِحَاتِ لَنُبَوِّئَنَّهُمْ مِنَ الْجَنَّةِ غُرَفًا
29:67	12	yu'minūna	they believe	 أَفَبِالْبَاطِلِ يُؤْمِنُونَ وَبِنِعْمَةِ اللَّهِ يَكْفُرُونَ
30:15	3	āmanū	believed	 فَأَمَّا الَّذِينَ آمَنُوا وَعَمِلُوا الصَّالِحَاتِ فَهُمْ فِي رَوْضَةٍ
30:37	15	yu'minūna	who believe	 إِنَّ فِي ذَٰلِكَ لَآيَاتٍ لِقَوْمٍ يُؤْمِنُونَ
30:45	3	āmanū	believe	 لِيَجْزِيَ الَّذِينَ آمَنُوا وَعَمِلُوا الصَّالِحَاتِ مِنْ فَضْلِهِ
30:53	11	yu'minu	believe	 تُسْمِعُ إِلَّا مَنْ يُؤْمِنُ بِآيَاتِنَا فَهُمْ مُسْلِمُونَ
31:8	3	āmanū	believe	 إِنَّ الَّذِينَ آمَنُوا وَعَمِلُوا الصَّالِحَاتِ لَهُمْ جَنَّاتُ النَّعِيمِ
32:15	2	yu'minu	believe	 إِنَّمَا يُؤْمِنُ بِآيَاتِنَا الَّذِينَ إِذَا ذُكِّرُوا بِهَا خَرُّوا سُجَّدًا
32:19	3	āmanū	believe	 أَمَّا الَّذِينَ آمَنُوا وَعَمِلُوا الصَّالِحَاتِ فَلَهُمْ جَنَّاتُ الْمَأْوَىٰ
33:9	3	āmanū	believe	 يَا أَيُّهَا الَّذِينَ آمَنُوا اذْكُرُوا نِعْمَةَ اللَّهِ عَلَيْكُمْ
33:19	27	yu'minū	they have believed	 أُولَٰئِكَ لَمْ يُؤْمِنُوا فَأَحْبَطَ اللَّهُ أَعْمَالَهُمْ
33:41	3	āmanū	O you who believe	 يَا أَيُّهَا الَّذِينَ آمَنُوا اذْكُرُوا اللَّهَ ذِكْرًا كَثِيرًا
33:49	3	āmanū	O you who believe	 يَا أَيُّهَا الَّذِينَ آمَنُوا إِذَا نَكَحْتُمُ الْمُؤْمِنَاتِ ثُمَّ طَلَّقْتُمُوهُنَّ
33:53	3	āmanū	O you who believe	 يَا أَيُّهَا الَّذِينَ آمَنُوا لَا تَدْخُلُوا بُيُوتَ النَّبِيِّ
33:56	9	āmanū	O you who believe	 يَا أَيُّهَا الَّذِينَ آمَنُوا صَلُّوا عَلَيْهِ وَسَلِّمُوا تَسْلِيمًا
33:69	3	āmanū	O you who believe	 يَا أَيُّهَا الَّذِينَ آمَنُوا لَا تَكُونُوا كَالَّذِينَ آذَوْا مُوسَىٰ
33:70	3	āmanū	O you who believe	 يَا أَيُّهَا الَّذِينَ آمَنُوا اتَّقُوا اللَّهَ وَقُولُوا قَوْلًا سَدِيدًا
34:4	3	āmanū	believe	 لِيَجْزِيَ الَّذِينَ آمَنُوا وَعَمِلُوا الصَّالِحَاتِ
34:8	11	yu'minūna	believe	 بَلِ الَّذِينَ لَا يُؤْمِنُونَ بِالْآخِرَةِ فِي الْعَذَابِ وَالضَّلَالِ الْبَعِيدِ
34:21	10	yu'minu	believes	 إِلَّا لِنَعْلَمَ مَنْ يُؤْمِنُ بِالْآخِرَةِ مِمَّنْ هُوَ مِنْهَا فِي شَكٍّ
34:31	5	nu'mina	we believe	 وَقَالَ الَّذِينَ كَفَرُوا لَنْ نُؤْمِنَ بِهَٰذَا الْقُرْآنِ وَلَا بِالَّذِي بَيْنَ يَدَيْهِ
34:37	11	āmana	believes	 إِلَّا مَنْ آمَنَ وَعَمِلَ صَالِحًا فَأُولَٰئِكَ لَهُمْ جَزَاءُ الضِّعْفِ
34:52	2	āmannā	We believe	 وَقَالُوا آمَنَّا بِهِ وَأَنَّىٰ لَهُمُ التَّنَاوُشُ مِنْ مَكَانٍ بَعِيدٍ
35:7	7	āmanū	who believe	 وَالَّذِينَ آمَنُوا وَعَمِلُوا الصَّالِحَاتِ لَهُمْ مَغْفِرَةٌ وَأَجْرٌ كَبِيرٌ
36:7	8	yu'minūna	believe	 لَقَدْ حَقَّ الْقَوْلُ عَلَىٰ أَكْثَرِهِمْ فَهُمْ لَا يُؤْمِنُونَ
36:10	8	yu'minūna	they will believe	 وَسَوَاءٌ عَلَيْهِمْ أَأَنْذَرْتَهُمْ أَمْ لَمْ تُنْذِرْهُمْ لَا يُؤْمِنُونَ
36:25	2	āmantu	[I] have believed	 إِنِّي آمَنْتُ بِرَبِّكُمْ فَاسْمَعُونِ
36:47	12	āmanū	believed	 قَالَ الَّذِينَ كَفَرُوا لِلَّذِينَ آمَنُوا أَنُطْعِمُ مَنْ لَوْ يَشَاءُ اللَّهُ أَطْعَمَهُ
37:148	1	faāmanū	And they believed	 فَآمَنُوا فَمَتَّعْنَاهُمْ إِلَىٰ حِينٍ
38:24	18	āmanū	believe	 إِلَّا الَّذِينَ آمَنُوا وَعَمِلُوا الصَّالِحَاتِ وَقَلِيلٌ مَا هُمْ
38:28	4	āmanū	believe	 أَمْ نَجْعَلُ الَّذِينَ آمَنُوا وَعَمِلُوا الصَّالِحَاتِ كَالْمُفْسِدِينَ
39:10	4	āmanū	believe	 قُلْ يَا عِبَادِ الَّذِينَ آمَنُوا اتَّقُوا رَبَّكُمْ
39:45	9	yu'minūna	believe	 وَإِذَا ذُكِرَ اللَّهُ وَحْدَهُ اشْمَأَزَّتْ قُلُوبُ الَّذِينَ لَا يُؤْمِنُونَ بِالْآخِرَةِ
39:52	15	yu'minūna	who believe	 إِنَّ فِي ذَٰلِكَ لَآيَاتٍ لِقَوْمٍ يُؤْمِنُونَ
40:7	9	wayu'minūna	and believe	 يُسَبِّحُونَ بِحَمْدِ رَبِّهِمْ وَيُؤْمِنُونَ بِهِ وَيَسْتَغْفِرُونَ لِلَّذِينَ آمَنُوا
40:7	13	āmanū	believe	 يُسَبِّحُونَ بِحَمْدِ رَبِّهِمْ وَيُؤْمِنُونَ بِهِ وَيَسْتَغْفِرُونَ لِلَّذِينَ آمَنُوا
40:12	11	tu'minū	you believed	 إِذَا دُعِيَ اللَّهُ وَحْدَهُ كَفَرْتُمْ وَإِنْ يُشْرَكْ بِهِ تُؤْمِنُوا
40:25	10	āmanū	believe	 قَالُوا اقْتُلُوا أَبْنَاءَ الَّذِينَ آمَنُوا مَعَهُ وَاسْتَحْيُوا نِسَاءَهُمْ
40:27	11	yu'minu	who believes	 إِنِّي عُذْتُ بِرَبِّي وَرَبِّكُمْ مِنْ كُلِّ مُتَكَبِّرٍ لَا يُؤْمِنُ بِيَوْمِ الْحِسَابِ
40:30	3	āmana	believed	 وَقَالَ الَّذِي آمَنَ يَا قَوْمِ إِنِّي أَخَافُ عَلَيْكُمْ مِثْلَ يَوْمِ الْأَحْزَابِ
40:35	15	āmanū	who believe	 كَبُرَ مَقْتًا عِنْدَ اللَّهِ وَعِنْدَ الَّذِينَ آمَنُوا
40:38	3	āmana	believed	 وَقَالَ الَّذِي آمَنَ يَا قَوْمِ اتَّبِعُونِ أَهْدِكُمْ سَبِيلَ الرَّشَادِ
40:51	5	āmanū	believe	 إِنَّا لَنَنْصُرُ رُسُلَنَا وَالَّذِينَ آمَنُوا فِي الْحَيَاةِ الدُّنْيَا
40:58	6	āmanū	believe	 وَمَا يَسْتَوِي الْأَعْمَىٰ وَالْبَصِيرُ وَالَّذِينَ آمَنُوا
40:59	11	yu'minūna	believe	 إِنَّ السَّاعَةَ لَآتِيَةٌ لَا رَيْبَ فِيهَا وَلَٰكِنَّ أَكْثَرَ النَّاسِ لَا يُؤْمِنُونَ
40:84	5	āmannā	We believe	 فَلَمَّا رَأَوْا بَأْسَنَا قَالُوا آمَنَّا بِاللَّهِ وَحْدَهُ
41:8	3	āmanū	believe	 إِنَّ الَّذِينَ آمَنُوا وَعَمِلُوا الصَّالِحَاتِ لَهُمْ أَجْرٌ غَيْرُ مَمْنُونٍ
41:18	3	āmanū	believed	 وَنَجَّيْنَا الَّذِينَ آمَنُوا وَكَانُوا يَتَّقُونَ
41:44	14	āmanū	believe	 أَأَعْجَمِيٌّ وَعَرَبِيٌّ قُلْ هُوَ لِلَّذِينَ آمَنُوا هُدًى وَشِفَاءٌ
41:44	19	yu'minūna	believe	 وَالَّذِينَ لَا يُؤْمِنُونَ فِي آذَانِهِمْ وَقْرٌ وَهُوَ عَلَيْهِمْ عَمًى
42:15	10	āmantu	I believe	 وَقُلْ آمَنْتُ بِمَا أَنْزَلَ اللَّهُ مِنْ كِتَابٍ وَأُمِرْتُ لِأَعْدِلَ بَيْنَكُمُ
42:18	5	yu'minūna	believe	 يَسْتَعْجِلُ بِهَا الَّذِينَ لَا يُؤْمِنُونَ بِهَا
42:18	8	āmanū	believe	 وَالَّذِينَ آمَنُوا مُشْفِقُونَ مِنْهَا وَيَعْلَمُونَ أَنَّهَا الْحَقُّ
42:22	10	āmanū	believe	 وَالَّذِينَ آمَنُوا وَعَمِلُوا الصَّالِحَاتِ فِي رَوْضَاتِ الْجَنَّاتِ
42:23	7	āmanū	believe	 ذَٰلِكَ الَّذِي يُبَشِّرُ اللَّهُ عِبَادَهُ الَّذِينَ آمَنُوا
42:26	3	āmanū	believe	 وَيَسْتَجِيبُ الَّذِينَ آمَنُوا وَعَمِلُوا الصَّالِحَاتِ
42:36	14	āmanū	believe	 وَمَا عِنْدَ اللَّهِ خَيْرٌ وَأَبْقَىٰ لِلَّذِينَ آمَنُوا وَعَلَىٰ رَبِّهِمْ يَتَوَكَّلُونَ
42:45	13	āmanū	believed	 وَقَالَ الَّذِينَ آمَنُوا إِنَّ الْخَاسِرِينَ الَّذِينَ خَسِرُوا أَنْفُسَهُمْ
43:69	2	āmanū	believed	 الَّذِينَ آمَنُوا بِآيَاتِنَا وَكَانُوا مُسْلِمِينَ
43:88	7	yu'minūna	believe	 وَقِيلِهِ يَا رَبِّ إِنَّ هَٰؤُلَاءِ قَوْمٌ لَا يُؤْمِنُونَ
44:21	3	tu'minū	you believe	 وَإِنْ لَمْ تُؤْمِنُوا لِي فَاعْتَزِلُونِ
45:6	12	yu'minūna	will they believe	 فَبِأَيِّ حَدِيثٍ بَعْدَ اللَّهِ وَآيَاتِهِ يُؤْمِنُونَ
45:14	3	āmanū	believe	 قُلْ لِلَّذِينَ آمَنُوا يَغْفِرُوا لِلَّذِينَ لَا يَرْجُونَ أَيَّامَ اللَّهِ
45:21	9	āmanū	believed	 أَمْ حَسِبَ الَّذِينَ اجْتَرَحُوا السَّيِّئَاتِ أَنْ نَجْعَلَهُمْ كَالَّذِينَ آمَنُوا
45:30	3	āmanū	believed	 فَأَمَّا الَّذِينَ آمَنُوا وَعَمِلُوا الصَّالِحَاتِ فَيُدْخِلُهُمْ رَبُّهُمْ فِي رَحْمَتِهِ
46:10	17	faāmana	then he believed	 وَشَهِدَ شَاهِدٌ مِنْ بَنِي إِسْرَائِيلَ عَلَىٰ مِثْلِهِ فَآمَنَ وَاسْتَكْبَرْتُمْ
46:11	5	āmanū	believe	 وَقَالَ الَّذِينَ كَفَرُوا لِلَّذِينَ آمَنُوا لَوْ كَانَ خَيْرًا مَا سَبَقُونَا إِلَيْهِ
46:17	18	āmin	Believe	 وَهُمَا يَسْتَغِيثَانِ اللَّهَ وَيْلَكَ آمِنْ إِنَّ وَعْدَ اللَّهِ حَقٌّ
46:31	5	waāminū	and believe	 يَا قَوْمَنَا أَجِيبُوا دَاعِيَ اللَّهِ وَآمِنُوا بِهِ
47:2	2	āmanū	believe	 وَالَّذِينَ آمَنُوا وَعَمِلُوا الصَّالِحَاتِ
47:2	5	waāmanū	and believe	 وَآمَنُوا بِمَا نُزِّلَ عَلَىٰ مُحَمَّدٍ وَهُوَ الْحَقُّ مِنْ رَبِّهِمْ
47:3	9	āmanū	believe	 وَأَنَّ الَّذِينَ آمَنُوا اتَّبَعُوا الْحَقَّ مِنْ رَبِّهِمْ
47:7	3	āmanū	O you who believe	 يَا أَيُّهَا الَّذِينَ آمَنُوا إِنْ تَنْصُرُوا اللَّهَ يَنْصُرْكُمْ
47:11	6	āmanū	believe	 ذَٰلِكَ بِأَنَّ اللَّهَ مَوْلَى الَّذِينَ آمَنُوا
47:12	5	āmanū	believe	 إِنَّ اللَّهَ يُدْخِلُ الَّذِينَ آمَنُوا وَعَمِلُوا الصَّالِحَاتِ جَنَّاتٍ
47:20	3	āmanū	believe	 وَيَقُولُ الَّذِينَ آمَنُوا لَوْلَا نُزِّلَتْ سُورَةٌ
47:33	3	āmanū	O you who believe	 يَا أَيُّهَا الَّذِينَ آمَنُوا أَطِيعُوا اللَّهَ وَأَطِيعُوا الرَّسُولَ
47:36	7	tu'minū	you believe	 وَإِنْ تُؤْمِنُوا وَتَتَّقُوا يُؤْتِكُمْ أُجُورَكُمْ وَلَا يَسْأَلْكُمْ أَمْوَالَكُمْ
48:9	1	litu'minū	That you may believe	 لِتُؤْمِنُوا بِاللَّهِ وَرَسُولِهِ وَتُعَزِّرُوهُ وَتُوَقِّرُوهُ وَتُسَبِّحُوهُ
48:13	3	yu'min	(has) not believed	 وَمَنْ لَمْ يُؤْمِنْ بِاللَّهِ وَرَسُولِهِ فَإِنَّا أَعْتَدْنَا لِلْكَافِرِينَ سَعِيرًا
48:29	48	āmanū	believe	 وَعَدَ اللَّهُ الَّذِينَ آمَنُوا وَعَمِلُوا الصَّالِحَاتِ مِنْهُمْ مَغْفِرَةً
49:1	3	āmanū	O you who believe	 يَا أَيُّهَا الَّذِينَ آمَنُوا لَا تُقَدِّمُوا بَيْنَ يَدَيِ اللَّهِ وَرَسُولِهِ
49:2	3	āmanū	O you who believe	 يَا أَيُّهَا الَّذِينَ آمَنُوا لَا تَرْفَعُوا أَصْوَاتَكُمْ فَوْقَ صَوْتِ النَّبِيِّ
49:6	3	āmanū	O you who believe	 يَا أَيُّهَا الَّذِينَ آمَنُوا إِنْ جَاءَكُمْ فَاسِقٌ بِنَبَإٍ فَتَبَيَّنُوا
49:11	3	āmanū	O you who believe	 يَا أَيُّهَا الَّذِينَ آمَنُوا لَا يَسْخَرْ قَوْمٌ مِنْ قَوْمٍ
49:12	3	āmanū	O you who believe	 يَا أَيُّهَا الَّذِينَ آمَنُوا اجْتَنِبُوا كَثِيرًا مِنَ الظَّنِّ
49:14	3	āmannā	We believe	 قَالَتِ الْأَعْرَابُ آمَنَّا قُلْ لَمْ تُؤْمِنُوا وَلَٰكِنْ قُولُوا أَسْلَمْنَا
49:14	6	tu'minū	you believe	 قَالَتِ الْأَعْرَابُ آمَنَّا قُلْ لَمْ تُؤْمِنُوا وَلَٰكِنْ قُولُوا أَسْلَمْنَا
49:15	4	āmanū	believe	 إِنَّمَا الْمُؤْمِنُونَ الَّذِينَ آمَنُوا بِاللَّهِ وَرَسُولِهِ
