surah:ayah	position	word	meaning	form	p-o-s	ayah_link
11:40	21	āmana	believed	IV	Verb	 وَأَهْلَكَ إِلَّا مَنْ سَبَقَ عَلَيْهِ الْقَوْلُ وَمَنْ آمَنَ
11:40	23	āmana	believed	IV	Verb	 وَمَا آمَنَ مَعَهُ إِلَّا قَلِيلٌ
11:58	7	āmanū	believed	IV	Verb	 وَلَمَّا جَاءَ أَمْرُنَا نَجَّيْنَا هُودًا وَالَّذِينَ آمَنُوا مَعَهُ بِرَحْمَةٍ مِنَّا
11:66	7	āmanū	believed	IV	Verb	 فَلَمَّا جَاءَ أَمْرُنَا نَجَّيْنَا صَالِحًا وَالَّذِينَ آمَنُوا مَعَهُ بِرَحْمَةٍ مِنَّا
11:94	7	āmanū	believed	IV	Verb	 وَلَمَّا جَاءَ أَمْرُنَا نَجَّيْنَا شُعَيْبًا وَالَّذِينَ آمَنُوا مَعَهُ بِرَحْمَةٍ مِنَّا
11:121	4	yu'minūna	believe	IV	Verb	 وَقُلْ لِلَّذِينَ لَا يُؤْمِنُونَ اعْمَلُوا عَلَىٰ مَكَانَتِكُمْ إِنَّا عَامِلُونَ
12:37	21	yu'minūna	they believe	IV	Verb	 إِنِّي تَرَكْتُ مِلَّةَ قَوْمٍ لَا يُؤْمِنُونَ بِاللَّهِ وَهُمْ بِالْآخِرَةِ هُمْ كَافِرُونَ
12:57	5	āmanū	believe	IV	Verb	 وَلَأَجْرُ الْآخِرَةِ خَيْرٌ لِلَّذِينَ آمَنُوا وَكَانُوا يَتَّقُونَ
12:106	2	yu'minu	believe	IV	Verb	 وَمَا يُؤْمِنُ أَكْثَرُهُمْ بِاللَّهِ إِلَّا وَهُمْ مُشْرِكُونَ
12:111	23	yu'minūna	who believe	IV	Verb	 وَتَفْصِيلَ كُلِّ شَيْءٍ وَهُدًى وَرَحْمَةً لِقَوْمٍ يُؤْمِنُونَ
13:1	15	yu'minūna	believe	IV	Verb	 وَلَٰكِنَّ أَكْثَرَ النَّاسِ لَا يُؤْمِنُونَ
13:28	2	āmanū	believed	IV	Verb	 الَّذِينَ آمَنُوا وَتَطْمَئِنُّ قُلُوبُهُمْ بِذِكْرِ اللَّهِ
13:29	2	āmanū	believed	IV	Verb	 الَّذِينَ آمَنُوا وَعَمِلُوا الصَّالِحَاتِ طُوبَىٰ لَهُمْ وَحُسْنُ مَآبٍ
13:31	22	āmanū	believe	IV	Verb	 أَفَلَمْ يَيْأَسِ الَّذِينَ آمَنُوا أَنْ لَوْ يَشَاءُ اللَّهُ لَهَدَى النَّاسَ
14:23	3	āmanū	believed	IV	Verb	 وَأُدْخِلَ الَّذِينَ آمَنُوا وَعَمِلُوا الصَّالِحَاتِ جَنَّاتٍ تَجْرِي
14:27	4	āmanū	believe	IV	Verb	 يُثَبِّتُ اللَّهُ الَّذِينَ آمَنُوا بِالْقَوْلِ الثَّابِتِ فِي الْحَيَاةِ الدُّنْيَا
14:31	4	āmanū	believe	IV	Verb	 قُلْ لِعِبَادِيَ الَّذِينَ آمَنُوا يُقِيمُوا الصَّلَاةَ
15:13	2	yu'minūna	they believe	IV	Verb	 لَا يُؤْمِنُونَ بِهِ وَقَدْ خَلَتْ سُنَّةُ الْأَوَّلِينَ
16:22	6	yu'minūna	believe	IV	Verb	 فَالَّذِينَ لَا يُؤْمِنُونَ بِالْآخِرَةِ قُلُوبُهُمْ مُنْكِرَةٌ وَهُمْ مُسْتَكْبِرُونَ
16:60	3	yu'minūna	believe	IV	Verb	 لِلَّذِينَ لَا يُؤْمِنُونَ بِالْآخِرَةِ مَثَلُ السَّوْءِ
16:64	14	yu'minūna	who believe	IV	Verb	 وَهُدًى وَرَحْمَةً لِقَوْمٍ يُؤْمِنُونَ
16:72	17	yu'minūna	they believe	IV	Verb	 أَفَبِالْبَاطِلِ يُؤْمِنُونَ وَبِنِعْمَتِ اللَّهِ هُمْ يَكْفُرُونَ
16:79	18	yu'minūna	who believe	IV	Verb	 إِنَّ فِي ذَٰلِكَ لَآيَاتٍ لِقَوْمٍ يُؤْمِنُونَ
16:99	7	āmanū	believe	IV	Verb	 إِنَّهُ لَيْسَ لَهُ سُلْطَانٌ عَلَى الَّذِينَ آمَنُوا
16:102	10	āmanū	believe	IV	Verb	 لِيُثَبِّتَ الَّذِينَ آمَنُوا وَهُدًى وَبُشْرَىٰ لِلْمُسْلِمِينَ
16:104	4	yu'minūna	believe	IV	Verb	 إِنَّ الَّذِينَ لَا يُؤْمِنُونَ بِآيَاتِ اللَّهِ لَا يَهْدِيهِمُ اللَّهُ
16:105	6	yu'minūna	believe	IV	Verb	 إِنَّمَا يَفْتَرِي الْكَذِبَ الَّذِينَ لَا يُؤْمِنُونَ بِآيَاتِ اللَّهِ
17:10	4	yu'minūna	believe	IV	Verb	 وَأَنَّ الَّذِينَ لَا يُؤْمِنُونَ بِالْآخِرَةِ أَعْتَدْنَا لَهُمْ عَذَابًا أَلِيمًا
17:45	9	yu'minūna	believe	IV	Verb	 جَعَلْنَا بَيْنَكَ وَبَيْنَ الَّذِينَ لَا يُؤْمِنُونَ بِالْآخِرَةِ حِجَابًا
17:90	3	nu'mina	we will believe	IV	Verb	 وَقَالُوا لَنْ نُؤْمِنَ لَكَ حَتَّىٰ تَفْجُرَ لَنَا مِنَ الْأَرْضِ يَنْبُوعًا
17:93	12	nu'mina	we will believe	IV	Verb	 وَلَنْ نُؤْمِنَ لِرُقِيِّكَ حَتَّىٰ تُنَزِّلَ عَلَيْنَا كِتَابًا نَقْرَؤُهُ
17:94	5	yu'minū	they believe	IV	Verb	 وَمَا مَنَعَ النَّاسَ أَنْ يُؤْمِنُوا إِذْ جَاءَهُمُ الْهُدَىٰ
17:107	2	āminū	Believe	IV	Verb	 قُلْ آمِنُوا بِهِ أَوْ لَا تُؤْمِنُوا
17:107	6	tu'minū	believe	IV	Verb	 قُلْ آمِنُوا بِهِ أَوْ لَا تُؤْمِنُوا
18:6	8	yu'minū	they believe	IV	Verb	 فَلَعَلَّكَ بَاخِعٌ نَفْسَكَ عَلَىٰ آثَارِهِمْ إِنْ لَمْ يُؤْمِنُوا بِهَٰذَا الْحَدِيثِ أَسَفًا
18:13	8	āmanū	who believed	IV	Verb	 إِنَّهُمْ فِتْيَةٌ آمَنُوا بِرَبِّهِمْ وَزِدْنَاهُمْ هُدًى
18:29	7	falyu'min	let him believe	IV	Verb	 وَقُلِ الْحَقُّ مِنْ رَبِّكُمْ فَمَنْ شَاءَ فَلْيُؤْمِنْ وَمَنْ شَاءَ فَلْيَكْفُرْ
18:30	3	āmanū	believed	IV	Verb	 إِنَّ الَّذِينَ آمَنُوا وَعَمِلُوا الصَّالِحَاتِ إِنَّا لَا نُضِيعُ أَجْرَ مَنْ أَحْسَنَ عَمَلًا
18:55	5	yu'minū	they believe	IV	Verb	 وَمَا مَنَعَ النَّاسَ أَنْ يُؤْمِنُوا إِذْ جَاءَهُمُ الْهُدَىٰ
18:88	3	āmana	believes	IV	Verb	 وَأَمَّا مَنْ آمَنَ وَعَمِلَ صَالِحًا فَلَهُ جَزَاءً الْحُسْنَىٰ
18:107	3	āmanū	believed	IV	Verb	 إِنَّ الَّذِينَ آمَنُوا وَعَمِلُوا الصَّالِحَاتِ كَانَتْ لَهُمْ جَنَّاتُ
19:39	12	yu'minūna	believe	IV	Verb	 إِذْ قُضِيَ الْأَمْرُ وَهُمْ فِي غَفْلَةٍ وَهُمْ لَا يُؤْمِنُونَ
19:60	4	waāmana	and believed	IV	Verb	 إِلَّا مَنْ تَابَ وَآمَنَ وَعَمِلَ صَالِحًا فَأُولَٰئِكَ يَدْخُلُونَ الْجَنَّةَ
19:73	10	āmanū	believed	IV	Verb	 قَالَ الَّذِينَ كَفَرُوا لِلَّذِينَ آمَنُوا أَيُّ الْفَرِيقَيْنِ خَيْرٌ مَقَامًا
19:96	3	āmanū	believed	IV	Verb	 إِنَّ الَّذِينَ آمَنُوا وَعَمِلُوا الصَّالِحَاتِ سَيَجْعَلُ لَهُمُ الرَّحْمَٰنُ وُدًّا
20:16	6	yu'minu	believe	IV	Verb	 فَلَا يَصُدَّنَّكَ عَنْهَا مَنْ لَا يُؤْمِنُ بِهَا وَاتَّبَعَ هَوَاهُ فَتَرْدَىٰ
20:70	5	āmannā	We believe	IV	Verb	 فَأُلْقِيَ السَّحَرَةُ سُجَّدًا قَالُوا آمَنَّا بِرَبِّ هَارُونَ وَمُوسَىٰ
20:71	2	āmantum	You believe	IV	Verb	 قَالَ آمَنْتُمْ لَهُ قَبْلَ أَنْ آذَنَ لَكُمْ إِنَّهُ لَكَبِيرُكُمُ
20:73	2	āmannā	we believe	IV	Verb	 إِنَّا آمَنَّا بِرَبِّنَا لِيَغْفِرَ لَنَا خَطَايَانَا
20:82	5	waāmana	and believes	IV	Verb	 وَإِنِّي لَغَفَّارٌ لِمَنْ تَابَ وَآمَنَ وَعَمِلَ صَالِحًا ثُمَّ اهْتَدَىٰ
20:127	6	yu'min	believes	IV	Verb	 وَكَذَٰلِكَ نَجْزِي مَنْ أَسْرَفَ وَلَمْ يُؤْمِنْ بِآيَاتِ رَبِّهِ
21:6	2	āmanat	believed	IV	Verb	 مَا آمَنَتْ قَبْلَهُمْ مِنْ قَرْيَةٍ أَهْلَكْنَاهَا أَفَهُمْ يُؤْمِنُونَ
21:6	8	yu'minūna	believe	IV	Verb	 مَا آمَنَتْ قَبْلَهُمْ مِنْ قَرْيَةٍ أَهْلَكْنَاهَا أَفَهُمْ يُؤْمِنُونَ
21:30	18	yu'minūna	they believe	IV	Verb	 وَجَعَلْنَا مِنَ الْمَاءِ كُلَّ شَيْءٍ حَيٍّ أَفَلَا يُؤْمِنُونَ
22:14	5	āmanū	believe	IV	Verb	 إِنَّ اللَّهَ يُدْخِلُ الَّذِينَ آمَنُوا وَعَمِلُوا الصَّالِحَاتِ جَنَّاتٍ
22:17	3	āmanū	have believed	IV	Verb	 إِنَّ الَّذِينَ آمَنُوا وَالَّذِينَ هَادُوا وَالصَّابِئِينَ وَالنَّصَارَىٰ
22:23	5	āmanū	believe	IV	Verb	 إِنَّ اللَّهَ يُدْخِلُ الَّذِينَ آمَنُوا وَعَمِلُوا الصَّالِحَاتِ جَنَّاتٍ
22:38	6	āmanū	believe	IV	Verb	 إِنَّ اللَّهَ يُدَافِعُ عَنِ الَّذِينَ آمَنُوا
22:50	2	āmanū	believe	IV	Verb	 فَالَّذِينَ آمَنُوا وَعَمِلُوا الصَّالِحَاتِ لَهُمْ مَغْفِرَةٌ وَرِزْقٌ كَرِيمٌ
22:54	9	fayu'minū	and they believe	IV	Verb	 وَلِيَعْلَمَ الَّذِينَ أُوتُوا الْعِلْمَ أَنَّهُ الْحَقُّ مِنْ رَبِّكَ فَيُؤْمِنُوا بِهِ
22:54	18	āmanū	believe	IV	Verb	 وَإِنَّ اللَّهَ لَهَادِ الَّذِينَ آمَنُوا إِلَىٰ صِرَاطٍ مُسْتَقِيمٍ
22:56	7	āmanū	believe	IV	Verb	 فَالَّذِينَ آمَنُوا وَعَمِلُوا الصَّالِحَاتِ فِي جَنَّاتِ النَّعِيمِ
22:77	3	āmanū	O you who believe	IV	Verb	 يَا أَيُّهَا الَّذِينَ آمَنُوا ارْكَعُوا وَاسْجُدُوا وَاعْبُدُوا رَبَّكُمْ
23:44	19	yu'minūna	they believe	IV	Verb	 وَجَعَلْنَاهُمْ أَحَادِيثَ فَبُعْدًا لِقَوْمٍ لَا يُؤْمِنُونَ
23:47	2	anu'minu	Shall we believe	IV	Verb	 فَقَالُوا أَنُؤْمِنُ لِبَشَرَيْنِ مِثْلِنَا وَقَوْمُهُمَا لَنَا عَابِدُونَ
23:58	5	yu'minūna	believe	IV	Verb	 وَالَّذِينَ هُمْ بِآيَاتِ رَبِّهِمْ يُؤْمِنُونَ
23:74	4	yu'minūna	believe	IV	Verb	 وَإِنَّ الَّذِينَ لَا يُؤْمِنُونَ بِالْآخِرَةِ عَنِ الصِّرَاطِ لَنَاكِبُونَ
23:109	8	āmannā	We believe	IV	Verb	 يَقُولُونَ رَبَّنَا آمَنَّا فَاغْفِرْ لَنَا وَارْحَمْنَا وَأَنْتَ خَيْرُ الرَّاحِمِينَ
24:2	18	tu'minūna	believe	IV	Verb	 وَلَا تَأْخُذْكُمْ بِهِمَا رَأْفَةٌ فِي دِينِ اللَّهِ إِنْ كُنْتُمْ تُؤْمِنُونَ بِاللَّهِ
24:19	9	āmanū	believe	IV	Verb	 إِنَّ الَّذِينَ يُحِبُّونَ أَنْ تَشِيعَ الْفَاحِشَةُ فِي الَّذِينَ آمَنُوا لَهُمْ عَذَابٌ أَلِيمٌ
24:21	3	āmanū	O you who believe	IV	Verb	 يَا أَيُّهَا الَّذِينَ آمَنُوا لَا تَتَّبِعُوا خُطُوَاتِ الشَّيْطَانِ
24:27	3	āmanū	believe	IV	Verb	 يَا أَيُّهَا الَّذِينَ آمَنُوا لَا تَدْخُلُوا بُيُوتًا غَيْرَ بُيُوتِكُمْ
24:47	2	āmannā	We believe	IV	Verb	 وَيَقُولُونَ آمَنَّا بِاللَّهِ وَبِالرَّسُولِ وَأَطَعْنَا
24:55	4	āmanū	believe	IV	Verb	 وَعَدَ اللَّهُ الَّذِينَ آمَنُوا مِنْكُمْ وَعَمِلُوا الصَّالِحَاتِ لَيَسْتَخْلِفَنَّهُمْ
24:58	3	āmanū	O you who believe	IV	Verb	 يَا أَيُّهَا الَّذِينَ آمَنُوا لِيَسْتَأْذِنْكُمُ الَّذِينَ مَلَكَتْ أَيْمَانُكُمْ
24:62	4	āmanū	believe	IV	Verb	 إِنَّمَا الْمُؤْمِنُونَ الَّذِينَ آمَنُوا بِاللَّهِ وَرَسُولِهِ
24:62	22	yu'minūna	believe	IV	Verb	 إِنَّ الَّذِينَ يَسْتَأْذِنُونَكَ أُولَٰئِكَ الَّذِينَ يُؤْمِنُونَ بِاللَّهِ وَرَسُولِهِ
25:70	4	waāmana	and believes	IV	Verb	 إِلَّا مَنْ تَابَ وَآمَنَ وَعَمِلَ عَمَلًا صَالِحًا
26:47	2	āmannā	We believe	IV	Verb	 قَالُوا آمَنَّا بِرَبِّ الْعَالَمِينَ
26:49	2	āmantum	You believed	IV	Verb	 قَالَ آمَنْتُمْ لَهُ قَبْلَ أَنْ آذَنَ لَكُمْ إِنَّهُ لَكَبِيرُكُمُ
26:111	2	anu'minu	Should we believe	IV	Verb	 قَالُوا أَنُؤْمِنُ لَكَ وَاتَّبَعَكَ الْأَرْذَلُونَ
26:201	2	yu'minūna	they will believe	IV	Verb	 لَا يُؤْمِنُونَ بِهِ حَتَّىٰ يَرَوُا الْعَذَابَ الْأَلِيمَ
26:227	3	āmanū	believe	IV	Verb	 إِلَّا الَّذِينَ آمَنُوا وَعَمِلُوا الصَّالِحَاتِ وَذَكَرُوا اللَّهَ كَثِيرًا
27:4	4	yu'minūna	believe	IV	Verb	 إِنَّ الَّذِينَ لَا يُؤْمِنُونَ بِالْآخِرَةِ زَيَّنَّا لَهُمْ أَعْمَالَهُمْ
27:53	3	āmanū	believed	IV	Verb	 وَأَنْجَيْنَا الَّذِينَ آمَنُوا وَكَانُوا يَتَّقُونَ
27:81	11	yu'minu	believe	IV	Verb	 إِنْ تُسْمِعُ إِلَّا مَنْ يُؤْمِنُ بِآيَاتِنَا فَهُمْ مُسْلِمُونَ
27:86	15	yu'minūna	who believe	IV	Verb	 إِنَّ فِي ذَٰلِكَ لَآيَاتٍ لِقَوْمٍ يُؤْمِنُونَ
28:3	9	yu'minūna	who believe	IV	Verb	 نَتْلُو عَلَيْكَ مِنْ نَبَإِ مُوسَىٰ وَفِرْعَوْنَ بِالْحَقِّ لِقَوْمٍ يُؤْمِنُونَ
28:52	8	yu'minūna	believe	IV	Verb	 الَّذِينَ آتَيْنَاهُمُ الْكِتَابَ مِنْ قَبْلِهِ هُمْ بِهِ يُؤْمِنُونَ
28:53	5	āmannā	We believe	IV	Verb	 وَإِذَا يُتْلَىٰ عَلَيْهِمْ قَالُوا آمَنَّا بِهِ إِنَّهُ الْحَقُّ مِنْ رَبِّنَا
28:67	4	waāmana	and believed	IV	Verb	 فَأَمَّا مَنْ تَابَ وَآمَنَ وَعَمِلَ صَالِحًا فَعَسَىٰ أَنْ يَكُونَ مِنَ الْمُفْلِحِينَ
28:80	10	āmana	believes	IV	Verb	 وَيْلَكُمْ ثَوَابُ اللَّهِ خَيْرٌ لِمَنْ آمَنَ وَعَمِلَ صَالِحًا
29:2	7	āmannā	We believe	IV	Verb	 أَحَسِبَ النَّاسُ أَنْ يُتْرَكُوا أَنْ يَقُولُوا آمَنَّا وَهُمْ لَا يُفْتَنُونَ
29:7	2	āmanū	believe	IV	Verb	 وَالَّذِينَ آمَنُوا وَعَمِلُوا الصَّالِحَاتِ لَنُكَفِّرَنَّ عَنْهُمْ سَيِّئَاتِهِمْ
29:9	2	āmanū	believe	IV	Verb	 وَالَّذِينَ آمَنُوا وَعَمِلُوا الصَّالِحَاتِ لَنُدْخِلَنَّهُمْ فِي الصَّالِحِينَ
29:10	5	āmannā	We believe	IV	Verb	 وَمِنَ النَّاسِ مَنْ يَقُولُ آمَنَّا بِاللَّهِ
29:11	4	āmanū	believe	IV	Verb	 وَلَيَعْلَمَنَّ اللَّهُ الَّذِينَ آمَنُوا وَلَيَعْلَمَنَّ الْمُنَافِقِينَ
29:12	5	āmanū	believe	IV	Verb	 وَقَالَ الَّذِينَ كَفَرُوا لِلَّذِينَ آمَنُوا اتَّبِعُوا سَبِيلَنَا
29:24	20	yu'minūna	who believe	IV	Verb	 فَأَنْجَاهُ اللَّهُ مِنَ النَّارِ إِنَّ فِي ذَٰلِكَ لَآيَاتٍ لِقَوْمٍ يُؤْمِنُونَ
29:26	1	faāmana	And believed	IV	Verb	 فَآمَنَ لَهُ لُوطٌ وَقَالَ إِنِّي مُهَاجِرٌ إِلَىٰ رَبِّي
29:46	14	āmannā	We believe	IV	Verb	 وَقُولُوا آمَنَّا بِالَّذِي أُنْزِلَ إِلَيْنَا وَأُنْزِلَ إِلَيْكُمْ
29:47	8	yu'minūna	believe	IV	Verb	 فَالَّذِينَ آتَيْنَاهُمُ الْكِتَابَ يُؤْمِنُونَ بِهِ وَمِنْ هَٰؤُلَاءِ مَنْ يُؤْمِنُ بِهِ
29:47	13	yu'minu	believe	IV	Verb	 وَمِنْ هَٰؤُلَاءِ مَنْ يُؤْمِنُ بِهِ وَمَا يَجْحَدُ بِآيَاتِنَا إِلَّا الْكَافِرُونَ
29:51	15	yu'minūna	who believe	IV	Verb	 إِنَّ فِي ذَٰلِكَ لَرَحْمَةً وَذِكْرَىٰ لِقَوْمٍ يُؤْمِنُونَ
29:52	13	āmanū	believe	IV	Verb	 وَالَّذِينَ آمَنُوا بِالْبَاطِلِ وَكَفَرُوا بِاللَّهِ أُولَٰئِكَ هُمُ الْخَاسِرُونَ
29:56	3	āmanū	believe	IV	Verb	 يَا عِبَادِيَ الَّذِينَ آمَنُوا إِنَّ أَرْضِي وَاسِعَةٌ فَإِيَّايَ فَاعْبُدُونِ
29:58	2	āmanū	believe	IV	Verb	 وَالَّذِينَ آمَنُوا وَعَمِلُوا الصَّالِحَاتِ لَنُبَوِّئَنَّهُمْ مِنَ الْجَنَّةِ غُرَفًا
29:67	12	yu'minūna	they believe	IV	Verb	 أَفَبِالْبَاطِلِ يُؤْمِنُونَ وَبِنِعْمَةِ اللَّهِ يَكْفُرُونَ
30:15	3	āmanū	believed	IV	Verb	 فَأَمَّا الَّذِينَ آمَنُوا وَعَمِلُوا الصَّالِحَاتِ فَهُمْ فِي رَوْضَةٍ
30:37	15	yu'minūna	who believe	IV	Verb	 إِنَّ فِي ذَٰلِكَ لَآيَاتٍ لِقَوْمٍ يُؤْمِنُونَ
30:45	3	āmanū	believe	IV	Verb	 لِيَجْزِيَ الَّذِينَ آمَنُوا وَعَمِلُوا الصَّالِحَاتِ مِنْ فَضْلِهِ
30:53	11	yu'minu	believe	IV	Verb	 تُسْمِعُ إِلَّا مَنْ يُؤْمِنُ بِآيَاتِنَا فَهُمْ مُسْلِمُونَ
31:8	3	āmanū	believe	IV	Verb	 إِنَّ الَّذِينَ آمَنُوا وَعَمِلُوا الصَّالِحَاتِ لَهُمْ جَنَّاتُ النَّعِيمِ
32:15	2	yu'minu	believe	IV	Verb	 إِنَّمَا يُؤْمِنُ بِآيَاتِنَا الَّذِينَ إِذَا ذُكِّرُوا بِهَا خَرُّوا سُجَّدًا
32:19	3	āmanū	believe	IV	Verb	 أَمَّا الَّذِينَ آمَنُوا وَعَمِلُوا الصَّالِحَاتِ فَلَهُمْ جَنَّاتُ الْمَأْوَىٰ
33:9	3	āmanū	believe	IV	Verb	 يَا أَيُّهَا الَّذِينَ آمَنُوا اذْكُرُوا نِعْمَةَ اللَّهِ عَلَيْكُمْ
33:19	27	yu'minū	they have believed	IV	Verb	 أُولَٰئِكَ لَمْ يُؤْمِنُوا فَأَحْبَطَ اللَّهُ أَعْمَالَهُمْ
33:41	3	āmanū	O you who believe	IV	Verb	 يَا أَيُّهَا الَّذِينَ آمَنُوا اذْكُرُوا اللَّهَ ذِكْرًا كَثِيرًا
33:49	3	āmanū	O you who believe	IV	Verb	 يَا أَيُّهَا الَّذِينَ آمَنُوا إِذَا نَكَحْتُمُ الْمُؤْمِنَاتِ ثُمَّ طَلَّقْتُمُوهُنَّ
33:53	3	āmanū	O you who believe	IV	Verb	 يَا أَيُّهَا الَّذِينَ آمَنُوا لَا تَدْخُلُوا بُيُوتَ النَّبِيِّ
33:56	9	āmanū	O you who believe	IV	Verb	 يَا أَيُّهَا الَّذِينَ آمَنُوا صَلُّوا عَلَيْهِ وَسَلِّمُوا تَسْلِيمًا
33:69	3	āmanū	O you who believe	IV	Verb	 يَا أَيُّهَا الَّذِينَ آمَنُوا لَا تَكُونُوا كَالَّذِينَ آذَوْا مُوسَىٰ
33:70	3	āmanū	O you who believe	IV	Verb	 يَا أَيُّهَا الَّذِينَ آمَنُوا اتَّقُوا اللَّهَ وَقُولُوا قَوْلًا سَدِيدًا
34:4	3	āmanū	believe	IV	Verb	 لِيَجْزِيَ الَّذِينَ آمَنُوا وَعَمِلُوا الصَّالِحَاتِ
34:8	11	yu'minūna	believe	IV	Verb	 بَلِ الَّذِينَ لَا يُؤْمِنُونَ بِالْآخِرَةِ فِي الْعَذَابِ وَالضَّلَالِ الْبَعِيدِ
34:21	10	yu'minu	believes	IV	Verb	 إِلَّا لِنَعْلَمَ مَنْ يُؤْمِنُ بِالْآخِرَةِ مِمَّنْ هُوَ مِنْهَا فِي شَكٍّ
34:31	5	nu'mina	we believe	IV	Verb	 وَقَالَ الَّذِينَ كَفَرُوا لَنْ نُؤْمِنَ بِهَٰذَا الْقُرْآنِ وَلَا بِالَّذِي بَيْنَ يَدَيْهِ
34:37	11	āmana	believes	IV	Verb	 إِلَّا مَنْ آمَنَ وَعَمِلَ صَالِحًا فَأُولَٰئِكَ لَهُمْ جَزَاءُ الضِّعْفِ
34:52	2	āmannā	We believe	IV	Verb	 وَقَالُوا آمَنَّا بِهِ وَأَنَّىٰ لَهُمُ التَّنَاوُشُ مِنْ مَكَانٍ بَعِيدٍ
35:7	7	āmanū	who believe	IV	Verb	 وَالَّذِينَ آمَنُوا وَعَمِلُوا الصَّالِحَاتِ لَهُمْ مَغْفِرَةٌ وَأَجْرٌ كَبِيرٌ
36:7	8	yu'minūna	believe	IV	Verb	 لَقَدْ حَقَّ الْقَوْلُ عَلَىٰ أَكْثَرِهِمْ فَهُمْ لَا يُؤْمِنُونَ
36:10	8	yu'minūna	they will believe	IV	Verb	 وَسَوَاءٌ عَلَيْهِمْ أَأَنْذَرْتَهُمْ أَمْ لَمْ تُنْذِرْهُمْ لَا يُؤْمِنُونَ
36:25	2	āmantu	[I] have believed	IV	Verb	 إِنِّي آمَنْتُ بِرَبِّكُمْ فَاسْمَعُونِ
36:47	12	āmanū	believed	IV	Verb	 قَالَ الَّذِينَ كَفَرُوا لِلَّذِينَ آمَنُوا أَنُطْعِمُ مَنْ لَوْ يَشَاءُ اللَّهُ أَطْعَمَهُ
37:148	1	faāmanū	And they believed	IV	Verb	 فَآمَنُوا فَمَتَّعْنَاهُمْ إِلَىٰ حِينٍ
38:24	18	āmanū	believe	IV	Verb	 إِلَّا الَّذِينَ آمَنُوا وَعَمِلُوا الصَّالِحَاتِ وَقَلِيلٌ مَا هُمْ
38:28	4	āmanū	believe	IV	Verb	 أَمْ نَجْعَلُ الَّذِينَ آمَنُوا وَعَمِلُوا الصَّالِحَاتِ كَالْمُفْسِدِينَ
39:10	4	āmanū	believe	IV	Verb	 قُلْ يَا عِبَادِ الَّذِينَ آمَنُوا اتَّقُوا رَبَّكُمْ
39:45	9	yu'minūna	believe	IV	Verb	 وَإِذَا ذُكِرَ اللَّهُ وَحْدَهُ اشْمَأَزَّتْ قُلُوبُ الَّذِينَ لَا يُؤْمِنُونَ بِالْآخِرَةِ
39:52	15	yu'minūna	who believe	IV	Verb	 إِنَّ فِي ذَٰلِكَ لَآيَاتٍ لِقَوْمٍ يُؤْمِنُونَ
40:7	9	wayu'minūna	and believe	IV	Verb	 يُسَبِّحُونَ بِحَمْدِ رَبِّهِمْ وَيُؤْمِنُونَ بِهِ وَيَسْتَغْفِرُونَ لِلَّذِينَ آمَنُوا
40:7	13	āmanū	believe	IV	Verb	 يُسَبِّحُونَ بِحَمْدِ رَبِّهِمْ وَيُؤْمِنُونَ بِهِ وَيَسْتَغْفِرُونَ لِلَّذِينَ آمَنُوا
40:12	11	tu'minū	you believed	IV	Verb	 إِذَا دُعِيَ اللَّهُ وَحْدَهُ كَفَرْتُمْ وَإِنْ يُشْرَكْ بِهِ تُؤْمِنُوا
40:25	10	āmanū	believe	IV	Verb	 قَالُوا اقْتُلُوا أَبْنَاءَ الَّذِينَ آمَنُوا مَعَهُ وَاسْتَحْيُوا نِسَاءَهُمْ
40:27	11	yu'minu	who believes	IV	Verb	 إِنِّي عُذْتُ بِرَبِّي وَرَبِّكُمْ مِنْ كُلِّ مُتَكَبِّرٍ لَا يُؤْمِنُ بِيَوْمِ الْحِسَابِ
40:30	3	āmana	believed	IV	Verb	 وَقَالَ الَّذِي آمَنَ يَا قَوْمِ إِنِّي أَخَافُ عَلَيْكُمْ مِثْلَ يَوْمِ الْأَحْزَابِ
40:35	15	āmanū	who believe	IV	Verb	 كَبُرَ مَقْتًا عِنْدَ اللَّهِ وَعِنْدَ الَّذِينَ آمَنُوا
40:38	3	āmana	believed	IV	Verb	 وَقَالَ الَّذِي آمَنَ يَا قَوْمِ اتَّبِعُونِ أَهْدِكُمْ سَبِيلَ الرَّشَادِ
40:51	5	āmanū	believe	IV	Verb	 إِنَّا لَنَنْصُرُ رُسُلَنَا وَالَّذِينَ آمَنُوا فِي الْحَيَاةِ الدُّنْيَا
40:58	6	āmanū	believe	IV	Verb	 وَمَا يَسْتَوِي الْأَعْمَىٰ وَالْبَصِيرُ وَالَّذِينَ آمَنُوا
