surah:ayah	position	word	meaning	ayah_link
33:59	8	yud'nīna	to draw	 يَا أَيُّهَا النَّبِيُّ قُلْ لِأَزْوَاجِكَ وَبَنَاتِكَ وَنِسَاءِ الْمُؤْمِنِينَ يُدْنِينَ عَلَيْهِنَّ مِنْ جَلَابِيبِهِنَّ
53:8	2	danā	he approached	 ثُمَّ دَنَا فَتَدَلَّىٰ
2:61	27	adnā	(is) inferior	 قَالَ أَتَسْتَبْدِلُونَ الَّذِي هُوَ أَدْنَىٰ بِالَّذِي هُوَ خَيْرٌ
2:282	93	wa-adnā	and nearer	 ذَٰلِكُمْ أَقْسَطُ عِنْدَ اللَّهِ وَأَقْوَمُ لِلشَّهَادَةِ وَأَدْنَىٰ أَلَّا تَرْتَابُوا
4:3	26	adnā	(is) more appropriate	 ذَٰلِكَ أَدْنَىٰ أَلَّا تَعُولُوا
5:108	2	adnā	(is) closer	 ذَٰلِكَ أَدْنَىٰ أَنْ يَأْتُوا بِالشَّهَادَةِ عَلَىٰ وَجْهِهَا
7:169	10	l-adnā	the lower (life)	 فَخَلَفَ مِنْ بَعْدِهِمْ خَلْفٌ وَرِثُوا الْكِتَابَ يَأْخُذُونَ عَرَضَ هَٰذَا الْأَدْنَىٰ
30:3	2	adnā	(the) nearest	 فِي أَدْنَى الْأَرْضِ وَهُمْ مِنْ بَعْدِ غَلَبِهِمْ سَيَغْلِبُونَ
33:51	17	adnā	(is) more suitable	 ذَٰلِكَ أَدْنَىٰ أَنْ تَقَرَّ أَعْيُنُهُنَّ وَلَا يَحْزَنَّ وَيَرْضَيْنَ بِمَا آتَيْتَهُنَّ كُلُّهُنَّ
33:59	13	adnā	(is) more suitable	 ذَٰلِكَ أَدْنَىٰ أَنْ يُعْرَفْنَ فَلَا يُؤْذَيْنَ
53:9	5	adnā	nearer	 فَكَانَ قَابَ قَوْسَيْنِ أَوْ أَدْنَىٰ
58:7	26	adnā	less	 وَلَا أَدْنَىٰ مِنْ ذَٰلِكَ وَلَا أَكْثَرَ إِلَّا هُوَ مَعَهُمْ أَيْنَ مَا كَانُوا
73:20	6	adnā	(a little) less	 إِنَّ رَبَّكَ يَعْلَمُ أَنَّكَ تَقُومُ أَدْنَىٰ مِنْ ثُلُثَيِ اللَّيْلِ وَنِصْفَهُ وَثُلُثَهُ
32:21	4	l-adnā	the nearer	 وَلَنُذِيقَنَّهُمْ مِنَ الْعَذَابِ الْأَدْنَىٰ دُونَ الْعَذَابِ الْأَكْبَرِ
2:85	38	l-dun'yā	(of) the world	 فَمَا جَزَاءُ مَنْ يَفْعَلُ ذَٰلِكَ مِنْكُمْ إِلَّا خِزْيٌ فِي الْحَيَاةِ الدُّنْيَا
2:86	5	l-dun'yā	(of) the world	 أُولَٰئِكَ الَّذِينَ اشْتَرَوُا الْحَيَاةَ الدُّنْيَا بِالْآخِرَةِ
2:204	8	l-dun'yā	(of) the world	 وَمِنَ النَّاسِ مَنْ يُعْجِبُكَ قَوْلُهُ فِي الْحَيَاةِ الدُّنْيَا وَيُشْهِدُ اللَّهَ عَلَىٰ مَا فِي قَلْبِهِ
2:212	5	l-dun'yā	(of) the world	 زُيِّنَ لِلَّذِينَ كَفَرُوا الْحَيَاةُ الدُّنْيَا وَيَسْخَرُونَ مِنَ الَّذِينَ آمَنُوا
3:14	20	l-dun'yā	(of) the world	 ذَٰلِكَ مَتَاعُ الْحَيَاةِ الدُّنْيَا وَاللَّهُ عِنْدَهُ حُسْنُ الْمَآبِ
3:117	7	l-dun'yā	(of) the world	 مَثَلُ مَا يُنْفِقُونَ فِي هَٰذِهِ الْحَيَاةِ الدُّنْيَا كَمَثَلِ رِيحٍ فِيهَا صِرٌّ
3:185	20	l-dun'yā	(of) the world	 وَمَا الْحَيَاةُ الدُّنْيَا إِلَّا مَتَاعُ الْغُرُورِ
4:74	8	l-dun'yā	(of) the world	 فَلْيُقَاتِلْ فِي سَبِيلِ اللَّهِ الَّذِينَ يَشْرُونَ الْحَيَاةَ الدُّنْيَا بِالْآخِرَةِ
4:94	21	l-dun'yā	(of) the world	 تَبْتَغُونَ عَرَضَ الْحَيَاةِ الدُّنْيَا فَعِنْدَ اللَّهِ مَغَانِمُ كَثِيرَةٌ
4:109	7	l-dun'yā	(of) the world	 هَا أَنْتُمْ هَٰؤُلَاءِ جَادَلْتُمْ عَنْهُمْ فِي الْحَيَاةِ الدُّنْيَا
6:29	6	l-dun'yā	(of) the world	 وَقَالُوا إِنْ هِيَ إِلَّا حَيَاتُنَا الدُّنْيَا وَمَا نَحْنُ بِمَبْعُوثِينَ
6:32	3	l-dun'yā	(of) the world	 وَمَا الْحَيَاةُ الدُّنْيَا إِلَّا لَعِبٌ وَلَهْوٌ
6:70	9	l-dun'yā	(of) the world	 وَذَرِ الَّذِينَ اتَّخَذُوا دِينَهُمْ لَعِبًا وَلَهْوًا وَغَرَّتْهُمُ الْحَيَاةُ الدُّنْيَا
6:130	21	l-dun'yā	(of) the world	 قَالُوا شَهِدْنَا عَلَىٰ أَنْفُسِنَا وَغَرَّتْهُمُ الْحَيَاةُ الدُّنْيَا
7:32	18	l-dun'yā	(of) the world	 قُلْ هِيَ لِلَّذِينَ آمَنُوا فِي الْحَيَاةِ الدُّنْيَا خَالِصَةً يَوْمَ الْقِيَامَةِ
7:51	8	l-dun'yā	(of) the world	 الَّذِينَ اتَّخَذُوا دِينَهُمْ لَهْوًا وَلَعِبًا وَغَرَّتْهُمُ الْحَيَاةُ الدُّنْيَا
7:152	12	l-dun'yā	(of) the world	 إِنَّ الَّذِينَ اتَّخَذُوا الْعِجْلَ سَيَنَالُهُمْ غَضَبٌ مِنْ رَبِّهِمْ وَذِلَّةٌ فِي الْحَيَاةِ الدُّنْيَا
8:42	4	l-dun'yā	the nearer	 إِذْ أَنْتُمْ بِالْعُدْوَةِ الدُّنْيَا وَهُمْ بِالْعُدْوَةِ الْقُصْوَىٰ وَالرَّكْبُ أَسْفَلَ مِنْكُمْ
8:67	14	l-dun'yā	(of) the world	 تُرِيدُونَ عَرَضَ الدُّنْيَا وَاللَّهُ يُرِيدُ الْآخِرَةَ وَاللَّهُ عَزِيزٌ حَكِيمٌ
9:38	18	l-dun'yā	(of) the world	 أَرَضِيتُمْ بِالْحَيَاةِ الدُّنْيَا مِنَ الْآخِرَةِ
9:38	24	l-dun'yā	(of) the world	 فَمَا مَتَاعُ الْحَيَاةِ الدُّنْيَا فِي الْآخِرَةِ إِلَّا قَلِيلٌ
9:55	13	l-dun'yā	(of) the world	 إِنَّمَا يُرِيدُ اللَّهُ لِيُعَذِّبَهُمْ بِهَا فِي الْحَيَاةِ الدُّنْيَا وَتَزْهَقَ أَنْفُسُهُمْ وَهُمْ كَافِرُونَ
10:7	8	l-dun'yā	(of) the world	 إِنَّ الَّذِينَ لَا يَرْجُونَ لِقَاءَنَا وَرَضُوا بِالْحَيَاةِ الدُّنْيَا وَاطْمَأَنُّوا بِهَا
10:23	18	l-dun'yā	(of) the world	 يَا أَيُّهَا النَّاسُ إِنَّمَا بَغْيُكُمْ عَلَىٰ أَنْفُسِكُمْ مَتَاعَ الْحَيَاةِ الدُّنْيَا
10:24	4	l-dun'yā	(of) the world	 إِنَّمَا مَثَلُ الْحَيَاةِ الدُّنْيَا كَمَاءٍ أَنْزَلْنَاهُ مِنَ السَّمَاءِ فَاخْتَلَطَ بِهِ نَبَاتُ الْأَرْضِ
10:64	5	l-dun'yā	(of) the world	 لَهُمُ الْبُشْرَىٰ فِي الْحَيَاةِ الدُّنْيَا وَفِي الْآخِرَةِ
10:88	12	l-dun'yā	(of) the world	 وَقَالَ مُوسَىٰ رَبَّنَا إِنَّكَ آتَيْتَ فِرْعَوْنَ وَمَلَأَهُ زِينَةً وَأَمْوَالًا فِي الْحَيَاةِ الدُّنْيَا
10:98	18	l-dun'yā	of the world	 لَمَّا آمَنُوا كَشَفْنَا عَنْهُمْ عَذَابَ الْخِزْيِ فِي الْحَيَاةِ الدُّنْيَا
11:15	5	l-dun'yā	(of) the world	 مَنْ كَانَ يُرِيدُ الْحَيَاةَ الدُّنْيَا وَزِينَتَهَا نُوَفِّ إِلَيْهِمْ أَعْمَالَهُمْ فِيهَا
13:26	9	l-dun'yā	(of) the world	 وَفَرِحُوا بِالْحَيَاةِ الدُّنْيَا
13:26	12	l-dun'yā	of the world	 وَمَا الْحَيَاةُ الدُّنْيَا فِي الْآخِرَةِ إِلَّا مَتَاعٌ
13:34	5	l-dun'yā	(of) the world	 لَهُمْ عَذَابٌ فِي الْحَيَاةِ الدُّنْيَا وَلَعَذَابُ الْآخِرَةِ أَشَقُّ
14:3	4	l-dun'yā	(of) the world	 الَّذِينَ يَسْتَحِبُّونَ الْحَيَاةَ الدُّنْيَا عَلَى الْآخِرَةِ
14:27	9	l-dun'yā	(of) the world	 يُثَبِّتُ اللَّهُ الَّذِينَ آمَنُوا بِالْقَوْلِ الثَّابِتِ فِي الْحَيَاةِ الدُّنْيَا
16:107	5	l-dun'yā	(of) the world	 ذَٰلِكَ بِأَنَّهُمُ اسْتَحَبُّوا الْحَيَاةَ الدُّنْيَا عَلَى الْآخِرَةِ
18:28	18	l-dun'yā	(of) the world	 وَلَا تَعْدُ عَيْنَاكَ عَنْهُمْ تُرِيدُ زِينَةَ الْحَيَاةِ الدُّنْيَا
18:45	5	l-dun'yā	(of) the world	 وَاضْرِبْ لَهُمْ مَثَلَ الْحَيَاةِ الدُّنْيَا كَمَاءٍ أَنْزَلْنَاهُ مِنَ السَّمَاءِ فَاخْتَلَطَ بِهِ نَبَاتُ الْأَرْضِ
18:46	5	l-dun'yā	(of) the world	 الْمَالُ وَالْبَنُونَ زِينَةُ الْحَيَاةِ الدُّنْيَا
18:104	6	l-dun'yā	(of) the world	 الَّذِينَ ضَلَّ سَعْيُهُمْ فِي الْحَيَاةِ الدُّنْيَا وَهُمْ يَحْسَبُونَ أَنَّهُمْ يُحْسِنُونَ صُنْعًا
20:72	19	l-dun'yā	(of) the world	 فَاقْضِ مَا أَنْتَ قَاضٍ إِنَّمَا تَقْضِي هَٰذِهِ الْحَيَاةَ الدُّنْيَا
20:131	12	l-dun'yā	(of) the world	 وَلَا تَمُدَّنَّ عَيْنَيْكَ إِلَىٰ مَا مَتَّعْنَا بِهِ أَزْوَاجًا مِنْهُمْ زَهْرَةَ الْحَيَاةِ الدُّنْيَا
23:33	13	l-dun'yā	(of) the world	 وَكَذَّبُوا بِلِقَاءِ الْآخِرَةِ وَأَتْرَفْنَاهُمْ فِي الْحَيَاةِ الدُّنْيَا
23:37	5	l-dun'yā	(of) the world	 إِنْ هِيَ إِلَّا حَيَاتُنَا الدُّنْيَا نَمُوتُ وَنَحْيَا وَمَا نَحْنُ بِمَبْعُوثِينَ
24:33	39	l-dun'yā	(of) the world	 وَلَا تُكْرِهُوا فَتَيَاتِكُمْ عَلَى الْبِغَاءِ إِنْ أَرَدْنَ تَحَصُّنًا لِتَبْتَغُوا عَرَضَ الْحَيَاةِ الدُّنْيَا
28:60	7	l-dun'yā	(of) the world	 وَمَا أُوتِيتُمْ مِنْ شَيْءٍ فَمَتَاعُ الْحَيَاةِ الدُّنْيَا وَزِينَتُهَا
28:61	11	l-dun'yā	(of) the world	 أَفَمَنْ وَعَدْنَاهُ وَعْدًا حَسَنًا فَهُوَ لَاقِيهِ كَمَنْ مَتَّعْنَاهُ مَتَاعَ الْحَيَاةِ الدُّنْيَا
28:79	10	l-dun'yā	(of) the world	 قَالَ الَّذِينَ يُرِيدُونَ الْحَيَاةَ الدُّنْيَا يَا لَيْتَ لَنَا مِثْلَ مَا أُوتِيَ قَارُونُ
29:25	12	l-dun'yā	(of) the world	 وَقَالَ إِنَّمَا اتَّخَذْتُمْ مِنْ دُونِ اللَّهِ أَوْثَانًا مَوَدَّةَ بَيْنِكُمْ فِي الْحَيَاةِ الدُّنْيَا
29:64	4	l-dun'yā	(of) the world	 وَمَا هَٰذِهِ الْحَيَاةُ الدُّنْيَا إِلَّا لَهْوٌ وَلَعِبٌ وَإِنَّ الدَّارَ الْآخِرَةَ لَهِيَ الْحَيَوَانُ
30:7	5	l-dun'yā	(of) the world	 يَعْلَمُونَ ظَاهِرًا مِنَ الْحَيَاةِ الدُّنْيَا وَهُمْ عَنِ الْآخِرَةِ هُمْ غَافِلُونَ
31:33	26	l-dun'yā	(of) the world	 فَلَا تَغُرَّنَّكُمُ الْحَيَاةُ الدُّنْيَا وَلَا يَغُرَّنَّكُمْ بِاللَّهِ الْغَرُورُ
33:28	9	l-dun'yā	(of) the world	 إِنْ كُنْتُنَّ تُرِدْنَ الْحَيَاةَ الدُّنْيَا وَزِينَتَهَا فَتَعَالَيْنَ أُمَتِّعْكُنَّ
35:5	10	l-dun'yā	(of) the world	 يَا أَيُّهَا النَّاسُ إِنَّ وَعْدَ اللَّهِ حَقٌّ فَلَا تَغُرَّنَّكُمُ الْحَيَاةُ الدُّنْيَا
37:6	4	l-dun'yā	[the world]	 إِنَّا زَيَّنَّا السَّمَاءَ الدُّنْيَا بِزِينَةٍ الْكَوَاكِبِ
39:26	6	l-dun'yā	(of) the world	 فَأَذَاقَهُمُ اللَّهُ الْخِزْيَ فِي الْحَيَاةِ الدُّنْيَا
40:39	5	l-dun'yā	(of) the world	 يَا قَوْمِ إِنَّمَا هَٰذِهِ الْحَيَاةُ الدُّنْيَا مَتَاعٌ
40:51	8	l-dun'yā	(of) the world	 إِنَّا لَنَنْصُرُ رُسُلَنَا وَالَّذِينَ آمَنُوا فِي الْحَيَاةِ الدُّنْيَا وَيَوْمَ يَقُومُ الْأَشْهَادُ
41:12	13	l-dun'yā	[the world]	 وَزَيَّنَّا السَّمَاءَ الدُّنْيَا بِمَصَابِيحَ وَحِفْظًا
41:16	13	l-dun'yā	(of) the world	 لِنُذِيقَهُمْ عَذَابَ الْخِزْيِ فِي الْحَيَاةِ الدُّنْيَا
41:31	5	l-dun'yā	(of) the world	 نَحْنُ أَوْلِيَاؤُكُمْ فِي الْحَيَاةِ الدُّنْيَا وَفِي الْآخِرَةِ
42:20	14	l-dun'yā	(of) the world	 وَمَنْ كَانَ يُرِيدُ حَرْثَ الدُّنْيَا نُؤْتِهِ مِنْهَا وَمَا لَهُ فِي الْآخِرَةِ مِنْ نَصِيبٍ
42:36	7	l-dun'yā	(of) the world	 فَمَا أُوتِيتُمْ مِنْ شَيْءٍ فَمَتَاعُ الْحَيَاةِ الدُّنْيَا
43:32	11	l-dun'yā	(of) the world	 نَحْنُ قَسَمْنَا بَيْنَهُمْ مَعِيشَتَهُمْ فِي الْحَيَاةِ الدُّنْيَا
43:35	8	l-dun'yā	(of) the world	 وَإِنْ كُلُّ ذَٰلِكَ لَمَّا مَتَاعُ الْحَيَاةِ الدُّنْيَا
45:24	6	l-dun'yā	(of) the world	 وَقَالُوا مَا هِيَ إِلَّا حَيَاتُنَا الدُّنْيَا نَمُوتُ وَنَحْيَا وَمَا يُهْلِكُنَا إِلَّا الدَّهْرُ
45:35	9	l-dun'yā	(of) the world	 ذَٰلِكُمْ بِأَنَّكُمُ اتَّخَذْتُمْ آيَاتِ اللَّهِ هُزُوًا وَغَرَّتْكُمُ الْحَيَاةُ الدُّنْيَا
46:20	11	l-dun'yā	(of) the world	 أَذْهَبْتُمْ طَيِّبَاتِكُمْ فِي حَيَاتِكُمُ الدُّنْيَا وَاسْتَمْتَعْتُمْ بِهَا
47:36	3	l-dun'yā	(of) the world	 إِنَّمَا الْحَيَاةُ الدُّنْيَا لَعِبٌ وَلَهْوٌ وَإِنْ تُؤْمِنُوا وَتَتَّقُوا يُؤْتِكُمْ أُجُورَكُمْ
53:29	11	l-dun'yā	(of) the world	 فَأَعْرِضْ عَنْ مَنْ تَوَلَّىٰ عَنْ ذِكْرِنَا وَلَمْ يُرِدْ إِلَّا الْحَيَاةَ الدُّنْيَا
57:20	4	l-dun'yā	(of) the world	 اعْلَمُوا أَنَّمَا الْحَيَاةُ الدُّنْيَا لَعِبٌ وَلَهْوٌ وَزِينَةٌ وَتَفَاخُرٌ بَيْنَكُمْ
57:20	36	l-dun'yā	(of) the world	 وَمَا الْحَيَاةُ الدُّنْيَا إِلَّا مَتَاعُ الْغُرُورِ
67:5	4	l-dun'yā	nearest	 وَلَقَدْ زَيَّنَّا السَّمَاءَ الدُّنْيَا بِمَصَابِيحَ وَجَعَلْنَاهَا رُجُومًا لِلشَّيَاطِينِ
79:38	3	l-dun'yā	(of) the world	 وَآثَرَ الْحَيَاةَ الدُّنْيَا
87:16	4	l-dun'yā	(of) the world	 بَلْ تُؤْثِرُونَ الْحَيَاةَ الدُّنْيَا
2:114	24	l-dun'yā	the world	 لَهُمْ فِي الدُّنْيَا خِزْيٌ وَلَهُمْ فِي الْآخِرَةِ عَذَابٌ عَظِيمٌ
2:130	13	l-dun'yā	the world	 وَلَقَدِ اصْطَفَيْنَاهُ فِي الدُّنْيَا وَإِنَّهُ فِي الْآخِرَةِ لَمِنَ الصَّالِحِينَ
2:200	18	l-dun'yā	the world	 فَمِنَ النَّاسِ مَنْ يَقُولُ رَبَّنَا آتِنَا فِي الدُّنْيَا وَمَا لَهُ فِي الْآخِرَةِ مِنْ خَلَاقٍ
2:201	7	l-dun'yā	the world	 وَمِنْهُمْ مَنْ يَقُولُ رَبَّنَا آتِنَا فِي الدُّنْيَا حَسَنَةً وَفِي الْآخِرَةِ حَسَنَةً وَقِنَا عَذَابَ النَّارِ
2:217	50	l-dun'yā	the world	 فَأُولَٰئِكَ حَبِطَتْ أَعْمَالُهُمْ فِي الدُّنْيَا وَالْآخِرَةِ
2:220	2	l-dun'yā	the world	 فِي الدُّنْيَا وَالْآخِرَةِ وَيَسْأَلُونَكَ عَنِ الْيَتَامَىٰ قُلْ إِصْلَاحٌ لَهُمْ خَيْرٌ
3:22	6	l-dun'yā	the world	 أُولَٰئِكَ الَّذِينَ حَبِطَتْ أَعْمَالُهُمْ فِي الدُّنْيَا وَالْآخِرَةِ
3:45	17	l-dun'yā	the world	 اسْمُهُ الْمَسِيحُ عِيسَى ابْنُ مَرْيَمَ وَجِيهًا فِي الدُّنْيَا وَالْآخِرَةِ
3:56	8	l-dun'yā	the world	 فَأَمَّا الَّذِينَ كَفَرُوا فَأُعَذِّبُهُمْ عَذَابًا شَدِيدًا فِي الدُّنْيَا وَالْآخِرَةِ وَمَا لَهُمْ مِنْ نَاصِرِينَ
3:145	14	l-dun'yā	(of) the world 	 وَمَنْ يُرِدْ ثَوَابَ الدُّنْيَا نُؤْتِهِ مِنْهَا
3:148	4	l-dun'yā	(in) the world	 فَآتَاهُمُ اللَّهُ ثَوَابَ الدُّنْيَا وَحُسْنَ ثَوَابِ الْآخِرَةِ
3:152	24	l-dun'yā	the world	 مِنْكُمْ مَنْ يُرِيدُ الدُّنْيَا وَمِنْكُمْ مَنْ يُرِيدُ الْآخِرَةَ
4:77	40	l-dun'yā	(of) the world	 قُلْ مَتَاعُ الدُّنْيَا قَلِيلٌ وَالْآخِرَةُ خَيْرٌ لِمَنِ اتَّقَىٰ وَلَا تُظْلَمُونَ فَتِيلًا
4:134	5	l-dun'yā	(of) the world 	 مَنْ كَانَ يُرِيدُ ثَوَابَ الدُّنْيَا
4:134	9	l-dun'yā	(of) the world	 فَعِنْدَ اللَّهِ ثَوَابُ الدُّنْيَا وَالْآخِرَةِ
5:33	29	l-dun'yā	the world	 ذَٰلِكَ لَهُمْ خِزْيٌ فِي الدُّنْيَا وَلَهُمْ فِي الْآخِرَةِ عَذَابٌ عَظِيمٌ
5:41	61	l-dun'yā	the world	 أُولَٰئِكَ الَّذِينَ لَمْ يُرِدِ اللَّهُ أَنْ يُطَهِّرَ قُلُوبَهُمْ لَهُمْ فِي الدُّنْيَا خِزْيٌ
7:156	5	l-dun'yā	[the] world	 وَاكْتُبْ لَنَا فِي هَٰذِهِ الدُّنْيَا حَسَنَةً وَفِي الْآخِرَةِ إِنَّا هُدْنَا إِلَيْكَ
9:69	28	l-dun'yā	the world	 أُولَٰئِكَ حَبِطَتْ أَعْمَالُهُمْ فِي الدُّنْيَا وَالْآخِرَةِ
9:74	37	l-dun'yā	the world	 وَإِنْ يَتَوَلَّوْا يُعَذِّبْهُمُ اللَّهُ عَذَابًا أَلِيمًا فِي الدُّنْيَا وَالْآخِرَةِ
9:85	12	l-dun'yā	the world	 إِنَّمَا يُرِيدُ اللَّهُ أَنْ يُعَذِّبَهُمْ بِهَا فِي الدُّنْيَا وَتَزْهَقَ أَنْفُسُهُمْ وَهُمْ كَافِرُونَ
10:70	3	l-dun'yā	the world	 مَتَاعٌ فِي الدُّنْيَا ثُمَّ إِلَيْنَا مَرْجِعُهُمْ ثُمَّ نُذِيقُهُمُ الْعَذَابَ الشَّدِيدَ
11:60	4	l-dun'yā	world	 وَأُتْبِعُوا فِي هَٰذِهِ الدُّنْيَا لَعْنَةً وَيَوْمَ الْقِيَامَةِ
12:101	16	l-dun'yā	the world	 فَاطِرَ السَّمَاوَاتِ وَالْأَرْضِ أَنْتَ وَلِيِّي فِي الدُّنْيَا وَالْآخِرَةِ
16:30	13	l-dun'yā	world	 لِلَّذِينَ أَحْسَنُوا فِي هَٰذِهِ الدُّنْيَا حَسَنَةٌ وَلَدَارُ الْآخِرَةِ خَيْرٌ
16:41	11	l-dun'yā	the world	 وَالَّذِينَ هَاجَرُوا فِي اللَّهِ مِنْ بَعْدِ مَا ظُلِمُوا لَنُبَوِّئَنَّهُمْ فِي الدُّنْيَا حَسَنَةً
16:122	3	l-dun'yā	the world	 وَآتَيْنَاهُ فِي الدُّنْيَا حَسَنَةً وَإِنَّهُ فِي الْآخِرَةِ لَمِنَ الصَّالِحِينَ
22:9	9	l-dun'yā	the world	 ثَانِيَ عِطْفِهِ لِيُضِلَّ عَنْ سَبِيلِ اللَّهِ لَهُ فِي الدُّنْيَا خِزْيٌ
22:11	20	l-dun'yā	the world	 وَإِنْ أَصَابَتْهُ فِتْنَةٌ انْقَلَبَ عَلَىٰ وَجْهِهِ خَسِرَ الدُّنْيَا وَالْآخِرَةَ
22:15	9	l-dun'yā	the world	 مَنْ كَانَ يَظُنُّ أَنْ لَنْ يَنْصُرَهُ اللَّهُ فِي الدُّنْيَا وَالْآخِرَةِ فَلْيَمْدُدْ بِسَبَبٍ إِلَى السَّمَاءِ
24:14	7	l-dun'yā	the world	 وَلَوْلَا فَضْلُ اللَّهِ عَلَيْكُمْ وَرَحْمَتُهُ فِي الدُّنْيَا وَالْآخِرَةِ لَمَسَّكُمْ فِي مَا أَفَضْتُمْ فِيهِ عَذَابٌ عَظِيمٌ
24:19	14	l-dun'yā	the world	 إِنَّ الَّذِينَ يُحِبُّونَ أَنْ تَشِيعَ الْفَاحِشَةُ فِي الَّذِينَ آمَنُوا لَهُمْ عَذَابٌ أَلِيمٌ فِي الدُّنْيَا وَالْآخِرَةِ
24:23	9	l-dun'yā	the world	 إِنَّ الَّذِينَ يَرْمُونَ الْمُحْصَنَاتِ الْغَافِلَاتِ الْمُؤْمِنَاتِ لُعِنُوا فِي الدُّنْيَا وَالْآخِرَةِ
28:42	4	l-dun'yā	world	 وَأَتْبَعْنَاهُمْ فِي هَٰذِهِ الدُّنْيَا لَعْنَةً وَيَوْمَ الْقِيَامَةِ هُمْ مِنَ الْمَقْبُوحِينَ
28:77	11	l-dun'yā	the world	 وَابْتَغِ فِيمَا آتَاكَ اللَّهُ الدَّارَ الْآخِرَةَ وَلَا تَنْسَ نَصِيبَكَ مِنَ الدُّنْيَا
29:27	13	l-dun'yā	the world	 وَآتَيْنَاهُ أَجْرَهُ فِي الدُّنْيَا وَإِنَّهُ فِي الْآخِرَةِ لَمِنَ الصَّالِحِينَ
31:15	16	l-dun'yā	the world	 وَصَاحِبْهُمَا فِي الدُّنْيَا مَعْرُوفًا وَاتَّبِعْ سَبِيلَ مَنْ أَنَابَ إِلَيَّ
33:57	9	l-dun'yā	the world	 إِنَّ الَّذِينَ يُؤْذُونَ اللَّهَ وَرَسُولَهُ لَعَنَهُمُ اللَّهُ فِي الدُّنْيَا وَالْآخِرَةِ
39:10	11	l-dun'yā	world	 لِلَّذِينَ أَحْسَنُوا فِي هَٰذِهِ الدُّنْيَا حَسَنَةٌ وَأَرْضُ اللَّهِ وَاسِعَةٌ
40:43	10	l-dun'yā	the world	 لَا جَرَمَ أَنَّمَا تَدْعُونَنِي إِلَيْهِ لَيْسَ لَهُ دَعْوَةٌ فِي الدُّنْيَا وَلَا فِي الْآخِرَةِ
59:3	9	l-dun'yā	the world	 وَلَوْلَا أَنْ كَتَبَ اللَّهُ عَلَيْهِمُ الْجَلَاءَ لَعَذَّبَهُمْ فِي الدُّنْيَا
55:54	9	dānin	(is) near	 مُتَّكِئِينَ عَلَىٰ فُرُشٍ بَطَائِنُهَا مِنْ إِسْتَبْرَقٍ وَجَنَى الْجَنَّتَيْنِ دَانٍ
69:23	2	dāniyatun	hanging near	 قُطُوفُهَا دَانِيَةٌ
76:14	1	wadāniyatan	And near	 وَدَانِيَةً عَلَيْهِمْ ظِلَالُهَا وَذُلِّلَتْ قُطُوفُهَا تَذْلِيلًا
6:99	24	dāniyatun	hanging low	 وَمِنَ النَّخْلِ مِنْ طَلْعِهَا قِنْوَانٌ دَانِيَةٌ وَجَنَّاتٍ مِنْ أَعْنَابٍ
