surah:ayah	position	word	meaning	form	p-o-s	ayah_link
2:125	12	waʿahid'nā	And We made a covenant	I	Verb	 وَعَهِدْنَا إِلَىٰ إِبْرَاهِيمَ وَإِسْمَاعِيلَ أَنْ طَهِّرَا بَيْتِيَ لِلطَّائِفِينَ
3:183	5	ʿahida	(has) taken promise	I	Verb	 إِنَّ اللَّهَ عَهِدَ إِلَيْنَا أَلَّا نُؤْمِنَ لِرَسُولٍ حَتَّىٰ يَأْتِيَنَا بِقُرْبَانٍ تَأْكُلُهُ النَّارُ
7:134	11	ʿahida	He has promised	I	Verb	 قَالُوا يَا مُوسَى ادْعُ لَنَا رَبَّكَ بِمَا عَهِدَ عِنْدَكَ
20:115	2	ʿahid'nā	We made a covenant	I	Verb	 وَلَقَدْ عَهِدْنَا إِلَىٰ آدَمَ مِنْ قَبْلُ فَنَسِيَ وَلَمْ نَجِدْ لَهُ عَزْمًا
36:60	2	aʿhad	I enjoin	I	Verb	 أَلَمْ أَعْهَدْ إِلَيْكُمْ يَا بَنِي آدَمَ أَنْ لَا تَعْبُدُوا الشَّيْطَانَ
43:49	8	ʿahida	He has made covenant	I	Verb	 وَقَالُوا يَا أَيُّهَ السَّاحِرُ ادْعُ لَنَا رَبَّكَ بِمَا عَهِدَ عِنْدَكَ
2:100	2	ʿāhadū	they took	III	Verb	 أَوَكُلَّمَا عَاهَدُوا عَهْدًا نَبَذَهُ فَرِيقٌ مِنْهُمْ
2:177	39	ʿāhadū	they make it	III	Verb	 وَالْمُوفُونَ بِعَهْدِهِمْ إِذَا عَاهَدُوا
8:56	2	ʿāhadtta	you made a covenant	III	Verb	 الَّذِينَ عَاهَدْتَ مِنْهُمْ ثُمَّ يَنْقُضُونَ عَهْدَهُمْ فِي كُلِّ مَرَّةٍ
9:1	7	ʿāhadttum	you made a covenant	III	Verb	 بَرَاءَةٌ مِنَ اللَّهِ وَرَسُولِهِ إِلَى الَّذِينَ عَاهَدْتُمْ مِنَ الْمُشْرِكِينَ
9:4	3	ʿāhadttum	you have a covenant	III	Verb	 إِلَّا الَّذِينَ عَاهَدْتُمْ مِنَ الْمُشْرِكِينَ ثُمَّ لَمْ يَنْقُصُوكُمْ شَيْئًا
9:7	11	ʿāhadttum	you made a covenant	III	Verb	 إِلَّا الَّذِينَ عَاهَدْتُمْ عِنْدَ الْمَسْجِدِ الْحَرَامِ فَمَا اسْتَقَامُوا
9:75	3	ʿāhada	made a covenant	III	Verb	 وَمِنْهُمْ مَنْ عَاهَدَ اللَّهَ لَئِنْ آتَانَا مِنْ فَضْلِهِ لَنَصَّدَّقَنَّ
16:91	5	ʿāhadttum	you have taken a covenant	III	Verb	 وَأَوْفُوا بِعَهْدِ اللَّهِ إِذَا عَاهَدْتُمْ
33:15	3	ʿāhadū	promised	III	Verb	 وَلَقَدْ كَانُوا عَاهَدُوا اللَّهَ مِنْ قَبْلُ لَا يُوَلُّونَ الْأَدْبَارَ
33:23	6	ʿāhadū	they promised Allah	III	Verb	 مِنَ الْمُؤْمِنِينَ رِجَالٌ صَدَقُوا مَا عَاهَدُوا اللَّهَ عَلَيْهِ
48:10	20	ʿāhada	he has covenanted	III	Verb	 وَمَنْ أَوْفَىٰ بِمَا عَاهَدَ عَلَيْهُ اللَّهَ فَسَيُؤْتِيهِ أَجْرًا عَظِيمًا
2:27	3	ʿahda	(the) Covenant	I	Noun	 الَّذِينَ يَنْقُضُونَ عَهْدَ اللَّهِ مِنْ بَعْدِ مِيثَاقِهِ
2:40	9	biʿahdī	My Covenant	I	Noun	 وَأَوْفُوا بِعَهْدِي أُوفِ بِعَهْدِكُمْ وَإِيَّايَ فَارْهَبُونِ
2:40	11	biʿahdikum	your covenant	I	Noun	 وَأَوْفُوا بِعَهْدِي أُوفِ بِعَهْدِكُمْ وَإِيَّايَ فَارْهَبُونِ
2:80	12	ʿahdan	a covenant	I	Noun	 قُلْ أَتَّخَذْتُمْ عِنْدَ اللَّهِ عَهْدًا فَلَنْ يُخْلِفَ اللَّهُ عَهْدَهُ
2:80	16	ʿahdahu	His Covenant	I	Noun	 قُلْ أَتَّخَذْتُمْ عِنْدَ اللَّهِ عَهْدًا فَلَنْ يُخْلِفَ اللَّهُ عَهْدَهُ
2:100	3	ʿahdan	a covenant	I	Noun	 أَوَكُلَّمَا عَاهَدُوا عَهْدًا نَبَذَهُ فَرِيقٌ مِنْهُمْ
2:124	18	ʿahdī	My Covenant	I	Noun	 قَالَ وَمِنْ ذُرِّيَّتِي قَالَ لَا يَنَالُ عَهْدِي الظَّالِمِينَ
2:177	37	biʿahdihim	their covenant	I	Noun	 وَالْمُوفُونَ بِعَهْدِهِمْ إِذَا عَاهَدُوا
3:76	4	biʿahdihi	his covenant	I	Noun	 بَلَىٰ مَنْ أَوْفَىٰ بِعَهْدِهِ وَاتَّقَىٰ فَإِنَّ اللَّهَ يُحِبُّ الْمُتَّقِينَ
3:77	4	biʿahdi	(the) Covenant	I	Noun	 إِنَّ الَّذِينَ يَشْتَرُونَ بِعَهْدِ اللَّهِ وَأَيْمَانِهِمْ ثَمَنًا قَلِيلًا أُولَٰئِكَ لَا خَلَاقَ لَهُمْ فِي الْآخِرَةِ
6:152	28	wabiʿahdi	And (the) Covenant	I	Noun	 وَإِذَا قُلْتُمْ فَاعْدِلُوا وَلَوْ كَانَ ذَا قُرْبَىٰ وَبِعَهْدِ اللَّهِ أَوْفُوا
7:102	5	ʿahdin	covenant	I	Noun	 وَمَا وَجَدْنَا لِأَكْثَرِهِمْ مِنْ عَهْدٍ وَإِنْ وَجَدْنَا أَكْثَرَهُمْ لَفَاسِقِينَ
8:56	6	ʿahdahum	their covenant	I	Noun	 الَّذِينَ عَاهَدْتَ مِنْهُمْ ثُمَّ يَنْقُضُونَ عَهْدَهُمْ فِي كُلِّ مَرَّةٍ
9:4	16	ʿahdahum	their treaty	I	Noun	 فَأَتِمُّوا إِلَيْهِمْ عَهْدَهُمْ إِلَىٰ مُدَّتِهِمْ
9:7	4	ʿahdun	a covenant	I	Noun	 كَيْفَ يَكُونُ لِلْمُشْرِكِينَ عَهْدٌ عِنْدَ اللَّهِ وَعِنْدَ رَسُولِهِ
9:12	6	ʿahdihim	their treaty	I	Noun	 وَإِنْ نَكَثُوا أَيْمَانَهُمْ مِنْ بَعْدِ عَهْدِهِمْ وَطَعَنُوا فِي دِينِكُمْ فَقَاتِلُوا أَئِمَّةَ الْكُفْرِ
9:111	26	biʿahdihi	to his promise	I	Noun	 وَمَنْ أَوْفَىٰ بِعَهْدِهِ مِنَ اللَّهِ
13:20	3	biʿahdi	the covenant	I	Noun	 الَّذِينَ يُوفُونَ بِعَهْدِ اللَّهِ وَلَا يَنْقُضُونَ الْمِيثَاقَ
13:25	3	ʿahda	the covenant	I	Noun	 وَالَّذِينَ يَنْقُضُونَ عَهْدَ اللَّهِ مِنْ بَعْدِ مِيثَاقِهِ
16:91	2	biʿahdi	the covenant	I	Noun	 وَأَوْفُوا بِعَهْدِ اللَّهِ إِذَا عَاهَدْتُمْ
16:95	3	biʿahdi	the covenant	I	Noun	 وَلَا تَشْتَرُوا بِعَهْدِ اللَّهِ ثَمَنًا قَلِيلًا
17:34	13	bil-ʿahdi	the covenant	I	Noun	 وَأَوْفُوا بِالْعَهْدِ
17:34	15	l-ʿahda	the covenant	I	Noun	 إِنَّ الْعَهْدَ كَانَ مَسْئُولًا
19:78	7	ʿahdan	a promise	I	Noun	 أَطَّلَعَ الْغَيْبَ أَمِ اتَّخَذَ عِنْدَ الرَّحْمَٰنِ عَهْدًا
19:87	9	ʿahdan	a covenant	I	Noun	 لَا يَمْلِكُونَ الشَّفَاعَةَ إِلَّا مَنِ اتَّخَذَ عِنْدَ الرَّحْمَٰنِ عَهْدًا
20:86	16	l-ʿahdu	the promise	I	Noun	 أَفَطَالَ عَلَيْكُمُ الْعَهْدُ أَمْ أَرَدْتُمْ أَنْ يَحِلَّ عَلَيْكُمْ غَضَبٌ مِنْ رَبِّكُمْ
23:8	4	waʿahdihim	and their promise(s)	I	Noun	 وَالَّذِينَ هُمْ لِأَمَانَاتِهِمْ وَعَهْدِهِمْ رَاعُونَ
33:15	11	ʿahdu	(the) promise	I	Noun	 وَكَانَ عَهْدُ اللَّهِ مَسْئُولًا
70:32	4	waʿahdihim	and their promise	I	Noun	 وَالَّذِينَ هُمْ لِأَمَانَاتِهِمْ وَعَهْدِهِمْ رَاعُونَ
