surah:ayah	position	word	meaning	ayah_link
25:65	11	gharāman	inseparable	 رَبَّنَا اصْرِفْ عَنَّا عَذَابَ جَهَنَّمَ إِنَّ عَذَابَهَا كَانَ غَرَامًا
9:98	7	maghraman	(as) a loss	 وَمِنَ الْأَعْرَابِ مَنْ يَتَّخِذُ مَا يُنْفِقُ مَغْرَمًا
52:40	6	maghramin	a debt	 أَمْ تَسْأَلُهُمْ أَجْرًا فَهُمْ مِنْ مَغْرَمٍ مُثْقَلُونَ
68:46	6	maghramin	(the) debt	 أَمْ تَسْأَلُهُمْ أَجْرًا فَهُمْ مِنْ مَغْرَمٍ مُثْقَلُونَ
9:60	11	wal-ghārimīna	and for those in debt	 وَفِي الرِّقَابِ وَالْغَارِمِينَ وَفِي سَبِيلِ اللَّهِ وَابْنِ السَّبِيلِ
56:66	2	lamugh'ramūna	surely are laden with debt	 إِنَّا لَمُغْرَمُونَ
