surah:ayah	position	word	meaning	ayah_link
22:23	19	walu'lu-an	and pearl	 يُحَلَّوْنَ فِيهَا مِنْ أَسَاوِرَ مِنْ ذَهَبٍ وَلُؤْلُؤًا
35:33	10	walu'lu-an	and pearls	 يُحَلَّوْنَ فِيهَا مِنْ أَسَاوِرَ مِنْ ذَهَبٍ وَلُؤْلُؤًا
52:24	6	lu'lu-on	pearls	 وَيَطُوفُ عَلَيْهِمْ غِلْمَانٌ لَهُمْ كَأَنَّهُمْ لُؤْلُؤٌ مَكْنُونٌ
55:22	3	l-lu'lu-u	the pearl	 يَخْرُجُ مِنْهُمَا اللُّؤْلُؤُ وَالْمَرْجَانُ
56:23	2	l-lu'lu-i	pearls	 كَأَمْثَالِ اللُّؤْلُؤِ الْمَكْنُونِ
76:19	8	lu'lu-an	(to be) pearls	 إِذَا رَأَيْتَهُمْ حَسِبْتَهُمْ لُؤْلُؤًا مَنْثُورًا
