surah:ayah	position	word	meaning	ayah_link
18:75	2	alam	Did not	 قَالَ أَلَمْ أَقُلْ لَكَ إِنَّكَ لَنْ تَسْتَطِيعَ مَعِيَ صَبْرًا
18:78	9	lam	not	 سَأُنَبِّئُكَ بِتَأْوِيلِ مَا لَمْ تَسْتَطِعْ عَلَيْهِ صَبْرًا
18:82	32	lam	not	 ذَٰلِكَ تَأْوِيلُ مَا لَمْ تَسْطِعْ عَلَيْهِ صَبْرًا
18:90	10	lam	not	 وَجَدَهَا تَطْلُعُ عَلَىٰ قَوْمٍ لَمْ نَجْعَلْ لَهُمْ مِنْ دُونِهَا سِتْرًا
19:4	10	walam	and not	 وَاشْتَعَلَ الرَّأْسُ شَيْبًا وَلَمْ أَكُنْ بِدُعَائِكَ رَبِّ شَقِيًّا
19:7	7	lam	not	 يَا زَكَرِيَّا إِنَّا نُبَشِّرُكَ بِغُلَامٍ اسْمُهُ يَحْيَىٰ لَمْ نَجْعَلْ لَهُ مِنْ قَبْلُ سَمِيًّا
19:9	12	walam	while not	 وَقَدْ خَلَقْتُكَ مِنْ قَبْلُ وَلَمْ تَكُ شَيْئًا
19:14	3	walam	and not	 وَبَرًّا بِوَالِدَيْهِ وَلَمْ يَكُنْ جَبَّارًا عَصِيًّا
19:20	6	walam	when not	 قَالَتْ أَنَّىٰ يَكُونُ لِي غُلَامٌ وَلَمْ يَمْسَسْنِي بَشَرٌ
19:20	9	walam	and not	 قَالَتْ أَنَّىٰ يَكُونُ لِي غُلَامٌ وَلَمْ يَمْسَسْنِي بَشَرٌ وَلَمْ أَكُ بَغِيًّا
19:32	3	walam	and not	 وَبَرًّا بِوَالِدَتِي وَلَمْ يَجْعَلْنِي جَبَّارًا شَقِيًّا
19:43	8	lam	not	 يَا أَبَتِ إِنِّي قَدْ جَاءَنِي مِنَ الْعِلْمِ مَا لَمْ يَأْتِكَ
19:46	8	lam	not	 أَرَاغِبٌ أَنْتَ عَنْ آلِهَتِي يَا إِبْرَاهِيمُ لَئِنْ لَمْ تَنْتَهِ لَأَرْجُمَنَّكَ
19:67	8	walam	while not	 أَوَلَا يَذْكُرُ الْإِنْسَانُ أَنَّا خَلَقْنَاهُ مِنْ قَبْلُ وَلَمْ يَكُ شَيْئًا
19:83	1	alam	Do not	 أَلَمْ تَرَ أَنَّا أَرْسَلْنَا الشَّيَاطِينَ عَلَى الْكَافِرِينَ تَؤُزُّهُمْ أَزًّا
20:86	9	alam	Did not	 قَالَ يَا قَوْمِ أَلَمْ يَعِدْكُمْ رَبُّكُمْ وَعْدًا حَسَنًا
20:94	16	walam	and not	 إِنِّي خَشِيتُ أَنْ تَقُولَ فَرَّقْتَ بَيْنَ بَنِي إِسْرَائِيلَ وَلَمْ تَرْقُبْ قَوْلِي
20:96	4	lam	not	 قَالَ بَصُرْتُ بِمَا لَمْ يَبْصُرُوا بِهِ
20:115	8	walam	and not	 وَلَقَدْ عَهِدْنَا إِلَىٰ آدَمَ مِنْ قَبْلُ فَنَسِيَ وَلَمْ نَجِدْ لَهُ عَزْمًا
20:127	5	walam	and not	 وَكَذَٰلِكَ نَجْزِي مَنْ أَسْرَفَ وَلَمْ يُؤْمِنْ بِآيَاتِ رَبِّهِ
20:128	1	afalam	Then has not	 أَفَلَمْ يَهْدِ لَهُمْ كَمْ أَهْلَكْنَا قَبْلَهُمْ مِنَ الْقُرُونِ يَمْشُونَ فِي مَسَاكِنِهِمْ
20:133	7	awalam	Has not	 وَقَالُوا لَوْلَا يَأْتِينَا بِآيَةٍ مِنْ رَبِّهِ أَوَلَمْ تَأْتِهِمْ بَيِّنَةُ
21:30	1	awalam	Do not	 أَوَلَمْ يَرَ الَّذِينَ كَفَرُوا أَنَّ السَّمَاوَاتِ وَالْأَرْضَ كَانَتَا رَتْقًا فَفَتَقْنَاهُمَا
22:18	1	alam	Do not	 أَلَمْ تَرَ أَنَّ اللَّهَ يَسْجُدُ لَهُ مَنْ فِي السَّمَاوَاتِ وَمَنْ فِي الْأَرْضِ وَالشَّمْسُ وَالْقَمَرُ
22:46	1	afalam	So have not	 أَفَلَمْ يَسِيرُوا فِي الْأَرْضِ فَتَكُونَ لَهُمْ قُلُوبٌ يَعْقِلُونَ بِهَا
22:63	1	alam	Do not	 أَلَمْ تَرَ أَنَّ اللَّهَ أَنْزَلَ مِنَ السَّمَاءِ مَاءً فَتُصْبِحُ الْأَرْضُ مُخْضَرَّةً
22:65	1	alam	Do not	 أَلَمْ تَرَ أَنَّ اللَّهَ سَخَّرَ لَكُمْ مَا فِي الْأَرْضِ وَالْفُلْكَ تَجْرِي فِي الْبَحْرِ بِأَمْرِهِ
22:70	1	alam	Do not	 أَلَمْ تَعْلَمْ أَنَّ اللَّهَ يَعْلَمُ مَا فِي السَّمَاءِ وَالْأَرْضِ
22:71	6	lam	not	 وَيَعْبُدُونَ مِنْ دُونِ اللَّهِ مَا لَمْ يُنَزِّلْ بِهِ سُلْطَانًا
23:68	1	afalam	Then, do not	 أَفَلَمْ يَدَّبَّرُوا الْقَوْلَ أَمْ جَاءَهُمْ مَا لَمْ يَأْتِ آبَاءَهُمُ الْأَوَّلِينَ
23:68	7	lam	not	 أَفَلَمْ يَدَّبَّرُوا الْقَوْلَ أَمْ جَاءَهُمْ مَا لَمْ يَأْتِ آبَاءَهُمُ الْأَوَّلِينَ
23:69	2	lam	(do) not	 أَمْ لَمْ يَعْرِفُوا رَسُولَهُمْ فَهُمْ لَهُ مُنْكِرُونَ
23:105	1	alam	Were not	 أَلَمْ تَكُنْ آيَاتِي تُتْلَىٰ عَلَيْكُمْ فَكُنْتُمْ بِهَا تُكَذِّبُونَ
24:4	5	lam	not	 وَالَّذِينَ يَرْمُونَ الْمُحْصَنَاتِ ثُمَّ لَمْ يَأْتُوا بِأَرْبَعَةِ شُهَدَاءَ فَاجْلِدُوهُمْ
24:6	4	walam	and not	 وَالَّذِينَ يَرْمُونَ أَزْوَاجَهُمْ وَلَمْ يَكُنْ لَهُمْ شُهَدَاءُ إِلَّا أَنْفُسُهُمْ فَشَهَادَةُ أَحَدِهِمْ أَرْبَعُ شَهَادَاتٍ بِاللَّهِ إِنَّهُ لَمِنَ الصَّادِقِينَ
24:13	7	lam	not	 فَإِذْ لَمْ يَأْتُوا بِالشُّهَدَاءِ فَأُولَٰئِكَ عِنْدَ اللَّهِ هُمُ الْكَاذِبُونَ
24:28	2	lam	not	 فَإِنْ لَمْ تَجِدُوا فِيهَا أَحَدًا فَلَا تَدْخُلُوهَا حَتَّىٰ يُؤْذَنَ لَكُمْ
24:31	58	lam	(are) not	 أَوِ الطِّفْلِ الَّذِينَ لَمْ يَظْهَرُوا عَلَىٰ عَوْرَاتِ النِّسَاءِ
24:35	30	lam	not	 يَكَادُ زَيْتُهَا يُضِيءُ وَلَوْ لَمْ تَمْسَسْهُ نَارٌ
24:39	12	lam	not	 حَتَّىٰ إِذَا جَاءَهُ لَمْ يَجِدْهُ شَيْئًا وَوَجَدَ اللَّهَ عِنْدَهُ فَوَفَّاهُ حِسَابَهُ
24:40	21	lam	hardly	 ظُلُمَاتٌ بَعْضُهَا فَوْقَ بَعْضٍ إِذَا أَخْرَجَ يَدَهُ لَمْ يَكَدْ يَرَاهَا
24:40	25	lam	not	 وَمَنْ لَمْ يَجْعَلِ اللَّهُ لَهُ نُورًا فَمَا لَهُ مِنْ نُورٍ
24:41	1	alam	Do not	 أَلَمْ تَرَ أَنَّ اللَّهَ يُسَبِّحُ لَهُ مَنْ فِي السَّمَاوَاتِ وَالْأَرْضِ وَالطَّيْرُ صَافَّاتٍ
24:43	1	alam	Do not	 أَلَمْ تَرَ أَنَّ اللَّهَ يُزْجِي سَحَابًا ثُمَّ يُؤَلِّفُ بَيْنَهُ ثُمَّ يَجْعَلُهُ رُكَامًا
24:58	9	lam	(have) not	 لِيَسْتَأْذِنْكُمُ الَّذِينَ مَلَكَتْ أَيْمَانُكُمْ وَالَّذِينَ لَمْ يَبْلُغُوا الْحُلُمَ مِنْكُمْ ثَلَاثَ مَرَّاتٍ
24:62	13	lam	not	 وَإِذَا كَانُوا مَعَهُ عَلَىٰ أَمْرٍ جَامِعٍ لَمْ يَذْهَبُوا حَتَّىٰ يَسْتَأْذِنُوهُ
25:2	6	walam	and not	 الَّذِي لَهُ مُلْكُ السَّمَاوَاتِ وَالْأَرْضِ وَلَمْ يَتَّخِذْ وَلَدًا
25:2	9	walam	and not	 وَلَمْ يَتَّخِذْ وَلَدًا وَلَمْ يَكُنْ لَهُ شَرِيكٌ فِي الْمُلْكِ
25:28	3	lam	not	 يَا وَيْلَتَىٰ لَيْتَنِي لَمْ أَتَّخِذْ فُلَانًا خَلِيلًا
25:40	9	afalam	Then do not	 أَفَلَمْ يَكُونُوا يَرَوْنَهَا بَلْ كَانُوا لَا يَرْجُونَ نُشُورًا
25:45	1	alam	Do you not	 أَلَمْ تَرَ إِلَىٰ رَبِّكَ كَيْفَ مَدَّ الظِّلَّ وَلَوْ شَاءَ لَجَعَلَهُ سَاكِنًا
25:67	4	lam	(are) not extravagant	 وَالَّذِينَ إِذَا أَنْفَقُوا لَمْ يُسْرِفُوا وَلَمْ يَقْتُرُوا
25:67	6	walam	and are not stingy	 وَالَّذِينَ إِذَا أَنْفَقُوا لَمْ يُسْرِفُوا وَلَمْ يَقْتُرُوا
25:73	6	lam	(do) not	 وَالَّذِينَ إِذَا ذُكِّرُوا بِآيَاتِ رَبِّهِمْ لَمْ يَخِرُّوا عَلَيْهَا صُمًّا وَعُمْيَانًا
26:7	1	awalam	Do not	 أَوَلَمْ يَرَوْا إِلَى الْأَرْضِ كَمْ أَنْبَتْنَا فِيهَا مِنْ كُلِّ زَوْجٍ كَرِيمٍ
26:18	2	alam	Did not	 قَالَ أَلَمْ نُرَبِّكَ فِينَا وَلِيدًا وَلَبِثْتَ فِينَا مِنْ عُمُرِكَ سِنِينَ
26:116	3	lam	not	 قَالُوا لَئِنْ لَمْ تَنْتَهِ يَا نُوحُ لَتَكُونَنَّ مِنَ الْمَرْجُومِينَ
26:136	6	lam	not	 قَالُوا سَوَاءٌ عَلَيْنَا أَوَعَظْتَ أَمْ لَمْ تَكُنْ مِنَ الْوَاعِظِينَ
26:167	3	lam	not	 قَالُوا لَئِنْ لَمْ تَنْتَهِ يَا لُوطُ لَتَكُونَنَّ مِنَ الْمُخْرَجِينَ
26:197	1	awalam	Is it not	 أَوَلَمْ يَكُنْ لَهُمْ آيَةً أَنْ يَعْلَمَهُ عُلَمَاءُ بَنِي إِسْرَائِيلَ
26:225	1	alam	Do not	 أَلَمْ تَرَ أَنَّهُمْ فِي كُلِّ وَادٍ يَهِيمُونَ
27:10	10	walam	and (did) not	 فَلَمَّا رَآهَا تَهْتَزُّ كَأَنَّهَا جَانٌّ وَلَّىٰ مُدْبِرًا وَلَمْ يُعَقِّبْ
27:22	7	lam	not	 أَحَطْتُ بِمَا لَمْ تُحِطْ بِهِ وَجِئْتُكَ مِنْ سَبَإٍ بِنَبَإٍ يَقِينٍ
27:84	7	walam	while not	 حَتَّىٰ إِذَا جَاءُوا قَالَ أَكَذَّبْتُمْ بِآيَاتِي وَلَمْ تُحِيطُوا بِهَا عِلْمًا
27:86	1	alam	Do not	 أَلَمْ يَرَوْا أَنَّا جَعَلْنَا اللَّيْلَ لِيَسْكُنُوا فِيهِ وَالنَّهَارَ مُبْصِرًا
28:31	11	walam	and (did) not	 فَلَمَّا رَآهَا تَهْتَزُّ كَأَنَّهَا جَانٌّ وَلَّىٰ مُدْبِرًا وَلَمْ يُعَقِّبْ
28:48	13	awalam	Did not	 فَلَمَّا جَاءَهُمُ الْحَقُّ مِنْ عِنْدِنَا قَالُوا لَوْلَا أُوتِيَ مِثْلَ مَا أُوتِيَ مُوسَىٰ أَوَلَمْ يَكْفُرُوا بِمَا أُوتِيَ مُوسَىٰ
28:50	2	lam	not	 فَإِنْ لَمْ يَسْتَجِيبُوا لَكَ فَاعْلَمْ أَنَّمَا يَتَّبِعُونَ أَهْوَاءَهُمْ
28:57	9	awalam	Have not	 أَوَلَمْ نُمَكِّنْ لَهُمْ حَرَمًا آمِنًا يُجْبَىٰ إِلَيْهِ ثَمَرَاتُ كُلِّ شَيْءٍ
28:58	9	lam	not	 فَتِلْكَ مَسَاكِنُهُمْ لَمْ تُسْكَنْ مِنْ بَعْدِهِمْ إِلَّا قَلِيلًا
28:64	5	falam	but not	 وَقِيلَ ادْعُوا شُرَكَاءَكُمْ فَدَعَوْهُمْ فَلَمْ يَسْتَجِيبُوا لَهُمْ
28:78	7	awalam	Did not	 أَوَلَمْ يَعْلَمْ أَنَّ اللَّهَ قَدْ أَهْلَكَ مِنْ قَبْلِهِ مِنَ الْقُرُونِ مَنْ هُوَ أَشَدُّ مِنْهُ قُوَّةً وَأَكْثَرُ جَمْعًا
29:19	1	awalam	Do not	 أَوَلَمْ يَرَوْا كَيْفَ يُبْدِئُ اللَّهُ الْخَلْقَ ثُمَّ يُعِيدُهُ
29:51	1	awalam	And is (it) not	 أَوَلَمْ يَكْفِهِمْ أَنَّا أَنْزَلْنَا عَلَيْكَ الْكِتَابَ يُتْلَىٰ عَلَيْهِمْ
29:67	1	awalam	Do not	 أَوَلَمْ يَرَوْا أَنَّا جَعَلْنَا حَرَمًا آمِنًا وَيُتَخَطَّفُ النَّاسُ مِنْ حَوْلِهِمْ
30:8	1	awalam	Do not	 أَوَلَمْ يَتَفَكَّرُوا فِي أَنْفُسِهِمْ
30:9	1	awalam	Have not	 أَوَلَمْ يَسِيرُوا فِي الْأَرْضِ فَيَنْظُرُوا كَيْفَ كَانَ عَاقِبَةُ الَّذِينَ مِنْ قَبْلِهِمْ كَانُوا أَشَدَّ مِنْهُمْ قُوَّةً
30:13	1	walam	And not	 وَلَمْ يَكُنْ لَهُمْ مِنْ شُرَكَائِهِمْ شُفَعَاءُ وَكَانُوا بِشُرَكَائِهِمْ كَافِرِينَ
30:37	1	awalam	Do not	 أَوَلَمْ يَرَوْا أَنَّ اللَّهَ يَبْسُطُ الرِّزْقَ لِمَنْ يَشَاءُ وَيَقْدِرُ
31:7	8	lam	not	 وَإِذَا تُتْلَىٰ عَلَيْهِ آيَاتُنَا وَلَّىٰ مُسْتَكْبِرًا كَأَنْ لَمْ يَسْمَعْهَا
31:20	1	alam	Do not	 أَلَمْ تَرَوْا أَنَّ اللَّهَ سَخَّرَ لَكُمْ مَا فِي السَّمَاوَاتِ وَمَا فِي الْأَرْضِ
31:29	1	alam	Do not	 أَلَمْ تَرَ أَنَّ اللَّهَ يُولِجُ اللَّيْلَ فِي النَّهَارِ وَيُولِجُ النَّهَارَ فِي اللَّيْلِ
31:31	1	alam	Do not	 أَلَمْ تَرَ أَنَّ الْفُلْكَ تَجْرِي فِي الْبَحْرِ بِنِعْمَتِ اللَّهِ لِيُرِيَكُمْ مِنْ آيَاتِهِ
32:26	1	awalam	Does it not	 أَوَلَمْ يَهْدِ لَهُمْ كَمْ أَهْلَكْنَا مِنْ قَبْلِهِمْ مِنَ الْقُرُونِ
32:27	1	awalam	Do not	 أَوَلَمْ يَرَوْا أَنَّا نَسُوقُ الْمَاءَ إِلَى الْأَرْضِ الْجُرُزِ
33:5	8	lam	not	 فَإِنْ لَمْ تَعْلَمُوا آبَاءَهُمْ فَإِخْوَانُكُمْ فِي الدِّينِ وَمَوَالِيكُمْ
33:9	15	lam	not	 إِذْ جَاءَتْكُمْ جُنُودٌ فَأَرْسَلْنَا عَلَيْهِمْ رِيحًا وَجُنُودًا لَمْ تَرَوْهَا
33:19	26	lam	not	 أُولَٰئِكَ لَمْ يُؤْمِنُوا فَأَحْبَطَ اللَّهُ أَعْمَالَهُمْ
33:20	3	lam	(have) not	 يَحْسَبُونَ الْأَحْزَابَ لَمْ يَذْهَبُوا
33:25	6	lam	not	 وَرَدَّ اللَّهُ الَّذِينَ كَفَرُوا بِغَيْظِهِمْ لَمْ يَنَالُوا خَيْرًا
33:27	6	lam	not	 وَأَوْرَثَكُمْ أَرْضَهُمْ وَدِيَارَهُمْ وَأَمْوَالَهُمْ وَأَرْضًا لَمْ تَطَئُوهَا
33:60	2	lam	(do) not	 لَئِنْ لَمْ يَنْتَهِ الْمُنَافِقُونَ وَالَّذِينَ فِي قُلُوبِهِمْ مَرَضٌ وَالْمُرْجِفُونَ فِي الْمَدِينَةِ لَنُغْرِيَنَّكَ بِهِمْ
34:9	1	afalam	Then, do not	 أَفَلَمْ يَرَوْا إِلَىٰ مَا بَيْنَ أَيْدِيهِمْ وَمَا خَلْفَهُمْ مِنَ السَّمَاءِ وَالْأَرْضِ
35:27	1	alam	Do not	 أَلَمْ تَرَ أَنَّ اللَّهَ أَنْزَلَ مِنَ السَّمَاءِ مَاءً فَأَخْرَجْنَا بِهِ ثَمَرَاتٍ مُخْتَلِفًا أَلْوَانُهَا
35:37	12	awalam	Did not	 أَوَلَمْ نُعَمِّرْكُمْ مَا يَتَذَكَّرُ فِيهِ مَنْ تَذَكَّرَ وَجَاءَكُمُ النَّذِيرُ
35:44	1	awalam	Have they not	 أَوَلَمْ يَسِيرُوا فِي الْأَرْضِ فَيَنْظُرُوا كَيْفَ كَانَ عَاقِبَةُ الَّذِينَ مِنْ قَبْلِهِمْ وَكَانُوا أَشَدَّ مِنْهُمْ قُوَّةً
36:10	5	lam	(do) not	 وَسَوَاءٌ عَلَيْهِمْ أَأَنْذَرْتَهُمْ أَمْ لَمْ تُنْذِرْهُمْ لَا يُؤْمِنُونَ
36:18	6	lam	not	 قَالُوا إِنَّا تَطَيَّرْنَا بِكُمْ لَئِنْ لَمْ تَنْتَهُوا لَنَرْجُمَنَّكُمْ
36:31	1	alam	Do not	 أَلَمْ يَرَوْا كَمْ أَهْلَكْنَا قَبْلَهُمْ مِنَ الْقُرُونِ أَنَّهُمْ إِلَيْهِمْ لَا يَرْجِعُونَ
36:60	1	alam	Did not	 أَلَمْ أَعْهَدْ إِلَيْكُمْ يَا بَنِي آدَمَ أَنْ لَا تَعْبُدُوا الشَّيْطَانَ
36:62	6	afalam	Then did not	 وَلَقَدْ أَضَلَّ مِنْكُمْ جِبِلًّا كَثِيرًا أَفَلَمْ تَكُونُوا تَعْقِلُونَ
36:71	1	awalam	Do not	 أَوَلَمْ يَرَوْا أَنَّا خَلَقْنَا لَهُمْ مِمَّا عَمِلَتْ أَيْدِينَا أَنْعَامًا
36:77	1	awalam	Does not	 أَوَلَمْ يَرَ الْإِنْسَانُ أَنَّا خَلَقْنَاهُ مِنْ نُطْفَةٍ فَإِذَا هُوَ خَصِيمٌ مُبِينٌ
37:29	3	lam	not	 قَالُوا بَلْ لَمْ تَكُونُوا مُؤْمِنِينَ
38:8	13	lammā	not yet	 بَلْ هُمْ فِي شَكٍّ مِنْ ذِكْرِي بَلْ لَمَّا يَذُوقُوا عَذَابِ
39:21	1	alam	Do not	 أَلَمْ تَرَ أَنَّ اللَّهَ أَنْزَلَ مِنَ السَّمَاءِ مَاءً فَسَلَكَهُ يَنَابِيعَ فِي الْأَرْضِ
39:42	7	lam	(does) not	 اللَّهُ يَتَوَفَّى الْأَنْفُسَ حِينَ مَوْتِهَا وَالَّتِي لَمْ تَمُتْ فِي مَنَامِهَا
39:47	23	lam	not	 وَبَدَا لَهُمْ مِنَ اللَّهِ مَا لَمْ يَكُونُوا يَحْتَسِبُونَ
39:52	1	awalam	Do not	 أَوَلَمْ يَعْلَمُوا أَنَّ اللَّهَ يَبْسُطُ الرِّزْقَ لِمَنْ يَشَاءُ وَيَقْدِرُ
39:71	15	alam	Did not	 وَقَالَ لَهُمْ خَزَنَتُهَا أَلَمْ يَأْتِكُمْ رُسُلٌ مِنْكُمْ
40:21	1	awalam	Do not	 أَوَلَمْ يَسِيرُوا فِي الْأَرْضِ فَيَنْظُرُوا كَيْفَ كَانَ عَاقِبَةُ الَّذِينَ كَانُوا مِنْ قَبْلِهِمْ كَانُوا هُمْ أَشَدَّ مِنْهُمْ قُوَّةً
40:50	2	awalam	Did there not	 قَالُوا أَوَلَمْ تَكُ تَأْتِيكُمْ رُسُلُكُمْ بِالْبَيِّنَاتِ
40:69	1	alam	Do not	 أَلَمْ تَرَ إِلَى الَّذِينَ يُجَادِلُونَ فِي آيَاتِ اللَّهِ أَنَّىٰ يُصْرَفُونَ
40:74	8	lam	Not	 قَالُوا ضَلُّوا عَنَّا بَلْ لَمْ نَكُنْ نَدْعُو مِنْ قَبْلُ شَيْئًا
40:78	12	lam	not	 مِنْهُمْ مَنْ قَصَصْنَا عَلَيْكَ وَمِنْهُمْ مَنْ لَمْ نَقْصُصْ عَلَيْكَ
40:82	1	afalam	Do they not	 أَفَلَمْ يَسِيرُوا فِي الْأَرْضِ فَيَنْظُرُوا كَيْفَ كَانَ عَاقِبَةُ الَّذِينَ مِنْ قَبْلِهِمْ كَانُوا أَكْثَرَ مِنْهُمْ
40:85	1	falam	But did not	 فَلَمْ يَكُ يَنْفَعُهُمْ إِيمَانُهُمْ لَمَّا رَأَوْا بَأْسَنَا
41:15	13	awalam	Do not	 أَوَلَمْ يَرَوْا أَنَّ اللَّهَ الَّذِي خَلَقَهُمْ هُوَ أَشَدُّ مِنْهُمْ قُوَّةً
41:53	12	awalam	Is (it) not	 أَوَلَمْ يَكْفِ بِرَبِّكَ أَنَّهُ عَلَىٰ كُلِّ شَيْءٍ شَهِيدٌ
42:21	9	lam	not	 أَمْ لَهُمْ شُرَكَاءُ شَرَعُوا لَهُمْ مِنَ الدِّينِ مَا لَمْ يَأْذَنْ بِهِ اللَّهُ
44:21	2	lam	not	 وَإِنْ لَمْ تُؤْمِنُوا لِي فَاعْتَزِلُونِ
45:8	10	lam	not	 يَسْمَعُ آيَاتِ اللَّهِ تُتْلَىٰ عَلَيْهِ ثُمَّ يُصِرُّ مُسْتَكْبِرًا كَأَنْ لَمْ يَسْمَعْهَا
45:31	4	afalam	Then were not	 وَأَمَّا الَّذِينَ كَفَرُوا أَفَلَمْ تَكُنْ آيَاتِي تُتْلَىٰ عَلَيْكُمْ
46:11	13	lam	not	 وَإِذْ لَمْ يَهْتَدُوا بِهِ فَسَيَقُولُونَ هَٰذَا إِفْكٌ قَدِيمٌ
46:33	1	awalam	Do not	 أَوَلَمْ يَرَوْا أَنَّ اللَّهَ الَّذِي خَلَقَ السَّمَاوَاتِ وَالْأَرْضَ وَلَمْ يَعْيَ بِخَلْقِهِنَّ بِقَادِرٍ عَلَىٰ أَنْ يُحْيِيَ الْمَوْتَىٰ
46:33	9	walam	and (was) not	 أَوَلَمْ يَرَوْا أَنَّ اللَّهَ الَّذِي خَلَقَ السَّمَاوَاتِ وَالْأَرْضَ وَلَمْ يَعْيَ
46:35	16	lam	not	 كَأَنَّهُمْ يَوْمَ يَرَوْنَ مَا يُوعَدُونَ لَمْ يَلْبَثُوا إِلَّا سَاعَةً مِنْ نَهَارٍ
47:10	1	afalam	Do not	 أَفَلَمْ يَسِيرُوا فِي الْأَرْضِ فَيَنْظُرُوا كَيْفَ كَانَ عَاقِبَةُ الَّذِينَ مِنْ قَبْلِهِمْ دَمَّرَ اللَّهُ عَلَيْهِمْ
47:15	15	lam	not	 فِيهَا أَنْهَارٌ مِنْ مَاءٍ غَيْرِ آسِنٍ وَأَنْهَارٌ مِنْ لَبَنٍ لَمْ يَتَغَيَّرْ طَعْمُهُ
48:13	2	lam	(has) not believed	 وَمَنْ لَمْ يُؤْمِنْ بِاللَّهِ وَرَسُولِهِ فَإِنَّا أَعْتَدْنَا لِلْكَافِرِينَ سَعِيرًا
48:21	2	lam	not	 وَأُخْرَىٰ لَمْ تَقْدِرُوا عَلَيْهَا قَدْ أَحَاطَ اللَّهُ بِهَا
48:25	18	lam	not	 وَلَوْلَا رِجَالٌ مُؤْمِنُونَ وَنِسَاءٌ مُؤْمِنَاتٌ لَمْ تَعْلَمُوهُمْ أَنْ تَطَئُوهُمْ
48:27	21	lam	not	 فَعَلِمَ مَا لَمْ تَعْلَمُوا فَجَعَلَ مِنْ دُونِ ذَٰلِكَ فَتْحًا قَرِيبًا
49:11	35	lam	(does) not	 وَمَنْ لَمْ يَتُبْ فَأُولَٰئِكَ هُمُ الظَّالِمُونَ
49:14	5	lam	Not	 قَالَتِ الْأَعْرَابُ آمَنَّا قُلْ لَمْ تُؤْمِنُوا
49:14	10	walammā	and has not yet	 وَلَٰكِنْ قُولُوا أَسْلَمْنَا وَلَمَّا يَدْخُلِ الْإِيمَانُ فِي قُلُوبِكُمْ
49:15	8	lam	(do) not	 إِنَّمَا الْمُؤْمِنُونَ الَّذِينَ آمَنُوا بِاللَّهِ وَرَسُولِهِ ثُمَّ لَمْ يَرْتَابُوا
50:6	1	afalam	Then do not	 أَفَلَمْ يَنْظُرُوا إِلَى السَّمَاءِ فَوْقَهُمْ كَيْفَ بَنَيْنَاهَا وَزَيَّنَّاهَا
53:29	7	walam	and not	 فَأَعْرِضْ عَنْ مَنْ تَوَلَّىٰ عَنْ ذِكْرِنَا وَلَمْ يُرِدْ إِلَّا الْحَيَاةَ الدُّنْيَا
53:36	2	lam	not	 أَمْ لَمْ يُنَبَّأْ بِمَا فِي صُحُفِ مُوسَىٰ
55:56	4	lam	not	 فِيهِنَّ قَاصِرَاتُ الطَّرْفِ لَمْ يَطْمِثْهُنَّ إِنْسٌ قَبْلَهُمْ وَلَا جَانٌّ
55:74	1	lam	Not	 لَمْ يَطْمِثْهُنَّ إِنْسٌ قَبْلَهُمْ وَلَا جَانٌّ
57:14	2	alam	Were not	 يُنَادُونَهُمْ أَلَمْ نَكُنْ مَعَكُمْ قَالُوا بَلَىٰ
57:16	1	alam	Has not	 أَلَمْ يَأْنِ لِلَّذِينَ آمَنُوا أَنْ تَخْشَعَ قُلُوبُهُمْ لِذِكْرِ اللَّهِ
58:4	2	lam	(does) not	 فَمَنْ لَمْ يَجِدْ فَصِيَامُ شَهْرَيْنِ مُتَتَابِعَيْنِ مِنْ قَبْلِ أَنْ يَتَمَاسَّا
58:4	12	lam	not	 فَمَنْ لَمْ يَسْتَطِعْ فَإِطْعَامُ سِتِّينَ مِسْكِينًا
58:7	1	alam	Do not	 أَلَمْ تَرَ أَنَّ اللَّهَ يَعْلَمُ مَا فِي السَّمَاوَاتِ وَمَا فِي الْأَرْضِ
58:8	1	alam	Do not	 أَلَمْ تَرَ إِلَى الَّذِينَ نُهُوا عَنِ النَّجْوَىٰ ثُمَّ يَعُودُونَ لِمَا نُهُوا عَنْهُ
58:8	22	lam	not	 وَإِذَا جَاءُوكَ حَيَّوْكَ بِمَا لَمْ يُحَيِّكَ بِهِ اللَّهُ
58:12	17	lam	not	 ذَٰلِكَ خَيْرٌ لَكُمْ وَأَطْهَرُ فَإِنْ لَمْ تَجِدُوا فَإِنَّ اللَّهَ غَفُورٌ رَحِيمٌ
