surah:ayah	position	word	meaning	ayah_link
2:6	8	lam	not	 سَوَاءٌ عَلَيْهِمْ أَأَنْذَرْتَهُمْ أَمْ لَمْ تُنْذِرْهُمْ لَا يُؤْمِنُونَ
2:24	2	lam	not	 فَإِنْ لَمْ تَفْعَلُوا
2:33	9	alam	Did not	 قَالَ أَلَمْ أَقُلْ لَكُمْ إِنِّي أَعْلَمُ غَيْبَ السَّمَاوَاتِ وَالْأَرْضِ
2:106	12	alam	Do not	 أَلَمْ تَعْلَمْ أَنَّ اللَّهَ عَلَىٰ كُلِّ شَيْءٍ قَدِيرٌ
2:107	1	alam	Do not	 أَلَمْ تَعْلَمْ أَنَّ اللَّهَ لَهُ مُلْكُ السَّمَاوَاتِ وَالْأَرْضِ
2:151	15	lam	not	 وَيُعَلِّمُكُمْ مَا لَمْ تَكُونُوا تَعْلَمُونَ
2:196	46	lam	(can) not	 فَمَنْ لَمْ يَجِدْ فَصِيَامُ ثَلَاثَةِ أَيَّامٍ فِي الْحَجِّ وَسَبْعَةٍ إِذَا رَجَعْتُمْ
2:196	61	lam	not	 ذَٰلِكَ لِمَنْ لَمْ يَكُنْ أَهْلُهُ حَاضِرِي الْمَسْجِدِ الْحَرَامِ
2:236	8	lam	not	 لَا جُنَاحَ عَلَيْكُمْ إِنْ طَلَّقْتُمُ النِّسَاءَ مَا لَمْ تَمَسُّوهُنَّ
2:239	13	lam	not	 فَإِذَا أَمِنْتُمْ فَاذْكُرُوا اللَّهَ كَمَا عَلَّمَكُمْ مَا لَمْ تَكُونُوا تَعْلَمُونَ
2:243	1	alam	Did not	 أَلَمْ تَرَ إِلَى الَّذِينَ خَرَجُوا مِنْ دِيَارِهِمْ وَهُمْ أُلُوفٌ حَذَرَ الْمَوْتِ
2:246	1	alam	Did not	 أَلَمْ تَرَ إِلَى الْمَلَإِ مِنْ بَنِي إِسْرَائِيلَ مِنْ بَعْدِ مُوسَىٰ
2:247	21	walam	and not	 وَنَحْنُ أَحَقُّ بِالْمُلْكِ مِنْهُ وَلَمْ يُؤْتَ سَعَةً مِنَ الْمَالِ
2:249	16	lam	(does) not	 فَمَنْ شَرِبَ مِنْهُ فَلَيْسَ مِنِّي وَمَنْ لَمْ يَطْعَمْهُ فَإِنَّهُ مِنِّي
2:258	1	alam	Did not	 أَلَمْ تَرَ إِلَى الَّذِي حَاجَّ إِبْرَاهِيمَ فِي رَبِّهِ أَنْ آتَاهُ اللَّهُ الْمُلْكَ
2:259	41	lam	(they did) not	 فَانْظُرْ إِلَىٰ طَعَامِكَ وَشَرَابِكَ لَمْ يَتَسَنَّهْ
2:260	10	awalam	Have not	 قَالَ أَوَلَمْ تُؤْمِنْ
2:265	20	lam	(does) not	 فَإِنْ لَمْ يُصِبْهَا وَابِلٌ فَطَلٌّ
2:279	2	lam	not	 فَإِنْ لَمْ تَفْعَلُوا فَأْذَنُوا بِحَرْبٍ مِنَ اللَّهِ وَرَسُولِهِ
2:282	57	lam	not	 فَإِنْ لَمْ يَكُونَا رَجُلَيْنِ فَرَجُلٌ وَامْرَأَتَانِ
2:283	5	walam	and not	 وَإِنْ كُنْتُمْ عَلَىٰ سَفَرٍ وَلَمْ تَجِدُوا كَاتِبًا فَرِهَانٌ مَقْبُوضَةٌ
3:23	1	alam	Have not	 أَلَمْ تَرَ إِلَى الَّذِينَ أُوتُوا نَصِيبًا مِنَ الْكِتَابِ يُدْعَوْنَ إِلَىٰ كِتَابِ اللَّهِ
3:47	7	walam	and (has) not	 قَالَتْ رَبِّ أَنَّىٰ يَكُونُ لِي وَلَدٌ وَلَمْ يَمْسَسْنِي بَشَرٌ
3:135	17	walam	And not	 وَلَمْ يُصِرُّوا عَلَىٰ مَا فَعَلُوا وَهُمْ يَعْلَمُونَ
3:151	11	lam	not	 سَنُلْقِي فِي قُلُوبِ الَّذِينَ كَفَرُوا الرُّعْبَ بِمَا أَشْرَكُوا بِاللَّهِ مَا لَمْ يُنَزِّلْ بِهِ سُلْطَانًا
3:170	9	lam	(have) not	 وَيَسْتَبْشِرُونَ بِالَّذِينَ لَمْ يَلْحَقُوا بِهِمْ مِنْ خَلْفِهِمْ
3:174	6	lam	not	 فَانْقَلَبُوا بِنِعْمَةٍ مِنَ اللَّهِ وَفَضْلٍ لَمْ يَمْسَسْهُمْ سُوءٌ
3:188	11	lam	not	 وَيُحِبُّونَ أَنْ يُحْمَدُوا بِمَا لَمْ يَفْعَلُوا فَلَا تَحْسَبَنَّهُمْ بِمَفَازَةٍ مِنَ الْعَذَابِ
4:11	35	lam	not	 فَإِنْ لَمْ يَكُنْ لَهُ وَلَدٌ وَوَرِثَهُ أَبَوَاهُ فَلِأُمِّهِ الثُّلُثُ
4:12	7	lam	not	 وَلَكُمْ نِصْفُ مَا تَرَكَ أَزْوَاجُكُمْ إِنْ لَمْ يَكُنْ لَهُنَّ وَلَدٌ
4:12	31	lam	not	 وَلَهُنَّ الرُّبُعُ مِمَّا تَرَكْتُمْ إِنْ لَمْ يَكُنْ لَكُمْ وَلَدٌ
4:23	30	lam	not	 فَإِنْ لَمْ تَكُونُوا دَخَلْتُمْ بِهِنَّ فَلَا جُنَاحَ عَلَيْكُمْ
4:25	2	lam	(is) not	 وَمَنْ لَمْ يَسْتَطِعْ مِنْكُمْ طَوْلًا أَنْ يَنْكِحَ الْمُحْصَنَاتِ
4:43	35	falam	and not	 أَوْ لَامَسْتُمُ النِّسَاءَ فَلَمْ تَجِدُوا مَاءً فَتَيَمَّمُوا صَعِيدًا طَيِّبًا
4:44	1	alam	Did not	 أَلَمْ تَرَ إِلَى الَّذِينَ أُوتُوا نَصِيبًا مِنَ الْكِتَابِ يَشْتَرُونَ الضَّلَالَةَ
4:49	1	alam	Do not	 أَلَمْ تَرَ إِلَى الَّذِينَ يُزَكُّونَ أَنْفُسَهُمْ بَلِ اللَّهُ يُزَكِّي مَنْ يَشَاءُ
4:51	1	alam	Do not	 أَلَمْ تَرَ إِلَى الَّذِينَ أُوتُوا نَصِيبًا مِنَ الْكِتَابِ يُؤْمِنُونَ بِالْجِبْتِ وَالطَّاغُوتِ
4:60	1	alam	Do not	 أَلَمْ تَرَ إِلَى الَّذِينَ يَزْعُمُونَ أَنَّهُمْ آمَنُوا بِمَا أُنْزِلَ إِلَيْكَ
4:72	14	lam	(that) not	 قَالَ قَدْ أَنْعَمَ اللَّهُ عَلَيَّ إِذْ لَمْ أَكُنْ مَعَهُمْ شَهِيدًا
4:73	8	lam	(had) not	 لَيَقُولَنَّ كَأَنْ لَمْ تَكُنْ بَيْنَكُمْ وَبَيْنَهُ مَوَدَّةٌ يَا لَيْتَنِي كُنْتُ مَعَهُمْ
4:77	1	alam	Have not	 أَلَمْ تَرَ إِلَى الَّذِينَ قِيلَ لَهُمْ كُفُّوا أَيْدِيَكُمْ وَأَقِيمُوا الصَّلَاةَ
4:90	26	falam	and (do) not	 فَإِنِ اعْتَزَلُوكُمْ فَلَمْ يُقَاتِلُوكُمْ وَأَلْقَوْا إِلَيْكُمُ السَّلَمَ
4:91	16	lam	not	 فَإِنْ لَمْ يَعْتَزِلُوكُمْ وَيُلْقُوا إِلَيْكُمُ السَّلَمَ وَيَكُفُّوا أَيْدِيَهُمْ فَخُذُوهُمْ
4:92	49	lam	(does) not	 فَمَنْ لَمْ يَجِدْ فَصِيَامُ شَهْرَيْنِ مُتَتَابِعَيْنِ تَوْبَةً مِنَ اللَّهِ
4:97	16	alam	Not	 قَالُوا أَلَمْ تَكُنْ أَرْضُ اللَّهِ وَاسِعَةً فَتُهَاجِرُوا فِيهَا
4:102	21	lam	(which has) not	 وَلْتَأْتِ طَائِفَةٌ أُخْرَىٰ لَمْ يُصَلُّوا فَلْيُصَلُّوا مَعَكَ
4:113	26	lam	not	 وَأَنْزَلَ اللَّهُ عَلَيْكَ الْكِتَابَ وَالْحِكْمَةَ وَعَلَّمَكَ مَا لَمْ تَكُنْ تَعْلَمُ
4:137	13	lam	not	 ثُمَّ كَفَرُوا ثُمَّ ازْدَادُوا كُفْرًا لَمْ يَكُنِ اللَّهُ لِيَغْفِرَ لَهُمْ
4:141	11	alam	Were not	 فَإِنْ كَانَ لَكُمْ فَتْحٌ مِنَ اللَّهِ قَالُوا أَلَمْ نَكُنْ مَعَكُمْ
4:141	19	alam	Did not	 وَإِنْ كَانَ لِلْكَافِرِينَ نَصِيبٌ قَالُوا أَلَمْ نَسْتَحْوِذْ عَلَيْكُمْ
4:152	5	walam	and not	 وَالَّذِينَ آمَنُوا بِاللَّهِ وَرُسُلِهِ وَلَمْ يُفَرِّقُوا بَيْنَ أَحَدٍ مِنْهُمْ أُولَٰئِكَ سَوْفَ يُؤْتِيهِمْ أُجُورَهُمْ
4:164	8	lam	not	 وَرُسُلًا لَمْ نَقْصُصْهُمْ عَلَيْكَ
4:168	5	lam	not	 إِنَّ الَّذِينَ كَفَرُوا وَظَلَمُوا لَمْ يَكُنِ اللَّهُ لِيَغْفِرَ لَهُمْ
4:176	22	lam	not	 وَهُوَ يَرِثُهَا إِنْ لَمْ يَكُنْ لَهَا وَلَدٌ
5:6	37	falam	and not	 أَوْ لَامَسْتُمُ النِّسَاءَ فَلَمْ تَجِدُوا مَاءً فَتَيَمَّمُوا صَعِيدًا طَيِّبًا
5:20	18	lam	not	 وَجَعَلَكُمْ مُلُوكًا وَآتَاكُمْ مَا لَمْ يُؤْتِ أَحَدًا مِنَ الْعَالَمِينَ
5:27	13	walam	and not	 فَتُقُبِّلَ مِنْ أَحَدِهِمَا وَلَمْ يُتَقَبَّلْ مِنَ الْآخَرِ
5:40	1	alam	Do not	 أَلَمْ تَعْلَمْ أَنَّ اللَّهَ لَهُ مُلْكُ السَّمَاوَاتِ وَالْأَرْضِ
5:41	14	walam	and not	 لَا يَحْزُنْكَ الَّذِينَ يُسَارِعُونَ فِي الْكُفْرِ مِنَ الَّذِينَ قَالُوا آمَنَّا بِأَفْوَاهِهِمْ وَلَمْ تُؤْمِنْ قُلُوبُهُمْ
5:41	25	lam	(who have) not	 سَمَّاعُونَ لِقَوْمٍ آخَرِينَ لَمْ يَأْتُوكَ
5:41	38	lam	not	 يَقُولُونَ إِنْ أُوتِيتُمْ هَٰذَا فَخُذُوهُ وَإِنْ لَمْ تُؤْتَوْهُ فَاحْذَرُوا
5:41	53	lam	never	 أُولَٰئِكَ الَّذِينَ لَمْ يُرِدِ اللَّهُ أَنْ يُطَهِّرَ قُلُوبَهُمْ
5:44	34	lam	(does) not	 وَمَنْ لَمْ يَحْكُمْ بِمَا أَنْزَلَ اللَّهُ فَأُولَٰئِكَ هُمُ الْكَافِرُونَ
5:45	24	lam	(does) not	 وَمَنْ لَمْ يَحْكُمْ بِمَا أَنْزَلَ اللَّهُ فَأُولَٰئِكَ هُمُ الظَّالِمُونَ
5:47	9	lam	(does) not	 وَمَنْ لَمْ يَحْكُمْ بِمَا أَنْزَلَ اللَّهُ فَأُولَٰئِكَ هُمُ الْفَاسِقُونَ
5:67	10	lam	not	 وَإِنْ لَمْ تَفْعَلْ فَمَا بَلَّغْتَ رِسَالَتَهُ
5:73	16	lam	not	 لَمْ يَنْتَهُوا عَمَّا يَقُولُونَ لَيَمَسَّنَّ الَّذِينَ كَفَرُوا مِنْهُمْ عَذَابٌ أَلِيمٌ
5:89	27	lam	(does) not	 فَمَنْ لَمْ يَجِدْ فَصِيَامُ ثَلَاثَةِ أَيَّامٍ ذَٰلِكَ كَفَّارَةُ أَيْمَانِكُمْ إِذَا حَلَفْتُمْ
6:6	1	alam	Did not	 أَلَمْ يَرَوْا كَمْ أَهْلَكْنَا مِنْ قَبْلِهِمْ مِنْ قَرْنٍ
6:6	13	lam	not	 مَكَّنَّاهُمْ فِي الْأَرْضِ مَا لَمْ نُمَكِّنْ لَكُمْ
6:23	2	lam	not	 ثُمَّ لَمْ تَكُنْ فِتْنَتُهُمْ إِلَّا أَنْ قَالُوا وَاللَّهِ رَبِّنَا مَا كُنَّا مُشْرِكِينَ
6:77	12	lam	(does) not	 فَلَمَّا أَفَلَ قَالَ لَئِنْ لَمْ يَهْدِنِي رَبِّي لَأَكُونَنَّ مِنَ الْقَوْمِ الضَّالِّينَ
6:81	11	lam	not	 وَلَا تَخَافُونَ أَنَّكُمْ أَشْرَكْتُمْ بِاللَّهِ مَا لَمْ يُنَزِّلْ بِهِ عَلَيْكُمْ سُلْطَانًا
6:82	3	walam	and (did) not	 الَّذِينَ آمَنُوا وَلَمْ يَلْبِسُوا إِيمَانَهُمْ بِظُلْمٍ أُولَٰئِكَ لَهُمُ الْأَمْنُ
6:91	33	lam	not	 وَعُلِّمْتُمْ مَا لَمْ تَعْلَمُوا أَنْتُمْ وَلَا آبَاؤُكُمْ
6:93	12	walam	while not	 وَمَنْ أَظْلَمُ مِمَّنِ افْتَرَىٰ عَلَى اللَّهِ كَذِبًا أَوْ قَالَ أُوحِيَ إِلَيَّ وَلَمْ يُوحَ إِلَيْهِ شَيْءٌ
6:101	8	walam	while not	 أَنَّىٰ يَكُونُ لَهُ وَلَدٌ وَلَمْ تَكُنْ لَهُ صَاحِبَةٌ وَخَلَقَ كُلَّ شَيْءٍ
6:110	5	lam	not	 وَنُقَلِّبُ أَفْئِدَتَهُمْ وَأَبْصَارَهُمْ كَمَا لَمْ يُؤْمِنُوا بِهِ أَوَّلَ مَرَّةٍ
6:121	4	lam	not	 وَلَا تَأْكُلُوا مِمَّا لَمْ يُذْكَرِ اسْمُ اللَّهِ عَلَيْهِ وَإِنَّهُ لَفِسْقٌ
6:130	4	alam	Did (there) not	 يَا مَعْشَرَ الْجِنِّ وَالْإِنْسِ أَلَمْ يَأْتِكُمْ رُسُلٌ مِنْكُمْ
6:131	3	lam	not	 ذَٰلِكَ أَنْ لَمْ يَكُنْ رَبُّكَ مُهْلِكَ الْقُرَىٰ بِظُلْمٍ وَأَهْلُهَا غَافِلُونَ
6:158	24	lam	not	 لَا يَنْفَعُ نَفْسًا إِيمَانُهَا لَمْ تَكُنْ آمَنَتْ مِنْ قَبْلُ
7:11	13	lam	Not	 فَسَجَدُوا إِلَّا إِبْلِيسَ لَمْ يَكُنْ مِنَ السَّاجِدِينَ
7:22	17	alam	Did not	 وَنَادَاهُمَا رَبُّهُمَا أَلَمْ أَنْهَكُمَا عَنْ تِلْكُمَا الشَّجَرَةِ
7:23	6	lam	not	 قَالَا رَبَّنَا ظَلَمْنَا أَنْفُسَنَا وَإِنْ لَمْ تَغْفِرْ لَنَا وَتَرْحَمْنَا لَنَكُونَنَّ مِنَ الْخَاسِرِينَ
7:33	19	lam	not	 وَأَنْ تُشْرِكُوا بِاللَّهِ مَا لَمْ يُنَزِّلْ بِهِ سُلْطَانًا
7:46	15	lam	Not	 لَمْ يَدْخُلُوهَا وَهُمْ يَطْمَعُونَ
7:87	10	lam	not	 وَطَائِفَةٌ لَمْ يُؤْمِنُوا فَاصْبِرُوا حَتَّىٰ يَحْكُمَ اللَّهُ بَيْنَنَا
7:92	5	lam	not	 الَّذِينَ كَذَّبُوا شُعَيْبًا كَأَنْ لَمْ يَغْنَوْا فِيهَا
7:100	1	awalam	Would it not	 أَوَلَمْ يَهْدِ لِلَّذِينَ يَرِثُونَ الْأَرْضَ مِنْ بَعْدِ أَهْلِهَا أَنْ لَوْ نَشَاءُ أَصَبْنَاهُمْ بِذُنُوبِهِمْ
7:148	12	alam	Did not	 أَلَمْ يَرَوْا أَنَّهُ لَا يُكَلِّمُهُمْ وَلَا يَهْدِيهِمْ سَبِيلًا
7:149	11	lam	not	 قَالُوا لَئِنْ لَمْ يَرْحَمْنَا رَبُّنَا وَيَغْفِرْ لَنَا لَنَكُونَنَّ مِنَ الْخَاسِرِينَ
7:169	19	alam	Was not	 أَلَمْ يُؤْخَذْ عَلَيْهِمْ مِيثَاقُ الْكِتَابِ أَنْ لَا يَقُولُوا عَلَى اللَّهِ إِلَّا الْحَقَّ
7:184	1	awalam	Do not	 أَوَلَمْ يَتَفَكَّرُوا مَا بِصَاحِبِهِمْ مِنْ جِنَّةٍ إِنْ هُوَ إِلَّا نَذِيرٌ مُبِينٌ
7:185	1	awalam	Do not	 أَوَلَمْ يَنْظُرُوا فِي مَلَكُوتِ السَّمَاوَاتِ وَالْأَرْضِ
7:203	2	lam	not	 وَإِذَا لَمْ تَأْتِهِمْ بِآيَةٍ قَالُوا لَوْلَا اجْتَبَيْتَهَا
8:17	1	falam	And not	 فَلَمْ تَقْتُلُوهُمْ وَلَٰكِنَّ اللَّهَ قَتَلَهُمْ
8:53	4	lam	not	 ذَٰلِكَ بِأَنَّ اللَّهَ لَمْ يَكُ مُغَيِّرًا نِعْمَةً أَنْعَمَهَا عَلَىٰ قَوْمٍ
8:72	20	walam	and (did) not	 وَالَّذِينَ آمَنُوا وَلَمْ يُهَاجِرُوا مَا لَكُمْ مِنْ وَلَايَتِهِمْ مِنْ شَيْءٍ
9:4	7	lam	not	 إِلَّا الَّذِينَ عَاهَدْتُمْ مِنَ الْمُشْرِكِينَ ثُمَّ لَمْ يَنْقُصُوكُمْ شَيْئًا
9:4	10	walam	and not	 ثُمَّ لَمْ يَنْقُصُوكُمْ شَيْئًا وَلَمْ يُظَاهِرُوا عَلَيْكُمْ أَحَدًا
9:16	5	walammā	while not	 أَمْ حَسِبْتُمْ أَنْ تُتْرَكُوا وَلَمَّا يَعْلَمِ اللَّهُ الَّذِينَ جَاهَدُوا مِنْكُمْ
9:16	11	walam	and not	 وَلَمْ يَتَّخِذُوا مِنْ دُونِ اللَّهِ وَلَا رَسُولِهِ وَلَا الْمُؤْمِنِينَ وَلِيجَةً
9:18	14	walam	and not	 وَأَقَامَ الصَّلَاةَ وَآتَى الزَّكَاةَ وَلَمْ يَخْشَ إِلَّا اللَّهَ
9:25	12	falam	but not	 وَيَوْمَ حُنَيْنٍ إِذْ أَعْجَبَتْكُمْ كَثْرَتُكُمْ فَلَمْ تُغْنِ عَنْكُمْ شَيْئًا
9:26	11	lam	which you did not see	 وَأَنْزَلَ جُنُودًا لَمْ تَرَوْهَا وَعَذَّبَ الَّذِينَ كَفَرُوا
9:40	30	lam	which you did not see	 فَأَنْزَلَ اللَّهُ سَكِينَتَهُ عَلَيْهِ وَأَيَّدَهُ بِجُنُودٍ لَمْ تَرَوْهَا
9:58	11	lam	not	 فَإِنْ أُعْطُوا مِنْهَا رَضُوا وَإِنْ لَمْ يُعْطَوْا مِنْهَا إِذَا هُمْ يَسْخَطُونَ
9:63	1	alam	Do not	 أَلَمْ يَعْلَمُوا أَنَّهُ مَنْ يُحَادِدِ اللَّهَ وَرَسُولَهُ فَأَنَّ لَهُ نَارَ جَهَنَّمَ خَالِدًا فِيهَا
9:70	1	alam	Has not	 أَلَمْ يَأْتِهِمْ نَبَأُ الَّذِينَ مِنْ قَبْلِهِمْ قَوْمِ نُوحٍ وَعَادٍ وَثَمُودَ
9:74	14	lam	not	 وَكَفَرُوا بَعْدَ إِسْلَامِهِمْ وَهَمُّوا بِمَا لَمْ يَنَالُوا
9:78	1	alam	Do not	 أَلَمْ يَعْلَمُوا أَنَّ اللَّهَ يَعْلَمُ سِرَّهُمْ وَنَجْوَاهُمْ وَأَنَّ اللَّهَ عَلَّامُ الْغُيُوبِ
9:104	1	alam	Do not	 أَلَمْ يَعْلَمُوا أَنَّ اللَّهَ هُوَ يَقْبَلُ التَّوْبَةَ عَنْ عِبَادِهِ
10:12	17	lam	(had) not	 فَلَمَّا كَشَفْنَا عَنْهُ ضُرَّهُ مَرَّ كَأَنْ لَمْ يَدْعُنَا إِلَىٰ ضُرٍّ مَسَّهُ
10:24	36	lam	not	 فَجَعَلْنَاهَا حَصِيدًا كَأَنْ لَمْ تَغْنَ بِالْأَمْسِ
10:39	4	lam	not	 بَلْ كَذَّبُوا بِمَا لَمْ يُحِيطُوا بِعِلْمِهِ وَلَمَّا يَأْتِهِمْ تَأْوِيلُهُ
10:39	7	walammā	and not	 بَلْ كَذَّبُوا بِمَا لَمْ يُحِيطُوا بِعِلْمِهِ وَلَمَّا يَأْتِهِمْ تَأْوِيلُهُ
10:45	4	lam	they had not remained	 وَيَوْمَ يَحْشُرُهُمْ كَأَنْ لَمْ يَلْبَثُوا إِلَّا سَاعَةً مِنَ النَّهَارِ
11:20	2	lam	not	 أُولَٰئِكَ لَمْ يَكُونُوا مُعْجِزِينَ فِي الْأَرْضِ
11:68	2	lam	not	 كَأَنْ لَمْ يَغْنَوْا فِيهَا
11:95	2	lam	not	 كَأَنْ لَمْ يَغْنَوْا فِيهَا أَلَا بُعْدًا لِمَدْيَنَ
12:32	12	lam	not	 وَلَئِنْ لَمْ يَفْعَلْ مَا آمُرُهُ لَيُسْجَنَنَّ وَلَيَكُونًا مِنَ الصَّاغِرِينَ
12:52	4	lam	not	 ذَٰلِكَ لِيَعْلَمَ أَنِّي لَمْ أَخُنْهُ بِالْغَيْبِ وَأَنَّ اللَّهَ لَا يَهْدِي كَيْدَ الْخَائِنِينَ
12:60	2	lam	not	 فَإِنْ لَمْ تَأْتُونِي بِهِ فَلَا كَيْلَ لَكُمْ عِنْدِي وَلَا تَقْرَبُونِ
12:77	14	walam	and (did) not	 فَأَسَرَّهَا يُوسُفُ فِي نَفْسِهِ وَلَمْ يُبْدِهَا لَهُمْ
12:80	8	alam	Do not	 قَالَ كَبِيرُهُمْ أَلَمْ تَعْلَمُوا أَنَّ أَبَاكُمْ قَدْ أَخَذَ عَلَيْكُمْ مَوْثِقًا مِنَ اللَّهِ
12:96	11	alam	Did not	 قَالَ أَلَمْ أَقُلْ لَكُمْ إِنِّي أَعْلَمُ مِنَ اللَّهِ مَا لَا تَعْلَمُونَ
12:109	12	afalam	So have not	 أَفَلَمْ يَسِيرُوا فِي الْأَرْضِ فَيَنْظُرُوا كَيْفَ كَانَ عَاقِبَةُ الَّذِينَ مِنْ قَبْلِهِمْ وَلَدَارُ الْآخِرَةِ خَيْرٌ
13:18	6	lam	(did) not	 وَالَّذِينَ لَمْ يَسْتَجِيبُوا لَهُ لَوْ أَنَّ لَهُمْ مَا فِي الْأَرْضِ جَمِيعًا وَمِثْلَهُ مَعَهُ لَافْتَدَوْا بِهِ
13:31	19	afalam	Then do not	 أَفَلَمْ يَيْأَسِ الَّذِينَ آمَنُوا أَنْ لَوْ يَشَاءُ اللَّهُ لَهَدَى النَّاسَ جَمِيعًا
13:41	1	awalam	Did not	 أَوَلَمْ يَرَوْا أَنَّا نَأْتِي الْأَرْضَ نَنْقُصُهَا مِنْ أَطْرَافِهَا
14:9	1	alam	Has not	 أَلَمْ يَأْتِكُمْ نَبَأُ الَّذِينَ مِنْ قَبْلِكُمْ قَوْمِ نُوحٍ وَعَادٍ وَثَمُودَ
14:19	1	alam	Do not	 أَلَمْ تَرَ أَنَّ اللَّهَ خَلَقَ السَّمَاوَاتِ وَالْأَرْضَ بِالْحَقِّ
14:24	1	alam	Do not	 أَلَمْ تَرَ كَيْفَ ضَرَبَ اللَّهُ مَثَلًا كَلِمَةً طَيِّبَةً كَشَجَرَةٍ طَيِّبَةٍ
14:28	1	alam	Have not	 أَلَمْ تَرَ إِلَى الَّذِينَ بَدَّلُوا نِعْمَتَ اللَّهِ كُفْرًا
14:44	18	awalam	Had not	 أَوَلَمْ تَكُونُوا أَقْسَمْتُمْ مِنْ قَبْلُ مَا لَكُمْ مِنْ زَوَالٍ
15:33	2	lam	I am not	 قَالَ لَمْ أَكُنْ لِأَسْجُدَ لِبَشَرٍ خَلَقْتَهُ مِنْ صَلْصَالٍ مِنْ حَمَإٍ مَسْنُونٍ
15:70	2	awalam	Did not	 قَالُوا أَوَلَمْ نَنْهَكَ عَنِ الْعَالَمِينَ
16:7	5	lam	not	 وَتَحْمِلُ أَثْقَالَكُمْ إِلَىٰ بَلَدٍ لَمْ تَكُونُوا بَالِغِيهِ إِلَّا بِشِقِّ الْأَنْفُسِ
16:48	1	awalam	Have not	 أَوَلَمْ يَرَوْا إِلَىٰ مَا خَلَقَ اللَّهُ مِنْ شَيْءٍ
16:79	1	alam	Do not	 أَلَمْ يَرَوْا إِلَى الطَّيْرِ مُسَخَّرَاتٍ فِي جَوِّ السَّمَاءِ مَا يُمْسِكُهُنَّ إِلَّا اللَّهُ
16:120	8	walam	and not	 إِنَّ إِبْرَاهِيمَ كَانَ أُمَّةً قَانِتًا لِلَّهِ حَنِيفًا وَلَمْ يَكُ مِنَ الْمُشْرِكِينَ
17:99	1	awalam	Do not	 أَوَلَمْ يَرَوْا أَنَّ اللَّهَ الَّذِي خَلَقَ السَّمَاوَاتِ وَالْأَرْضَ قَادِرٌ عَلَىٰ أَنْ يَخْلُقَ مِثْلَهُمْ
17:111	5	lam	has not taken	 وَقُلِ الْحَمْدُ لِلَّهِ الَّذِي لَمْ يَتَّخِذْ وَلَدًا وَلَمْ يَكُنْ لَهُ شَرِيكٌ
17:111	8	walam	and not	 وَقُلِ الْحَمْدُ لِلَّهِ الَّذِي لَمْ يَتَّخِذْ وَلَدًا وَلَمْ يَكُنْ لَهُ شَرِيكٌ فِي الْمُلْكِ
17:111	14	walam	and not	 وَلَمْ يَكُنْ لَهُ وَلِيٌّ مِنَ الذُّلِّ وَكَبِّرْهُ تَكْبِيرًا
18:1	8	walam	and not	 الْحَمْدُ لِلَّهِ الَّذِي أَنْزَلَ عَلَىٰ عَبْدِهِ الْكِتَابَ وَلَمْ يَجْعَلْ لَهُ عِوَجًا
18:6	7	lam	not	 فَلَعَلَّكَ بَاخِعٌ نَفْسَكَ عَلَىٰ آثَارِهِمْ إِنْ لَمْ يُؤْمِنُوا بِهَٰذَا
18:33	5	walam	and not	 كِلْتَا الْجَنَّتَيْنِ آتَتْ أُكُلَهَا وَلَمْ تَظْلِمْ مِنْهُ شَيْئًا
18:42	16	lam	I had not associated	 وَيَقُولُ يَا لَيْتَنِي لَمْ أُشْرِكْ بِرَبِّي أَحَدًا
18:43	1	walam	And not	 وَلَمْ تَكُنْ لَهُ فِئَةٌ يَنْصُرُونَهُ مِنْ دُونِ اللَّهِ وَمَا كَانَ مُنْتَصِرًا
18:47	8	falam	and not	 وَتَرَى الْأَرْضَ بَارِزَةً وَحَشَرْنَاهُمْ فَلَمْ نُغَادِرْ مِنْهُمْ أَحَدًا
18:52	8	falam	but not	 وَيَوْمَ يَقُولُ نَادُوا شُرَكَائِيَ الَّذِينَ زَعَمْتُمْ فَدَعَوْهُمْ فَلَمْ يَسْتَجِيبُوا لَهُمْ
18:53	7	walam	And not	 فَظَنُّوا أَنَّهُمْ مُوَاقِعُوهَا وَلَمْ يَجِدُوا عَنْهَا مَصْرِفًا
18:68	5	lam	not	 وَكَيْفَ تَصْبِرُ عَلَىٰ مَا لَمْ تُحِطْ بِهِ خُبْرًا
18:72	2	alam	Did not	 قَالَ أَلَمْ أَقُلْ إِنَّكَ لَنْ تَسْتَطِيعَ مَعِيَ صَبْرًا
