surah:ayah	position	word	meaning	ayah_link
3:46	4	l-mahdi	the cradle	 وَيُكَلِّمُ النَّاسَ فِي الْمَهْدِ وَكَهْلًا وَمِنَ الصَّالِحِينَ
5:110	19	l-mahdi	the cradle	 إِذْ أَيَّدْتُكَ بِرُوحِ الْقُدُسِ تُكَلِّمُ النَّاسَ فِي الْمَهْدِ وَكَهْلًا
19:29	9	l-mahdi	the cradle	 فَأَشَارَتْ إِلَيْهِ قَالُوا كَيْفَ نُكَلِّمُ مَنْ كَانَ فِي الْمَهْدِ صَبِيًّا
20:53	5	mahdan	(as) a bed	 الَّذِي جَعَلَ لَكُمُ الْأَرْضَ مَهْدًا وَسَلَكَ لَكُمْ فِيهَا سُبُلًا
43:10	5	mahdan	a bed	 الَّذِي جَعَلَ لَكُمُ الْأَرْضَ مَهْدًا وَجَعَلَ لَكُمْ فِيهَا سُبُلًا
74:14	1	wamahhadttu	And I spread	 وَمَهَّدْتُ لَهُ تَمْهِيدًا
