surah:ayah	position	word	meaning	ayah_link
2:126	22	fa-umattiʿuhu	[then] I will grant him enjoyment	 قَالَ وَمَنْ كَفَرَ فَأُمَتِّعُهُ قَلِيلًا ثُمَّ أَضْطَرُّهُ إِلَىٰ عَذَابِ النَّارِ
2:236	14	wamattiʿūhunna	And make provision for them 	 وَمَتِّعُوهُنَّ عَلَى الْمُوسِعِ قَدَرُهُ وَعَلَى الْمُقْتِرِ قَدَرُهُ
10:98	19	wamattaʿnāhum	and We granted them enjoyment	 وَمَتَّعْنَاهُمْ إِلَىٰ حِينٍ
11:3	7	yumattiʿ'kum	He will let you	 وَأَنِ اسْتَغْفِرُوا رَبَّكُمْ ثُمَّ تُوبُوا إِلَيْهِ يُمَتِّعْكُمْ مَتَاعًا حَسَنًا
11:48	13	sanumattiʿuhum	We will grant enjoyment	 وَأُمَمٌ سَنُمَتِّعُهُمْ ثُمَّ يَمَسُّهُمْ مِنَّا عَذَابٌ أَلِيمٌ
15:88	6	mattaʿnā	We have bestowed	 لَا تَمُدَّنَّ عَيْنَيْكَ إِلَىٰ مَا مَتَّعْنَا بِهِ أَزْوَاجًا مِنْهُمْ وَلَا تَحْزَنْ عَلَيْهِمْ
20:131	6	mattaʿnā	We have given for enjoyment	 وَلَا تَمُدَّنَّ عَيْنَيْكَ إِلَىٰ مَا مَتَّعْنَا بِهِ أَزْوَاجًا مِنْهُمْ
21:44	2	mattaʿnā	We gave provision	 بَلْ مَتَّعْنَا هَٰؤُلَاءِ وَآبَاءَهُمْ حَتَّىٰ طَالَ عَلَيْهِمُ الْعُمُرُ
25:18	14	mattaʿtahum	You gave them comforts	 وَلَٰكِنْ مَتَّعْتَهُمْ وَآبَاءَهُمْ حَتَّىٰ نَسُوا الذِّكْرَ وَكَانُوا قَوْمًا بُورًا
26:205	3	mattaʿnāhum	We let them enjoy	 أَفَرَأَيْتَ إِنْ مَتَّعْنَاهُمْ سِنِينَ
26:207	6	yumattaʿūna	enjoyment they were given	 مَا أَغْنَىٰ عَنْهُمْ مَا كَانُوا يُمَتَّعُونَ
28:61	8	mattaʿnāhu	We provided him	 أَفَمَنْ وَعَدْنَاهُ وَعْدًا حَسَنًا فَهُوَ لَاقِيهِ كَمَنْ مَتَّعْنَاهُ مَتَاعَ الْحَيَاةِ الدُّنْيَا
31:24	1	numattiʿuhum	We grant them enjoyment	 نُمَتِّعُهُمْ قَلِيلًا ثُمَّ نَضْطَرُّهُمْ إِلَىٰ عَذَابٍ غَلِيظٍ
33:16	13	tumattaʿūna	you will be allowed to enjoy	 وَإِذًا لَا تُمَتَّعُونَ إِلَّا قَلِيلًا
33:28	12	umattiʿ'kunna	I will provide for you	 فَتَعَالَيْنَ أُمَتِّعْكُنَّ وَأُسَرِّحْكُنَّ سَرَاحًا جَمِيلًا
33:49	19	famattiʿūhunna	So provide for them	 فَمَتِّعُوهُنَّ وَسَرِّحُوهُنَّ سَرَاحًا جَمِيلًا
37:148	2	famattaʿnāhum	so We gave them enjoyment	 فَآمَنُوا فَمَتَّعْنَاهُمْ إِلَىٰ حِينٍ
43:29	2	mattaʿtu	I gave enjoyment	 بَلْ مَتَّعْتُ هَٰؤُلَاءِ وَآبَاءَهُمْ حَتَّىٰ جَاءَهُمُ الْحَقُّ وَرَسُولٌ مُبِينٌ
2:196	37	tamattaʿa	took advantage	 فَإِذَا أَمِنْتُمْ فَمَنْ تَمَتَّعَ بِالْعُمْرَةِ إِلَى الْحَجِّ
11:65	3	tamattaʿū	Enjoy (yourselves)	 فَعَقَرُوهَا فَقَالَ تَمَتَّعُوا فِي دَارِكُمْ ثَلَاثَةَ أَيَّامٍ
14:30	8	tamattaʿū	Enjoy	 قُلْ تَمَتَّعُوا فَإِنَّ مَصِيرَكُمْ إِلَى النَّارِ
15:3	3	wayatamattaʿū	and enjoy	 ذَرْهُمْ يَأْكُلُوا وَيَتَمَتَّعُوا وَيُلْهِهِمُ الْأَمَلُ فَسَوْفَ يَعْلَمُونَ
16:55	4	fatamattaʿū	Then enjoy yourselves	 لِيَكْفُرُوا بِمَا آتَيْنَاهُمْ فَتَمَتَّعُوا فَسَوْفَ تَعْلَمُونَ
29:66	4	waliyatamattaʿū	and they may enjoy (themselves)	 لِيَكْفُرُوا بِمَا آتَيْنَاهُمْ وَلِيَتَمَتَّعُوا فَسَوْفَ يَعْلَمُونَ
30:34	4	fatamattaʿū	Then enjoy	 لِيَكْفُرُوا بِمَا آتَيْنَاهُمْ فَتَمَتَّعُوا فَسَوْفَ تَعْلَمُونَ
39:8	28	tamattaʿ	Enjoy	 قُلْ تَمَتَّعْ بِكُفْرِكَ قَلِيلًا إِنَّكَ مِنْ أَصْحَابِ النَّارِ
47:12	15	yatamattaʿūna	they enjoy	 وَالَّذِينَ كَفَرُوا يَتَمَتَّعُونَ وَيَأْكُلُونَ كَمَا تَأْكُلُ الْأَنْعَامُ
51:43	6	tamattaʿū	Enjoy (yourselves)	 وَفِي ثَمُودَ إِذْ قِيلَ لَهُمْ تَمَتَّعُوا حَتَّىٰ حِينٍ
77:46	2	watamattaʿū	and enjoy yourselves	 كُلُوا وَتَمَتَّعُوا قَلِيلًا إِنَّكُمْ مُجْرِمُونَ
4:24	23	is'tamtaʿtum	you benefit[ed]	 فَمَا اسْتَمْتَعْتُمْ بِهِ مِنْهُنَّ فَآتُوهُنَّ أُجُورَهُنَّ فَرِيضَةً
6:128	15	is'tamtaʿa	profited	 رَبَّنَا اسْتَمْتَعَ بَعْضُنَا بِبَعْضٍ وَبَلَغْنَا أَجَلَنَا الَّذِي أَجَّلْتَ لَنَا
9:69	11	fa-is'tamtaʿū	So they enjoyed	 فَاسْتَمْتَعُوا بِخَلَاقِهِمْ فَاسْتَمْتَعْتُمْ بِخَلَاقِكُمْ
9:69	13	fa-is'tamtaʿtum	and you have enjoyed	 فَاسْتَمْتَعْتُمْ بِخَلَاقِكُمْ كَمَا اسْتَمْتَعَ الَّذِينَ مِنْ قَبْلِكُمْ بِخَلَاقِهِمْ
9:69	16	is'tamtaʿa	enjoyed	 فَاسْتَمْتَعْتُمْ بِخَلَاقِكُمْ كَمَا اسْتَمْتَعَ الَّذِينَ مِنْ قَبْلِكُمْ بِخَلَاقِهِمْ
46:20	12	wa-is'tamtaʿtum	and you took your pleasures	 أَذْهَبْتُمْ طَيِّبَاتِكُمْ فِي حَيَاتِكُمُ الدُّنْيَا وَاسْتَمْتَعْتُمْ بِهَا
2:36	17	wamatāʿun	and a provision	 وَلَكُمْ فِي الْأَرْضِ مُسْتَقَرٌّ وَمَتَاعٌ إِلَىٰ حِينٍ
2:236	21	matāʿan	a provision	 وَمَتِّعُوهُنَّ عَلَى الْمُوسِعِ قَدَرُهُ وَعَلَى الْمُقْتِرِ قَدَرُهُ مَتَاعًا بِالْمَعْرُوفِ
2:240	8	matāʿan	provision	 وَصِيَّةً لِأَزْوَاجِهِمْ مَتَاعًا إِلَى الْحَوْلِ غَيْرَ إِخْرَاجٍ
2:241	2	matāʿun	(is) a provision	 وَلِلْمُطَلَّقَاتِ مَتَاعٌ بِالْمَعْرُوفِ حَقًّا عَلَى الْمُتَّقِينَ
3:14	18	matāʿu	(is) provision	 ذَٰلِكَ مَتَاعُ الْحَيَاةِ الدُّنْيَا وَاللَّهُ عِنْدَهُ حُسْنُ الْمَآبِ
3:185	22	matāʿu	enjoyment	 وَمَا الْحَيَاةُ الدُّنْيَا إِلَّا مَتَاعُ الْغُرُورِ
3:197	1	matāʿun	An enjoyment	 مَتَاعٌ قَلِيلٌ ثُمَّ مَأْوَاهُمْ جَهَنَّمُ وَبِئْسَ الْمِهَادُ
4:77	39	matāʿu	Enjoyment	 قُلْ مَتَاعُ الدُّنْيَا قَلِيلٌ وَالْآخِرَةُ خَيْرٌ لِمَنِ اتَّقَىٰ
4:102	35	wa-amtiʿatikum	and your baggage	 وَدَّ الَّذِينَ كَفَرُوا لَوْ تَغْفُلُونَ عَنْ أَسْلِحَتِكُمْ وَأَمْتِعَتِكُمْ
5:96	6	matāʿan	(as) provision	 أُحِلَّ لَكُمْ صَيْدُ الْبَحْرِ وَطَعَامُهُ مَتَاعًا لَكُمْ وَلِلسَّيَّارَةِ
7:24	10	wamatāʿun	and livelihood	 وَلَكُمْ فِي الْأَرْضِ مُسْتَقَرٌّ وَمَتَاعٌ إِلَىٰ حِينٍ
9:38	22	matāʿu	(is the) enjoyment	 فَمَا مَتَاعُ الْحَيَاةِ الدُّنْيَا فِي الْآخِرَةِ إِلَّا قَلِيلٌ
10:23	16	matāʿa	(the) enjoyment	 إِنَّمَا بَغْيُكُمْ عَلَىٰ أَنْفُسِكُمْ مَتَاعَ الْحَيَاةِ الدُّنْيَا
10:70	1	matāʿun	An enjoyment	 مَتَاعٌ فِي الدُّنْيَا ثُمَّ إِلَيْنَا مَرْجِعُهُمْ ثُمَّ نُذِيقُهُمُ الْعَذَابَ الشَّدِيدَ
11:3	8	matāʿan	enjoy	 ثُمَّ تُوبُوا إِلَيْهِ يُمَتِّعْكُمْ مَتَاعًا حَسَنًا إِلَىٰ أَجَلٍ مُسَمًّى
12:17	9	matāʿinā	our possessions	 إِنَّا ذَهَبْنَا نَسْتَبِقُ وَتَرَكْنَا يُوسُفَ عِنْدَ مَتَاعِنَا فَأَكَلَهُ الذِّئْبُ
12:65	3	matāʿahum	their baggage	 وَلَمَّا فَتَحُوا مَتَاعَهُمْ وَجَدُوا بِضَاعَتَهُمْ رُدَّتْ إِلَيْهِمْ
12:79	9	matāʿanā	our possession	 قَالَ مَعَاذَ اللَّهِ أَنْ نَأْخُذَ إِلَّا مَنْ وَجَدْنَا مَتَاعَنَا عِنْدَهُ
13:17	20	matāʿin	utensils	 وَمِمَّا يُوقِدُونَ عَلَيْهِ فِي النَّارِ ابْتِغَاءَ حِلْيَةٍ أَوْ مَتَاعٍ زَبَدٌ مِثْلُهُ
13:26	16	matāʿun	an enjoyment	 وَفَرِحُوا بِالْحَيَاةِ الدُّنْيَا وَمَا الْحَيَاةُ الدُّنْيَا فِي الْآخِرَةِ إِلَّا مَتَاعٌ
16:80	23	wamatāʿan	and a provision	 وَمِنْ أَصْوَافِهَا وَأَوْبَارِهَا وَأَشْعَارِهَا أَثَاثًا وَمَتَاعًا إِلَىٰ حِينٍ
16:117	1	matāʿun	An enjoyment	 مَتَاعٌ قَلِيلٌ وَلَهُمْ عَذَابٌ أَلِيمٌ
21:111	6	wamatāʿun	and an enjoyment	 وَإِنْ أَدْرِي لَعَلَّهُ فِتْنَةٌ لَكُمْ وَمَتَاعٌ إِلَىٰ حِينٍ
24:29	10	matāʿun	(is) a provision	 لَيْسَ عَلَيْكُمْ جُنَاحٌ أَنْ تَدْخُلُوا بُيُوتًا غَيْرَ مَسْكُونَةٍ فِيهَا مَتَاعٌ لَكُمْ
28:60	5	famatāʿu	(is) an enjoyment	 وَمَا أُوتِيتُمْ مِنْ شَيْءٍ فَمَتَاعُ الْحَيَاةِ الدُّنْيَا وَزِينَتُهَا
28:61	9	matāʿa	enjoyment	 أَفَمَنْ وَعَدْنَاهُ وَعْدًا حَسَنًا فَهُوَ لَاقِيهِ كَمَنْ مَتَّعْنَاهُ مَتَاعَ الْحَيَاةِ الدُّنْيَا
33:53	41	matāʿan	(for) anything	 وَإِذَا سَأَلْتُمُوهُنَّ مَتَاعًا فَاسْأَلُوهُنَّ مِنْ وَرَاءِ حِجَابٍ
36:44	4	wamatāʿan	and provision	 إِلَّا رَحْمَةً مِنَّا وَمَتَاعًا إِلَىٰ حِينٍ
40:39	6	matāʿun	(is) enjoyment	 يَا قَوْمِ إِنَّمَا هَٰذِهِ الْحَيَاةُ الدُّنْيَا مَتَاعٌ
42:36	5	famatāʿu	(is) but a passing enjoyment	 فَمَا أُوتِيتُمْ مِنْ شَيْءٍ فَمَتَاعُ الْحَيَاةِ الدُّنْيَا
43:35	6	matāʿu	an enjoyment	 وَإِنْ كُلُّ ذَٰلِكَ لَمَّا مَتَاعُ الْحَيَاةِ الدُّنْيَا
56:73	4	wamatāʿan	and a provision	 نَحْنُ جَعَلْنَاهَا تَذْكِرَةً وَمَتَاعًا لِلْمُقْوِينَ
57:20	38	matāʿu	(the) enjoyment	 وَمَا الْحَيَاةُ الدُّنْيَا إِلَّا مَتَاعُ الْغُرُورِ
79:33	1	matāʿan	(As) a provision	 مَتَاعًا لَكُمْ وَلِأَنْعَامِكُمْ
80:32	1	matāʿan	(As) a provision	 مَتَاعًا لَكُمْ وَلِأَنْعَامِكُمْ
