surah:ayah	position	word	meaning	ayah_link
2:32	5	lanā	(is) for us	 قَالُوا سُبْحَانَكَ لَا عِلْمَ لَنَا إِلَّا مَا عَلَّمْتَنَا إِنَّكَ أَنْتَ الْعَلِيمُ الْحَكِيمُ
2:61	10	lanā	for us	 فَادْعُ لَنَا رَبَّكَ يُخْرِجْ لَنَا مِمَّا تُنْبِتُ الْأَرْضُ
2:61	13	lanā	for us	 فَادْعُ لَنَا رَبَّكَ يُخْرِجْ لَنَا مِمَّا تُنْبِتُ الْأَرْضُ مِنْ بَقْلِهَا
2:68	3	lanā	for us	 قَالُوا ادْعُ لَنَا رَبَّكَ يُبَيِّنْ لَنَا مَا هِيَ
2:68	6	lanā	to us	 قَالُوا ادْعُ لَنَا رَبَّكَ يُبَيِّنْ لَنَا مَا هِيَ
2:69	3	lanā	for us	 قَالُوا ادْعُ لَنَا رَبَّكَ يُبَيِّنْ لَنَا مَا لَوْنُهَا
2:69	6	lanā	to us	 قَالُوا ادْعُ لَنَا رَبَّكَ يُبَيِّنْ لَنَا مَا لَوْنُهَا
2:70	3	lanā	for us	 قَالُوا ادْعُ لَنَا رَبَّكَ يُبَيِّنْ لَنَا مَا هِيَ إِنَّ الْبَقَرَ تَشَابَهَ عَلَيْنَا
2:70	6	lanā	to us	 قَالُوا ادْعُ لَنَا رَبَّكَ يُبَيِّنْ لَنَا مَا هِيَ إِنَّ الْبَقَرَ تَشَابَهَ عَلَيْنَا
2:139	8	walanā	And for us	 وَلَنَا أَعْمَالُنَا وَلَكُمْ أَعْمَالُكُمْ
2:167	6	lanā	for us	 وَقَالَ الَّذِينَ اتَّبَعُوا لَوْ أَنَّ لَنَا كَرَّةً فَنَتَبَرَّأَ مِنْهُمْ كَمَا تَبَرَّءُوا مِنَّا
2:246	16	lanā	for us	 إِذْ قَالُوا لِنَبِيٍّ لَهُمُ ابْعَثْ لَنَا مَلِكًا نُقَاتِلْ فِي سَبِيلِ اللَّهِ
2:246	33	lanā	for us	 قَالُوا وَمَا لَنَا أَلَّا نُقَاتِلَ فِي سَبِيلِ اللَّهِ وَقَدْ أُخْرِجْنَا مِنْ دِيَارِنَا
2:249	39	lanā	for us	 قَالُوا لَا طَاقَةَ لَنَا الْيَوْمَ بِجَالُوتَ وَجُنُودِهِ
2:286	37	lanā	we have	 رَبَّنَا وَلَا تُحَمِّلْنَا مَا لَا طَاقَةَ لَنَا بِهِ
2:286	42	lanā	[for] us	 وَاعْفُ عَنَّا وَاغْفِرْ لَنَا وَارْحَمْنَا
3:8	9	lanā	(for) us	 رَبَّنَا لَا تُزِغْ قُلُوبَنَا بَعْدَ إِذْ هَدَيْتَنَا وَهَبْ لَنَا مِنْ لَدُنْكَ رَحْمَةً
3:16	7	lanā	for us	 الَّذِينَ يَقُولُونَ رَبَّنَا إِنَّنَا آمَنَّا فَاغْفِرْ لَنَا ذُنُوبَنَا
3:147	9	lanā	for us	 وَمَا كَانَ قَوْلَهُمْ إِلَّا أَنْ قَالُوا رَبَّنَا اغْفِرْ لَنَا ذُنُوبَنَا
3:154	24	lanā	for us	 يَقُولُونَ هَلْ لَنَا مِنَ الْأَمْرِ مِنْ شَيْءٍ
3:154	44	lanā	for us	 يَقُولُونَ لَوْ كَانَ لَنَا مِنَ الْأَمْرِ شَيْءٌ مَا قُتِلْنَا هَاهُنَا
3:193	13	lanā	for us	 رَبَّنَا فَاغْفِرْ لَنَا ذُنُوبَنَا وَكَفِّرْ عَنَّا سَيِّئَاتِنَا
4:75	23	lanā	for us	 رَبَّنَا أَخْرِجْنَا مِنْ هَٰذِهِ الْقَرْيَةِ الظَّالِمِ أَهْلُهَا وَاجْعَلْ لَنَا مِنْ لَدُنْكَ وَلِيًّا
4:75	28	lanā	for us	 وَاجْعَلْ لَنَا مِنْ لَدُنْكَ نَصِيرًا
5:84	2	lanā	for us (that)	 وَمَا لَنَا لَا نُؤْمِنُ بِاللَّهِ وَمَا جَاءَنَا مِنَ الْحَقِّ
5:109	11	lanā	for us	 قَالُوا لَا عِلْمَ لَنَا إِنَّكَ أَنْتَ عَلَّامُ الْغُيُوبِ
5:114	13	lanā	for us	 رَبَّنَا أَنْزِلْ عَلَيْنَا مَائِدَةً مِنَ السَّمَاءِ تَكُونُ لَنَا عِيدًا لِأَوَّلِنَا وَآخِرِنَا
6:128	22	lanā	for us	 رَبَّنَا اسْتَمْتَعَ بَعْضُنَا بِبَعْضٍ وَبَلَغْنَا أَجَلَنَا الَّذِي أَجَّلْتَ لَنَا
6:148	29	lanā	for us	 قُلْ هَلْ عِنْدَكُمْ مِنْ عِلْمٍ فَتُخْرِجُوهُ لَنَا
7:23	8	lanā	[for] us	 وَإِنْ لَمْ تَغْفِرْ لَنَا وَتَرْحَمْنَا لَنَكُونَنَّ مِنَ الْخَاسِرِينَ
7:53	19	lanā	for us	 قَدْ جَاءَتْ رُسُلُ رَبِّنَا بِالْحَقِّ فَهَلْ لَنَا مِنْ شُفَعَاءَ فَيَشْفَعُوا لَنَا
7:53	23	lanā	for us	 فَهَلْ لَنَا مِنْ شُفَعَاءَ فَيَشْفَعُوا لَنَا
7:89	17	lanā	for us	 وَمَا يَكُونُ لَنَا أَنْ نَعُودَ فِيهَا إِلَّا أَنْ يَشَاءَ اللَّهُ رَبُّنَا
7:113	6	lanā	for us	 وَجَاءَ السَّحَرَةُ فِرْعَوْنَ قَالُوا إِنَّ لَنَا لَأَجْرًا إِنْ كُنَّا نَحْنُ الْغَالِبِينَ
7:131	5	lanā	For us	 فَإِذَا جَاءَتْهُمُ الْحَسَنَةُ قَالُوا لَنَا هَٰذِهِ
7:134	8	lanā	for us	 وَلَمَّا وَقَعَ عَلَيْهِمُ الرِّجْزُ قَالُوا يَا مُوسَى ادْعُ لَنَا رَبَّكَ بِمَا عَهِدَ عِنْدَكَ
7:138	15	lanā	for us	 قَالُوا يَا مُوسَى اجْعَلْ لَنَا إِلَٰهًا كَمَا لَهُمْ آلِهَةٌ
7:149	15	lanā	[for] us	 لَئِنْ لَمْ يَرْحَمْنَا رَبُّنَا وَيَغْفِرْ لَنَا لَنَكُونَنَّ مِنَ الْخَاسِرِينَ
7:155	37	lanā	us	 أَنْتَ وَلِيُّنَا فَاغْفِرْ لَنَا وَارْحَمْنَا وَأَنْتَ خَيْرُ الْغَافِرِينَ
7:156	2	lanā	for us	 وَاكْتُبْ لَنَا فِي هَٰذِهِ الدُّنْيَا حَسَنَةً وَفِي الْآخِرَةِ إِنَّا هُدْنَا إِلَيْكَ
7:169	13	lanā	for us	 يَأْخُذُونَ عَرَضَ هَٰذَا الْأَدْنَىٰ وَيَقُولُونَ سَيُغْفَرُ لَنَا
9:51	8	lanā	for us	 قُلْ لَنْ يُصِيبَنَا إِلَّا مَا كَتَبَ اللَّهُ لَنَا هُوَ مَوْلَانَا
9:52	4	binā	for us	 قُلْ هَلْ تَرَبَّصُونَ بِنَا إِلَّا إِحْدَى الْحُسْنَيَيْنِ
11:79	5	lanā	we have	 قَالُوا لَقَدْ عَلِمْتَ مَا لَنَا فِي بَنَاتِكَ مِنْ حَقٍّ
12:17	15	lanā	us	 وَمَا أَنْتَ بِمُؤْمِنٍ لَنَا وَلَوْ كُنَّا صَادِقِينَ
12:38	9	lanā	for us	 مَا كَانَ لَنَا أَنْ نُشْرِكَ بِاللَّهِ مِنْ شَيْءٍ
12:88	14	lanā	to us	 وَجِئْنَا بِبِضَاعَةٍ مُزْجَاةٍ فَأَوْفِ لَنَا الْكَيْلَ وَتَصَدَّقْ عَلَيْنَا
12:97	4	lanā	for us	 قَالُوا يَا أَبَانَا اسْتَغْفِرْ لَنَا ذُنُوبَنَا إِنَّا كُنَّا خَاطِئِينَ
14:11	19	lanā	for us	 وَمَا كَانَ لَنَا أَنْ نَأْتِيَكُمْ بِسُلْطَانٍ إِلَّا بِإِذْنِ اللَّهِ
14:12	2	lanā	(is) for us	 وَمَا لَنَا أَلَّا نَتَوَكَّلَ عَلَى اللَّهِ وَقَدْ هَدَانَا سُبُلَنَا
14:21	32	lanā	(is) for us	 سَوَاءٌ عَلَيْنَا أَجَزِعْنَا أَمْ صَبَرْنَا مَا لَنَا مِنْ مَحِيصٍ
17:5	8	lanā	of Ours	 فَإِذَا جَاءَ وَعْدُ أُولَاهُمَا بَعَثْنَا عَلَيْكُمْ عِبَادًا لَنَا أُولِي بَأْسٍ شَدِيدٍ
17:90	7	lanā	for us	 وَقَالُوا لَنْ نُؤْمِنَ لَكَ حَتَّىٰ تَفْجُرَ لَنَا مِنَ الْأَرْضِ يَنْبُوعًا
18:10	13	lanā	for us	 رَبَّنَا آتِنَا مِنْ لَدُنْكَ رَحْمَةً وَهَيِّئْ لَنَا مِنْ أَمْرِنَا رَشَدًا
20:35	3	binā	of us	 إِنَّكَ كُنْتَ بِنَا بَصِيرًا
20:73	5	lanā	for us	 إِنَّا آمَنَّا بِرَبِّنَا لِيَغْفِرَ لَنَا خَطَايَانَا
21:47	19	binā	(are) We	 وَإِنْ كَانَ مِثْقَالَ حَبَّةٍ مِنْ خَرْدَلٍ أَتَيْنَا بِهَا وَكَفَىٰ بِنَا حَاسِبِينَ
21:73	14	lanā	of Us	 وَكَانُوا لَنَا عَابِدِينَ
21:90	18	lanā	to Us	 وَيَدْعُونَنَا رَغَبًا وَرَهَبًا وَكَانُوا لَنَا خَاشِعِينَ
23:47	6	lanā	for us	 فَقَالُوا أَنُؤْمِنُ لِبَشَرَيْنِ مِثْلِنَا وَقَوْمُهُمَا لَنَا عَابِدُونَ
23:109	10	lanā	us	 إِنَّهُ كَانَ فَرِيقٌ مِنْ عِبَادِي يَقُولُونَ رَبَّنَا آمَنَّا فَاغْفِرْ لَنَا وَارْحَمْنَا
24:16	7	lanā	for us	 وَلَوْلَا إِذْ سَمِعْتُمُوهُ قُلْتُمْ مَا يَكُونُ لَنَا أَنْ نَتَكَلَّمَ بِهَٰذَا
25:18	6	lanā	for us	 قَالُوا سُبْحَانَكَ مَا كَانَ يَنْبَغِي لَنَا أَنْ نَتَّخِذَ مِنْ دُونِكَ مِنْ أَوْلِيَاءَ
25:74	5	lanā	to us	 وَالَّذِينَ يَقُولُونَ رَبَّنَا هَبْ لَنَا مِنْ أَزْوَاجِنَا وَذُرِّيَّاتِنَا قُرَّةَ أَعْيُنٍ
26:41	7	lanā	for us	 فَلَمَّا جَاءَ السَّحَرَةُ قَالُوا لِفِرْعَوْنَ أَئِنَّ لَنَا لَأَجْرًا إِنْ كُنَّا نَحْنُ الْغَالِبِينَ
26:51	5	lanā	us	 إِنَّا نَطْمَعُ أَنْ يَغْفِرَ لَنَا رَبُّنَا خَطَايَانَا أَنْ كُنَّا أَوَّلَ الْمُؤْمِنِينَ
26:55	2	lanā	[to] us	 وَإِنَّهُمْ لَنَا لَغَائِظُونَ
26:100	2	lanā	we have	 فَمَا لَنَا مِنْ شَافِعِينَ
26:102	3	lanā	we had	 فَلَوْ أَنَّ لَنَا كَرَّةً فَنَكُونَ مِنَ الْمُؤْمِنِينَ
28:25	14	lanā	for us	 قَالَتْ إِنَّ أَبِي يَدْعُوكَ لِيَجْزِيَكَ أَجْرَ مَا سَقَيْتَ لَنَا
28:55	7	lanā	For us	 وَإِذَا سَمِعُوا اللَّغْوَ أَعْرَضُوا عَنْهُ وَقَالُوا لَنَا أَعْمَالُنَا
28:79	12	lanā	for us	 يَا لَيْتَ لَنَا مِثْلَ مَا أُوتِيَ قَارُونُ إِنَّهُ لَذُو حَظٍّ عَظِيمٍ
28:82	22	binā	He would have caused it to swallow us	 لَوْلَا أَنْ مَنَّ اللَّهُ عَلَيْنَا لَخَسَفَ بِنَا
36:78	2	lanā	for Us	 وَضَرَبَ لَنَا مَثَلًا وَنَسِيَ خَلْقَهُ قَالَ مَنْ يُحْيِي الْعِظَامَ وَهِيَ رَمِيمٌ
37:30	3	lanā	for us	 وَمَا كَانَ لَنَا عَلَيْكُمْ مِنْ سُلْطَانٍ بَلْ كُنْتُمْ قَوْمًا طَاغِينَ
38:16	4	lanā	for us	 وَقَالُوا رَبَّنَا عَجِّلْ لَنَا قِطَّنَا قَبْلَ يَوْمِ الْحِسَابِ
38:60	9	lanā	upon us	 قَالُوا بَلْ أَنْتُمْ لَا مَرْحَبًا بِكُمْ أَنْتُمْ قَدَّمْتُمُوهُ لَنَا
38:61	5	lanā	upon us	 قَالُوا رَبَّنَا مَنْ قَدَّمَ لَنَا هَٰذَا فَزِدْهُ عَذَابًا ضِعْفًا فِي النَّارِ
38:62	3	lanā	for us	 وَقَالُوا مَا لَنَا لَا نَرَىٰ رِجَالًا كُنَّا نَعُدُّهُمْ مِنَ الْأَشْرَارِ
42:15	22	lanā	For us	 اللَّهُ رَبُّنَا وَرَبُّكُمْ لَنَا أَعْمَالُنَا وَلَكُمْ أَعْمَالُكُمْ
43:13	15	lanā	to us	 سُبْحَانَ الَّذِي سَخَّرَ لَنَا هَٰذَا وَمَا كُنَّا لَهُ مُقْرِنِينَ
43:49	5	lanā	for us	 وَقَالُوا يَا أَيُّهَ السَّاحِرُ ادْعُ لَنَا رَبَّكَ بِمَا عَهِدَ عِنْدَكَ
48:11	10	lanā	for us	 شَغَلَتْنَا أَمْوَالُنَا وَأَهْلُونَا فَاسْتَغْفِرْ لَنَا
59:10	8	lanā	us	 رَبَّنَا اغْفِرْ لَنَا وَلِإِخْوَانِنَا الَّذِينَ سَبَقُونَا بِالْإِيمَانِ
60:5	8	lanā	us	 رَبَّنَا لَا تَجْعَلْنَا فِتْنَةً لِلَّذِينَ كَفَرُوا وَاغْفِرْ لَنَا رَبَّنَا
66:8	37	lanā	for us	 يَقُولُونَ رَبَّنَا أَتْمِمْ لَنَا نُورَنَا وَاغْفِرْ لَنَا إِنَّكَ عَلَىٰ كُلِّ شَيْءٍ قَدِيرٌ
66:8	40	lanā	to us	 يَقُولُونَ رَبَّنَا أَتْمِمْ لَنَا نُورَنَا وَاغْفِرْ لَنَا
92:13	2	lanā	for Us	 وَإِنَّ لَنَا لَلْآخِرَةَ وَالْأُولَىٰ
