surah:ayah	position	word	meaning	ayah_link
2:49	12	nisāakum	your women	 يُذَبِّحُونَ أَبْنَاءَكُمْ وَيَسْتَحْيُونَ نِسَاءَكُمْ
2:187	7	nisāikum	your wives	 أُحِلَّ لَكُمْ لَيْلَةَ الصِّيَامِ الرَّفَثُ إِلَىٰ نِسَائِكُمْ
2:222	8	l-nisāa	[the] women	 قُلْ هُوَ أَذًى فَاعْتَزِلُوا النِّسَاءَ فِي الْمَحِيضِ
2:223	1	nisāukum	Your wives	 نِسَاؤُكُمْ حَرْثٌ لَكُمْ فَأْتُوا حَرْثَكُمْ أَنَّىٰ شِئْتُمْ
2:226	4	nisāihim	their wives	 لِلَّذِينَ يُؤْلُونَ مِنْ نِسَائِهِمْ تَرَبُّصُ أَرْبَعَةِ أَشْهُرٍ
2:231	3	l-nisāa	the women	 وَإِذَا طَلَّقْتُمُ النِّسَاءَ فَبَلَغْنَ أَجَلَهُنَّ فَأَمْسِكُوهُنَّ بِمَعْرُوفٍ
2:232	3	l-nisāa	[the] women	 وَإِذَا طَلَّقْتُمُ النِّسَاءَ فَبَلَغْنَ أَجَلَهُنَّ فَلَا تَعْضُلُوهُنَّ
2:235	9	l-nisāi	[to] the women	 وَلَا جُنَاحَ عَلَيْكُمْ فِيمَا عَرَّضْتُمْ بِهِ مِنْ خِطْبَةِ النِّسَاءِ
2:236	6	l-nisāa	[the] women	 لَا جُنَاحَ عَلَيْكُمْ إِنْ طَلَّقْتُمُ النِّسَاءَ مَا لَمْ تَمَسُّوهُنَّ
3:14	6	l-nisāi	[the] women	 زُيِّنَ لِلنَّاسِ حُبُّ الشَّهَوَاتِ مِنَ النِّسَاءِ وَالْبَنِينَ
3:42	11	nisāi	(the) women	 إِنَّ اللَّهَ اصْطَفَاكِ وَطَهَّرَكِ وَاصْطَفَاكِ عَلَىٰ نِسَاءِ الْعَالَمِينَ
3:61	15	wanisāanā	and our women	 فَقُلْ تَعَالَوْا نَدْعُ أَبْنَاءَنَا وَأَبْنَاءَكُمْ وَنِسَاءَنَا وَنِسَاءَكُمْ
3:61	16	wanisāakum	and your women	 فَقُلْ تَعَالَوْا نَدْعُ أَبْنَاءَنَا وَأَبْنَاءَكُمْ وَنِسَاءَنَا وَنِسَاءَكُمْ
4:1	17	wanisāan	and women	 وَخَلَقَ مِنْهَا زَوْجَهَا وَبَثَّ مِنْهُمَا رِجَالًا كَثِيرًا وَنِسَاءً
4:3	12	l-nisāi	the women	 وَإِنْ خِفْتُمْ أَلَّا تُقْسِطُوا فِي الْيَتَامَىٰ فَانْكِحُوا مَا طَابَ لَكُمْ مِنَ النِّسَاءِ
4:4	2	l-nisāa	the women	 وَآتُوا النِّسَاءَ صَدُقَاتِهِنَّ نِحْلَةً
4:7	7	walilnnisāi	and for the women	 وَلِلنِّسَاءِ نَصِيبٌ مِمَّا تَرَكَ الْوَالِدَانِ وَالْأَقْرَبُونَ
4:11	11	nisāan	(only) women	 فَإِنْ كُنَّ نِسَاءً فَوْقَ اثْنَتَيْنِ فَلَهُنَّ ثُلُثَا مَا تَرَكَ
4:15	5	nisāikum	your women	 وَاللَّاتِي يَأْتِينَ الْفَاحِشَةَ مِنْ نِسَائِكُمْ فَاسْتَشْهِدُوا عَلَيْهِنَّ أَرْبَعَةً مِنْكُمْ
4:19	9	l-nisāa	the women	 يَا أَيُّهَا الَّذِينَ آمَنُوا لَا يَحِلُّ لَكُمْ أَنْ تَرِثُوا النِّسَاءَ كَرْهًا
4:22	7	l-nisāi	the women	 وَلَا تَنْكِحُوا مَا نَكَحَ آبَاؤُكُمْ مِنَ النِّسَاءِ إِلَّا مَا قَدْ سَلَفَ
4:23	19	nisāikum	(of) your wives	 وَأَخَوَاتُكُمْ مِنَ الرَّضَاعَةِ وَأُمَّهَاتُ نِسَائِكُمْ
4:23	25	nisāikumu	your women	 وَرَبَائِبُكُمُ اللَّاتِي فِي حُجُورِكُمْ مِنْ نِسَائِكُمُ اللَّاتِي دَخَلْتُمْ بِهِنَّ
4:24	3	l-nisāi	the women	 وَالْمُحْصَنَاتُ مِنَ النِّسَاءِ إِلَّا مَا مَلَكَتْ أَيْمَانُكُمْ
4:32	14	walilnnisāi	and for women	 لِلرِّجَالِ نَصِيبٌ مِمَّا اكْتَسَبُوا وَلِلنِّسَاءِ نَصِيبٌ مِمَّا اكْتَسَبْنَ
4:34	4	l-nisāi	the women	 الرِّجَالُ قَوَّامُونَ عَلَى النِّسَاءِ بِمَا فَضَّلَ اللَّهُ بَعْضَهُمْ عَلَىٰ بَعْضٍ
4:43	34	l-nisāa	the women	 أَوْ لَامَسْتُمُ النِّسَاءَ فَلَمْ تَجِدُوا مَاءً فَتَيَمَّمُوا صَعِيدًا طَيِّبًا
4:75	11	wal-nisāi	and the women	 وَمَا لَكُمْ لَا تُقَاتِلُونَ فِي سَبِيلِ اللَّهِ وَالْمُسْتَضْعَفِينَ مِنَ الرِّجَالِ وَالنِّسَاءِ
4:98	5	wal-nisāi	and the women	 إِلَّا الْمُسْتَضْعَفِينَ مِنَ الرِّجَالِ وَالنِّسَاءِ وَالْوِلْدَانِ
4:127	3	l-nisāi	the women	 وَيَسْتَفْتُونَكَ فِي النِّسَاءِ قُلِ اللَّهُ يُفْتِيكُمْ فِيهِنَّ
4:127	15	l-nisāi	(of) girls	 وَمَا يُتْلَىٰ عَلَيْكُمْ فِي الْكِتَابِ فِي يَتَامَى النِّسَاءِ
4:129	6	l-nisāi	[the] women	 وَلَنْ تَسْتَطِيعُوا أَنْ تَعْدِلُوا بَيْنَ النِّسَاءِ وَلَوْ حَرَصْتُمْ
4:176	37	wanisāan	and women	 وَإِنْ كَانُوا إِخْوَةً رِجَالًا وَنِسَاءً فَلِلذَّكَرِ مِثْلُ حَظِّ الْأُنْثَيَيْنِ
5:6	36	l-nisāa	(with) the women	 أَوْ لَامَسْتُمُ النِّسَاءَ فَلَمْ تَجِدُوا مَاءً فَتَيَمَّمُوا صَعِيدًا طَيِّبًا
7:81	7	l-nisāi	the women	 إِنَّكُمْ لَتَأْتُونَ الرِّجَالَ شَهْوَةً مِنْ دُونِ النِّسَاءِ
7:127	18	nisāahum	their women	 قَالَ سَنُقَتِّلُ أَبْنَاءَهُمْ وَنَسْتَحْيِي نِسَاءَهُمْ
7:141	12	nisāakum	your women	 يُقَتِّلُونَ أَبْنَاءَكُمْ وَيَسْتَحْيُونَ نِسَاءَكُمْ
12:30	2	nis'watun	women	 وَقَالَ نِسْوَةٌ فِي الْمَدِينَةِ امْرَأَتُ الْعَزِيزِ تُرَاوِدُ فَتَاهَا عَنْ نَفْسِهِ
12:50	15	l-nis'wati	(of) the women	 ارْجِعْ إِلَىٰ رَبِّكَ فَاسْأَلْهُ مَا بَالُ النِّسْوَةِ اللَّاتِي قَطَّعْنَ أَيْدِيَهُنَّ
14:6	20	nisāakum	your women	 يَسُومُونَكُمْ سُوءَ الْعَذَابِ وَيُذَبِّحُونَ أَبْنَاءَكُمْ وَيَسْتَحْيُونَ نِسَاءَكُمْ
24:31	43	nisāihinna	their women	 أَوْ بَنِي أَخَوَاتِهِنَّ أَوْ نِسَائِهِنَّ
24:31	62	l-nisāi	(of) the women	 أَوِ الطِّفْلِ الَّذِينَ لَمْ يَظْهَرُوا عَلَىٰ عَوْرَاتِ النِّسَاءِ
24:60	3	l-nisāi	the women	 وَالْقَوَاعِدُ مِنَ النِّسَاءِ اللَّاتِي لَا يَرْجُونَ نِكَاحًا
27:55	7	l-nisāi	the women	 أَئِنَّكُمْ لَتَأْتُونَ الرِّجَالَ شَهْوَةً مِنْ دُونِ النِّسَاءِ
28:4	15	nisāahum	their women	 يَسْتَضْعِفُ طَائِفَةً مِنْهُمْ يُذَبِّحُ أَبْنَاءَهُمْ وَيَسْتَحْيِي نِسَاءَهُمْ
33:30	1	yānisāa	O wives	 يَا نِسَاءَ النَّبِيِّ مَنْ يَأْتِ مِنْكُنَّ بِفَاحِشَةٍ مُبَيِّنَةٍ يُضَاعَفْ لَهَا الْعَذَابُ ضِعْفَيْنِ
33:32	1	yānisāa	O wives	 يَا نِسَاءَ النَّبِيِّ
33:32	6	l-nisāi	the women	 لَسْتُنَّ كَأَحَدٍ مِنَ النِّسَاءِ
33:52	4	l-nisāu	(to marry) women	 لَا يَحِلُّ لَكَ النِّسَاءُ مِنْ بَعْدُ وَلَا أَنْ تَبَدَّلَ بِهِنَّ
33:55	17	nisāihinna	their women	 وَلَا أَبْنَاءِ أَخَوَاتِهِنَّ وَلَا نِسَائِهِنَّ وَلَا مَا مَلَكَتْ أَيْمَانُهُنَّ
33:59	6	wanisāi	and (the) women	 يَا أَيُّهَا النَّبِيُّ قُلْ لِأَزْوَاجِكَ وَبَنَاتِكَ وَنِسَاءِ الْمُؤْمِنِينَ يُدْنِينَ عَلَيْهِنَّ مِنْ جَلَابِيبِهِنَّ
40:25	13	nisāahum	their women	 قَالُوا اقْتُلُوا أَبْنَاءَ الَّذِينَ آمَنُوا مَعَهُ وَاسْتَحْيُوا نِسَاءَهُمْ
48:25	16	wanisāon	and women	 وَلَوْلَا رِجَالٌ مُؤْمِنُونَ وَنِسَاءٌ مُؤْمِنَاتٌ لَمْ تَعْلَمُوهُمْ أَنْ تَطَئُوهُمْ
49:11	15	nisāon	women	 لَا يَسْخَرْ قَوْمٌ مِنْ قَوْمٍ عَسَىٰ أَنْ يَكُونُوا خَيْرًا مِنْهُمْ وَلَا نِسَاءٌ
49:11	17	nisāin	(other) women	 مِنْ نِسَاءٍ عَسَىٰ أَنْ يَكُنَّ خَيْرًا مِنْهُنَّ
58:2	5	nisāihim	(to) their wives	 الَّذِينَ يُظَاهِرُونَ مِنْكُمْ مِنْ نِسَائِهِمْ مَا هُنَّ أُمَّهَاتِهِمْ
58:3	4	nisāihim	(to) their wives	 وَالَّذِينَ يُظَاهِرُونَ مِنْ نِسَائِهِمْ ثُمَّ يَعُودُونَ لِمَا قَالُوا فَتَحْرِيرُ رَقَبَةٍ مِنْ قَبْلِ أَنْ يَتَمَاسَّا
65:1	5	l-nisāa	[the] women	 إِذَا طَلَّقْتُمُ النِّسَاءَ فَطَلِّقُوهُنَّ لِعِدَّتِهِنَّ وَأَحْصُوا الْعِدَّةَ
65:4	6	nisāikum	your women	 وَاللَّائِي يَئِسْنَ مِنَ الْمَحِيضِ مِنْ نِسَائِكُمْ إِنِ ارْتَبْتُمْ فَعِدَّتُهُنَّ ثَلَاثَةُ أَشْهُرٍ
