surah:ayah	position	word	meaning	ayah_link
2:120	2	tarḍā	will be pleased	 وَلَنْ تَرْضَىٰ عَنْكَ الْيَهُودُ وَلَا النَّصَارَىٰ حَتَّىٰ تَتَّبِعَ مِلَّتَهُمْ
2:144	9	tarḍāhā	you will be pleased with	 قَدْ نَرَىٰ تَقَلُّبَ وَجْهِكَ فِي السَّمَاءِ فَلَنُوَلِّيَنَّكَ قِبْلَةً تَرْضَاهَا
2:282	63	tarḍawna	you agree	 فَرَجُلٌ وَامْرَأَتَانِ مِمَّنْ تَرْضَوْنَ مِنَ الشُّهَدَاءِ
4:108	14	yarḍā	(does) he approve	 وَهُوَ مَعَهُمْ إِذْ يُبَيِّتُونَ مَا لَا يَرْضَىٰ مِنَ الْقَوْلِ
5:3	47	waraḍītu	and I have approved	 وَأَتْمَمْتُ عَلَيْكُمْ نِعْمَتِي وَرَضِيتُ لَكُمُ الْإِسْلَامَ دِينًا
5:119	17	raḍiya	is pleased	 رَضِيَ اللَّهُ عَنْهُمْ وَرَضُوا عَنْهُ ذَٰلِكَ الْفَوْزُ الْعَظِيمُ
5:119	20	waraḍū	and they are pleased	 رَضِيَ اللَّهُ عَنْهُمْ وَرَضُوا عَنْهُ ذَٰلِكَ الْفَوْزُ الْعَظِيمُ
6:113	8	waliyarḍawhu	and so that they may be pleased with it	 وَلِتَصْغَىٰ إِلَيْهِ أَفْئِدَةُ الَّذِينَ لَا يُؤْمِنُونَ بِالْآخِرَةِ وَلِيَرْضَوْهُ
9:24	15	tarḍawnahā	you delight (in) it	 وَمَسَاكِنُ تَرْضَوْنَهَا أَحَبَّ إِلَيْكُمْ مِنَ اللَّهِ وَرَسُولِهِ
9:38	16	araḍītum	Are you pleased	 أَرَضِيتُمْ بِالْحَيَاةِ الدُّنْيَا مِنَ الْآخِرَةِ
9:58	9	raḍū	they are pleased	 فَإِنْ أُعْطُوا مِنْهَا رَضُوا وَإِنْ لَمْ يُعْطَوْا مِنْهَا إِذَا هُمْ يَسْخَطُونَ
9:59	3	raḍū	(were) satisfied	 وَلَوْ أَنَّهُمْ رَضُوا مَا آتَاهُمُ اللَّهُ وَرَسُولُهُ وَقَالُوا حَسْبُنَا اللَّهُ
9:83	19	raḍītum	were satisfied	 إِنَّكُمْ رَضِيتُمْ بِالْقُعُودِ أَوَّلَ مَرَّةٍ فَاقْعُدُوا مَعَ الْخَالِفِينَ
9:87	1	raḍū	They (were) satisfied	 رَضُوا بِأَنْ يَكُونُوا مَعَ الْخَوَالِفِ وَطُبِعَ عَلَىٰ قُلُوبِهِمْ
9:93	8	raḍū	They (are) satisfied	 رَضُوا بِأَنْ يَكُونُوا مَعَ الْخَوَالِفِ وَطَبَعَ اللَّهُ عَلَىٰ قُلُوبِهِمْ
9:96	3	litarḍaw	that you may be pleased	 يَحْلِفُونَ لَكُمْ لِتَرْضَوْا عَنْهُمْ
9:96	6	tarḍaw	you are pleased	 فَإِنْ تَرْضَوْا عَنْهُمْ فَإِنَّ اللَّهَ لَا يَرْضَىٰ عَنِ الْقَوْمِ الْفَاسِقِينَ
9:96	11	yarḍā	(is) not pleased	 فَإِنْ تَرْضَوْا عَنْهُمْ فَإِنَّ اللَّهَ لَا يَرْضَىٰ عَنِ الْقَوْمِ الْفَاسِقِينَ
9:100	9	raḍiya	Allah is pleased	 وَالَّذِينَ اتَّبَعُوهُمْ بِإِحْسَانٍ رَضِيَ اللَّهُ عَنْهُمْ وَرَضُوا عَنْهُ
9:100	12	waraḍū	and they are pleased	 وَالَّذِينَ اتَّبَعُوهُمْ بِإِحْسَانٍ رَضِيَ اللَّهُ عَنْهُمْ وَرَضُوا عَنْهُ
10:7	6	waraḍū	and are pleased	 إِنَّ الَّذِينَ لَا يَرْجُونَ لِقَاءَنَا وَرَضُوا بِالْحَيَاةِ الدُّنْيَا وَاطْمَأَنُّوا بِهَا
20:84	9	litarḍā	that You be pleased	 قَالَ هُمْ أُولَاءِ عَلَىٰ أَثَرِي وَعَجِلْتُ إِلَيْكَ رَبِّ لِتَرْضَىٰ
20:109	10	waraḍiya	and He has accepted	 يَوْمَئِذٍ لَا تَنْفَعُ الشَّفَاعَةُ إِلَّا مَنْ أَذِنَ لَهُ الرَّحْمَٰنُ وَرَضِيَ لَهُ قَوْلًا
20:130	20	tarḍā	be satisfied	 وَمِنْ آنَاءِ اللَّيْلِ فَسَبِّحْ وَأَطْرَافَ النَّهَارِ لَعَلَّكَ تَرْضَىٰ
22:59	3	yarḍawnahu	they will be pleased (with) it	 لَيُدْخِلَنَّهُمْ مُدْخَلًا يَرْضَوْنَهُ وَإِنَّ اللَّهَ لَعَلِيمٌ حَلِيمٌ
27:19	19	tarḍāhu	that will please You	 وَأَنْ أَعْمَلَ صَالِحًا تَرْضَاهُ وَأَدْخِلْنِي بِرَحْمَتِكَ فِي عِبَادِكَ الصَّالِحِينَ
33:51	23	wayarḍayna	and they may be pleased	 وَلَا يَحْزَنَّ وَيَرْضَيْنَ بِمَا آتَيْتَهُنَّ كُلُّهُنَّ
39:7	8	yarḍā	He likes	 إِنْ تَكْفُرُوا فَإِنَّ اللَّهَ غَنِيٌّ عَنْكُمْ وَلَا يَرْضَىٰ لِعِبَادِهِ الْكُفْرَ
39:7	13	yarḍahu	He likes it	 وَلَا يَرْضَىٰ لِعِبَادِهِ الْكُفْرَ وَإِنْ تَشْكُرُوا يَرْضَهُ لَكُمْ
46:15	35	tarḍāhu	which please You	 وَأَنْ أَعْمَلَ صَالِحًا تَرْضَاهُ وَأَصْلِحْ لِي فِي ذُرِّيَّتِي
48:18	2	raḍiya	Allah was pleased	 لَقَدْ رَضِيَ اللَّهُ عَنِ الْمُؤْمِنِينَ إِذْ يُبَايِعُونَكَ تَحْتَ الشَّجَرَةِ
53:26	18	wayarḍā	and approves	 إِلَّا مِنْ بَعْدِ أَنْ يَأْذَنَ اللَّهُ لِمَنْ يَشَاءُ وَيَرْضَىٰ
58:22	38	raḍiya	Allah is pleased	 رَضِيَ اللَّهُ عَنْهُمْ وَرَضُوا عَنْهُ أُولَٰئِكَ حِزْبُ اللَّهِ
58:22	41	waraḍū	and they are pleased	 رَضِيَ اللَّهُ عَنْهُمْ وَرَضُوا عَنْهُ أُولَٰئِكَ حِزْبُ اللَّهِ
92:21	2	yarḍā	he will be pleased	 وَلَسَوْفَ يَرْضَىٰ
93:5	4	fatarḍā	then you will be satisfied	 وَلَسَوْفَ يُعْطِيكَ رَبُّكَ فَتَرْضَىٰ
98:8	13	raḍiya	(will be) pleased	 رَضِيَ اللَّهُ عَنْهُمْ وَرَضُوا عَنْهُ ذَٰلِكَ لِمَنْ خَشِيَ رَبَّهُ
98:8	16	waraḍū	and they (will be) pleased	 رَضِيَ اللَّهُ عَنْهُمْ وَرَضُوا عَنْهُ ذَٰلِكَ لِمَنْ خَشِيَ رَبَّهُ
9:8	11	yur'ḍūnakum	They satisfy you	 يُرْضُونَكُمْ بِأَفْوَاهِهِمْ وَتَأْبَىٰ قُلُوبُهُمْ وَأَكْثَرُهُمْ فَاسِقُونَ
9:62	4	liyur'ḍūkum	to please you	 يَحْلِفُونَ بِاللَّهِ لَكُمْ لِيُرْضُوكُمْ
9:62	9	yur'ḍūhu	they should please Him	 وَاللَّهُ وَرَسُولُهُ أَحَقُّ أَنْ يُرْضُوهُ إِنْ كَانُوا مُؤْمِنِينَ
2:232	12	tarāḍaw	they agree	 فَلَا تَعْضُلُوهُنَّ أَنْ يَنْكِحْنَ أَزْوَاجَهُنَّ إِذَا تَرَاضَوْا بَيْنَهُمْ بِالْمَعْرُوفِ
4:24	33	tarāḍaytum	you mutually agree	 وَلَا جُنَاحَ عَلَيْكُمْ فِيمَا تَرَاضَيْتُمْ بِهِ مِنْ بَعْدِ الْفَرِيضَةِ
21:28	11	ir'taḍā	He approves	 وَلَا يَشْفَعُونَ إِلَّا لِمَنِ ارْتَضَىٰ وَهُمْ مِنْ خَشْيَتِهِ مُشْفِقُونَ
24:55	20	ir'taḍā	He has approved	 وَلَيُمَكِّنَنَّ لَهُمْ دِينَهُمُ الَّذِي ارْتَضَىٰ لَهُمْ
72:27	3	ir'taḍā	He has approved	 إِلَّا مَنِ ارْتَضَىٰ مِنْ رَسُولٍ فَإِنَّهُ يَسْلُكُ مِنْ بَيْنِ يَدَيْهِ وَمِنْ خَلْفِهِ رَصَدًا
3:15	19	wariḍ'wānun	and approval	 خَالِدِينَ فِيهَا وَأَزْوَاجٌ مُطَهَّرَةٌ وَرِضْوَانٌ مِنَ اللَّهِ
3:162	3	riḍ'wāna	(the) pleasure	 أَفَمَنِ اتَّبَعَ رِضْوَانَ اللَّهِ كَمَنْ بَاءَ بِسَخَطٍ مِنَ اللَّهِ وَمَأْوَاهُ جَهَنَّمُ
3:174	10	riḍ'wāna	(the) pleasure	 وَاتَّبَعُوا رِضْوَانَ اللَّهِ وَاللَّهُ ذُو فَضْلٍ عَظِيمٍ
5:2	23	wariḍ'wānan	and good pleasure	 وَلَا آمِّينَ الْبَيْتَ الْحَرَامَ يَبْتَغُونَ فَضْلًا مِنْ رَبِّهِمْ وَرِضْوَانًا
5:16	6	riḍ'wānahu	His pleasure	 يَهْدِي بِهِ اللَّهُ مَنِ اتَّبَعَ رِضْوَانَهُ سُبُلَ السَّلَامِ
9:21	5	wariḍ'wānin	and Pleasure	 يُبَشِّرُهُمْ رَبُّهُمْ بِرَحْمَةٍ مِنْهُ وَرِضْوَانٍ وَجَنَّاتٍ
9:72	17	wariḍ'wānun	But the pleasure	 وَمَسَاكِنَ طَيِّبَةً فِي جَنَّاتِ عَدْنٍ وَرِضْوَانٌ مِنَ اللَّهِ أَكْبَرُ
9:109	8	wariḍ'wānin	and (His) pleasure	 أَفَمَنْ أَسَّسَ بُنْيَانَهُ عَلَىٰ تَقْوَىٰ مِنَ اللَّهِ وَرِضْوَانٍ خَيْرٌ
47:28	8	riḍ'wānahu	His pleasure	 ذَٰلِكَ بِأَنَّهُمُ اتَّبَعُوا مَا أَسْخَطَ اللَّهَ وَكَرِهُوا رِضْوَانَهُ
48:29	18	wariḍ'wānan	and pleasure	 تَرَاهُمْ رُكَّعًا سُجَّدًا يَبْتَغُونَ فَضْلًا مِنَ اللَّهِ وَرِضْوَانًا
57:20	33	wariḍ'wānun	and Pleasure	 وَفِي الْآخِرَةِ عَذَابٌ شَدِيدٌ وَمَغْفِرَةٌ مِنَ اللَّهِ وَرِضْوَانٌ
57:27	26	riḍ'wāni	(the) pleasure	 مَا كَتَبْنَاهَا عَلَيْهِمْ إِلَّا ابْتِغَاءَ رِضْوَانِ اللَّهِ
59:8	12	wariḍ'wānan	and pleasure	 الَّذِينَ أُخْرِجُوا مِنْ دِيَارِهِمْ وَأَمْوَالِهِمْ يَبْتَغُونَ فَضْلًا مِنَ اللَّهِ وَرِضْوَانًا
19:6	8	raḍiyyan	pleasing	 يَرِثُنِي وَيَرِثُ مِنْ آلِ يَعْقُوبَ وَاجْعَلْهُ رَبِّ رَضِيًّا
2:207	7	marḍāti	pleasure	 وَمِنَ النَّاسِ مَنْ يَشْرِي نَفْسَهُ ابْتِغَاءَ مَرْضَاتِ اللَّهِ
2:265	6	marḍāti	(the) pleasure	 وَمَثَلُ الَّذِينَ يُنْفِقُونَ أَمْوَالَهُمُ ابْتِغَاءَ مَرْضَاتِ اللَّهِ
4:114	21	marḍāti	pleasure	 وَمَنْ يَفْعَلْ ذَٰلِكَ ابْتِغَاءَ مَرْضَاتِ اللَّهِ فَسَوْفَ نُؤْتِيهِ أَجْرًا عَظِيمًا
60:1	32	marḍātī	My Pleasure	 إِنْ كُنْتُمْ خَرَجْتُمْ جِهَادًا فِي سَبِيلِي وَابْتِغَاءَ مَرْضَاتِي
66:1	10	marḍāta	(to) please	 يَا أَيُّهَا النَّبِيُّ لِمَ تُحَرِّمُ مَا أَحَلَّ اللَّهُ لَكَ تَبْتَغِي مَرْضَاتَ أَزْوَاجِكَ
88:9	2	rāḍiyatun	satisfied	 لِسَعْيِهَا رَاضِيَةٌ
89:28	4	rāḍiyatan	well pleased	 ارْجِعِي إِلَىٰ رَبِّكِ رَاضِيَةً مَرْضِيَّةً
69:21	4	rāḍiyatin	pleasant	 فَهُوَ فِي عِيشَةٍ رَاضِيَةٍ
101:7	4	rāḍiyatin	pleasant	 فَهُوَ فِي عِيشَةٍ رَاضِيَةٍ
19:55	9	marḍiyyan	pleasing	 وَكَانَ يَأْمُرُ أَهْلَهُ بِالصَّلَاةِ وَالزَّكَاةِ وَكَانَ عِنْدَ رَبِّهِ مَرْضِيًّا
89:28	5	marḍiyyatan	and pleasing	 ارْجِعِي إِلَىٰ رَبِّكِ رَاضِيَةً مَرْضِيَّةً
2:233	38	tarāḍin	mutual consent	 فَإِنْ أَرَادَا فِصَالًا عَنْ تَرَاضٍ مِنْهُمَا وَتَشَاوُرٍ فَلَا جُنَاحَ عَلَيْهِمَا
4:29	14	tarāḍin	mutual consent	 إِلَّا أَنْ تَكُونَ تِجَارَةً عَنْ تَرَاضٍ مِنْكُمْ
