surah:ayah	position	word	meaning	ayah_link
2:85	41	yuraddūna	they will be sent back	 وَيَوْمَ الْقِيَامَةِ يُرَدُّونَ إِلَىٰ أَشَدِّ الْعَذَابِ
2:109	7	yaruddūnakum	they could turn you back	 وَدَّ كَثِيرٌ مِنْ أَهْلِ الْكِتَابِ لَوْ يَرُدُّونَكُمْ مِنْ بَعْدِ إِيمَانِكُمْ كُفَّارًا
2:217	33	yaruddūkum	they turn you away	 وَلَا يَزَالُونَ يُقَاتِلُونَكُمْ حَتَّىٰ يَرُدُّوكُمْ عَنْ دِينِكُمْ إِنِ اسْتَطَاعُوا
3:100	11	yaruddūkum	they will turn you back	 إِنْ تُطِيعُوا فَرِيقًا مِنَ الَّذِينَ أُوتُوا الْكِتَابَ يَرُدُّوكُمْ بَعْدَ إِيمَانِكُمْ كَافِرِينَ
3:149	8	yaruddūkum	they will turn you back	 إِنْ تُطِيعُوا الَّذِينَ كَفَرُوا يَرُدُّوكُمْ عَلَىٰ أَعْقَابِكُمْ
4:47	16	fanaruddahā	and turn them	 مِنْ قَبْلِ أَنْ نَطْمِسَ وُجُوهًا فَنَرُدَّهَا عَلَىٰ أَدْبَارِهَا
4:59	15	faruddūhu	refer it	 فَإِنْ تَنَازَعْتُمْ فِي شَيْءٍ فَرُدُّوهُ إِلَى اللَّهِ وَالرَّسُولِ
4:83	11	raddūhu	they (had) referred it	 وَلَوْ رَدُّوهُ إِلَى الرَّسُولِ وَإِلَىٰ أُولِي الْأَمْرِ مِنْهُمْ لَعَلِمَهُ الَّذِينَ يَسْتَنْبِطُونَهُ مِنْهُمْ
4:86	8	ruddūhā	return it	 وَإِذَا حُيِّيتُمْ بِتَحِيَّةٍ فَحَيُّوا بِأَحْسَنَ مِنْهَا أَوْ رُدُّوهَا
4:91	10	ruddū	they are returned	 كُلَّ مَا رُدُّوا إِلَى الْفِتْنَةِ أُرْكِسُوا فِيهَا
5:108	11	turadda	will be refuted	 أَوْ يَخَافُوا أَنْ تُرَدَّ أَيْمَانٌ بَعْدَ أَيْمَانِهِمْ
6:27	9	nuraddu	were sent back	 فَقَالُوا يَا لَيْتَنَا نُرَدُّ وَلَا نُكَذِّبَ بِآيَاتِ رَبِّنَا وَنَكُونَ مِنَ الْمُؤْمِنِينَ
6:28	10	ruddū	they were sent back	 وَلَوْ رُدُّوا لَعَادُوا لِمَا نُهُوا عَنْهُ وَإِنَّهُمْ لَكَاذِبُونَ
6:62	2	ruddū	they are returned	 ثُمَّ رُدُّوا إِلَى اللَّهِ مَوْلَاهُمُ الْحَقِّ
6:71	11	wanuraddu	and we turn back	 قُلْ أَنَدْعُو مِنْ دُونِ اللَّهِ مَا لَا يَنْفَعُنَا وَلَا يَضُرُّنَا وَنُرَدُّ عَلَىٰ أَعْقَابِنَا بَعْدَ إِذْ هَدَانَا اللَّهُ
6:147	9	yuraddu	will be turned back	 وَلَا يُرَدُّ بَأْسُهُ عَنِ الْقَوْمِ الْمُجْرِمِينَ
7:53	25	nuraddu	we are sent back	 فَهَلْ لَنَا مِنْ شُفَعَاءَ فَيَشْفَعُوا لَنَا أَوْ نُرَدُّ فَنَعْمَلَ غَيْرَ الَّذِي كُنَّا نَعْمَلُ
9:94	22	turaddūna	you will be brought back	 وَسَيَرَى اللَّهُ عَمَلَكُمْ وَرَسُولُهُ ثُمَّ تُرَدُّونَ إِلَىٰ عَالِمِ الْغَيْبِ وَالشَّهَادَةِ
9:101	19	yuraddūna	they will be returned	 سَنُعَذِّبُهُمْ مَرَّتَيْنِ ثُمَّ يُرَدُّونَ إِلَىٰ عَذَابٍ عَظِيمٍ
9:105	8	wasaturaddūna	And you will be brought back	 وَسَتُرَدُّونَ إِلَىٰ عَالِمِ الْغَيْبِ وَالشَّهَادَةِ فَيُنَبِّئُكُمْ بِمَا كُنْتُمْ تَعْمَلُونَ
10:30	7	waruddū	and they will be returned	 وَرُدُّوا إِلَى اللَّهِ مَوْلَاهُمُ الْحَقِّ
12:65	6	ruddat	returned	 وَلَمَّا فَتَحُوا مَتَاعَهُمْ وَجَدُوا بِضَاعَتَهُمْ رُدَّتْ إِلَيْهِمْ
12:65	14	ruddat	returned	 قَالُوا يَا أَبَانَا مَا نَبْغِي هَٰذِهِ بِضَاعَتُنَا رُدَّتْ إِلَيْنَا
12:110	15	yuraddu	(can) be repelled	 جَاءَهُمْ نَصْرُنَا فَنُجِّيَ مَنْ نَشَاءُ وَلَا يُرَدُّ بَأْسُنَا عَنِ الْقَوْمِ الْمُجْرِمِينَ
14:9	21	faraddū	but they returned	 جَاءَتْهُمْ رُسُلُهُمْ بِالْبَيِّنَاتِ فَرَدُّوا أَيْدِيَهُمْ فِي أَفْوَاهِهِمْ
16:70	7	yuraddu	is sent back	 وَمِنْكُمْ مَنْ يُرَدُّ إِلَىٰ أَرْذَلِ الْعُمُرِ لِكَيْ لَا يَعْلَمَ بَعْدَ عِلْمٍ شَيْئًا
17:6	2	radadnā	We gave back	 ثُمَّ رَدَدْنَا لَكُمُ الْكَرَّةَ عَلَيْهِمْ وَأَمْدَدْنَاكُمْ بِأَمْوَالٍ وَبَنِينَ
18:36	6	rudidttu	I am brought back	 وَلَئِنْ رُدِدْتُ إِلَىٰ رَبِّي لَأَجِدَنَّ خَيْرًا مِنْهَا مُنْقَلَبًا
18:87	8	yuraddu	he will be returned	 قَالَ أَمَّا مَنْ ظَلَمَ فَسَوْفَ نُعَذِّبُهُ ثُمَّ يُرَدُّ إِلَىٰ رَبِّهِ فَيُعَذِّبُهُ عَذَابًا نُكْرًا
22:5	46	yuraddu	is returned	 وَمِنْكُمْ مَنْ يُرَدُّ إِلَىٰ أَرْذَلِ الْعُمُرِ لِكَيْلَا يَعْلَمَ مِنْ بَعْدِ عِلْمٍ شَيْئًا
28:13	1	faradadnāhu	So We restored him	 فَرَدَدْنَاهُ إِلَىٰ أُمِّهِ كَيْ تَقَرَّ عَيْنُهَا وَلَا تَحْزَنَ
33:25	1	waradda	And Allah turned back	 وَرَدَّ اللَّهُ الَّذِينَ كَفَرُوا بِغَيْظِهِمْ لَمْ يَنَالُوا خَيْرًا
38:33	1	ruddūhā	Return them	 رُدُّوهَا عَلَيَّ فَطَفِقَ مَسْحًا بِالسُّوقِ وَالْأَعْنَاقِ
41:47	2	yuraddu	is referred	 إِلَيْهِ يُرَدُّ عِلْمُ السَّاعَةِ
62:8	10	turaddūna	you will be sent back	 ثُمَّ تُرَدُّونَ إِلَىٰ عَالِمِ الْغَيْبِ وَالشَّهَادَةِ فَيُنَبِّئُكُمْ بِمَا كُنْتُمْ تَعْمَلُونَ
95:5	2	radadnāhu	We returned him	 ثُمَّ رَدَدْنَاهُ أَسْفَلَ سَافِلِينَ
9:45	14	yataraddadūna	they waver	 وَارْتَابَتْ قُلُوبُهُمْ فَهُمْ فِي رَيْبِهِمْ يَتَرَدَّدُونَ
2:217	39	yartadid	turns away	 وَمَنْ يَرْتَدِدْ مِنْكُمْ عَنْ دِينِهِ فَيَمُتْ وَهُوَ كَافِرٌ فَأُولَٰئِكَ حَبِطَتْ أَعْمَالُهُمْ فِي الدُّنْيَا وَالْآخِرَةِ
5:21	10	tartaddū	turn	 وَلَا تَرْتَدُّوا عَلَىٰ أَدْبَارِكُمْ فَتَنْقَلِبُوا خَاسِرِينَ
5:54	5	yartadda	turns back	 مَنْ يَرْتَدَّ مِنْكُمْ عَنْ دِينِهِ فَسَوْفَ يَأْتِي اللَّهُ بِقَوْمٍ يُحِبُّهُمْ وَيُحِبُّونَهُ
12:96	8	fa-ir'tadda	then returned (his) sight	 فَلَمَّا أَنْ جَاءَ الْبَشِيرُ أَلْقَاهُ عَلَىٰ وَجْهِهِ فَارْتَدَّ بَصِيرًا
14:43	5	yartaddu	returning	 مُهْطِعِينَ مُقْنِعِي رُءُوسِهِمْ لَا يَرْتَدُّ إِلَيْهِمْ طَرْفُهُمْ
18:64	6	fa-ir'taddā	So they returned	 قَالَ ذَٰلِكَ مَا كُنَّا نَبْغِ فَارْتَدَّا عَلَىٰ آثَارِهِمَا قَصَصًا
27:40	12	yartadda	returns	 أَنَا آتِيكَ بِهِ قَبْلَ أَنْ يَرْتَدَّ إِلَيْكَ طَرْفُكَ
47:25	3	ir'taddū	return	 إِنَّ الَّذِينَ ارْتَدُّوا عَلَىٰ أَدْبَارِهِمْ مِنْ بَعْدِ مَا تَبَيَّنَ لَهُمُ الْهُدَى الشَّيْطَانُ سَوَّلَ لَهُمْ
16:71	11	birāddī	would hand over	 فَمَا الَّذِينَ فُضِّلُوا بِرَادِّي رِزْقِهِمْ عَلَىٰ مَا مَلَكَتْ أَيْمَانُهُمْ
2:228	24	biraddihinna	to take them back	 وَبُعُولَتُهُنَّ أَحَقُّ بِرَدِّهِنَّ فِي ذَٰلِكَ إِنْ أَرَادُوا إِصْلَاحًا
21:40	7	raddahā	to repel it	 فَلَا يَسْتَطِيعُونَ رَدَّهَا وَلَا هُمْ يُنْظَرُونَ
13:11	28	maradda	turning away	 وَإِذَا أَرَادَ اللَّهُ بِقَوْمٍ سُوءًا فَلَا مَرَدَّ لَهُ
19:76	13	maraddan	(for) return	 وَالْبَاقِيَاتُ الصَّالِحَاتُ خَيْرٌ عِنْدَ رَبِّكَ ثَوَابًا وَخَيْرٌ مَرَدًّا
30:43	11	maradda	(can be) averted	 فَأَقِمْ وَجْهَكَ لِلدِّينِ الْقَيِّمِ مِنْ قَبْلِ أَنْ يَأْتِيَ يَوْمٌ لَا مَرَدَّ لَهُ مِنَ اللَّهِ
40:43	15	maraddanā	our return	 وَأَنَّ مَرَدَّنَا إِلَى اللَّهِ وَأَنَّ الْمُسْرِفِينَ هُمْ أَصْحَابُ النَّارِ
42:44	18	maraddin	return	 وَتَرَى الظَّالِمِينَ لَمَّا رَأَوُا الْعَذَابَ يَقُولُونَ هَلْ إِلَىٰ مَرَدٍّ مِنْ سَبِيلٍ
42:47	9	maradda	averting	 اسْتَجِيبُوا لِرَبِّكُمْ مِنْ قَبْلِ أَنْ يَأْتِيَ يَوْمٌ لَا مَرَدَّ لَهُ مِنَ اللَّهِ
10:107	14	rādda	repeller	 وَإِنْ يُرِدْكَ بِخَيْرٍ فَلَا رَادَّ لِفَضْلِهِ
28:7	18	rāddūhu	(will) restore him	 إِنَّا رَادُّوهُ إِلَيْكِ وَجَاعِلُوهُ مِنَ الْمُرْسَلِينَ
28:85	6	larādduka	(will) surely take you back	 إِنَّ الَّذِي فَرَضَ عَلَيْكَ الْقُرْآنَ لَرَادُّكَ إِلَىٰ مَعَادٍ
11:76	14	mardūdin	(be) repelled	 وَإِنَّهُمْ آتِيهِمْ عَذَابٌ غَيْرُ مَرْدُودٍ
79:10	3	lamardūdūna	indeed be returned	 يَقُولُونَ أَإِنَّا لَمَرْدُودُونَ فِي الْحَافِرَةِ
