surah:ayah	position	word	meaning	ayah_link
4:157	13	ṣalabūhu	they crucified him	 وَمَا قَتَلُوهُ وَمَا صَلَبُوهُ وَلَٰكِنْ شُبِّهَ لَهُمْ
12:41	10	fayuṣ'labu	he will be crucified	 وَأَمَّا الْآخَرُ فَيُصْلَبُ فَتَأْكُلُ الطَّيْرُ مِنْ رَأْسِهِ
5:33	14	yuṣallabū	they be crucified	 أَنْ يُقَتَّلُوا أَوْ يُصَلَّبُوا أَوْ تُقَطَّعَ أَيْدِيهِمْ وَأَرْجُلُهُمْ مِنْ خِلَافٍ
7:124	7	la-uṣallibannakum	I will surely crucify you	 لَأُقَطِّعَنَّ أَيْدِيَكُمْ وَأَرْجُلَكُمْ مِنْ خِلَافٍ ثُمَّ لَأُصَلِّبَنَّكُمْ أَجْمَعِينَ
20:71	18	wala-uṣallibannakum	and surely I will crucify you	 وَلَأُصَلِّبَنَّكُمْ فِي جُذُوعِ النَّخْلِ
26:49	20	wala-uṣallibannakum	and I will surely crucify you	 لَأُقَطِّعَنَّ أَيْدِيَكُمْ وَأَرْجُلَكُمْ مِنْ خِلَافٍ وَلَأُصَلِّبَنَّكُمْ أَجْمَعِينَ
4:23	41	aṣlābikum	your loins	 وَحَلَائِلُ أَبْنَائِكُمُ الَّذِينَ مِنْ أَصْلَابِكُمْ
86:7	4	l-ṣul'bi	the backbone	 يَخْرُجُ مِنْ بَيْنِ الصُّلْبِ وَالتَّرَائِبِ
