surah:ayah	position	word	meaning	ayah_link
7:163	20	yasbitūna	they had Sabbath	 وَيَوْمَ لَا يَسْبِتُونَ لَا تَأْتِيهِمْ
25:47	8	subātan	a rest	 وَهُوَ الَّذِي جَعَلَ لَكُمُ اللَّيْلَ لِبَاسًا وَالنَّوْمَ سُبَاتًا
78:9	3	subātan	(for) rest	 وَجَعَلْنَا نَوْمَكُمْ سُبَاتًا
2:65	7	l-sabti	the (matter of) Sabbath	 وَلَقَدْ عَلِمْتُمُ الَّذِينَ اعْتَدَوْا مِنْكُمْ فِي السَّبْتِ
4:47	24	l-sabti	(of) the Sabbath	 فَنَرُدَّهَا عَلَىٰ أَدْبَارِهَا أَوْ نَلْعَنَهُمْ كَمَا لَعَنَّا أَصْحَابَ السَّبْتِ
4:154	15	l-sabti	the Sabbath	 وَقُلْنَا لَهُمْ لَا تَعْدُوا فِي السَّبْتِ وَأَخَذْنَا مِنْهُمْ مِيثَاقًا غَلِيظًا
7:163	11	l-sabti	the (matter of) Sabbath	 وَاسْأَلْهُمْ عَنِ الْقَرْيَةِ الَّتِي كَانَتْ حَاضِرَةَ الْبَحْرِ إِذْ يَعْدُونَ فِي السَّبْتِ
7:163	16	sabtihim	(of) their Sabbath	 إِذْ تَأْتِيهِمْ حِيتَانُهُمْ يَوْمَ سَبْتِهِمْ شُرَّعًا
16:124	3	l-sabtu	the Sabbath	 إِنَّمَا جُعِلَ السَّبْتُ عَلَى الَّذِينَ اخْتَلَفُوا فِيهِ
