surah:ayah	position	word	meaning	ayah_link
3:36	16	sammaytuhā	[I] (have) named her	 وَإِنِّي سَمَّيْتُهَا مَرْيَمَ
7:71	12	sammaytumūhā	you have named them 	 أَتُجَادِلُونَنِي فِي أَسْمَاءٍ سَمَّيْتُمُوهَا أَنْتُمْ وَآبَاؤُكُمْ
12:40	7	sammaytumūhā	which you have named them	 مَا تَعْبُدُونَ مِنْ دُونِهِ إِلَّا أَسْمَاءً سَمَّيْتُمُوهَا أَنْتُمْ وَآبَاؤُكُمْ
13:33	13	sammūhum	Name them	 وَجَعَلُوا لِلَّهِ شُرَكَاءَ قُلْ سَمُّوهُمْ
22:78	19	sammākumu	named you	 هُوَ سَمَّاكُمُ الْمُسْلِمِينَ مِنْ قَبْلُ وَفِي هَٰذَا
53:23	5	sammaytumūhā	you have named them	 إِنْ هِيَ إِلَّا أَسْمَاءٌ سَمَّيْتُمُوهَا أَنْتُمْ وَآبَاؤُكُمْ
53:27	6	layusammūna	surely they name	 إِنَّ الَّذِينَ لَا يُؤْمِنُونَ بِالْآخِرَةِ لَيُسَمُّونَ الْمَلَائِكَةَ تَسْمِيَةَ الْأُنْثَىٰ
76:18	3	tusammā	named	 عَيْنًا فِيهَا تُسَمَّىٰ سَلْسَبِيلًا
1:1	1	bis'mi	In (the) name	 بِسْمِ اللَّهِ الرَّحْمَٰنِ الرَّحِيمِ
2:31	3	l-asmāa	the names 	 وَعَلَّمَ آدَمَ الْأَسْمَاءَ كُلَّهَا ثُمَّ عَرَضَهُمْ عَلَى الْمَلَائِكَةِ
2:31	11	bi-asmāi	of (the) names	 فَقَالَ أَنْبِئُونِي بِأَسْمَاءِ هَٰؤُلَاءِ إِنْ كُنْتُمْ صَادِقِينَ
2:33	4	bi-asmāihim	of their names	 قَالَ يَا آدَمُ أَنْبِئْهُمْ بِأَسْمَائِهِمْ
2:33	7	bi-asmāihim	of their names	 فَلَمَّا أَنْبَأَهُمْ بِأَسْمَائِهِمْ قَالَ أَلَمْ أَقُلْ لَكُمْ إِنِّي أَعْلَمُ غَيْبَ السَّمَاوَاتِ وَالْأَرْضِ
2:114	10	us'muhu	His name	 وَمَنْ أَظْلَمُ مِمَّنْ مَنَعَ مَسَاجِدَ اللَّهِ أَنْ يُذْكَرَ فِيهَا اسْمُهُ
3:45	10	us'muhu	his name	 إِنَّ اللَّهَ يُبَشِّرُكِ بِكَلِمَةٍ مِنْهُ اسْمُهُ الْمَسِيحُ عِيسَى ابْنُ مَرْيَمَ
5:4	23	is'ma	(the) name	 فَكُلُوا مِمَّا أَمْسَكْنَ عَلَيْكُمْ وَاذْكُرُوا اسْمَ اللَّهِ عَلَيْهِ
6:118	4	us'mu	(the) name	 فَكُلُوا مِمَّا ذُكِرَ اسْمُ اللَّهِ عَلَيْهِ إِنْ كُنْتُمْ بِآيَاتِهِ مُؤْمِنِينَ
6:119	7	us'mu	(the) name	 وَمَا لَكُمْ أَلَّا تَأْكُلُوا مِمَّا ذُكِرَ اسْمُ اللَّهِ عَلَيْهِ
6:121	6	us'mu	(the) name	 وَلَا تَأْكُلُوا مِمَّا لَمْ يُذْكَرِ اسْمُ اللَّهِ عَلَيْهِ وَإِنَّهُ لَفِسْقٌ
6:138	18	is'ma	(the) name	 وَأَنْعَامٌ حُرِّمَتْ ظُهُورُهَا وَأَنْعَامٌ لَا يَذْكُرُونَ اسْمَ اللَّهِ عَلَيْهَا افْتِرَاءً عَلَيْهِ
7:71	11	asmāin	names	 أَتُجَادِلُونَنِي فِي أَسْمَاءٍ سَمَّيْتُمُوهَا أَنْتُمْ وَآبَاؤُكُمْ
7:180	2	l-asmāu	(are) the names 	 وَلِلَّهِ الْأَسْمَاءُ الْحُسْنَىٰ فَادْعُوهُ بِهَا
7:180	10	asmāihi	His names	 وَذَرُوا الَّذِينَ يُلْحِدُونَ فِي أَسْمَائِهِ
11:41	4	bis'mi	in the name	 وَقَالَ ارْكَبُوا فِيهَا بِسْمِ اللَّهِ مَجْرَاهَا وَمُرْسَاهَا
12:40	6	asmāan	names	 مَا تَعْبُدُونَ مِنْ دُونِهِ إِلَّا أَسْمَاءً سَمَّيْتُمُوهَا أَنْتُمْ وَآبَاؤُكُمْ
17:110	11	l-asmāu	the Most Beautiful Names	 أَيًّا مَا تَدْعُوا فَلَهُ الْأَسْمَاءُ الْحُسْنَىٰ
19:7	5	us'muhu	his name	 يَا زَكَرِيَّا إِنَّا نُبَشِّرُكَ بِغُلَامٍ اسْمُهُ يَحْيَىٰ لَمْ نَجْعَلْ لَهُ مِنْ قَبْلُ سَمِيًّا
20:8	7	l-asmāu	the Names	 اللَّهُ لَا إِلَٰهَ إِلَّا هُوَ لَهُ الْأَسْمَاءُ الْحُسْنَىٰ
22:28	5	is'ma	(the) name	 لِيَشْهَدُوا مَنَافِعَ لَهُمْ وَيَذْكُرُوا اسْمَ اللَّهِ فِي أَيَّامٍ مَعْلُومَاتٍ
22:34	6	is'ma	(the) name	 وَلِكُلِّ أُمَّةٍ جَعَلْنَا مَنْسَكًا لِيَذْكُرُوا اسْمَ اللَّهِ عَلَىٰ مَا رَزَقَهُمْ مِنْ بَهِيمَةِ الْأَنْعَامِ
22:36	11	is'ma	(the) name	 فَاذْكُرُوا اسْمَ اللَّهِ عَلَيْهَا صَوَافَّ
22:40	25	us'mu	(the) name of Allah	 وَلَوْلَا دَفْعُ اللَّهِ النَّاسَ بَعْضَهُمْ بِبَعْضٍ لَهُدِّمَتْ صَوَامِعُ وَبِيَعٌ وَصَلَوَاتٌ وَمَسَاجِدُ يُذْكَرُ فِيهَا اسْمُ اللَّهِ كَثِيرًا
24:36	9	us'muhu	His name	 فِي بُيُوتٍ أَذِنَ اللَّهُ أَنْ تُرْفَعَ وَيُذْكَرَ فِيهَا اسْمُهُ
27:30	5	bis'mi	In the name	 إِنَّهُ مِنْ سُلَيْمَانَ وَإِنَّهُ بِسْمِ اللَّهِ الرَّحْمَٰنِ الرَّحِيمِ
49:11	30	l-s'mu	the name	 وَلَا تَنَابَزُوا بِالْأَلْقَابِ بِئْسَ الِاسْمُ الْفُسُوقُ بَعْدَ الْإِيمَانِ
53:23	4	asmāon	names	 إِنْ هِيَ إِلَّا أَسْمَاءٌ سَمَّيْتُمُوهَا أَنْتُمْ وَآبَاؤُكُمْ
55:78	2	us'mu	(the) name	 تَبَارَكَ اسْمُ رَبِّكَ ذِي الْجَلَالِ وَالْإِكْرَامِ
56:74	2	bi-is'mi	(the) name	 فَسَبِّحْ بِاسْمِ رَبِّكَ الْعَظِيمِ
56:96	2	bi-is'mi	(the) name	 فَسَبِّحْ بِاسْمِ رَبِّكَ الْعَظِيمِ
59:24	7	l-asmāu	(are) the names	 هُوَ اللَّهُ الْخَالِقُ الْبَارِئُ الْمُصَوِّرُ لَهُ الْأَسْمَاءُ الْحُسْنَىٰ
61:6	23	us'muhu	whose name (will be)	 وَمُبَشِّرًا بِرَسُولٍ يَأْتِي مِنْ بَعْدِي اسْمُهُ أَحْمَدُ
69:52	2	bi-is'mi	(the) name	 فَسَبِّحْ بِاسْمِ رَبِّكَ الْعَظِيمِ
73:8	2	is'ma	(the) name	 وَاذْكُرِ اسْمَ رَبِّكَ وَتَبَتَّلْ إِلَيْهِ تَبْتِيلًا
76:25	2	is'ma	(the) name	 وَاذْكُرِ اسْمَ رَبِّكَ بُكْرَةً وَأَصِيلًا
87:1	2	is'ma	(the) name	 سَبِّحِ اسْمَ رَبِّكَ الْأَعْلَى
87:15	2	is'ma	(the) name	 وَذَكَرَ اسْمَ رَبِّهِ فَصَلَّىٰ
96:1	2	bi-is'mi	in (the) name	 اقْرَأْ بِاسْمِ رَبِّكَ الَّذِي خَلَقَ
2:19	4	l-samāi	the sky	 أَوْ كَصَيِّبٍ مِنَ السَّمَاءِ فِيهِ ظُلُمَاتٌ وَرَعْدٌ وَبَرْقٌ
2:22	6	wal-samāa	and the sky	 الَّذِي جَعَلَ لَكُمُ الْأَرْضَ فِرَاشًا وَالسَّمَاءَ بِنَاءً
2:22	10	l-samāi	the sky	 وَأَنْزَلَ مِنَ السَّمَاءِ مَاءً فَأَخْرَجَ بِهِ مِنَ الثَّمَرَاتِ رِزْقًا لَكُمْ
2:29	12	l-samāi	the heaven	 ثُمَّ اسْتَوَىٰ إِلَى السَّمَاءِ فَسَوَّاهُنَّ سَبْعَ سَمَاوَاتٍ
2:29	15	samāwātin	heavens	 ثُمَّ اسْتَوَىٰ إِلَى السَّمَاءِ فَسَوَّاهُنَّ سَبْعَ سَمَاوَاتٍ
2:33	15	l-samāwāti	(of) the heavens	 قَالَ أَلَمْ أَقُلْ لَكُمْ إِنِّي أَعْلَمُ غَيْبَ السَّمَاوَاتِ وَالْأَرْضِ
2:59	15	l-samāi	the sky	 فَأَنْزَلْنَا عَلَى الَّذِينَ ظَلَمُوا رِجْزًا مِنَ السَّمَاءِ بِمَا كَانُوا يَفْسُقُونَ
2:107	7	l-samāwāti	(of) the heavens	 أَلَمْ تَعْلَمْ أَنَّ اللَّهَ لَهُ مُلْكُ السَّمَاوَاتِ وَالْأَرْضِ
2:116	10	l-samāwāti	the heavens	 وَقَالُوا اتَّخَذَ اللَّهُ وَلَدًا سُبْحَانَهُ بَلْ لَهُ مَا فِي السَّمَاوَاتِ وَالْأَرْضِ
2:117	2	l-samāwāti	(of) the heavens	 بَدِيعُ السَّمَاوَاتِ وَالْأَرْضِ وَإِذَا قَضَىٰ أَمْرًا فَإِنَّمَا يَقُولُ لَهُ كُنْ فَيَكُونُ
2:144	6	l-samāi	the heaven	 قَدْ نَرَىٰ تَقَلُّبَ وَجْهِكَ فِي السَّمَاءِ فَلَنُوَلِّيَنَّكَ قِبْلَةً تَرْضَاهَا
2:164	4	l-samāwāti	(of) the heavens	 إِنَّ فِي خَلْقِ السَّمَاوَاتِ وَالْأَرْضِ وَاخْتِلَافِ اللَّيْلِ وَالنَّهَارِ
2:164	21	l-samāi	the sky	 وَمَا أَنْزَلَ اللَّهُ مِنَ السَّمَاءِ مِنْ مَاءٍ فَأَحْيَا بِهِ الْأَرْضَ بَعْدَ مَوْتِهَا
2:164	39	l-samāi	the sky	 وَتَصْرِيفِ الرِّيَاحِ وَالسَّحَابِ الْمُسَخَّرِ بَيْنَ السَّمَاءِ وَالْأَرْضِ
2:255	16	l-samāwāti	the heavens	 لَا تَأْخُذُهُ سِنَةٌ وَلَا نَوْمٌ لَهُ مَا فِي السَّمَاوَاتِ وَمَا فِي الْأَرْضِ
2:255	43	l-samāwāti	(to) the heavens	 وَسِعَ كُرْسِيُّهُ السَّمَاوَاتِ وَالْأَرْضَ وَلَا يَئُودُهُ حِفْظُهُمَا
2:284	4	l-samāwāti	the heavens	 لِلَّهِ مَا فِي السَّمَاوَاتِ وَمَا فِي الْأَرْضِ
3:5	11	l-samāi	the heaven	 إِنَّ اللَّهَ لَا يَخْفَىٰ عَلَيْهِ شَيْءٌ فِي الْأَرْضِ وَلَا فِي السَّمَاءِ
3:29	14	l-samāwāti	the heavens	 وَيَعْلَمُ مَا فِي السَّمَاوَاتِ وَمَا فِي الْأَرْضِ
3:83	9	l-samāwāti	the heavens	 أَفَغَيْرَ دِينِ اللَّهِ يَبْغُونَ وَلَهُ أَسْلَمَ مَنْ فِي السَّمَاوَاتِ وَالْأَرْضِ
3:109	4	l-samāwāti	the heavens	 وَلِلَّهِ مَا فِي السَّمَاوَاتِ وَمَا فِي الْأَرْضِ وَإِلَى اللَّهِ تُرْجَعُ الْأُمُورُ
3:129	4	l-samāwāti	the heavens	 وَلِلَّهِ مَا فِي السَّمَاوَاتِ وَمَا فِي الْأَرْضِ
3:133	8	l-samāwātu	(is like that of) the heavens	 وَسَارِعُوا إِلَىٰ مَغْفِرَةٍ مِنْ رَبِّكُمْ وَجَنَّةٍ عَرْضُهَا السَّمَاوَاتُ وَالْأَرْضُ
3:180	25	l-samāwāti	(of) the heavens	 وَلِلَّهِ مِيرَاثُ السَّمَاوَاتِ وَالْأَرْضِ وَاللَّهُ بِمَا تَعْمَلُونَ خَبِيرٌ
3:189	3	l-samāwāti	(of) the heavens	 وَلِلَّهِ مُلْكُ السَّمَاوَاتِ وَالْأَرْضِ وَاللَّهُ عَلَىٰ كُلِّ شَيْءٍ قَدِيرٌ
3:190	4	l-samāwāti	(of) the heavens	 إِنَّ فِي خَلْقِ السَّمَاوَاتِ وَالْأَرْضِ وَاخْتِلَافِ اللَّيْلِ وَالنَّهَارِ لَآيَاتٍ لِأُولِي الْأَلْبَابِ
3:191	11	l-samāwāti	(of) the heavens	 وَيَتَفَكَّرُونَ فِي خَلْقِ السَّمَاوَاتِ وَالْأَرْضِ
4:126	4	l-samāwāti	the heavens	 وَلِلَّهِ مَا فِي السَّمَاوَاتِ وَمَا فِي الْأَرْضِ وَكَانَ اللَّهُ بِكُلِّ شَيْءٍ مُحِيطًا
4:131	4	l-samāwāti	the heavens	 وَلِلَّهِ مَا فِي السَّمَاوَاتِ وَمَا فِي الْأَرْضِ وَلَقَدْ وَصَّيْنَا الَّذِينَ أُوتُوا الْكِتَابَ مِنْ قَبْلِكُمْ وَإِيَّاكُمْ أَنِ اتَّقُوا اللَّهَ
4:131	25	l-samāwāti	the heavens	 وَإِنْ تَكْفُرُوا فَإِنَّ لِلَّهِ مَا فِي السَّمَاوَاتِ وَمَا فِي الْأَرْضِ
4:132	4	l-samāwāti	the heavens	 وَلِلَّهِ مَا فِي السَّمَاوَاتِ وَمَا فِي الْأَرْضِ وَكَفَىٰ بِاللَّهِ وَكِيلًا
4:153	9	l-samāi	the heaven	 يَسْأَلُكَ أَهْلُ الْكِتَابِ أَنْ تُنَزِّلَ عَلَيْهِمْ كِتَابًا مِنَ السَّمَاءِ
4:170	18	l-samāwāti	the heavens	 وَإِنْ تَكْفُرُوا فَإِنَّ لِلَّهِ مَا فِي السَّمَاوَاتِ وَالْأَرْضِ
4:171	47	l-samāwāti	the heavens	 لَهُ مَا فِي السَّمَاوَاتِ وَمَا فِي الْأَرْضِ وَكَفَىٰ بِاللَّهِ وَكِيلًا
5:17	31	l-samāwāti	(of) the heavens	 وَلِلَّهِ مُلْكُ السَّمَاوَاتِ وَالْأَرْضِ وَمَا بَيْنَهُمَا يَخْلُقُ مَا يَشَاءُ
5:18	25	l-samāwāti	(of) the heavens	 وَلِلَّهِ مُلْكُ السَّمَاوَاتِ وَالْأَرْضِ وَمَا بَيْنَهُمَا وَإِلَيْهِ الْمَصِيرُ
5:40	7	l-samāwāti	(of) the heavens	 أَلَمْ تَعْلَمْ أَنَّ اللَّهَ لَهُ مُلْكُ السَّمَاوَاتِ وَالْأَرْضِ
5:97	19	l-samāwāti	the heavens	 ذَٰلِكَ لِتَعْلَمُوا أَنَّ اللَّهَ يَعْلَمُ مَا فِي السَّمَاوَاتِ وَمَا فِي الْأَرْضِ
5:112	15	l-samāi	the heaven	 هَلْ يَسْتَطِيعُ رَبُّكَ أَنْ يُنَزِّلَ عَلَيْنَا مَائِدَةً مِنَ السَّمَاءِ
5:114	11	l-samāi	the heaven	 قَالَ عِيسَى ابْنُ مَرْيَمَ اللَّهُمَّ رَبَّنَا أَنْزِلْ عَلَيْنَا مَائِدَةً مِنَ السَّمَاءِ
5:120	3	l-samāwāti	(of) the heavens	 لِلَّهِ مُلْكُ السَّمَاوَاتِ وَالْأَرْضِ وَمَا فِيهِنَّ وَهُوَ عَلَىٰ كُلِّ شَيْءٍ قَدِيرٌ
6:1	5	l-samāwāti	the heavens	 الْحَمْدُ لِلَّهِ الَّذِي خَلَقَ السَّمَاوَاتِ وَالْأَرْضَ
6:3	4	l-samāwāti	the heavens	 وَهُوَ اللَّهُ فِي السَّمَاوَاتِ وَفِي الْأَرْضِ يَعْلَمُ سِرَّكُمْ وَجَهْرَكُمْ
6:6	17	l-samāa	(rain from) the sky	 وَأَرْسَلْنَا السَّمَاءَ عَلَيْهِمْ مِدْرَارًا وَجَعَلْنَا الْأَنْهَارَ تَجْرِي مِنْ تَحْتِهِمْ
6:12	5	l-samāwāti	the heavens	 قُلْ لِمَنْ مَا فِي السَّمَاوَاتِ وَالْأَرْضِ قُلْ لِلَّهِ
6:14	7	l-samāwāti	(of) the heavens	 قُلْ أَغَيْرَ اللَّهِ أَتَّخِذُ وَلِيًّا فَاطِرِ السَّمَاوَاتِ وَالْأَرْضِ
6:35	16	l-samāi	the sky	 فَإِنِ اسْتَطَعْتَ أَنْ تَبْتَغِيَ نَفَقًا فِي الْأَرْضِ أَوْ سُلَّمًا فِي السَّمَاءِ فَتَأْتِيَهُمْ بِآيَةٍ
6:73	4	l-samāwāti	the heavens	 وَهُوَ الَّذِي خَلَقَ السَّمَاوَاتِ وَالْأَرْضَ بِالْحَقِّ
6:75	5	l-samāwāti	(of) the heavens	 وَكَذَٰلِكَ نُرِي إِبْرَاهِيمَ مَلَكُوتَ السَّمَاوَاتِ وَالْأَرْضِ
6:79	6	l-samāwāti	the heavens	 إِنِّي وَجَّهْتُ وَجْهِيَ لِلَّذِي فَطَرَ السَّمَاوَاتِ وَالْأَرْضَ حَنِيفًا
6:99	5	l-samāi	the sky	 وَهُوَ الَّذِي أَنْزَلَ مِنَ السَّمَاءِ مَاءً فَأَخْرَجْنَا بِهِ نَبَاتَ كُلِّ شَيْءٍ
6:101	2	l-samāwāti	(of) the heavens	 بَدِيعُ السَّمَاوَاتِ وَالْأَرْضِ أَنَّىٰ يَكُونُ لَهُ وَلَدٌ وَلَمْ تَكُنْ لَهُ صَاحِبَةٌ
6:125	20	l-samāi	the sky	 فَمَنْ يُرِدِ اللَّهُ أَنْ يَهْدِيَهُ يَشْرَحْ صَدْرَهُ لِلْإِسْلَامِ وَمَنْ يُرِدْ أَنْ يُضِلَّهُ يَجْعَلْ صَدْرَهُ ضَيِّقًا حَرَجًا كَأَنَّمَا يَصَّعَّدُ فِي السَّمَاءِ
7:40	11	l-samāi	(of) the heaven	 إِنَّ الَّذِينَ كَذَّبُوا بِآيَاتِنَا وَاسْتَكْبَرُوا عَنْهَا لَا تُفَتَّحُ لَهُمْ أَبْوَابُ السَّمَاءِ
7:54	6	l-samāwāti	the heavens	 إِنَّ رَبَّكُمُ اللَّهُ الَّذِي خَلَقَ السَّمَاوَاتِ وَالْأَرْضَ فِي سِتَّةِ أَيَّامٍ
7:96	11	l-samāi	the heaven	 وَلَوْ أَنَّ أَهْلَ الْقُرَىٰ آمَنُوا وَاتَّقَوْا لَفَتَحْنَا عَلَيْهِمْ بَرَكَاتٍ مِنَ السَّمَاءِ وَالْأَرْضِ
7:158	12	l-samāwāti	(of) the heavens	 إِنِّي رَسُولُ اللَّهِ إِلَيْكُمْ جَمِيعًا الَّذِي لَهُ مُلْكُ السَّمَاوَاتِ وَالْأَرْضِ
7:162	14	l-samāi	the sky	 فَأَرْسَلْنَا عَلَيْهِمْ رِجْزًا مِنَ السَّمَاءِ بِمَا كَانُوا يَظْلِمُونَ
7:185	5	l-samāwāti	(of) the heavens	 أَوَلَمْ يَنْظُرُوا فِي مَلَكُوتِ السَّمَاوَاتِ وَالْأَرْضِ
7:187	18	l-samāwāti	the heavens	 ثَقُلَتْ فِي السَّمَاوَاتِ وَالْأَرْضِ لَا تَأْتِيكُمْ إِلَّا بَغْتَةً
8:11	9	l-samāi	the sky	 إِذْ يُغَشِّيكُمُ النُّعَاسَ أَمَنَةً مِنْهُ وَيُنَزِّلُ عَلَيْكُمْ مِنَ السَّمَاءِ مَاءً
8:32	15	l-samāi	the sky	 إِنْ كَانَ هَٰذَا هُوَ الْحَقَّ مِنْ عِنْدِكَ فَأَمْطِرْ عَلَيْنَا حِجَارَةً مِنَ السَّمَاءِ
9:36	14	l-samāwāti	the heavens	 فِي كِتَابِ اللَّهِ يَوْمَ خَلَقَ السَّمَاوَاتِ وَالْأَرْضَ مِنْهَا أَرْبَعَةٌ حُرُمٌ
9:116	5	l-samāwāti	(of) the heavens	 إِنَّ اللَّهَ لَهُ مُلْكُ السَّمَاوَاتِ وَالْأَرْضِ يُحْيِي وَيُمِيتُ
10:3	6	l-samāwāti	the heavens	 إِنَّ رَبَّكُمُ اللَّهُ الَّذِي خَلَقَ السَّمَاوَاتِ وَالْأَرْضَ فِي سِتَّةِ أَيَّامٍ
10:6	10	l-samāwāti	the heavens	 إِنَّ فِي اخْتِلَافِ اللَّيْلِ وَالنَّهَارِ وَمَا خَلَقَ اللَّهُ فِي السَّمَاوَاتِ وَالْأَرْضِ لَآيَاتٍ لِقَوْمٍ يَتَّقُونَ
10:18	22	l-samāwāti	the heavens	 قُلْ أَتُنَبِّئُونَ اللَّهَ بِمَا لَا يَعْلَمُ فِي السَّمَاوَاتِ وَلَا فِي الْأَرْضِ
10:24	8	l-samāi	the sky	 إِنَّمَا مَثَلُ الْحَيَاةِ الدُّنْيَا كَمَاءٍ أَنْزَلْنَاهُ مِنَ السَّمَاءِ فَاخْتَلَطَ بِهِ نَبَاتُ الْأَرْضِ
10:31	5	l-samāi	the sky	 قُلْ مَنْ يَرْزُقُكُمْ مِنَ السَّمَاءِ وَالْأَرْضِ أَمَّنْ يَمْلِكُ السَّمْعَ وَالْأَبْصَارَ
10:55	6	l-samāwāti	the heavens	 أَلَا إِنَّ لِلَّهِ مَا فِي السَّمَاوَاتِ وَالْأَرْضِ أَلَا إِنَّ وَعْدَ اللَّهِ حَقٌّ
10:61	32	l-samāi	the heavens	 وَمَا يَعْزُبُ عَنْ رَبِّكَ مِنْ مِثْقَالِ ذَرَّةٍ فِي الْأَرْضِ وَلَا فِي السَّمَاءِ
10:66	6	l-samāwāti	the heavens	 أَلَا إِنَّ لِلَّهِ مَنْ فِي السَّمَاوَاتِ وَمَنْ فِي الْأَرْضِ
10:68	11	l-samāwāti	the heavens	 سُبْحَانَهُ هُوَ الْغَنِيُّ لَهُ مَا فِي السَّمَاوَاتِ وَمَا فِي الْأَرْضِ
10:101	5	l-samāwāti	the heavens	 قُلِ انْظُرُوا مَاذَا فِي السَّمَاوَاتِ وَالْأَرْضِ
11:7	4	l-samāwāti	the heavens	 وَهُوَ الَّذِي خَلَقَ السَّمَاوَاتِ وَالْأَرْضَ فِي سِتَّةِ أَيَّامٍ
11:44	5	wayāsamāu	and O sky	 وَقِيلَ يَا أَرْضُ ابْلَعِي مَاءَكِ وَيَا سَمَاءُ أَقْلِعِي
11:52	8	l-samāa	(from) the sky (rain)	 وَيَا قَوْمِ اسْتَغْفِرُوا رَبَّكُمْ ثُمَّ تُوبُوا إِلَيْهِ يُرْسِلِ السَّمَاءَ عَلَيْكُمْ مِدْرَارًا
11:107	5	l-samāwātu	the heavens	 خَالِدِينَ فِيهَا مَا دَامَتِ السَّمَاوَاتُ وَالْأَرْضُ إِلَّا مَا شَاءَ رَبُّكَ
11:108	10	l-samāwātu	the heavens	 خَالِدِينَ فِيهَا مَا دَامَتِ السَّمَاوَاتُ وَالْأَرْضُ
11:123	3	l-samāwāti	(of) the heavens	 وَلِلَّهِ غَيْبُ السَّمَاوَاتِ وَالْأَرْضِ وَإِلَيْهِ يُرْجَعُ الْأَمْرُ كُلُّهُ
12:101	11	l-samāwāti	(of) the heavens	 فَاطِرَ السَّمَاوَاتِ وَالْأَرْضِ أَنْتَ وَلِيِّي فِي الدُّنْيَا وَالْآخِرَةِ
12:105	5	l-samāwāti	the heavens	 وَكَأَيِّنْ مِنْ آيَةٍ فِي السَّمَاوَاتِ وَالْأَرْضِ يَمُرُّونَ عَلَيْهَا
13:2	4	l-samāwāti	the heavens	 اللَّهُ الَّذِي رَفَعَ السَّمَاوَاتِ بِغَيْرِ عَمَدٍ تَرَوْنَهَا
13:15	5	l-samāwāti	the heavens	 وَلِلَّهِ يَسْجُدُ مَنْ فِي السَّمَاوَاتِ وَالْأَرْضِ طَوْعًا وَكَرْهًا
13:16	4	l-samāwāti	(of) the heavens	 قُلْ مَنْ رَبُّ السَّمَاوَاتِ وَالْأَرْضِ قُلِ اللَّهُ
13:17	3	l-samāi	the sky	 أَنْزَلَ مِنَ السَّمَاءِ مَاءً فَسَالَتْ أَوْدِيَةٌ بِقَدَرِهَا
14:2	6	l-samāwāti	the heavens	 اللَّهِ الَّذِي لَهُ مَا فِي السَّمَاوَاتِ وَمَا فِي الْأَرْضِ
14:10	7	l-samāwāti	(of) the heavens	 أَفِي اللَّهِ شَكٌّ فَاطِرِ السَّمَاوَاتِ وَالْأَرْضِ
14:19	6	l-samāwāti	the heavens	 أَلَمْ تَرَ أَنَّ اللَّهَ خَلَقَ السَّمَاوَاتِ وَالْأَرْضَ بِالْحَقِّ
14:24	15	l-samāi	the sky	 كَلِمَةً طَيِّبَةً كَشَجَرَةٍ طَيِّبَةٍ أَصْلُهَا ثَابِتٌ وَفَرْعُهَا فِي السَّمَاءِ
14:32	4	l-samāwāti	the heavens	 اللَّهُ الَّذِي خَلَقَ السَّمَاوَاتِ وَالْأَرْضَ وَأَنْزَلَ مِنَ السَّمَاءِ مَاءً
14:32	8	l-samāi	the sky	 وَأَنْزَلَ مِنَ السَّمَاءِ مَاءً فَأَخْرَجَ بِهِ مِنَ الثَّمَرَاتِ رِزْقًا لَكُمْ
14:38	18	l-samāi	the heaven	 وَمَا يَخْفَىٰ عَلَى اللَّهِ مِنْ شَيْءٍ فِي الْأَرْضِ وَلَا فِي السَّمَاءِ
14:48	6	wal-samāwātu	and the heavens	 يَوْمَ تُبَدَّلُ الْأَرْضُ غَيْرَ الْأَرْضِ وَالسَّمَاوَاتُ
15:14	6	l-samāi	the heaven	 وَلَوْ فَتَحْنَا عَلَيْهِمْ بَابًا مِنَ السَّمَاءِ فَظَلُّوا فِيهِ يَعْرُجُونَ
15:16	4	l-samāi	the heavens	 وَلَقَدْ جَعَلْنَا فِي السَّمَاءِ بُرُوجًا وَزَيَّنَّاهَا لِلنَّاظِرِينَ
15:22	6	l-samāi	the sky	 وَأَرْسَلْنَا الرِّيَاحَ لَوَاقِحَ فَأَنْزَلْنَا مِنَ السَّمَاءِ مَاءً فَأَسْقَيْنَاكُمُوهُ
15:85	3	l-samāwāti	the heavens	 وَمَا خَلَقْنَا السَّمَاوَاتِ وَالْأَرْضَ وَمَا بَيْنَهُمَا إِلَّا بِالْحَقِّ
16:3	2	l-samāwāti	the heavens	 خَلَقَ السَّمَاوَاتِ وَالْأَرْضَ بِالْحَقِّ تَعَالَىٰ عَمَّا يُشْرِكُونَ
16:10	5	l-samāi	the sky	 هُوَ الَّذِي أَنْزَلَ مِنَ السَّمَاءِ مَاءً لَكُمْ مِنْهُ شَرَابٌ
