surah:ayah	position	word	meaning	ayah_link
16:49	5	l-samāwāti	the heavens	 وَلِلَّهِ يَسْجُدُ مَا فِي السَّمَاوَاتِ وَمَا فِي الْأَرْضِ مِنْ دَابَّةٍ
16:52	4	l-samāwāti	the heavens	 وَلَهُ مَا فِي السَّمَاوَاتِ وَالْأَرْضِ وَلَهُ الدِّينُ وَاصِبًا
16:65	4	l-samāi	the sky	 وَاللَّهُ أَنْزَلَ مِنَ السَّمَاءِ مَاءً فَأَحْيَا بِهِ الْأَرْضَ بَعْدَ مَوْتِهَا
16:73	11	l-samāwāti	the heavens	 وَيَعْبُدُونَ مِنْ دُونِ اللَّهِ مَا لَا يَمْلِكُ لَهُمْ رِزْقًا مِنَ السَّمَاوَاتِ وَالْأَرْضِ شَيْئًا
16:77	3	l-samāwāti	(of) the heavens	 وَلِلَّهِ غَيْبُ السَّمَاوَاتِ وَالْأَرْضِ
16:79	8	l-samāi	(of) the sky	 أَلَمْ يَرَوْا إِلَى الطَّيْرِ مُسَخَّرَاتٍ فِي جَوِّ السَّمَاءِ مَا يُمْسِكُهُنَّ إِلَّا اللَّهُ
17:44	3	l-samāwātu	the seven heavens	 تُسَبِّحُ لَهُ السَّمَاوَاتُ السَّبْعُ وَالْأَرْضُ وَمَنْ فِيهِنَّ
17:55	5	l-samāwāti	the heavens	 وَرَبُّكَ أَعْلَمُ بِمَنْ فِي السَّمَاوَاتِ وَالْأَرْضِ
17:92	3	l-samāa	the sky	 أَوْ تُسْقِطَ السَّمَاءَ كَمَا زَعَمْتَ عَلَيْنَا كِسَفًا
17:93	10	l-samāi	the sky	 أَوْ يَكُونَ لَكَ بَيْتٌ مِنْ زُخْرُفٍ أَوْ تَرْقَىٰ فِي السَّمَاءِ
17:95	12	l-samāi	the heaven	 لَنَزَّلْنَا عَلَيْهِمْ مِنَ السَّمَاءِ مَلَكًا رَسُولًا
17:99	7	l-samāwāti	the heavens	 أَوَلَمْ يَرَوْا أَنَّ اللَّهَ الَّذِي خَلَقَ السَّمَاوَاتِ وَالْأَرْضَ قَادِرٌ عَلَىٰ أَنْ يَخْلُقَ مِثْلَهُمْ
17:102	9	l-samāwāti	(of) the heavens	 مَا أَنْزَلَ هَٰؤُلَاءِ إِلَّا رَبُّ السَّمَاوَاتِ وَالْأَرْضِ بَصَائِرَ
18:14	9	l-samāwāti	(of) the heavens	 فَقَالُوا رَبُّنَا رَبُّ السَّمَاوَاتِ وَالْأَرْضِ
18:26	8	l-samāwāti	(of) the heavens	 قُلِ اللَّهُ أَعْلَمُ بِمَا لَبِثُوا لَهُ غَيْبُ السَّمَاوَاتِ وَالْأَرْضِ
18:40	12	l-samāi	the sky	 وَيُرْسِلَ عَلَيْهَا حُسْبَانًا مِنَ السَّمَاءِ فَتُصْبِحَ صَعِيدًا زَلَقًا
18:45	9	l-samāi	the sky	 وَاضْرِبْ لَهُمْ مَثَلَ الْحَيَاةِ الدُّنْيَا كَمَاءٍ أَنْزَلْنَاهُ مِنَ السَّمَاءِ
18:51	4	l-samāwāti	(of) the heavens	 مَا أَشْهَدْتُهُمْ خَلْقَ السَّمَاوَاتِ وَالْأَرْضِ وَلَا خَلْقَ أَنْفُسِهِمْ
19:65	2	l-samāwāti	(of) the heavens	 رَبُّ السَّمَاوَاتِ وَالْأَرْضِ وَمَا بَيْنَهُمَا فَاعْبُدْهُ وَاصْطَبِرْ لِعِبَادَتِهِ
19:90	2	l-samāwātu	the heavens	 تَكَادُ السَّمَاوَاتُ يَتَفَطَّرْنَ مِنْهُ وَتَنْشَقُّ الْأَرْضُ وَتَخِرُّ الْجِبَالُ هَدًّا
19:93	5	l-samāwāti	the heavens	 إِنْ كُلُّ مَنْ فِي السَّمَاوَاتِ وَالْأَرْضِ إِلَّا آتِي الرَّحْمَٰنِ عَبْدًا
20:4	5	wal-samāwāti	and the heavens	 تَنْزِيلًا مِمَّنْ خَلَقَ الْأَرْضَ وَالسَّمَاوَاتِ الْعُلَى
20:6	4	l-samāwāti	the heavens	 لَهُ مَا فِي السَّمَاوَاتِ وَمَا فِي الْأَرْضِ وَمَا بَيْنَهُمَا وَمَا تَحْتَ الثَّرَىٰ
20:53	12	l-samāi	the sky	 وَأَنْزَلَ مِنَ السَّمَاءِ مَاءً فَأَخْرَجْنَا بِهِ أَزْوَاجًا مِنْ نَبَاتٍ شَتَّىٰ
21:4	6	l-samāi	the heavens	 قَالَ رَبِّي يَعْلَمُ الْقَوْلَ فِي السَّمَاءِ وَالْأَرْضِ
21:16	3	l-samāa	the heavens	 وَمَا خَلَقْنَا السَّمَاءَ وَالْأَرْضَ وَمَا بَيْنَهُمَا لَاعِبِينَ
21:19	4	l-samāwāti	the heavens	 وَلَهُ مَنْ فِي السَّمَاوَاتِ وَالْأَرْضِ
21:30	6	l-samāwāti	the heavens	 أَوَلَمْ يَرَ الَّذِينَ كَفَرُوا أَنَّ السَّمَاوَاتِ وَالْأَرْضَ كَانَتَا رَتْقًا فَفَتَقْنَاهُمَا
21:32	2	l-samāa	the sky	 وَجَعَلْنَا السَّمَاءَ سَقْفًا مَحْفُوظًا وَهُمْ عَنْ آيَاتِهَا مُعْرِضُونَ
21:56	5	l-samāwāti	(of) the heavens	 قَالَ بَلْ رَبُّكُمْ رَبُّ السَّمَاوَاتِ وَالْأَرْضِ الَّذِي فَطَرَهُنَّ
21:104	3	l-samāa	the heaven	 يَوْمَ نَطْوِي السَّمَاءَ كَطَيِّ السِّجِلِّ لِلْكُتُبِ
22:15	14	l-samāi	the sky	 فَلْيَمْدُدْ بِسَبَبٍ إِلَى السَّمَاءِ ثُمَّ لْيَقْطَعْ فَلْيَنْظُرْ هَلْ يُذْهِبَنَّ كَيْدُهُ مَا يَغِيظُ
22:18	9	l-samāwāti	the heavens	 أَلَمْ تَرَ أَنَّ اللَّهَ يَسْجُدُ لَهُ مَنْ فِي السَّمَاوَاتِ وَمَنْ فِي الْأَرْضِ
22:31	12	l-samāi	the sky	 وَمَنْ يُشْرِكْ بِاللَّهِ فَكَأَنَّمَا خَرَّ مِنَ السَّمَاءِ فَتَخْطَفُهُ الطَّيْرُ
22:63	7	l-samāi	the sky	 أَلَمْ تَرَ أَنَّ اللَّهَ أَنْزَلَ مِنَ السَّمَاءِ مَاءً فَتُصْبِحُ الْأَرْضُ مُخْضَرَّةً
22:64	4	l-samāwāti	the heavens	 لَهُ مَا فِي السَّمَاوَاتِ وَمَا فِي الْأَرْضِ وَإِنَّ اللَّهَ لَهُوَ الْغَنِيُّ الْحَمِيدُ
22:65	16	l-samāa	the sky	 وَيُمْسِكُ السَّمَاءَ أَنْ تَقَعَ عَلَى الْأَرْضِ إِلَّا بِإِذْنِهِ
22:70	8	l-samāi	the heaven	 أَلَمْ تَعْلَمْ أَنَّ اللَّهَ يَعْلَمُ مَا فِي السَّمَاءِ وَالْأَرْضِ
23:18	3	l-samāi	the sky	 وَأَنْزَلْنَا مِنَ السَّمَاءِ مَاءً بِقَدَرٍ فَأَسْكَنَّاهُ فِي الْأَرْضِ
23:71	6	l-samāwātu	the heavens	 وَلَوِ اتَّبَعَ الْحَقُّ أَهْوَاءَهُمْ لَفَسَدَتِ السَّمَاوَاتُ وَالْأَرْضُ وَمَنْ فِيهِنَّ
23:86	4	l-samāwāti	(of) the seven heavens	 قُلْ مَنْ رَبُّ السَّمَاوَاتِ السَّبْعِ وَرَبُّ الْعَرْشِ الْعَظِيمِ
24:35	3	l-samāwāti	(of) the heavens	 اللَّهُ نُورُ السَّمَاوَاتِ وَالْأَرْضِ
24:41	9	l-samāwāti	the heavens	 أَلَمْ تَرَ أَنَّ اللَّهَ يُسَبِّحُ لَهُ مَنْ فِي السَّمَاوَاتِ وَالْأَرْضِ
24:42	3	l-samāwāti	(of) the heavens	 وَلِلَّهِ مُلْكُ السَّمَاوَاتِ وَالْأَرْضِ وَإِلَى اللَّهِ الْمَصِيرُ
24:43	20	l-samāi	(the) sky	 وَيُنَزِّلُ مِنَ السَّمَاءِ مِنْ جِبَالٍ فِيهَا مِنْ بَرَدٍ
24:64	6	l-samāwāti	the heavens	 أَلَا إِنَّ لِلَّهِ مَا فِي السَّمَاوَاتِ وَالْأَرْضِ
25:2	4	l-samāwāti	(of) the heavens	 الَّذِي لَهُ مُلْكُ السَّمَاوَاتِ وَالْأَرْضِ وَلَمْ يَتَّخِذْ وَلَدًا
25:6	7	l-samāwāti	the heavens	 قُلْ أَنْزَلَهُ الَّذِي يَعْلَمُ السِّرَّ فِي السَّمَاوَاتِ وَالْأَرْضِ
25:25	3	l-samāu	the heavens	 وَيَوْمَ تَشَقَّقُ السَّمَاءُ بِالْغَمَامِ وَنُزِّلَ الْمَلَائِكَةُ تَنْزِيلًا
25:48	11	l-samāi	the sky	 وَأَنْزَلْنَا مِنَ السَّمَاءِ مَاءً طَهُورًا
25:59	3	l-samāwāti	the heavens	 الَّذِي خَلَقَ السَّمَاوَاتِ وَالْأَرْضَ وَمَا بَيْنَهُمَا فِي سِتَّةِ أَيَّامٍ
25:61	5	l-samāi	the skies	 تَبَارَكَ الَّذِي جَعَلَ فِي السَّمَاءِ بُرُوجًا وَجَعَلَ فِيهَا سِرَاجًا
26:4	6	l-samāi	the sky	 إِنْ نَشَأْ نُنَزِّلْ عَلَيْهِمْ مِنَ السَّمَاءِ آيَةً فَظَلَّتْ أَعْنَاقُهُمْ لَهَا خَاضِعِينَ
26:24	3	l-samāwāti	(of) the heavens	 قَالَ رَبُّ السَّمَاوَاتِ وَالْأَرْضِ وَمَا بَيْنَهُمَا إِنْ كُنْتُمْ مُوقِنِينَ
26:187	5	l-samāi	the sky	 فَأَسْقِطْ عَلَيْنَا كِسَفًا مِنَ السَّمَاءِ إِنْ كُنْتَ مِنَ الصَّادِقِينَ
27:25	8	l-samāwāti	the heavens	 أَلَّا يَسْجُدُوا لِلَّهِ الَّذِي يُخْرِجُ الْخَبْءَ فِي السَّمَاوَاتِ وَالْأَرْضِ
27:60	3	l-samāwāti	the heavens	 أَمَّنْ خَلَقَ السَّمَاوَاتِ وَالْأَرْضَ وَأَنْزَلَ لَكُمْ مِنَ السَّمَاءِ مَاءً
27:60	8	l-samāi	the sky	 وَأَنْزَلَ لَكُمْ مِنَ السَّمَاءِ مَاءً فَأَنْبَتْنَا بِهِ حَدَائِقَ ذَاتَ بَهْجَةٍ
27:64	9	l-samāi	the heavens	 أَمَّنْ يَبْدَأُ الْخَلْقَ ثُمَّ يُعِيدُهُ وَمَنْ يَرْزُقُكُمْ مِنَ السَّمَاءِ وَالْأَرْضِ
27:65	6	l-samāwāti	the heavens	 قُلْ لَا يَعْلَمُ مَنْ فِي السَّمَاوَاتِ وَالْأَرْضِ الْغَيْبَ إِلَّا اللَّهُ
27:75	5	l-samāi	the heavens	 وَمَا مِنْ غَائِبَةٍ فِي السَّمَاءِ وَالْأَرْضِ إِلَّا فِي كِتَابٍ مُبِينٍ
27:87	8	l-samāwāti	the heavens	 وَيَوْمَ يُنْفَخُ فِي الصُّورِ فَفَزِعَ مَنْ فِي السَّمَاوَاتِ وَمَنْ فِي الْأَرْضِ
29:22	8	l-samāi	the heaven	 وَمَا أَنْتُمْ بِمُعْجِزِينَ فِي الْأَرْضِ وَلَا فِي السَّمَاءِ
29:34	9	l-samāi	(the) sky	 إِنَّا مُنْزِلُونَ عَلَىٰ أَهْلِ هَٰذِهِ الْقَرْيَةِ رِجْزًا مِنَ السَّمَاءِ
29:44	3	l-samāwāti	the heavens	 خَلَقَ اللَّهُ السَّمَاوَاتِ وَالْأَرْضَ بِالْحَقِّ
29:52	10	l-samāwāti	the heavens	 قُلْ كَفَىٰ بِاللَّهِ بَيْنِي وَبَيْنَكُمْ شَهِيدًا يَعْلَمُ مَا فِي السَّمَاوَاتِ وَالْأَرْضِ
29:61	5	l-samāwāti	the heavens	 وَلَئِنْ سَأَلْتَهُمْ مَنْ خَلَقَ السَّمَاوَاتِ وَالْأَرْضَ وَسَخَّرَ الشَّمْسَ وَالْقَمَرَ لَيَقُولُنَّ اللَّهُ
29:63	6	l-samāi	the sky	 وَلَئِنْ سَأَلْتَهُمْ مَنْ نَزَّلَ مِنَ السَّمَاءِ مَاءً فَأَحْيَا بِهِ الْأَرْضَ مِنْ بَعْدِ مَوْتِهَا لَيَقُولُنَّ اللَّهُ
30:8	8	l-samāwāti	the heavens	 مَا خَلَقَ اللَّهُ السَّمَاوَاتِ وَالْأَرْضَ وَمَا بَيْنَهُمَا إِلَّا بِالْحَقِّ
30:18	4	l-samāwāti	the heavens	 وَلَهُ الْحَمْدُ فِي السَّمَاوَاتِ وَالْأَرْضِ وَعَشِيًّا وَحِينَ تُظْهِرُونَ
30:22	4	l-samāwāti	(of) the heavens	 وَمِنْ آيَاتِهِ خَلْقُ السَّمَاوَاتِ وَالْأَرْضِ وَاخْتِلَافُ أَلْسِنَتِكُمْ
30:24	9	l-samāi	the sky	 وَيُنَزِّلُ مِنَ السَّمَاءِ مَاءً فَيُحْيِي بِهِ الْأَرْضَ بَعْدَ مَوْتِهَا
30:25	5	l-samāu	the heavens	 وَمِنْ آيَاتِهِ أَنْ تَقُومَ السَّمَاءُ وَالْأَرْضُ بِأَمْرِهِ
30:26	4	l-samāwāti	the heavens	 وَلَهُ مَنْ فِي السَّمَاوَاتِ وَالْأَرْضِ كُلٌّ لَهُ قَانِتُونَ
30:27	14	l-samāwāti	the heavens	 وَلَهُ الْمَثَلُ الْأَعْلَىٰ فِي السَّمَاوَاتِ وَالْأَرْضِ وَهُوَ الْعَزِيزُ الْحَكِيمُ
30:48	9	l-samāi	the sky	 فَتُثِيرُ سَحَابًا فَيَبْسُطُهُ فِي السَّمَاءِ كَيْفَ يَشَاءُ
31:10	2	l-samāwāti	the heavens	 خَلَقَ السَّمَاوَاتِ بِغَيْرِ عَمَدٍ تَرَوْنَهَا
31:10	20	l-samāi	the sky	 وَأَنْزَلْنَا مِنَ السَّمَاءِ مَاءً فَأَنْبَتْنَا فِيهَا مِنْ كُلِّ زَوْجٍ كَرِيمٍ
31:16	14	l-samāwāti	the heavens	 فَتَكُنْ فِي صَخْرَةٍ أَوْ فِي السَّمَاوَاتِ أَوْ فِي الْأَرْضِ يَأْتِ بِهَا اللَّهُ
31:20	9	l-samāwāti	the heavens	 أَلَمْ تَرَوْا أَنَّ اللَّهَ سَخَّرَ لَكُمْ مَا فِي السَّمَاوَاتِ وَمَا فِي الْأَرْضِ
31:25	5	l-samāwāti	the heavens	 وَلَئِنْ سَأَلْتَهُمْ مَنْ خَلَقَ السَّمَاوَاتِ وَالْأَرْضَ لَيَقُولُنَّ اللَّهُ
31:26	4	l-samāwāti	the heavens	 لِلَّهِ مَا فِي السَّمَاوَاتِ وَالْأَرْضِ إِنَّ اللَّهَ هُوَ الْغَنِيُّ الْحَمِيدُ
32:4	4	l-samāwāti	the heavens	 اللَّهُ الَّذِي خَلَقَ السَّمَاوَاتِ وَالْأَرْضَ وَمَا بَيْنَهُمَا فِي سِتَّةِ أَيَّامٍ
32:5	4	l-samāi	the heaven	 يُدَبِّرُ الْأَمْرَ مِنَ السَّمَاءِ إِلَى الْأَرْضِ
33:72	5	l-samāwāti	the heavens	 إِنَّا عَرَضْنَا الْأَمَانَةَ عَلَى السَّمَاوَاتِ وَالْأَرْضِ وَالْجِبَالِ
34:1	7	l-samāwāti	the heavens	 الْحَمْدُ لِلَّهِ الَّذِي لَهُ مَا فِي السَّمَاوَاتِ وَمَا فِي الْأَرْضِ
34:2	12	l-samāi	the heaven	 يَعْلَمُ مَا يَلِجُ فِي الْأَرْضِ وَمَا يَخْرُجُ مِنْهَا وَمَا يَنْزِلُ مِنَ السَّمَاءِ وَمَا يَعْرُجُ فِيهَا
34:3	19	l-samāwāti	the heavens	 لَا يَعْزُبُ عَنْهُ مِثْقَالُ ذَرَّةٍ فِي السَّمَاوَاتِ وَلَا فِي الْأَرْضِ
34:9	10	l-samāi	the heaven	 أَفَلَمْ يَرَوْا إِلَىٰ مَا بَيْنَ أَيْدِيهِمْ وَمَا خَلْفَهُمْ مِنَ السَّمَاءِ وَالْأَرْضِ
34:9	22	l-samāi	the sky	 إِنْ نَشَأْ نَخْسِفْ بِهِمُ الْأَرْضَ أَوْ نُسْقِطْ عَلَيْهِمْ كِسَفًا مِنَ السَّمَاءِ
34:22	13	l-samāwāti	the heavens	 لَا يَمْلِكُونَ مِثْقَالَ ذَرَّةٍ فِي السَّمَاوَاتِ وَلَا فِي الْأَرْضِ
34:24	5	l-samāwāti	the heavens	 قُلْ مَنْ يَرْزُقُكُمْ مِنَ السَّمَاوَاتِ وَالْأَرْضِ قُلِ اللَّهُ
35:1	4	l-samāwāti	(of) the heavens	 الْحَمْدُ لِلَّهِ فَاطِرِ السَّمَاوَاتِ وَالْأَرْضِ جَاعِلِ الْمَلَائِكَةِ رُسُلًا
35:3	14	l-samāi	the sky	 هَلْ مِنْ خَالِقٍ غَيْرُ اللَّهِ يَرْزُقُكُمْ مِنَ السَّمَاءِ وَالْأَرْضِ
35:27	7	l-samāi	the sky	 أَلَمْ تَرَ أَنَّ اللَّهَ أَنْزَلَ مِنَ السَّمَاءِ مَاءً
35:38	5	l-samāwāti	(of) the heavens	 إِنَّ اللَّهَ عَالِمُ غَيْبِ السَّمَاوَاتِ وَالْأَرْضِ
35:40	18	l-samāwāti	the heavens	 مَاذَا خَلَقُوا مِنَ الْأَرْضِ أَمْ لَهُمْ شِرْكٌ فِي السَّمَاوَاتِ
35:41	4	l-samāwāti	the heavens	 إِنَّ اللَّهَ يُمْسِكُ السَّمَاوَاتِ وَالْأَرْضَ أَنْ تَزُولَا
35:44	23	l-samāwāti	the heavens	 وَمَا كَانَ اللَّهُ لِيُعْجِزَهُ مِنْ شَيْءٍ فِي السَّمَاوَاتِ وَلَا فِي الْأَرْضِ
36:28	10	l-samāi	the heaven	 وَمَا أَنْزَلْنَا عَلَىٰ قَوْمِهِ مِنْ بَعْدِهِ مِنْ جُنْدٍ مِنَ السَّمَاءِ وَمَا كُنَّا مُنْزِلِينَ
36:81	4	l-samāwāti	the heavens	 أَوَلَيْسَ الَّذِي خَلَقَ السَّمَاوَاتِ وَالْأَرْضَ بِقَادِرٍ عَلَىٰ أَنْ يَخْلُقَ مِثْلَهُمْ
37:5	2	l-samāwāti	(of) the heavens	 رَبُّ السَّمَاوَاتِ وَالْأَرْضِ وَمَا بَيْنَهُمَا وَرَبُّ الْمَشَارِقِ
37:6	3	l-samāa	the sky	 إِنَّا زَيَّنَّا السَّمَاءَ الدُّنْيَا بِزِينَةٍ الْكَوَاكِبِ
38:10	4	l-samāwāti	(of) the heavens	 أَمْ لَهُمْ مُلْكُ السَّمَاوَاتِ وَالْأَرْضِ وَمَا بَيْنَهُمَا
38:27	3	l-samāa	the heaven	 وَمَا خَلَقْنَا السَّمَاءَ وَالْأَرْضَ وَمَا بَيْنَهُمَا بَاطِلًا
38:66	2	l-samāwāti	(of) the heavens	 رَبُّ السَّمَاوَاتِ وَالْأَرْضِ وَمَا بَيْنَهُمَا الْعَزِيزُ الْغَفَّارُ
39:5	2	l-samāwāti	the heavens	 خَلَقَ السَّمَاوَاتِ وَالْأَرْضَ بِالْحَقِّ
39:21	7	l-samāi	the sky	 أَلَمْ تَرَ أَنَّ اللَّهَ أَنْزَلَ مِنَ السَّمَاءِ مَاءً فَسَلَكَهُ يَنَابِيعَ فِي الْأَرْضِ
39:38	5	l-samāwāti	the heavens	 وَلَئِنْ سَأَلْتَهُمْ مَنْ خَلَقَ السَّمَاوَاتِ وَالْأَرْضَ لَيَقُولُنَّ اللَّهُ
39:44	7	l-samāwāti	(of) the heavens	 قُلْ لِلَّهِ الشَّفَاعَةُ جَمِيعًا لَهُ مُلْكُ السَّمَاوَاتِ وَالْأَرْضِ
39:46	4	l-samāwāti	(of) the heavens	 قُلِ اللَّهُمَّ فَاطِرَ السَّمَاوَاتِ وَالْأَرْضِ عَالِمَ الْغَيْبِ وَالشَّهَادَةِ
39:63	3	l-samāwāti	(of) the heavens	 لَهُ مَقَالِيدُ السَّمَاوَاتِ وَالْأَرْضِ
39:67	11	wal-samāwātu	and the heavens	 وَالسَّمَاوَاتُ مَطْوِيَّاتٌ بِيَمِينِهِ سُبْحَانَهُ وَتَعَالَىٰ
39:68	7	l-samāwāti	the heavens	 وَنُفِخَ فِي الصُّورِ فَصَعِقَ مَنْ فِي السَّمَاوَاتِ وَمَنْ فِي الْأَرْضِ
40:13	8	l-samāi	the sky	 هُوَ الَّذِي يُرِيكُمْ آيَاتِهِ وَيُنَزِّلُ لَكُمْ مِنَ السَّمَاءِ رِزْقًا
40:37	2	l-samāwāti	(to) the heavens	 أَسْبَابَ السَّمَاوَاتِ فَأَطَّلِعَ إِلَىٰ إِلَٰهِ مُوسَىٰ وَإِنِّي لَأَظُنُّهُ كَاذِبًا
40:57	2	l-samāwāti	(of) the heavens	 لَخَلْقُ السَّمَاوَاتِ وَالْأَرْضِ أَكْبَرُ مِنْ خَلْقِ النَّاسِ
40:64	7	wal-samāa	and the sky	 اللَّهُ الَّذِي جَعَلَ لَكُمُ الْأَرْضَ قَرَارًا وَالسَّمَاءَ بِنَاءً
41:11	4	l-samāi	the heaven	 ثُمَّ اسْتَوَىٰ إِلَى السَّمَاءِ وَهِيَ دُخَانٌ
41:12	3	samāwātin	heavens	 فَقَضَاهُنَّ سَبْعَ سَمَاوَاتٍ فِي يَوْمَيْنِ وَأَوْحَىٰ فِي كُلِّ سَمَاءٍ أَمْرَهَا
41:12	9	samāin	heaven	 فَقَضَاهُنَّ سَبْعَ سَمَاوَاتٍ فِي يَوْمَيْنِ وَأَوْحَىٰ فِي كُلِّ سَمَاءٍ أَمْرَهَا
41:12	12	l-samāa	the heaven	 وَزَيَّنَّا السَّمَاءَ الدُّنْيَا بِمَصَابِيحَ وَحِفْظًا
42:4	4	l-samāwāti	the heavens	 لَهُ مَا فِي السَّمَاوَاتِ وَمَا فِي الْأَرْضِ وَهُوَ الْعَلِيُّ الْعَظِيمُ
42:5	2	l-samāwātu	the heavens	 تَكَادُ السَّمَاوَاتُ يَتَفَطَّرْنَ مِنْ فَوْقِهِنَّ
42:11	2	l-samāwāti	(of) the heavens	 فَاطِرُ السَّمَاوَاتِ وَالْأَرْضِ جَعَلَ لَكُمْ مِنْ أَنْفُسِكُمْ أَزْوَاجًا
42:12	3	l-samāwāti	(of) the heavens	 لَهُ مَقَالِيدُ السَّمَاوَاتِ وَالْأَرْضِ يَبْسُطُ الرِّزْقَ لِمَنْ يَشَاءُ وَيَقْدِرُ
42:29	4	l-samāwāti	(of) the heavens	 وَمِنْ آيَاتِهِ خَلْقُ السَّمَاوَاتِ وَالْأَرْضِ وَمَا بَثَّ فِيهِمَا مِنْ دَابَّةٍ
42:49	3	l-samāwāti	(of) the heavens	 لِلَّهِ مُلْكُ السَّمَاوَاتِ وَالْأَرْضِ يَخْلُقُ مَا يَشَاءُ
42:53	7	l-samāwāti	the heavens	 صِرَاطِ اللَّهِ الَّذِي لَهُ مَا فِي السَّمَاوَاتِ وَمَا فِي الْأَرْضِ
43:9	5	l-samāwāti	the heavens	 وَلَئِنْ سَأَلْتَهُمْ مَنْ خَلَقَ السَّمَاوَاتِ وَالْأَرْضَ لَيَقُولُنَّ خَلَقَهُنَّ الْعَزِيزُ الْعَلِيمُ
43:11	4	l-samāi	the sky	 وَالَّذِي نَزَّلَ مِنَ السَّمَاءِ مَاءً بِقَدَرٍ
43:82	3	l-samāwāti	(of) the heavens	 سُبْحَانَ رَبِّ السَّمَاوَاتِ وَالْأَرْضِ رَبِّ الْعَرْشِ عَمَّا يَصِفُونَ
43:84	4	l-samāi	the heaven 	 وَهُوَ الَّذِي فِي السَّمَاءِ إِلَٰهٌ وَفِي الْأَرْضِ إِلَٰهٌ
43:85	5	l-samāwāti	(of) the heavens	 وَتَبَارَكَ الَّذِي لَهُ مُلْكُ السَّمَاوَاتِ وَالْأَرْضِ وَمَا بَيْنَهُمَا
44:7	2	l-samāwāti	(of) the heavens	 رَبِّ السَّمَاوَاتِ وَالْأَرْضِ وَمَا بَيْنَهُمَا إِنْ كُنْتُمْ مُوقِنِينَ
44:10	4	l-samāu	the sky	 فَارْتَقِبْ يَوْمَ تَأْتِي السَّمَاءُ بِدُخَانٍ مُبِينٍ
44:29	4	l-samāu	the heaven	 فَمَا بَكَتْ عَلَيْهِمُ السَّمَاءُ وَالْأَرْضُ وَمَا كَانُوا مُنْظَرِينَ
44:38	3	l-samāwāti	the heavens	 وَمَا خَلَقْنَا السَّمَاوَاتِ وَالْأَرْضَ وَمَا بَيْنَهُمَا لَاعِبِينَ
45:3	3	l-samāwāti	the heavens	 إِنَّ فِي السَّمَاوَاتِ وَالْأَرْضِ لَآيَاتٍ لِلْمُؤْمِنِينَ
45:5	8	l-samāi	the sky	 وَاخْتِلَافِ اللَّيْلِ وَالنَّهَارِ وَمَا أَنْزَلَ اللَّهُ مِنَ السَّمَاءِ مِنْ رِزْقٍ فَأَحْيَا بِهِ الْأَرْضَ بَعْدَ مَوْتِهَا وَتَصْرِيفِ الرِّيَاحِ آيَاتٌ لِقَوْمٍ يَعْقِلُونَ
45:13	5	l-samāwāti	the heavens	 وَسَخَّرَ لَكُمْ مَا فِي السَّمَاوَاتِ وَمَا فِي الْأَرْضِ
45:22	3	l-samāwāti	the heavens	 وَخَلَقَ اللَّهُ السَّمَاوَاتِ وَالْأَرْضَ بِالْحَقِّ وَلِتُجْزَىٰ كُلُّ نَفْسٍ بِمَا كَسَبَتْ
45:27	3	l-samāwāti	(of) the heavens	 وَلِلَّهِ مُلْكُ السَّمَاوَاتِ وَالْأَرْضِ
45:36	4	l-samāwāti	(of) the heavens	 فَلِلَّهِ الْحَمْدُ رَبِّ السَّمَاوَاتِ وَرَبِّ الْأَرْضِ رَبِّ الْعَالَمِينَ
45:37	4	l-samāwāti	the heavens	 وَلَهُ الْكِبْرِيَاءُ فِي السَّمَاوَاتِ وَالْأَرْضِ وَهُوَ الْعَزِيزُ الْحَكِيمُ
46:3	3	l-samāwāti	the heavens	 مَا خَلَقْنَا السَّمَاوَاتِ وَالْأَرْضَ وَمَا بَيْنَهُمَا إِلَّا بِالْحَقِّ
46:4	17	l-samāwāti	the heavens	 مَاذَا خَلَقُوا مِنَ الْأَرْضِ أَمْ لَهُمْ شِرْكٌ فِي السَّمَاوَاتِ
