surah:ayah	position	word	meaning	ayah_link
2:182	2	khāfa	fears	 فَمَنْ خَافَ مِنْ مُوصٍ جَنَفًا أَوْ إِثْمًا فَأَصْلَحَ بَيْنَهُمْ فَلَا إِثْمَ عَلَيْهِ
2:229	18	yakhāfā	both fear	 وَلَا يَحِلُّ لَكُمْ أَنْ تَأْخُذُوا مِمَّا آتَيْتُمُوهُنَّ شَيْئًا إِلَّا أَنْ يَخَافَا أَلَّا يُقِيمَا حُدُودَ اللَّهِ
2:229	24	khif'tum	you fear	 فَإِنْ خِفْتُمْ أَلَّا يُقِيمَا حُدُودَ اللَّهِ فَلَا جُنَاحَ عَلَيْهِمَا فِيمَا افْتَدَتْ بِهِ
2:239	2	khif'tum	you fear	 فَإِنْ خِفْتُمْ فَرِجَالًا أَوْ رُكْبَانًا
3:175	7	takhāfūhum	fear them	 فَلَا تَخَافُوهُمْ وَخَافُونِ إِنْ كُنْتُمْ مُؤْمِنِينَ
3:175	8	wakhāfūni	but fear Me	 إِنَّمَا ذَٰلِكُمُ الشَّيْطَانُ يُخَوِّفُ أَوْلِيَاءَهُ فَلَا تَخَافُوهُمْ وَخَافُونِ إِنْ كُنْتُمْ مُؤْمِنِينَ
4:3	2	khif'tum	you fear	 وَإِنْ خِفْتُمْ أَلَّا تُقْسِطُوا فِي الْيَتَامَىٰ فَانْكِحُوا مَا طَابَ لَكُمْ مِنَ النِّسَاءِ مَثْنَىٰ وَثُلَاثَ وَرُبَاعَ
4:3	17	khif'tum	you fear	 فَإِنْ خِفْتُمْ أَلَّا تَعْدِلُوا فَوَاحِدَةً أَوْ مَا مَلَكَتْ أَيْمَانُكُمْ
4:9	9	khāfū	(and) they would have feared	 وَلْيَخْشَ الَّذِينَ لَوْ تَرَكُوا مِنْ خَلْفِهِمْ ذُرِّيَّةً ضِعَافًا خَافُوا عَلَيْهِمْ فَلْيَتَّقُوا اللَّهَ
4:34	23	takhāfūna	you fear	 وَاللَّاتِي تَخَافُونَ نُشُوزَهُنَّ فَعِظُوهُنَّ وَاهْجُرُوهُنَّ فِي الْمَضَاجِعِ
4:35	2	khif'tum	you fear	 وَإِنْ خِفْتُمْ شِقَاقَ بَيْنِهِمَا فَابْعَثُوا حَكَمًا مِنْ أَهْلِهِ وَحَكَمًا مِنْ أَهْلِهَا
4:101	13	khif'tum	you fear	 فَلَيْسَ عَلَيْكُمْ جُنَاحٌ أَنْ تَقْصُرُوا مِنَ الصَّلَاةِ إِنْ خِفْتُمْ أَنْ يَفْتِنَكُمُ الَّذِينَ كَفَرُوا
4:128	3	khāfat	fears	 وَإِنِ امْرَأَةٌ خَافَتْ مِنْ بَعْلِهَا نُشُوزًا أَوْ إِعْرَاضًا فَلَا جُنَاحَ عَلَيْهِمَا أَنْ يُصْلِحَا بَيْنَهُمَا صُلْحًا
5:23	5	yakhāfūna	feared (Allah)	 قَالَ رَجُلَانِ مِنَ الَّذِينَ يَخَافُونَ أَنْعَمَ اللَّهُ عَلَيْهِمَا ادْخُلُوا عَلَيْهِمُ الْبَابَ
5:28	13	akhāfu	fear	 لَئِنْ بَسَطْتَ إِلَيَّ يَدَكَ لِتَقْتُلَنِي مَا أَنَا بِبَاسِطٍ يَدِيَ إِلَيْكَ لِأَقْتُلَكَ إِنِّي أَخَافُ اللَّهَ رَبَّ الْعَالَمِينَ
5:54	26	yakhāfūna	fearing	 يُجَاهِدُونَ فِي سَبِيلِ اللَّهِ وَلَا يَخَافُونَ لَوْمَةَ لَائِمٍ
5:94	15	yakhāfuhu	fears Him	 لَيَبْلُوَنَّكُمُ اللَّهُ بِشَيْءٍ مِنَ الصَّيْدِ تَنَالُهُ أَيْدِيكُمْ وَرِمَاحُكُمْ لِيَعْلَمَ اللَّهُ مَنْ يَخَافُهُ بِالْغَيْبِ
5:108	9	yakhāfū	they would fear	 ذَٰلِكَ أَدْنَىٰ أَنْ يَأْتُوا بِالشَّهَادَةِ عَلَىٰ وَجْهِهَا أَوْ يَخَافُوا أَنْ تُرَدَّ أَيْمَانٌ بَعْدَ أَيْمَانِهِمْ
6:15	3	akhāfu	[I] fear	 قُلْ إِنِّي أَخَافُ إِنْ عَصَيْتُ رَبِّي عَذَابَ يَوْمٍ عَظِيمٍ
6:51	4	yakhāfūna	fear	 وَأَنْذِرْ بِهِ الَّذِينَ يَخَافُونَ أَنْ يُحْشَرُوا إِلَىٰ رَبِّهِمْ
6:80	10	akhāfu	(do) I fear	 وَلَا أَخَافُ مَا تُشْرِكُونَ بِهِ إِلَّا أَنْ يَشَاءَ رَبِّي شَيْئًا
6:81	2	akhāfu	could I fear	 وَكَيْفَ أَخَافُ مَا أَشْرَكْتُمْ وَلَا تَخَافُونَ أَنَّكُمْ أَشْرَكْتُمْ بِاللَّهِ مَا لَمْ يُنَزِّلْ بِهِ عَلَيْكُمْ سُلْطَانًا
6:81	6	takhāfūna	you fear	 وَكَيْفَ أَخَافُ مَا أَشْرَكْتُمْ وَلَا تَخَافُونَ أَنَّكُمْ أَشْرَكْتُمْ بِاللَّهِ
7:59	16	akhāfu	[I] fear	 إِنِّي أَخَافُ عَلَيْكُمْ عَذَابَ يَوْمٍ عَظِيمٍ
8:26	8	takhāfūna	fearing	 وَاذْكُرُوا إِذْ أَنْتُمْ قَلِيلٌ مُسْتَضْعَفُونَ فِي الْأَرْضِ تَخَافُونَ أَنْ يَتَخَطَّفَكُمُ النَّاسُ فَآوَاكُمْ
8:48	32	akhāfu	[I] fear	 إِنِّي بَرِيءٌ مِنْكُمْ إِنِّي أَرَىٰ مَا لَا تَرَوْنَ إِنِّي أَخَافُ اللَّهَ
8:58	2	takhāfanna	you fear	 وَإِمَّا تَخَافَنَّ مِنْ قَوْمٍ خِيَانَةً فَانْبِذْ إِلَيْهِمْ عَلَىٰ سَوَاءٍ
9:28	15	khif'tum	you fear	 وَإِنْ خِفْتُمْ عَيْلَةً فَسَوْفَ يُغْنِيكُمُ اللَّهُ مِنْ فَضْلِهِ إِنْ شَاءَ
10:15	33	akhāfu	[I] fear	 إِنِّي أَخَافُ إِنْ عَصَيْتُ رَبِّي عَذَابَ يَوْمٍ عَظِيمٍ
11:3	21	akhāfu	fear	 وَإِنْ تَوَلَّوْا فَإِنِّي أَخَافُ عَلَيْكُمْ عَذَابَ يَوْمٍ كَبِيرٍ
11:26	7	akhāfu	[I] fear	 إِنِّي أَخَافُ عَلَيْكُمْ عَذَابَ يَوْمٍ أَلِيمٍ
11:70	13	takhaf	fear	 قَالُوا لَا تَخَفْ إِنَّا أُرْسِلْنَا إِلَىٰ قَوْمِ لُوطٍ
11:84	22	akhāfu	fear	 إِنِّي أَرَاكُمْ بِخَيْرٍ وَإِنِّي أَخَافُ عَلَيْكُمْ عَذَابَ يَوْمٍ مُحِيطٍ
11:103	6	khāfa	fear	 إِنَّ فِي ذَٰلِكَ لَآيَةً لِمَنْ خَافَ عَذَابَ الْآخِرَةِ
12:13	7	wa-akhāfu	and I fear	 قَالَ إِنِّي لَيَحْزُنُنِي أَنْ تَذْهَبُوا بِهِ وَأَخَافُ أَنْ يَأْكُلَهُ الذِّئْبُ
13:21	11	wayakhāfūna	and are afraid	 وَالَّذِينَ يَصِلُونَ مَا أَمَرَ اللَّهُ بِهِ أَنْ يُوصَلَ وَيَخْشَوْنَ رَبَّهُمْ وَيَخَافُونَ سُوءَ الْحِسَابِ
14:14	7	khāfa	fears	 وَلَنُسْكِنَنَّكُمُ الْأَرْضَ مِنْ بَعْدِهِمْ ذَٰلِكَ لِمَنْ خَافَ مَقَامِي
14:14	9	wakhāfa	and fears	 وَخَافَ وَعِيدِ
16:50	1	yakhāfūna	They fear	 يَخَافُونَ رَبَّهُمْ مِنْ فَوْقِهِمْ وَيَفْعَلُونَ مَا يُؤْمَرُونَ
17:57	12	wayakhāfūna	and fear	 يَبْتَغُونَ إِلَىٰ رَبِّهِمُ الْوَسِيلَةَ أَيُّهُمْ أَقْرَبُ وَيَرْجُونَ رَحْمَتَهُ وَيَخَافُونَ عَذَابَهُ
19:5	2	khif'tu	[I] fear	 وَإِنِّي خِفْتُ الْمَوَالِيَ مِنْ وَرَائِي وَكَانَتِ امْرَأَتِي عَاقِرًا
19:45	3	akhāfu	[I] fear	 يَا أَبَتِ إِنِّي أَخَافُ أَنْ يَمَسَّكَ عَذَابٌ مِنَ الرَّحْمَٰنِ فَتَكُونَ لِلشَّيْطَانِ وَلِيًّا
20:21	4	takhaf	fear	 قَالَ خُذْهَا وَلَا تَخَفْ سَنُعِيدُهَا سِيرَتَهَا الْأُولَىٰ
20:45	4	nakhāfu	fear	 قَالَا رَبَّنَا إِنَّنَا نَخَافُ أَنْ يَفْرُطَ عَلَيْنَا أَوْ أَنْ يَطْغَىٰ
20:46	3	takhāfā	fear	 قَالَ لَا تَخَافَا إِنَّنِي مَعَكُمَا أَسْمَعُ وَأَرَىٰ
20:68	3	takhaf	fear	 قُلْنَا لَا تَخَفْ إِنَّكَ أَنْتَ الْأَعْلَىٰ
20:77	15	takhāfu	fearing	 فَاضْرِبْ لَهُمْ طَرِيقًا فِي الْبَحْرِ يَبَسًا لَا تَخَافُ دَرَكًا وَلَا تَخْشَىٰ
20:112	8	yakhāfu	he will fear	 وَمَنْ يَعْمَلْ مِنَ الصَّالِحَاتِ وَهُوَ مُؤْمِنٌ فَلَا يَخَافُ ظُلْمًا وَلَا هَضْمًا
24:37	14	yakhāfūna	They fear	 يَخَافُونَ يَوْمًا تَتَقَلَّبُ فِيهِ الْقُلُوبُ وَالْأَبْصَارُ
24:50	7	yakhāfūna	they fear	 أَفِي قُلُوبِهِمْ مَرَضٌ أَمِ ارْتَابُوا أَمْ يَخَافُونَ أَنْ يَحِيفَ اللَّهُ عَلَيْهِمْ وَرَسُولُهُ
26:12	4	akhāfu	[I] fear	 قَالَ رَبِّ إِنِّي أَخَافُ أَنْ يُكَذِّبُونِ
26:14	4	fa-akhāfu	so I fear	 وَلَهُمْ عَلَيَّ ذَنْبٌ فَأَخَافُ أَنْ يَقْتُلُونِ
26:21	4	khif'tukum	I feared you	 فَفَرَرْتُ مِنْكُمْ لَمَّا خِفْتُكُمْ فَوَهَبَ لِي رَبِّي حُكْمًا
26:135	2	akhāfu	[I] fear	 إِنِّي أَخَافُ عَلَيْكُمْ عَذَابَ يَوْمٍ عَظِيمٍ
27:10	14	takhaf	fear	 يَا مُوسَىٰ لَا تَخَفْ إِنِّي لَا يَخَافُ لَدَيَّ الْمُرْسَلُونَ
27:10	17	yakhāfu	fear	 يَا مُوسَىٰ لَا تَخَفْ إِنِّي لَا يَخَافُ لَدَيَّ الْمُرْسَلُونَ
28:7	8	khif'ti	you fear	 فَإِذَا خِفْتِ عَلَيْهِ فَأَلْقِيهِ فِي الْيَمِّ وَلَا تَخَافِي وَلَا تَحْزَنِي
28:7	14	takhāfī	fear	 فَإِذَا خِفْتِ عَلَيْهِ فَأَلْقِيهِ فِي الْيَمِّ وَلَا تَخَافِي وَلَا تَحْزَنِي
28:25	22	takhaf	fear	 فَلَمَّا جَاءَهُ وَقَصَّ عَلَيْهِ الْقَصَصَ قَالَ لَا تَخَفْ
28:31	16	takhaf	fear	 يَا مُوسَىٰ أَقْبِلْ وَلَا تَخَفْ إِنَّكَ مِنَ الْآمِنِينَ
28:33	7	fa-akhāfu	and I fear	 قَالَ رَبِّ إِنِّي قَتَلْتُ مِنْهُمْ نَفْسًا فَأَخَافُ أَنْ يَقْتُلُونِ
28:34	12	akhāfu	I fear	 فَأَرْسِلْهُ مَعِيَ رِدْءًا يُصَدِّقُنِي إِنِّي أَخَافُ أَنْ يُكَذِّبُونِ
29:33	13	takhaf	fear	 وَقَالُوا لَا تَخَفْ وَلَا تَحْزَنْ إِنَّا مُنَجُّوكَ وَأَهْلَكَ إِلَّا امْرَأَتَكَ
30:28	20	takhāfūnahum	you fear them	 فَأَنْتُمْ فِيهِ سَوَاءٌ تَخَافُونَهُمْ كَخِيفَتِكُمْ أَنْفُسَكُمْ
38:22	9	takhaf	fear	 إِذْ دَخَلُوا عَلَىٰ دَاوُودَ فَفَزِعَ مِنْهُمْ قَالُوا لَا تَخَفْ
39:13	3	akhāfu	[I] fear	 قُلْ إِنِّي أَخَافُ إِنْ عَصَيْتُ رَبِّي عَذَابَ يَوْمٍ عَظِيمٍ
40:26	9	akhāfu	[I] fear	 إِنِّي أَخَافُ أَنْ يُبَدِّلَ دِينَكُمْ أَوْ أَنْ يُظْهِرَ فِي الْأَرْضِ الْفَسَادَ
40:30	6	akhāfu	[I] fear	 وَقَالَ الَّذِي آمَنَ يَا قَوْمِ إِنِّي أَخَافُ عَلَيْكُمْ مِثْلَ يَوْمِ الْأَحْزَابِ
40:32	3	akhāfu	[I] fear	 وَيَا قَوْمِ إِنِّي أَخَافُ عَلَيْكُمْ يَوْمَ التَّنَادِ
41:30	12	takhāfū	fear	 تَتَنَزَّلُ عَلَيْهِمُ الْمَلَائِكَةُ أَلَّا تَخَافُوا وَلَا تَحْزَنُوا
46:21	21	akhāfu	[I] fear	 أَلَّا تَعْبُدُوا إِلَّا اللَّهَ إِنِّي أَخَافُ عَلَيْكُمْ عَذَابَ يَوْمٍ عَظِيمٍ
48:27	18	takhāfūna	fearing	 مُحَلِّقِينَ رُءُوسَكُمْ وَمُقَصِّرِينَ لَا تَخَافُونَ
50:45	12	yakhāfu	fears	 فَذَكِّرْ بِالْقُرْآنِ مَنْ يَخَافُ وَعِيدِ
51:28	6	takhaf	fear	 فَأَوْجَسَ مِنْهُمْ خِيفَةً قَالُوا لَا تَخَفْ وَبَشَّرُوهُ بِغُلَامٍ عَلِيمٍ
51:37	5	yakhāfūna	fear	 وَتَرَكْنَا فِيهَا آيَةً لِلَّذِينَ يَخَافُونَ الْعَذَابَ الْأَلِيمَ
55:46	2	khāfa	fears	 وَلِمَنْ خَافَ مَقَامَ رَبِّهِ جَنَّتَانِ
59:16	14	akhāfu	I fear	 فَلَمَّا كَفَرَ قَالَ إِنِّي بَرِيءٌ مِنْكَ إِنِّي أَخَافُ اللَّهَ رَبَّ الْعَالَمِينَ
72:13	11	yakhāfu	he will fear	 فَمَنْ يُؤْمِنْ بِرَبِّهِ فَلَا يَخَافُ بَخْسًا وَلَا رَهَقًا
74:53	4	yakhāfūna	they fear	 كَلَّا بَلْ لَا يَخَافُونَ الْآخِرَةَ
76:7	3	wayakhāfūna	and fear	 يُوفُونَ بِالنَّذْرِ وَيَخَافُونَ يَوْمًا كَانَ شَرُّهُ مُسْتَطِيرًا
76:10	2	nakhāfu	fear	 إِنَّا نَخَافُ مِنْ رَبِّنَا يَوْمًا عَبُوسًا قَمْطَرِيرًا
79:40	3	khāfa	feared	 وَأَمَّا مَنْ خَافَ مَقَامَ رَبِّهِ وَنَهَى النَّفْسَ عَنِ الْهَوَىٰ
91:15	2	yakhāfu	He fears	 وَلَا يَخَافُ عُقْبَاهَا
3:175	4	yukhawwifu	frightens (you)	 إِنَّمَا ذَٰلِكُمُ الشَّيْطَانُ يُخَوِّفُ أَوْلِيَاءَهُ فَلَا تَخَافُوهُمْ
17:60	20	wanukhawwifuhum	And We threaten them	 وَنُخَوِّفُهُمْ فَمَا يَزِيدُهُمْ إِلَّا طُغْيَانًا كَبِيرًا
39:16	11	yukhawwifu	threatens	 ذَٰلِكَ يُخَوِّفُ اللَّهُ بِهِ عِبَادَهُ يَا عِبَادِ فَاتَّقُونِ
39:36	5	wayukhawwifūnaka	And they threaten you	 وَيُخَوِّفُونَكَ بِالَّذِينَ مِنْ دُونِهِ
2:38	13	khawfun	fear	 فَمَنْ تَبِعَ هُدَايَ فَلَا خَوْفٌ عَلَيْهِمْ وَلَا هُمْ يَحْزَنُونَ
2:62	20	khawfun	fear	 فَلَهُمْ أَجْرُهُمْ عِنْدَ رَبِّهِمْ وَلَا خَوْفٌ عَلَيْهِمْ وَلَا هُمْ يَحْزَنُونَ
2:112	13	khawfun	fear	 بَلَىٰ مَنْ أَسْلَمَ وَجْهَهُ لِلَّهِ وَهُوَ مُحْسِنٌ فَلَهُ أَجْرُهُ عِنْدَ رَبِّهِ وَلَا خَوْفٌ عَلَيْهِمْ وَلَا هُمْ يَحْزَنُونَ
2:155	4	l-khawfi	[the] fear	 وَلَنَبْلُوَنَّكُمْ بِشَيْءٍ مِنَ الْخَوْفِ وَالْجُوعِ وَنَقْصٍ مِنَ الْأَمْوَالِ
2:262	20	khawfun	fear	 لَهُمْ أَجْرُهُمْ عِنْدَ رَبِّهِمْ وَلَا خَوْفٌ عَلَيْهِمْ وَلَا هُمْ يَحْزَنُونَ
2:274	13	khawfun	fear	 فَلَهُمْ أَجْرُهُمْ عِنْدَ رَبِّهِمْ وَلَا خَوْفٌ عَلَيْهِمْ وَلَا هُمْ يَحْزَنُونَ
2:277	15	khawfun	fear	 لَهُمْ أَجْرُهُمْ عِنْدَ رَبِّهِمْ وَلَا خَوْفٌ عَلَيْهِمْ وَلَا هُمْ يَحْزَنُونَ
3:170	15	khawfun	fear	 وَيَسْتَبْشِرُونَ بِالَّذِينَ لَمْ يَلْحَقُوا بِهِمْ مِنْ خَلْفِهِمْ أَلَّا خَوْفٌ عَلَيْهِمْ وَلَا هُمْ يَحْزَنُونَ
4:83	7	l-khawfi	[the] fear	 وَإِذَا جَاءَهُمْ أَمْرٌ مِنَ الْأَمْنِ أَوِ الْخَوْفِ أَذَاعُوا بِهِ
5:69	16	khawfun	fear	 مَنْ آمَنَ بِاللَّهِ وَالْيَوْمِ الْآخِرِ وَعَمِلَ صَالِحًا فَلَا خَوْفٌ عَلَيْهِمْ وَلَا هُمْ يَحْزَنُونَ
6:48	11	khawfun	fear	 فَمَنْ آمَنَ وَأَصْلَحَ فَلَا خَوْفٌ عَلَيْهِمْ وَلَا هُمْ يَحْزَنُونَ
7:35	14	khawfun	fear	 فَمَنِ اتَّقَىٰ وَأَصْلَحَ فَلَا خَوْفٌ عَلَيْهِمْ وَلَا هُمْ يَحْزَنُونَ
7:49	11	khawfun	fear	 ادْخُلُوا الْجَنَّةَ لَا خَوْفٌ عَلَيْكُمْ وَلَا أَنْتُمْ تَحْزَنُونَ
7:56	8	khawfan	(in) fear	 وَلَا تُفْسِدُوا فِي الْأَرْضِ بَعْدَ إِصْلَاحِهَا وَادْعُوهُ خَوْفًا وَطَمَعًا
10:62	6	khawfun	fear	 أَلَا إِنَّ أَوْلِيَاءَ اللَّهِ لَا خَوْفٌ عَلَيْهِمْ وَلَا هُمْ يَحْزَنُونَ
10:83	9	khawfin	fear	 فَمَا آمَنَ لِمُوسَىٰ إِلَّا ذُرِّيَّةٌ مِنْ قَوْمِهِ عَلَىٰ خَوْفٍ مِنْ فِرْعَوْنَ وَمَلَئِهِمْ أَنْ يَفْتِنَهُمْ
13:12	5	khawfan	a fear	 هُوَ الَّذِي يُرِيكُمُ الْبَرْقَ خَوْفًا وَطَمَعًا وَيُنْشِئُ السَّحَابَ الثِّقَالَ
16:112	21	wal-khawfi	and the fear	 فَأَذَاقَهَا اللَّهُ لِبَاسَ الْجُوعِ وَالْخَوْفِ بِمَا كَانُوا يَصْنَعُونَ
24:55	25	khawfihim	their fear	 وَلَيُبَدِّلَنَّهُمْ مِنْ بَعْدِ خَوْفِهِمْ أَمْنًا
30:24	5	khawfan	(causing) fear	 وَمِنْ آيَاتِهِ يُرِيكُمُ الْبَرْقَ خَوْفًا وَطَمَعًا
32:16	7	khawfan	(in) fear	 تَتَجَافَىٰ جُنُوبُهُمْ عَنِ الْمَضَاجِعِ يَدْعُونَ رَبَّهُمْ خَوْفًا وَطَمَعًا
33:19	5	l-khawfu	the fear	 فَإِذَا جَاءَ الْخَوْفُ رَأَيْتَهُمْ يَنْظُرُونَ إِلَيْكَ
33:19	18	l-khawfu	the fear	 فَإِذَا ذَهَبَ الْخَوْفُ سَلَقُوكُمْ بِأَلْسِنَةٍ حِدَادٍ
43:68	3	khawfun	fear	 يَا عِبَادِ لَا خَوْفٌ عَلَيْكُمُ الْيَوْمَ وَلَا أَنْتُمْ تَحْزَنُونَ
46:13	9	khawfun	fear	 إِنَّ الَّذِينَ قَالُوا رَبُّنَا اللَّهُ ثُمَّ اسْتَقَامُوا فَلَا خَوْفٌ عَلَيْهِمْ وَلَا هُمْ يَحْزَنُونَ
106:4	7	khawfin	fear	 الَّذِي أَطْعَمَهُمْ مِنْ جُوعٍ وَآمَنَهُمْ مِنْ خَوْفٍ
7:205	6	wakhīfatan	and (in) fear	 وَاذْكُرْ رَبَّكَ فِي نَفْسِكَ تَضَرُّعًا وَخِيفَةً
11:70	10	khīfatan	[a fear]	 فَلَمَّا رَأَىٰ أَيْدِيَهُمْ لَا تَصِلُ إِلَيْهِ نَكِرَهُمْ وَأَوْجَسَ مِنْهُمْ خِيفَةً
13:13	6	khīfatihi	fear of Him	 وَيُسَبِّحُ الرَّعْدُ بِحَمْدِهِ وَالْمَلَائِكَةُ مِنْ خِيفَتِهِ
20:67	4	khīfatan	a fear	 فَأَوْجَسَ فِي نَفْسِهِ خِيفَةً مُوسَىٰ
30:28	21	kakhīfatikum	as you fear	 فَأَنْتُمْ فِيهِ سَوَاءٌ تَخَافُونَهُمْ كَخِيفَتِكُمْ أَنْفُسَكُمْ
51:28	3	khīfatan	a fear	 فَأَوْجَسَ مِنْهُمْ خِيفَةً قَالُوا لَا تَخَفْ وَبَشَّرُوهُ بِغُلَامٍ عَلِيمٍ
2:114	21	khāifīna	(like) those in fear	 أُولَٰئِكَ مَا كَانَ لَهُمْ أَنْ يَدْخُلُوهَا إِلَّا خَائِفِينَ
28:18	4	khāifan	fearful	 فَأَصْبَحَ فِي الْمَدِينَةِ خَائِفًا يَتَرَقَّبُ
28:21	3	khāifan	fearing	 فَخَرَجَ مِنْهَا خَائِفًا يَتَرَقَّبُ قَالَ رَبِّ نَجِّنِي مِنَ الْقَوْمِ الظَّالِمِينَ
17:59	21	takhwīfan	(as) a warning	 وَمَا نُرْسِلُ بِالْآيَاتِ إِلَّا تَخْوِيفًا
16:47	4	takhawwufin	a gradual wasting	 أَوْ يَأْخُذَهُمْ عَلَىٰ تَخَوُّفٍ فَإِنَّ رَبَّكُمْ لَرَءُوفٌ رَحِيمٌ
