surah_ayah	position	string	meaning	ayah_link
2:3	5	l-ṣalata	the prayer	 الَّذِينَ يُؤْمِنُونَ بِالْغَيْبِ وَيُقِيمُونَ الصَّلَاةَ
2:43	2	l-ṣalata	the prayer	 وَأَقِيمُوا الصَّلَاةَ وَآتُوا الزَّكَاةَ وَارْكَعُوا مَعَ الرَّاكِعِينَ
2:45	3	wal-ṣalati	and the prayer	 وَاسْتَعِينُوا بِالصَّبْرِ وَالصَّلَاةِ وَإِنَّهَا لَكَبِيرَةٌ إِلَّا عَلَى الْخَاشِعِينَ
2:83	20	l-ṣalata	the prayer	 وَقُولُوا لِلنَّاسِ حُسْنًا وَأَقِيمُوا الصَّلَاةَ وَآتُوا الزَّكَاةَ
2:110	2	l-ṣalata	the prayer	 وَأَقِيمُوا الصَّلَاةَ وَآتُوا الزَّكَاةَ
2:153	6	wal-ṣalati	and the prayer	 يَا أَيُّهَا الَّذِينَ آمَنُوا اسْتَعِينُوا بِالصَّبْرِ وَالصَّلَاةِ
2:157	3	ṣalawātun	(are) blessings	 أُولَٰئِكَ عَلَيْهِمْ صَلَوَاتٌ مِنْ رَبِّهِمْ وَرَحْمَةٌ
2:177	33	l-ṣalata	the prayer	 وَالسَّائِلِينَ وَفِي الرِّقَابِ وَأَقَامَ الصَّلَاةَ وَآتَى الزَّكَاةَ
2:238	3	l-ṣalawāti	the prayers	 حَافِظُوا عَلَى الصَّلَوَاتِ وَالصَّلَاةِ الْوُسْطَىٰ
2:238	4	wal-ṣalati	and the prayer 	 حَافِظُوا عَلَى الصَّلَوَاتِ وَالصَّلَاةِ الْوُسْطَىٰ
2:277	7	l-ṣalata	the prayer	 وَأَقَامُوا الصَّلَاةَ وَآتَوُا الزَّكَاةَ لَهُمْ أَجْرُهُمْ عِنْدَ رَبِّهِمْ
4:43	6	l-ṣalata	the prayer	 يَا أَيُّهَا الَّذِينَ آمَنُوا لَا تَقْرَبُوا الصَّلَاةَ وَأَنْتُمْ سُكَارَىٰ
4:77	10	l-ṣalata	the prayer	 أَلَمْ تَرَ إِلَى الَّذِينَ قِيلَ لَهُمْ كُفُّوا أَيْدِيَكُمْ وَأَقِيمُوا الصَّلَاةَ
4:101	11	l-ṣalati	the prayer	 وَإِذَا ضَرَبْتُمْ فِي الْأَرْضِ فَلَيْسَ عَلَيْكُمْ جُنَاحٌ أَنْ تَقْصُرُوا مِنَ الصَّلَاةِ إِنْ خِفْتُمْ أَنْ يَفْتِنَكُمُ الَّذِينَ كَفَرُوا
4:102	6	l-ṣalata	the prayer	 وَإِذَا كُنْتَ فِيهِمْ فَأَقَمْتَ لَهُمُ الصَّلَاةَ فَلْتَقُمْ طَائِفَةٌ مِنْهُمْ مَعَكَ
4:103	3	l-ṣalata	the prayer	 فَإِذَا قَضَيْتُمُ الصَّلَاةَ فَاذْكُرُوا اللَّهَ قِيَامًا وَقُعُودًا وَعَلَىٰ جُنُوبِكُمْ
4:103	13	l-ṣalata	the (regular) prayer	 فَإِذَا اطْمَأْنَنْتُمْ فَأَقِيمُوا الصَّلَاةَ
4:103	15	l-ṣalata	the prayer	 إِنَّ الصَّلَاةَ كَانَتْ عَلَى الْمُؤْمِنِينَ كِتَابًا مَوْقُوتًا
4:142	10	l-ṣalati	the prayer	 وَإِذَا قَامُوا إِلَى الصَّلَاةِ قَامُوا كُسَالَىٰ
4:162	16	l-ṣalata	the prayer	 يُؤْمِنُونَ بِمَا أُنْزِلَ إِلَيْكَ وَمَا أُنْزِلَ مِنْ قَبْلِكَ وَالْمُقِيمِينَ الصَّلَاةَ
5:6	7	l-ṣalati	the prayer	 يَا أَيُّهَا الَّذِينَ آمَنُوا إِذَا قُمْتُمْ إِلَى الصَّلَاةِ فَاغْسِلُوا وُجُوهَكُمْ
5:12	18	l-ṣalata	the prayer	 لَئِنْ أَقَمْتُمُ الصَّلَاةَ وَآتَيْتُمُ الزَّكَاةَ وَآمَنْتُمْ بِرُسُلِي
5:55	9	l-ṣalata	the prayer	 الَّذِينَ يُقِيمُونَ الصَّلَاةَ وَيُؤْتُونَ الزَّكَاةَ وَهُمْ رَاكِعُونَ
5:58	4	l-ṣalati	the prayer	 وَإِذَا نَادَيْتُمْ إِلَى الصَّلَاةِ اتَّخَذُوهَا هُزُوًا وَلَعِبًا
5:91	17	l-ṣalati	the prayer	 وَيَصُدَّكُمْ عَنْ ذِكْرِ اللَّهِ وَعَنِ الصَّلَاةِ فَهَلْ أَنْتُمْ مُنْتَهُونَ
5:106	31	l-ṣalati	the prayer	 تَحْبِسُونَهُمَا مِنْ بَعْدِ الصَّلَاةِ فَيُقْسِمَانِ بِاللَّهِ
6:72	3	l-ṣalata	the prayer	 وَأَنْ أَقِيمُوا الصَّلَاةَ وَاتَّقُوهُ وَهُوَ الَّذِي إِلَيْهِ تُحْشَرُونَ
6:92	21	ṣalātihim	their prayers	 وَهُمْ عَلَىٰ صَلَاتِهِمْ يُحَافِظُونَ
6:162	3	ṣalātī	my prayer	 قُلْ إِنَّ صَلَاتِي وَنُسُكِي وَمَحْيَايَ وَمَمَاتِي لِلَّهِ رَبِّ الْعَالَمِينَ
7:170	5	l-ṣalata	the prayer	 وَالَّذِينَ يُمَسِّكُونَ بِالْكِتَابِ وَأَقَامُوا الصَّلَاةَ
8:3	3	l-ṣalata	the prayer	 الَّذِينَ يُقِيمُونَ الصَّلَاةَ وَمِمَّا رَزَقْنَاهُمْ يُنْفِقُونَ
8:35	3	ṣalātuhum	their prayer	 وَمَا كَانَ صَلَاتُهُمْ عِنْدَ الْبَيْتِ إِلَّا مُكَاءً وَتَصْدِيَةً
9:5	18	l-ṣalata	the prayer	 فَإِنْ تَابُوا وَأَقَامُوا الصَّلَاةَ وَآتَوُا الزَّكَاةَ فَخَلُّوا سَبِيلَهُمْ
9:11	4	l-ṣalata	the prayer	 فَإِنْ تَابُوا وَأَقَامُوا الصَّلَاةَ وَآتَوُا الزَّكَاةَ فَإِخْوَانُكُمْ فِي الدِّينِ
9:18	11	l-ṣalata	the prayer	 مَنْ آمَنَ بِاللَّهِ وَالْيَوْمِ الْآخِرِ وَأَقَامَ الصَّلَاةَ وَآتَى الزَّكَاةَ
9:54	14	l-ṣalata	(to) the prayer	 وَلَا يَأْتُونَ الصَّلَاةَ إِلَّا وَهُمْ كُسَالَىٰ
9:71	12	l-ṣalata	the prayer	 وَيُقِيمُونَ الصَّلَاةَ وَيُؤْتُونَ الزَّكَاةَ وَيُطِيعُونَ اللَّهَ وَرَسُولَهُ
9:99	14	waṣalawāti	and blessings	 وَيَتَّخِذُ مَا يُنْفِقُ قُرُبَاتٍ عِنْدَ اللَّهِ وَصَلَوَاتِ الرَّسُولِ
9:103	11	ṣalataka	your blessings	 وَصَلِّ عَلَيْهِمْ إِنَّ صَلَاتَكَ سَكَنٌ لَهُمْ
10:87	14	l-ṣalata	the prayer	 وَاجْعَلُوا بُيُوتَكُمْ قِبْلَةً وَأَقِيمُوا الصَّلَاةَ وَبَشِّرِ الْمُؤْمِنِينَ
11:87	3	aṣalatuka	Does your prayer	 قَالُوا يَا شُعَيْبُ أَصَلَاتُكَ تَأْمُرُكَ أَنْ نَتْرُكَ مَا يَعْبُدُ آبَاؤُنَا
11:114	2	l-ṣalata	the prayer	 وَأَقِمِ الصَّلَاةَ طَرَفَيِ النَّهَارِ وَزُلَفًا مِنَ اللَّيْلِ
13:22	7	l-ṣalata	the prayer	 وَالَّذِينَ صَبَرُوا ابْتِغَاءَ وَجْهِ رَبِّهِمْ وَأَقَامُوا الصَّلَاةَ
14:31	6	l-ṣalata	the prayers	 قُلْ لِعِبَادِيَ الَّذِينَ آمَنُوا يُقِيمُوا الصَّلَاةَ
14:37	15	l-ṣalata	the prayers	 رَبَّنَا لِيُقِيمُوا الصَّلَاةَ فَاجْعَلْ أَفْئِدَةً مِنَ النَّاسِ تَهْوِي إِلَيْهِمْ
14:40	4	l-ṣalati	(of) the prayer	 رَبِّ اجْعَلْنِي مُقِيمَ الصَّلَاةِ وَمِنْ ذُرِّيَّتِي
17:78	2	l-ṣalata	the prayer	 أَقِمِ الصَّلَاةَ لِدُلُوكِ الشَّمْسِ إِلَىٰ غَسَقِ اللَّيْلِ
17:110	15	biṣalātika	in your prayers	 وَلَا تَجْهَرْ بِصَلَاتِكَ وَلَا تُخَافِتْ بِهَا وَابْتَغِ بَيْنَ ذَٰلِكَ سَبِيلًا
19:31	7	bil-ṣalati	[of] the prayer	 وَأَوْصَانِي بِالصَّلَاةِ وَالزَّكَاةِ مَا دُمْتُ حَيًّا
19:55	4	bil-ṣalati	the prayer	 وَكَانَ يَأْمُرُ أَهْلَهُ بِالصَّلَاةِ وَالزَّكَاةِ وَكَانَ عِنْدَ رَبِّهِ مَرْضِيًّا
19:59	6	l-ṣalata	the prayer	 فَخَلَفَ مِنْ بَعْدِهِمْ خَلْفٌ أَضَاعُوا الصَّلَاةَ وَاتَّبَعُوا الشَّهَوَاتِ
20:14	10	l-ṣalata	the prayer	 إِنَّنِي أَنَا اللَّهُ لَا إِلَٰهَ إِلَّا أَنَا فَاعْبُدْنِي وَأَقِمِ الصَّلَاةَ لِذِكْرِي
20:132	3	bil-ṣalati	the prayer	 وَأْمُرْ أَهْلَكَ بِالصَّلَاةِ وَاصْطَبِرْ عَلَيْهَا
21:73	10	l-ṣalati	(of) the prayer	 وَأَوْحَيْنَا إِلَيْهِمْ فِعْلَ الْخَيْرَاتِ وَإِقَامَ الصَّلَاةِ
22:35	12	l-ṣalati	the prayer	 وَالصَّابِرِينَ عَلَىٰ مَا أَصَابَهُمْ وَالْمُقِيمِي الصَّلَاةِ
22:40	21	waṣalawātun	and synagogues	 وَلَوْلَا دَفْعُ اللَّهِ النَّاسَ بَعْضَهُمْ بِبَعْضٍ لَهُدِّمَتْ صَوَامِعُ وَبِيَعٌ وَصَلَوَاتٌ وَمَسَاجِدُ يُذْكَرُ فِيهَا اسْمُ اللَّهِ كَثِيرًا
22:41	7	l-ṣalata	the prayer	 الَّذِينَ إِنْ مَكَّنَّاهُمْ فِي الْأَرْضِ أَقَامُوا الصَّلَاةَ وَآتَوُا الزَّكَاةَ
22:78	34	l-ṣalata	the prayer	 فَأَقِيمُوا الصَّلَاةَ وَآتُوا الزَّكَاةَ وَاعْتَصِمُوا بِاللَّهِ هُوَ مَوْلَاكُمْ
23:2	4	ṣalātihim	their prayers	 الَّذِينَ هُمْ فِي صَلَاتِهِمْ خَاشِعُونَ
23:9	4	ṣalawātihim	their prayers	 وَالَّذِينَ هُمْ عَلَىٰ صَلَوَاتِهِمْ يُحَافِظُونَ
24:37	11	l-ṣalati	the prayer	 رِجَالٌ لَا تُلْهِيهِمْ تِجَارَةٌ وَلَا بَيْعٌ عَنْ ذِكْرِ اللَّهِ وَإِقَامِ الصَّلَاةِ
24:41	16	ṣalātahu	its prayer	 كُلٌّ قَدْ عَلِمَ صَلَاتَهُ وَتَسْبِيحَهُ
24:56	2	l-ṣalata	the prayer	 وَأَقِيمُوا الصَّلَاةَ وَآتُوا الزَّكَاةَ وَأَطِيعُوا الرَّسُولَ
24:58	17	ṣalati	(the) prayer	 لِيَسْتَأْذِنْكُمُ الَّذِينَ مَلَكَتْ أَيْمَانُكُمْ وَالَّذِينَ لَمْ يَبْلُغُوا الْحُلُمَ مِنْكُمْ ثَلَاثَ مَرَّاتٍ مِنْ قَبْلِ صَلَاةِ الْفَجْرِ
24:58	26	ṣalati	(the) prayer	 وَحِينَ تَضَعُونَ ثِيَابَكُمْ مِنَ الظَّهِيرَةِ وَمِنْ بَعْدِ صَلَاةِ الْعِشَاءِ
27:3	3	l-ṣalata	the prayer	 الَّذِينَ يُقِيمُونَ الصَّلَاةَ وَيُؤْتُونَ الزَّكَاةَ
29:45	8	l-ṣalata	the prayer	 اتْلُ مَا أُوحِيَ إِلَيْكَ مِنَ الْكِتَابِ وَأَقِمِ الصَّلَاةَ
29:45	10	l-ṣalata	the prayer	 إِنَّ الصَّلَاةَ تَنْهَىٰ عَنِ الْفَحْشَاءِ وَالْمُنْكَرِ
30:31	5	l-ṣalata	the prayer	 مُنِيبِينَ إِلَيْهِ وَاتَّقُوهُ وَأَقِيمُوا الصَّلَاةَ وَلَا تَكُونُوا مِنَ الْمُشْرِكِينَ
31:4	3	l-ṣalata	the prayer	 الَّذِينَ يُقِيمُونَ الصَّلَاةَ وَيُؤْتُونَ الزَّكَاةَ
31:17	3	l-ṣalata	the prayer	 يَا بُنَيَّ أَقِمِ الصَّلَاةَ وَأْمُرْ بِالْمَعْرُوفِ وَانْهَ عَنِ الْمُنْكَرِ
33:33	10	l-ṣalata	the prayer	 وَأَقِمْنَ الصَّلَاةَ وَآتِينَ الزَّكَاةَ وَأَطِعْنَ اللَّهَ وَرَسُولَهُ
35:18	26	l-ṣalata	the prayer	 تُنْذِرُ الَّذِينَ يَخْشَوْنَ رَبَّهُمْ بِالْغَيْبِ وَأَقَامُوا الصَّلَاةَ
35:29	7	l-ṣalata	the prayer	 إِنَّ الَّذِينَ يَتْلُونَ كِتَابَ اللَّهِ وَأَقَامُوا الصَّلَاةَ
42:38	5	l-ṣalata	prayer	 وَالَّذِينَ اسْتَجَابُوا لِرَبِّهِمْ وَأَقَامُوا الصَّلَاةَ
58:13	15	l-ṣalata	the prayer	 فَإِذْ لَمْ تَفْعَلُوا وَتَابَ اللَّهُ عَلَيْكُمْ فَأَقِيمُوا الصَّلَاةَ وَآتُوا الزَّكَاةَ
62:9	6	lilṣṣalati	for (the) prayer	 إِذَا نُودِيَ لِلصَّلَاةِ مِنْ يَوْمِ الْجُمُعَةِ فَاسْعَوْا إِلَىٰ ذِكْرِ اللَّهِ
62:10	3	l-ṣalatu	the prayer	 فَإِذَا قُضِيَتِ الصَّلَاةُ فَانْتَشِرُوا فِي الْأَرْضِ
70:23	4	ṣalātihim	their prayer	 الَّذِينَ هُمْ عَلَىٰ صَلَاتِهِمْ دَائِمُونَ
70:34	4	ṣalātihim	their prayer	 وَالَّذِينَ هُمْ عَلَىٰ صَلَاتِهِمْ يُحَافِظُونَ
73:20	54	l-ṣalata	the prayer	 وَأَقِيمُوا الصَّلَاةَ وَآتُوا الزَّكَاةَ وَأَقْرِضُوا اللَّهَ قَرْضًا حَسَنًا
98:5	11	l-ṣalata	the prayer	 مُخْلِصِينَ لَهُ الدِّينَ حُنَفَاءَ وَيُقِيمُوا الصَّلَاةَ
107:5	4	ṣalātihim	their prayers	 الَّذِينَ هُمْ عَنْ صَلَاتِهِمْ سَاهُونَ
